"","business_id","name","city","state","postal_code","latitude","longitude","is_open","categories"
"355",74208,"Einstein Bros Bagels","Charlotte","NC","28277",35.0570335388,-80.8516464233,"1","Bagels, Food"
"356",58358,"Einstein Bros Bagels","Cleveland","OH","44130",41.3800705,-81.7849819,"1","Restaurants, Food, Bagels"
"357",50347,"Bruegger's Bagels","Mentor","OH","44060",41.6769109,-81.308924,"1","Sandwiches, Restaurants, Breakfast & Brunch, Bagels, Food"
"358",100245,"Uncle Tony's Bagels, Deli & Pizza","Phoenix","AZ","85012",33.4846952,-112.0732999,"1","Restaurants, Delis, Pizza, Food, Breakfast & Brunch, Bagels"
"359",147847,"Bagel Nosh","Scottsdale","AZ","85260",33.6396856,-111.8915244,"0","Food, Bagels"
"360",100857,"Chompie's","Phoenix","AZ","85032",33.6272318,-112.0121147,"0","Bagels, Caterers, Event Planning & Services, Bakeries, Delis, Restaurants, Food"
"361",179692,"La Fabrique de Bagel","Montréal","QC","H2Y 1N9",45.5022956091,-73.5598544776,"1","Bagels, Sandwiches, Breakfast & Brunch, Restaurants, Food"
"362",110430,"Odelay Bagel","Phoenix","AZ","85044",33.3377046576,-111.9947783418,"1","Bagels, Coffee & Tea, Caterers, Restaurants, Cafes, Event Planning & Services, Food"
"363",159032,"Bruegger's Bagels","Brecksville","OH","44141",41.3197502,-81.6257975,"1","Bagels, Coffee & Tea, Sandwiches, Food, Breakfast & Brunch, Restaurants, Bakeries"
"364",125684,"Dewey's Coffee House","Cleveland","OH","44120",41.4846805,-81.5899745,"1","Ice Cream & Frozen Yogurt, Restaurants, Sandwiches, Bagels, Food, Coffee & Tea"
"365",55336,"Nate's Bagels & Gluten Free Foods","Vaughan","ON","L4K 2G4",43.8063634,-79.4984212,"1","Bakeries, Gluten-Free, Restaurants, Bagels, Food"
"366",170001,"Einstein Bros Bagels","Rocky River","OH","44116",41.482462,-81.835641,"0","Event Planning & Services, Restaurants, Bagels, Caterers, Food"
"367",9644,"T & T Bakery and Cafe","Markham","ON","L3P 1X3",43.8751774,-79.2599749,"1","Food, Bakeries, Bagels"
"368",172961,"Fukuburger Truck","Las Vegas","NV","89146",36.135635,-115.2304131,"1","Food Trucks, Restaurants, Food, Food Stands, Burgers, Bagels"
"369",111516,"Katz Deli","Charlotte","NC","28277",35.0543244737,-80.8154617363,"1","Food, Delis, Sandwiches, Bagels, Restaurants, American (Traditional), Burgers"
"370",94033,"Bruegger's Bagels","Pittsburgh","PA","15222",40.441073,-80.00294,"1","Bagels, Sandwiches, Restaurants, Breakfast & Brunch, Food"
"371",29190,"Panera Bread","Fitchburg","WI","53711",43.016974,-89.42269,"1","Food, Salad, Breakfast & Brunch, Soup, Restaurants, Bakeries, Sandwiches, Bagels"
"372",159334,"Tim Hortons","Toronto","ON","M6P 1A8",43.6551814157,-79.4586271941,"1","Food, Bagels, Coffee & Tea"
"373",103416,"Wayne's Bagels","Calgary","AB","T2R 0B4",51.043724,-114.080907,"1","Bagels, Food"
"374",152656,"JackBeagles","Charlotte","NC","28205",35.2474779,-80.8055628,"1","Arts & Entertainment, Bagels, Restaurants, American (Traditional), Food, Beer, Wine & Spirits, Pubs, Nightlife, Breakfast & Brunch, Bars, Music Venues"
"375",1136,"Tim Hortons","Brampton","ON","L6Y 1N6",43.6680386475,-79.7370777841,"1","Donuts, Restaurants, Bagels, Food, Coffee & Tea, Sandwiches"
"376",94245,"Oasis Bagels","Goodyear","AZ","85338",33.3576587,-112.4285876,"1","Breakfast & Brunch, Restaurants, Bagels, Food, Coffee & Tea"
"377",179262,"Sunset Grill","Etobicoke","ON","M9C 1A8",43.6198094009,-79.5542589863,"1","Diners, Canadian (New), Restaurants, Salad, Breakfast & Brunch, Bagels, Food"
"378",10251,"Panera Bread","Rocky River","OH","44116",41.464592,-81.841481,"1","Soup, Restaurants, Breakfast & Brunch, Bakeries, Food, Sandwiches, Salad, Bagels, Coffee & Tea"
"379",30808,"Kiva's Bagel Bar","Toronto","ON","M4V 1K6",43.6877259,-79.3947538,"1","Caterers, Food, Restaurants, Breakfast & Brunch, Event Planning & Services, Bagels"
"380",29166,"Panera Bread","Bethel Park","PA","15102",40.332715,-80.022094,"1","Breakfast & Brunch, Food, Sandwiches, Soup, Salad, Bagels, Bakeries, Restaurants"
"381",79591,"The Brilliant Bagel","Scottsdale","AZ","85258",33.570389,-111.886452,"1","Bagels, Bakeries, Restaurants, Vegan, Food, Coffee & Tea, Vegetarian"
"382",57342,"Bagel Stop","Toronto","ON","M5J 1E6",43.6453166,-79.3804073,"1","Bagels, Food"
"383",191046,"The Bagel House","Mississauga","ON","L5G",43.559130281,-79.5771483608,"1","Food, Bagels"
"384",101550,"Panera Bread","Etobicoke","ON","M9C 1A7",43.6150376753,-79.5560713195,"1","Bakeries, Salad, Sandwiches, Soup, Food, Restaurants, Bagels"
"385",169250,"The Black Cup Coffee","Las Vegas","NV","89101",36.1677166,-115.1383532,"0","Food, Coffee & Tea, Bagels"
"386",110268,"Panera Bread","Lakewood","OH","44107",41.484839,-81.79852,"1","Salad, Coffee & Tea, Food, Breakfast & Brunch, Soup, Restaurants, Sandwiches, Bagels"
"387",133749,"Bruegger's Bagels","Charlotte","NC","28211",35.1761455,-80.7996081,"1","Breakfast & Brunch, Bagels, Sandwiches, Restaurants, Food"
"388",73685,"Einstein Brothers Bagels","Madison","WI","53711",43.0352824,-89.4536017,"0","Restaurants, Breakfast & Brunch, Bagels, Food"
"389",31174,"NY Bagels","Tempe","AZ","85281",33.4153899,-111.9251413,"1","Restaurants, Sandwiches, Bagels, Delis, Breakfast & Brunch, Coffee & Tea, Food"
"390",89246,"Beans Coffee Shop","Chardon","OH","44024",41.581407,-81.204121,"1","Bagels, Food, Coffee & Tea, Breakfast & Brunch, Restaurants"
"391",170656,"Panera Bread","Broadview Heights","OH","44147",41.2924309872,-81.6714084148,"1","Coffee & Tea, Soup, Breakfast & Brunch, Bagels, Salad, Food, Restaurants, Bakeries, Sandwiches"
"392",188435,"BF Bakers","Aurora","ON","L4G 2N9",43.9986572268,-79.4751424921,"0","Organic Stores, Restaurants, Cafes, Food, Bakeries, Bagels, Gluten-Free"
"393",11598,"Poppyseeds Bagels","Weddington","NC","28104",35.0235091,-80.7608256,"1","Bagels, Sandwiches, Food, Restaurants, Bakeries, Delis, Breakfast & Brunch"
"394",62847,"Chompie's","Glendale","AZ","85308",33.6416717396,-112.2236080746,"1","Breakfast & Brunch, Bakeries, Bagels, Food, Waffles, Sandwiches, Delis, Restaurants"
"395",88107,"Lox + Schmear","Toronto","ON","M6E 1A4",43.6791729,-79.4382679,"1","Breakfast & Brunch, Restaurants, Bagels, Food"
"396",56829,"Cocky's Bagels","Cleveland","OH","44113",41.4857101,-81.6966306,"1","Mediterranean, Food Trucks, Bagels, Event Planning & Services, Caterers, Sandwiches, Food, Restaurants"
"397",63118,"Tim Hortons","Toronto","ON","M4J 1M7",43.681346,-79.3319114,"1","Restaurants, Sandwiches, Bagels, Coffee & Tea, Breakfast & Brunch, Food"
"398",24460,"Bruegger's Bagels","Pittsburgh","PA","15241",40.3481439,-80.0538247,"0","Restaurants, Food, Sandwiches, Bagels, Breakfast & Brunch"
"399",139559,"Starbucks","Goodyear","AZ","85338",33.437709,-112.411262,"1","Bakeries, Coffee & Tea, Food, Bagels"
"400",62753,"Einstein Bros Bagels","Madison","WI","53705",43.0731022,-89.4343952,"1","Coffee & Tea, Food, Restaurants, Bagels"
"401",77279,"Lox, Stock & Bagel","Scottsdale","AZ","85258",33.5442293455,-111.9054722786,"0","Bagels, Restaurants, Food, Delis, Coffee & Tea, Sandwiches, Breakfast & Brunch"
"402",90583,"Panera Bread","Mayfield Heights","OH","44124",41.5161522695,-81.4506535606,"0","Soup, Sandwiches, Food, Bagels, Breakfast & Brunch, Bakeries, Salad, Restaurants"
"403",51940,"Panera Bread","Amherst","OH","44001",41.3787986,-82.2112654,"1","Salad, Sandwiches, Soup, Bagels, Restaurants, Breakfast & Brunch, Food"
"404",1257,"Einstein Bros Bagels","Tempe","AZ","85281",33.4227444,-111.9258396,"1","Bagels, Restaurants, Food, Breakfast & Brunch, Delis"
"405",116581,"Gryfe's Bagel Bakery","Toronto","ON","M6A 2C1",43.7271702,-79.4314138,"1","Bagels, Food"
"406",45149,"Body Envy Fitness","Chandler","AZ","85286",33.2799761,-111.7995074,"1","Health & Medical, Active Life, Food, Trainers, Bagels, Fitness & Instruction, Weight Loss Centers"
"407",18748,"Bagel Factory","Pittsburgh","PA","15232",40.456795,-79.930231,"0","Bakeries, Restaurants, Bagels, Food"
"408",108710,"What a Bagel Eatery","Vaughan","ON","L4J",43.8490261249,-79.4596694845,"1","Bagels, Restaurants, Sandwiches, Food"
"409",75176,"Le Mardi Gras","Pittsburgh","PA","15232",40.4512603,-79.9345876,"1","Dive Bars, Nightlife, Food, Bagels, Lounges, Bars"
"410",89668,"Einstein Bros Bagels","Pittsburgh","PA","15222",40.4400812,-80.0027794,"1","Bagels, Restaurants, Food"
"411",36654,"The Great Canadian Bagel","Calgary","AB","T2L 2L4",51.0959712,-114.1412239,"0","Bagels, Restaurants, Sandwiches, Food"
"412",46803,"Bruegger's Bagels & Jamba Juice","Pittsburgh","PA","15219",40.440637,-79.996631,"1","Restaurants, Bagels, Breakfast & Brunch, Coffee & Tea, Sandwiches, Food"
"413",74319,"Naturalis Cafe","Toronto","ON","M4E 1E7",43.6725424,-79.2899051,"1","Bakeries, Restaurants, Bagels, Gluten-Free, Food, Cafes"
"414",92161,"Panera Bread","Mississauga","ON","L5B 0E2",43.5969248417,-79.6426394954,"1","Salad, Sandwiches, Food, Restaurants, Bagels, Breakfast & Brunch, Soup, Bakeries"
"415",72962,"Panera Bread","Madison","WI","53704",43.131264,-89.301283,"1","Soup, Food, Restaurants, American (Traditional), Sandwiches, Breakfast & Brunch, Bakeries, Salad, Bagels"
"416",85975,"Famous Toastery","Tega Cay","SC","29708",35.047191135,-80.9908684123,"1","Breakfast & Brunch, Caterers, Event Planning & Services, Sandwiches, Coffee & Tea, Food, Bagels, Burgers, Salad, American (Traditional), Restaurants"
"417",19431,"Panera Bread","Independence","OH","44131",41.393934,-81.643735,"1","Restaurants, Coffee & Tea, Soup, Breakfast & Brunch, Bakeries, Food, Bagels, Sandwiches, Salad"
"418",140277,"Einstein Bros Bagels","Henderson","NV","89014",36.0633902,-115.0470166,"1","Bagels, Restaurants, Food, Delis"
"419",176293,"Gotham Bagels","Madison","WI","53715",43.0598416,-89.4008555,"0","Food, Bagels, Restaurants, Sandwiches"
"420",6229,"Panera Bread","Charlotte","NC","28216",35.349778,-80.854491,"1","Food, Soup, Salad, Bagels, Sandwiches, Breakfast & Brunch, Restaurants"
"421",138464,"Caribou Coffee","Fitchburg","WI","53713",43.0304279233,-89.4092341387,"1","Coffee & Tea, Bagels, Food"
"422",114793,"Planet Smoothie","Mesa","AZ","85201",33.4157593,-111.8418604,"1","Bagels, Juice Bars & Smoothies, Food"
"423",179735,"Premier Bagel","Kirkland","QC","H9H 3B5",45.449168,-73.854146,"1","Bagels, Food"
"424",62698,"Addley's Bagel","Belmont","NC","28012",35.2428423,-81.0376885,"0","Bagels, Food"
"425",27769,"Tintoretto Restaurant and Bakery","Las Vegas","NV","89109",36.122113735,-115.1706238888,"0","Breakfast & Brunch, Bagels, Gelato, Restaurants, Bakeries, Italian, Food"
"426",87445,"Einstein Bros","Las Vegas","NV","89118",36.0634211684,-115.2414469067,"1","Food, Bagels"
"427",158747,"Hot Bagels and Deli","Phoenix","AZ","85086",33.7991098079,-112.1309262192,"1","Bagels, Breakfast & Brunch, Restaurants, Food, Delis"
"428",70917,"Bruegger's Bagels","North Olmsted","OH","44070",41.4165681,-81.9213962,"0","Restaurants, Food, Sandwiches, Breakfast & Brunch, Bagels"
"429",36608,"The Coffee Brewer","Lyndhurst","OH","44124",41.5016901659,-81.4760038362,"0","Bagels, Coffee & Tea, Food"
"430",91988,"Halfpenny's","Charlotte","NC","28202",35.2254513,-80.84528,"1","Bagels, Ice Cream & Frozen Yogurt, Food"
"431",173583,"Panera Bread","Charlotte","NC","28244",35.224819,-80.843626,"1","Food, Breakfast & Brunch, Sandwiches, Restaurants, Bagels, Salad, Bakeries, Soup"
"432",12133,"What A Bagel","York","ON","M6C 2C4",43.6999216,-79.4294884,"1","Food, Restaurants, Breakfast & Brunch, Bagels"
"433",162930,"Einstein Bros Bagels","Scottsdale","AZ","85254",33.5834720349,-111.976011895,"1","Restaurants, Delis, Breakfast & Brunch, Bagels, Food"
"434",54993,"Starbucks","Toronto","ON","M5V",43.6474968,-79.392644,"1","Coffee & Tea, Bagels, Food, Desserts"
"435",166844,"Sunset Grill","Aurora","ON","L4G 7N2",44.004241,-79.4472438,"1","Breakfast & Brunch, Restaurants, Bagels, Sandwiches, Burgers, Food, Canadian (New), Diners"
"436",85952,"Marash Café","La Salle","QC","H8N 1B1",45.4369999,-73.6139318,"1","Bagels, Ice Cream & Frozen Yogurt, Bakeries, Cafes, Food, Restaurants"
"437",184749,"Panera Bread","Charlotte","NC","28226",35.087992,-80.846242,"1","Salad, Bagels, Food, Restaurants, Bakeries, Sandwiches, Breakfast & Brunch, Soup"
"438",56660,"First Break Coffee Shop","Toronto","ON","M4M 3L1",43.6634875,-79.3411679,"0","Bagels, Food, Restaurants, Comfort Food, Coffee & Tea"
"439",103745,"Bruegger's Bagels","Pittsburgh","PA","15237",40.5296965,-80.010085,"1","Bagels, Restaurants, Food, Breakfast & Brunch, Bakeries, Sandwiches"
"440",137497,"Bruegger's Bagels","Pittsburgh","PA","15219",40.4384589,-79.9983343,"1","Breakfast & Brunch, Coffee & Tea, Bagels, Sandwiches, Restaurants, Food"
"441",124296,"Bruegger's Bagels","Westlake","OH","44145",41.461141,-81.952925,"1","Bagels, Restaurants, Breakfast & Brunch, Food, Sandwiches"
"442",111480,"Einstein Bros Bagels","Chandler","AZ","85286",33.263458252,-111.8574981689,"1","Bagels, Food"
"443",172599,"Dunkin' Donuts","Madison","WI","53715",43.0592017,-89.4002507,"1","Donuts, Bagels, Bakeries, Coffee & Tea, Food"
"444",55861,"Einstein Bros","Las Vegas","NV","89128",36.195608,-115.2610055,"1","Restaurants, Mexican, Food, Bagels"
"445",38155,"Panera Bread","Pittsburgh","PA","15275",40.44935,-80.174279,"1","Breakfast & Brunch, Food, Bagels, Soup, Restaurants, Salad, Sandwiches"
"446",135589,"Einstein Bros","Las Vegas","NV","89117",36.1438217,-115.294084,"1","Bagels, Food, Restaurants"
"447",92710,"Bagel Gourmet","Phoenix","AZ","85053",33.6388635,-112.1209921,"1","Bagels, Sandwiches, Food, Breakfast & Brunch, Bakeries, Restaurants"
"448",146978,"Bruegger's Bagels","Cornelius","NC","28031",35.485702,-80.878408,"1","Sandwiches, Breakfast & Brunch, Food, Bagels, Restaurants"
"449",64941,"Great Harvest Bread Company","Las Vegas","NV","89147",36.1008766,-115.3147099,"1","Food, Desserts, Bakeries, Sandwiches, Bagels, Coffee & Tea, Breakfast & Brunch, Restaurants, Cafes"
"450",172163,"Panera Bread","West Homestead","PA","15120",40.407174,-79.916603,"1","Breakfast & Brunch, Restaurants, Salad, Soup, Food, Sandwiches, Bagels"
"451",133518,"Tim Hortons","Toronto","ON","M5E 1R8",43.6477040939,-79.3705069274,"1","Bagels, Coffee & Tea, Food, Donuts"
"452",135797,"Tim Hortons","Calgary","AB","T2A 6K3",51.0568502,-113.9825415,"1","Bagels, Sandwiches, Breakfast & Brunch, Restaurants, Coffee & Tea, Food"
"453",185489,"The Local Donut","Scottsdale","AZ","85251",33.48516,-111.908355,"1","Bakeries, Food, Bagels, Coffee & Tea, Donuts"
"454",121201,"Einstein Bros Bagels","Cave Creek","AZ","85331",33.7541424,-111.9907214,"1","Bagels, Restaurants, Food"
"455",78007,"Panera Bread","Huntersville","NC","28078",35.442832,-80.859496,"1","Salad, Bagels, Sandwiches, Soup, Food, Breakfast & Brunch, Restaurants"
"456",142280,"Einstein Bros Bagels","Scottsdale","AZ","85255",33.6965078621,-111.9246726342,"1","Bagels, Food, Sandwiches, Coffee & Tea, Restaurants"
"457",162550,"Treats York University","Toronto","ON","M3K 1P3",43.7739036342,-79.5032940432,"1","Restaurants, Breakfast & Brunch, Food, Bagels, Coffee & Tea"
"458",56317,"Bagel Corner Deli and Bakery","Las Vegas","NV","89144",36.1691517,-115.2913521,"1","Bakeries, Food, Bagels"
"459",154035,"The Bagel House","Toronto","ON","M4P 2J3",43.713947196,-79.4000464305,"1","Delis, Breakfast & Brunch, Restaurants, Bagels, Food"
"460",62769,"Canada's Baking and Sweets Show","Etobicoke","ON","M9W 1J1",43.6910625,-79.5781333,"1","Food, Bakeries, Donuts, Bagels"
"461",14026,"Bobby's Bagel Bistro","Las Vegas","NV","89106",36.2003921,-115.2819509,"0","Breakfast & Brunch, Food, Restaurants, Bagels"
"462",99948,"BeanThru","Glenshaw","PA","15116",40.541713,-79.964318,"1","Breakfast & Brunch, Juice Bars & Smoothies, Coffee & Tea, Food, Restaurants, Bagels"
"463",109030,"Tim Hortons","Toronto","ON","M4C 1L5",43.6882339533,-79.300733824,"1","Donuts, Coffee & Tea, Food, Bagels"
"464",170083,"Einstein Bagels","Goodyear","AZ","85338",33.4636381932,-112.34145023,"1","Food, Restaurants, Bagels, Breakfast & Brunch"
"465",14375,"Faubourg Bagel Place","Montréal","QC","H3H 1L7",45.4941562,-73.5789142,"0","Bagels, Food"
"466",10505,"Panera Bread","Amherst","OH","44001",41.3798516553,-82.222956419,"1","Bagels, Salad, Soup, Sandwiches, Food, Breakfast & Brunch, Restaurants"
"467",82182,"Bruegger's Bagels","Matthews","NC","28105",35.1244838531,-80.7085589208,"1","Restaurants, Bagels, Sandwiches, Breakfast & Brunch, Bakeries, Food"
"468",5181,"Einstein Bros Bagels","Las Vegas","NV","89134",36.1918793785,-115.3051185755,"1","Sandwiches, Bagels, Food, Restaurants"
"469",95523,"Caffe Mona La Bistro","Pittsburgh","PA","15224",40.465725,-79.95432,"1","Creperies, Breakfast & Brunch, Cafes, Italian, Restaurants, Coffee & Tea, Food, French, Bagels"
"470",28850,"Bruegger's Bagels","Pittsburgh","PA","15236",40.3441937,-79.970963,"0","Bagels, Food, Sandwiches, Restaurants, Bakeries, Breakfast & Brunch"
"471",104221,"Einstein Bros Bagels","Tempe","AZ","85281",33.4180432505,-111.9342374268,"1","Delis, Restaurants, Food, Bagels"
"472",139574,"Tim Hortons","Toronto","ON","M3H 2S5",43.7547531128,-79.4432983398,"1","Bagels, Ice Cream & Frozen Yogurt, Food, Bakeries, Coffee & Tea"
"473",65490,"Brossard Bagel","Greenfield Park","QC","J4K 2Y6",45.492788,-73.4805901,"1","Bagels, Food"
"474",34248,"The Bagel House","Toronto","ON","M4G 3B6",43.7048197,-79.3749946,"1","Food, Bagels"
"475",143425,"Einstein Bros Bagels","Rocky River","OH","44116",41.4822684,-81.8340087,"1","Food, Bagels"
"476",168679,"Dunkin' Donuts","Las Vegas","NV","89121",36.1005270562,-115.1021624451,"0","Food, Bagels, Donuts, Coffee & Tea"
"477",126664,"What A Bagel","Richmond Hill","ON","L4C 9Y2",43.8851115,-79.4666091,"1","Bagels, Food"
"478",21392,"Dunkin' Donuts","Charlotte","NC","28208",35.228639,-80.86708,"1","Donuts, Coffee & Tea, Bagels, Food"
"479",130044,"Kiva's Restaurant & Bakery","North York","ON","M2R 2S9",43.7913381016,-79.4477032015,"1","Food, Restaurants, Bagels, Bakeries, Breakfast & Brunch"
"480",60347,"Bagel Brigade","York","ON","M6C 2C4",43.6999711,-79.4292246,"1","Bagels, Bakeries, Food"
"481",151855,"Panera Bread","Ross Township","PA","15237",40.537139,-80.013116,"1","Restaurants, Soup, Bagels, Food, Breakfast & Brunch, Salad, Bakeries, Sandwiches"
"482",185978,"Einstein Bros Bagels","Charlotte","NC","28202",35.2284396,-80.8349193,"1","Food, Bagels"
"483",154314,"Tim Horton's","Mississauga","ON","L5C 1T7",43.5747675,-79.6448037,"1","Bagels, Food, Donuts, Coffee & Tea"
"484",103878,"Small Town Coffeehouse","Glendale","AZ","85308",33.662645,-112.187027,"1","Restaurants, Coffee & Tea, Cafes, Breakfast & Brunch, Bagels, Food"
"485",75666,"Grouchy John's Coffee","Las Vegas","NV","89123",36.0350856,-115.1357861,"1","Food Trucks, Breakfast & Brunch, Cafes, Food, Bagels, Juice Bars & Smoothies, Restaurants, Coffee & Tea"
"486",61557,"Bruegger's Bagels","Coraopolis","PA","15108",40.505252,-80.2084709,"1","Sandwiches, Bagels, Breakfast & Brunch, Restaurants, Food"
"487",156342,"Einstein Bros Bagels","Phoenix","AZ","85004",33.4497405,-112.0716698,"0","Delis, Breakfast & Brunch, Bagels, Food, Restaurants"
"488",187004,"Montreal Bagels","Calgary","AB","T2V 1K7",50.9792697,-114.082675,"1","Grocery, Bagels, Food"
"489",190173,"Panera Bread","Warrensville Heights","OH","44122",41.44481,-81.4971732,"1","Restaurants, Breakfast & Brunch, Sandwiches, Coffee & Tea, Salad, Food, Bagels, Soup"
"490",89292,"Gotham Provisions Company","Sun Prairie","WI","53590",43.1828531,-89.2203346,"0","Sandwiches, Food, Restaurants, Soup, Bagels"
