"","business_id","name","city","state","postal_code","latitude","longitude","is_open","categories"
"1",116415,"Panera Bread","Richmond Hill","ON","L4C 5G2",43.8568578495,-79.4344568253,"1","Salad, Bagels, Breakfast & Brunch, Sandwiches, Food, Bakeries, Soup, Restaurants"
"2",177308,"New York Bagels 'N Bialys","Scottsdale","AZ","85253",33.5796797,-111.9275444,"1","Restaurants, Delis, Breakfast & Brunch, American (Traditional), Food, Bakeries, Bagels"
"3",62236,"Dunkin' Donuts","Moon","PA","15108",40.5157666,-80.2216573,"1","Bagels, Donuts, Coffee & Tea, Breakfast & Brunch, Restaurants, Food"
"4",53529,"Einstein Bros Bagels","Las Vegas","NV","89119",36.0574675327,-115.1207419292,"1","Restaurants, Pizza, Food, Bagels, Sandwiches, Breakfast & Brunch"
"5",7207,"Winchell's Donut House","Las Vegas","NV","89146",36.1282146,-115.2252957,"1","Sandwiches, Food, Donuts, Bagels, Restaurants"
"6",153541,"Bagel St-Lo","Montréal","QC","H4H 1K6",45.4529067,-73.5724513,"1","Food, Internet Cafes, Bagels"
"7",150322,"Patisserie Lavande","Montréal","QC","H4R 1T4",45.4985638,-73.7497567,"1","Food Delivery Services, Food, Bagels, Bakeries"
"8",89018,"Panera Bread","North Ridgeville","OH","44039",41.385899,-81.9751,"1","Sandwiches, Bagels, Soup, Breakfast & Brunch, Salad, Restaurants, Bakeries, Food"
"9",10248,"What A Bagel","North York","ON","M3B 1X8",43.7545229757,-79.3575244778,"1","Bagels, Food"
"10",100815,"Nu Bügel","Toronto","ON","M5T 2L7",43.6553612109,-79.4023953024,"1","Bagels, Food"
"11",121582,"Rainbow Donuts Cafe and Deli","Phoenix","AZ","85032",33.611676987,-111.9984461607,"1","Bagels, Restaurants, Donuts, Sandwiches, Cafes, Food, Breakfast & Brunch, Delis"
"12",18060,"Panera Bread","Murrysville","PA","15668",40.421806,-79.661538,"1","Restaurants, Breakfast & Brunch, Sandwiches, Bagels, Food, Salad, Soup"
"13",139494,"Panera Bread","Allison Park","PA","15101",40.602218,-79.945617,"1","Bagels, Soup, Salad, Restaurants, Food, Sandwiches, Breakfast & Brunch"
"14",34869,"Einstein Bros Bagels","Tempe","AZ","85284",33.3218022,-111.9304637,"1","Restaurants, Breakfast & Brunch, Food, Delis, Bagels"
"15",158694,"Einstein Bros Bagels","Pittsburgh","PA","15241",40.3475049005,-80.0545406342,"0","Breakfast & Brunch, Food, Sandwiches, Bagels, Restaurants"
"16",45221,"Madhouse Coffee","Las Vegas","NV","89123",36.0280976,-115.1189137,"1","Bagels, Restaurants, Juice Bars & Smoothies, Breakfast & Brunch, Food, Coffee & Tea, Bakeries"
"17",184843,"The Cuppa","Las Vegas","NV","89135",36.1488913095,-115.3333637771,"0","Bagels, Coffee & Tea, Sandwiches, Bakeries, Food, Restaurants"
"18",22814,"The Bagel Cafe","Las Vegas","NV","89145",36.1761018,-115.2602821,"1","Breakfast & Brunch, Bagels, Delis, Coffee & Tea, Comfort Food, Cafes, Bakeries, Food, Restaurants"
"19",139269,"Panera Bread","Highland Heights","OH","44143",41.539594,-81.451432,"1","Bagels, Restaurants, Sandwiches, Soup, Breakfast & Brunch, Salad, Bakeries, Food"
"20",115733,"Einstein Bros Bagels","Chandler","AZ","85224",33.3065952578,-111.8891021576,"1","Delis, Food, Restaurants, Bagels"
"21",103412,"Bagelino's","Calgary","AB","T2P 1Z5",51.0457559,-114.0791699,"1","Bagels, Food, Sandwiches, Breakfast & Brunch, Cafes, Restaurants"
"22",68592,"Krispy Kreme","Las Vegas","NV","89109",36.1370185301,-115.1640695141,"1","Coffee & Tea, Donuts, Bagels, Food"
"23",165748,"Dunkin' Donuts","Crafton","PA","15205",40.4400217488,-80.0691623849,"1","Donuts, Coffee & Tea, Food, Bagels"
"24",55563,"Einstein Bros Bagels","Lakewood","OH","44107",41.4850286,-81.7977859,"1","Food, Caterers, Restaurants, Event Planning & Services, Bagels"
"25",58745,"Bagel Bin","Huntersville","NC","28078",35.442567,-80.860933,"1","Bagels, Restaurants, Delis, Coffee & Tea, Food"
"26",78879,"Tim Hortons","Toronto","ON","M5G 1X8",43.6597276849,-79.3907524248,"1","Food, Bagels, Coffee & Tea, Bakeries"
"27",107367,"Bagel World","Markham","ON","L6E 0H7",43.9043010026,-79.2690962926,"0","Breakfast & Brunch, Restaurants, Bagels, Waffles, Food"
"28",167791,"Einstein Bros","Las Vegas","NV","89119",36.1056431,-115.1368196,"1","Bagels, Restaurants, Breakfast & Brunch, Delis, Food"
"29",46425,"Einstein Bros Bagels","Glendale","AZ","85308",33.6392147652,-112.2302141629,"1","Food, Bagels, Coffee & Tea"
"30",8820,"Owen's Bagel & Deli","Charlotte","NC","28203",35.208424,-80.859759,"1","Coffee & Tea, Food, Delis, Restaurants, Bagels"
"31",100262,"Caribou Coffee And Einsteins Bros Bagels","Phoenix","AZ","85021",33.5531876399,-112.1038430913,"1","Food, Coffee & Tea, Juice Bars & Smoothies, Bagels"
"32",86922,"Caribou Coffee & Einstein Bros. Bagels","Tempe","AZ","85281",33.4227444,-111.9258396,"1","Restaurants, Sandwiches, Bagels, Food, Coffee & Tea, Internet Cafes"
"33",50920,"Bruegger's Bagels","Pittsburgh","PA","15213",40.4412932,-79.9569755,"1","Bagels, Sandwiches, Restaurants, Food, Breakfast & Brunch"
"34",89872,"Big City Bagels","Scottsdale","AZ","85260",33.627288,-111.89567,"1","Restaurants, Breakfast & Brunch, Food, Bagels, Delis"
"35",138510,"St-Viateur Bagel & Café","Montréal","QC","H2J 1X9",45.528427,-73.57911,"1","Cafes, Breakfast & Brunch, Bagels, Restaurants, Bakeries, Food, Coffee & Tea, Fast Food"
"36",20514,"St-Viateur Bagel & Café DDO","Pointe-Claire","QC","H9R 4X8",45.4751833936,-73.8123833354,"1","Food, Bagels, Breakfast & Brunch, Restaurants, Cafes, Bakeries"
"37",61332,"Toquoi","Montréal","QC","H2V 1L4",45.5187458,-73.6166623,"1","Food, Juice Bars & Smoothies, Coffee & Tea, Bagels"
"38",44496,"Einstein Bros","Las Vegas","NV","89119",36.1032874506,-115.14194525,"1","Sandwiches, Coffee & Tea, Food, Restaurants, Bagels"
"39",72633,"Bagel Nash","Thornhill","ON","L4J 0A6",43.8283387,-79.4787377,"1","Food, Bakeries, Bagels"
"40",42967,"The Great American Bagel Bakery","Charlotte","NC","28208",35.2184907,-80.9453334,"1","Bagels, Food"
"41",115735,"Panera Bread","Strongsville","OH","44136",41.3141693629,-81.83472,"1","Breakfast & Brunch, Bagels, Soup, Sandwiches, Salad, Food, Restaurants"
"42",72739,"Bagel World","Vaughan","ON","L6A 0A9",43.8621337551,-79.4857406616,"0","Food, Bagels, Restaurants, Breakfast & Brunch"
"43",80187,"Schmaltz","Toronto","ON","M6J 2Z9",43.6492114,-79.4209224,"1","Bagels, Coffee & Tea, Food"
"44",141072,"Howbowda Bagel","Champaign","IL","61820",40.1164204,-88.2433829,"0","Food, Bagels"
"45",165016,"Einstein Bros Bagels","Charlotte","NC","28207",35.19508,-80.825792,"0","Bagels, Food, Coffee & Tea"
"46",177304,"Rockaberry","Dollard-Des-Ormeaux","QC","H9B 1Z8",45.484633,-73.796026,"1","Salad, Diners, Desserts, Sandwiches, Cafes, Bagels, Restaurants, Food"
"47",68439,"Bruegger's Bagels","Cleveland Hghts.","OH","44106",41.5012588,-81.5929132,"1","Bagels, Breakfast & Brunch, Food, Restaurants, Sandwiches"
"48",172455,"Panera Bread","Charlotte","NC","28210",35.151154,-80.841072,"1","Restaurants, Bagels, Breakfast & Brunch, Bakeries, Soup, Salad, Sandwiches, Food"
"49",80583,"Einstein Bros","Las Vegas","NV","89103",36.1161032,-115.2425,"1","Delis, Restaurants, Bakeries, Bagels, Food"
"50",149904,"Einstein Brothers Bagels","Madison","WI","53704",43.1215580306,-89.318560982,"1","Food, Bagels"
"51",121315,"Mako Espresso Bar","Toronto","ON","M4E 2W2",43.6844069,-79.2974463,"1","Food, Coffee & Tea, Bagels, Desserts"
"52",72338,"Hot Bagels & Deli","Glendale Az","AZ","85310",33.7135958371,-112.2001252952,"1","Food, Delis, Restaurants, Breakfast & Brunch, Bagels"
"53",38128,"Einstein Bros Bagels","Champaign","IL","61822",40.1365794371,-88.2573496356,"1","Restaurants, Bagels, American (New), Breakfast & Brunch, Food"
"54",50767,"Nocawich","Tempe","AZ","85281",33.4227395826,-111.9347911023,"1","Food, Breakfast & Brunch, Sandwiches, Restaurants, Bagels"
"55",3745,"Tega Cay Gourmet Deli","Tega Cay","SC","29708",35.0474998,-80.9918989,"1","Breakfast & Brunch, Food, Sandwiches, Restaurants, Delis, Bagels"
"56",18868,"Einstein Bros Bagels","Phoenix","AZ","85016",33.5087147,-112.0458206,"1","Delis, Restaurants, Bagels, Food, Breakfast & Brunch"
"57",130668,"Mustard Cafe","Las Vegas","NV","89169",36.1274670308,-115.1690260629,"0","Cafes, Coffee & Tea, Bagels, Food, Restaurants"
"58",92623,"Panera Bread","Charlotte","NC","28277",35.053051,-80.850809,"1","Bakeries, Salad, Breakfast & Brunch, Food, Bagels, Restaurants, Soup, Sandwiches"
"59",168711,"St. Urbain Bagel Bakery","Thornhill","ON","L4J 2J6",43.7940577,-79.4455122,"1","Food, Bagels"
"60",837,"What A Bagel - Spadina","Toronto","ON","M5V 2L4",43.6471114738,-79.3958801811,"1","Bakeries, Breakfast & Brunch, Food, Bagels, Restaurants"
"61",104072,"Einstein Bros. Bagels","Canonsburg","PA","15317",40.2731213,-80.126437,"1","Food, Coffee & Tea, Bagels"
"62",42319,"Panera Bread","Pittsburgh","PA","15213",40.436272,-79.958116,"1","Breakfast & Brunch, Salad, Sandwiches, Food, Soup, Bagels, Restaurants"
"63",41226,"Dunkin' Donuts","Las Vegas","NV","89149",36.2858206806,-115.2885471582,"1","Coffee & Tea, Donuts, Bagels, Food"
"64",77708,"Tim Hortons","Toronto","ON","M5V 2K2",43.646919747,-79.3951460347,"0","Coffee & Tea, Food, Donuts, Bagels"
"65",23661,"Panera Bread","Madison","WI","53717",43.0731892532,-89.5248886945,"1","Salad, Bagels, Soup, Breakfast & Brunch, Food, Restaurants, Sandwiches"
"66",187230,"BIGGBY COFFEE","Champaign","IL","61821",40.1123750709,-88.2772195188,"1","Bagels, Coffee & Tea, Restaurants, Bakeries, Cafes, Food"
"67",44065,"Barista Bagels","Las Vegas","NV","89109",36.1376416,-115.1653861,"1","Coffee & Tea, Breakfast & Brunch, Food, Bagels, Restaurants"
"68",10918,"City Square Cafe","Phoenix","AZ","85012",33.4918515,-112.074775,"0","Restaurants, Breakfast & Brunch, Bagels, Food, Sandwiches"
"69",65841,"Bruegger's Bagels","Charlotte","NC","28262",35.312144,-80.745093,"0","Restaurants, Food, Sandwiches, Breakfast & Brunch, Bagels"
"70",20256,"Panera Bread","Westlake","OH","44145",41.468284,-81.909276,"1","Breakfast & Brunch, Restaurants, Salad, Soup, Sandwiches, Bakeries, Bagels, Food"
"71",158318,"Bruegger's Bagels","Sewickley","PA","15143",40.5406501,-80.1811203,"1","Sandwiches, Restaurants, Bagels, Bakeries, Food, Breakfast & Brunch"
"72",83748,"Tim Hortons","Toronto","ON","M6P 2A2",43.6653638,-79.4750685,"1","Donuts, Restaurants, Coffee & Tea, Sandwiches, Breakfast & Brunch, Bagels, Food"
"73",47366,"Panera Bread","Mentor","OH","44060",41.6540041778,-81.3784173131,"1","Sandwiches, Soup, Bagels, Breakfast & Brunch, Salad, Food, Restaurants"
"74",67538,"Tim Hortons","Lachine","QC","H8R 4E1",45.442169,-73.6463282,"1","Food, Bagels"
"75",75844,"Back East Bagels","Tempe","AZ","85282",33.3943144,-111.9129167,"1","Restaurants, Breakfast & Brunch, Bagels, Sandwiches, Food"
"76",110471,"Brooklyns Best Bagel and Deli","Phoenix","AZ","85050",33.6756727,-111.9791944,"0","Delis, Restaurants, Food, Bagels"
"77",57734,"Chompie's","Scottsdale","AZ","85260",33.5809003055,-111.8806399013,"1","Restaurants, Bagels, Caterers, Event Planning & Services, Delis, Food, Breakfast & Brunch, Bakeries"
"78",87190,"Einsteins Bagels","Phoenix","AZ","85028",33.5834720349,-111.9760118954,"1","Food, Bagels"
"79",143138,"Einstein Bros Bagels","Phoenix","AZ","85004",33.4663898,-112.0656616,"1","Delis, Restaurants, Food, Breakfast & Brunch, Bagels, Coffee & Tea"
"80",91926,"The Bagel Shoppe","South Euclid","OH","44121",41.5056444,-81.5369026,"1","Bagels, Food"
"81",124800,"Viva Café Espresso Bar","Las Vegas","NV","89107",36.1725319,-115.197258,"0","Food, Cafes, Restaurants, Coffee & Tea, Bagels"
"82",176441,"The Bagel House","Toronto","ON","M4T 1Y7",43.6873008,-79.3939087,"1","Bagels, Food"
"83",99830,"Panera Bread","Champaign","IL","61821",40.097838,-88.275366,"1","Bagels, Sandwiches, Salad, Breakfast & Brunch, Bakeries, Soup, Restaurants, Food"
"84",179360,"Bagel Nash","Toronto","ON","M3J 3N4",43.7852513,-79.4732888,"1","Bagels, Bakeries, Sandwiches, Restaurants, Food, Breakfast & Brunch"
"85",29236,"Dunkin' Donuts","Irwin","PA","15642",40.3250195,-79.7035194,"1","Bagels, Restaurants, Ice Cream & Frozen Yogurt, Food, Coffee & Tea, Donuts"
"86",47018,"Panera Bread","Scottsdale","AZ","85251",33.494685103,-111.927015268,"1","Sandwiches, Food, Restaurants, Bagels, Bakeries"
"87",168367,"Grotto Cafe","Cave Creek","AZ","85331",33.8323562,-111.9408396,"1","Coffee & Tea, Restaurants, Cafes, Bagels, Food, Breakfast & Brunch, Beer, Wine & Spirits, American (New), Local Flavor"
"88",173761,"Einstein Bros Bagels","Charlotte","NC","28203",35.2141898,-80.8545793,"1","Restaurants, Bagels, Food"
"89",41865,"O'Bagel","Montréal","QC","H2S 1B5",45.5359283997,-73.6137303337,"1","Food, Bagels"
"90",97440,"Lox Stock & Bagel","Champaign","IL","61824",40.1211828,-88.2434596,"0","Restaurants, Food, Bagels"
"91",176299,"Bialy's Bagels","Cleveland","OH","44118",41.4979909,-81.5357253,"1","Restaurants, Food, Bagels, Bakeries"
"92",175663,"Buka Maranga","Mississauga","ON","L5N 5R3",43.5911743,-79.7418695,"1","Food, Breakfast & Brunch, Restaurants, Bagels, Bakeries, Cafes"
"93",175780,"Sunset Grill","Nobleton","ON","L0G 1N0",43.9079343,-79.6526462,"1","Sandwiches, Breakfast & Brunch, Diners, Restaurants, Bagels, Food, Canadian (New)"
"94",147962,"Einstein Bros Bagels","Las Vegas","NV","89139",36.0393356223,-115.1912002953,"1","Coffee & Tea, Bagels, Food"
"95",31179,"Panera Bread","Pittsburgh","PA","15232",40.456066,-79.937436,"1","Soup, Food, Sandwiches, Breakfast & Brunch, Salad, Bagels, Restaurants"
"96",2581,"The Great Canadian Bagel","Mississauga","ON","L4W 1S9",43.6790689348,-79.6079389316,"1","Food, Coffee & Tea, Bagels"
"97",118504,"Express Donuts","Goodyear","AZ","85395",33.4651361,-112.356396,"1","Food, Donuts, Bagels, Breakfast & Brunch, Coffee & Tea, Restaurants"
"98",170653,"Dunkin' Donuts","Elyria","OH","44035",41.4151103581,-82.0775117684,"1","Donuts, Coffee & Tea, Food, Bagels"
"99",126966,"Great Canadian Bagel","Calgary","AB","T2S 0A3",51.0376927,-114.069133,"0","Food, Restaurants, Delis, Bagels"
"100",96079,"The Cleveland Bagel Co","Cleveland","OH","44113",41.4873977922,-81.7163715252,"1","Bagels, Donuts, Food"
"101",123649,"Panera Bread","Solon","OH","44139",41.392065,-81.442852,"1","Sandwiches, Food, Bagels, Salad, Breakfast & Brunch, Soup, Bakeries, Restaurants, Cafes"
"102",81770,"Vermont Sandwich Co","Scottsdale","AZ","85260",33.6396513,-111.8913939,"0","Sandwiches, Vegetarian, Restaurants, Breakfast & Brunch, Food, Soup, Salad, Bagels"
"103",86154,"The Coffee Buzz","Phoenix","AZ","85073",33.3055166,-111.9798699,"0","Food, Sandwiches, Restaurants, Bagels, Local Flavor, Coffee & Tea"
"104",153161,"La Fabrique de Bagel","Montréal","QC","H3B 4W5",45.498563,-73.566195,"1","Food, Bagels"
"105",57309,"Ana Meilleure Cuisine","Montréal","QC","H2W 1X9",45.515867,-73.576528,"1","Food, Restaurants, Bagels, Sandwiches, Coffee & Tea"
"106",2183,"Sweet Buzz Bean & Bistro","Harrison City","PA","15636",40.3550933347,-79.6515513495,"1","Coffee & Tea, Restaurants, Bagels, Food, American (Traditional), American (New), Hot Dogs, Bakeries, Breakfast & Brunch"
"107",62121,"Panera Bread","Medina","OH","44256",41.16388,-81.861382,"1","Salad, Food, Sandwiches, Bagels, Restaurants, Soup, Breakfast & Brunch"
"108",44402,"Sunrise Kosher Foods","North York","ON","M3H 2S5",43.7551507,-79.4417537,"1","Delis, Sandwiches, Food, Restaurants, Bagels, Specialty Food"
"109",160761,"Panera Bread","Champaign","IL","61820",40.138507,-88.243173,"1","Breakfast & Brunch, Bagels, Restaurants, Soup, Food, Coffee & Tea, Salad, Sandwiches, Bakeries"
"110",35669,"Jamboree Bagel Restaurant & Cafe","Las Vegas","NV","89149",36.2660802,-115.2586289,"0","Donuts, Restaurants, Bakeries, Food, Bagels, Delis"
"111",164494,"Panera Bread","Charlotte","NC","28207",35.201751,-80.824406,"1","Bagels, Food, Salad, Breakfast & Brunch, Coffee & Tea, Soup, Sandwiches, Delis, Restaurants"
"112",77217,"Dj's Bagel Cafe","Fountain Hills","AZ","85268",33.609428,-111.729264,"1","Bagels, Restaurants, Cafes, Food"
"113",105016,"Carefree Coffee","Cave Creek","AZ","85331",33.8276875987,-111.9247950548,"1","Customized Merchandise, Bagels, Food, Shopping, Coffee & Tea, Bakeries, Coffee Roasteries"
"114",1323,"My Brothers Bagel","Denver","NC","28037",35.4629853826,-80.9935725116,"1","Bagels, Food, Breakfast & Brunch, Restaurants, Sandwiches"
"115",146632,"Bagel Buddy's","Euclid","OH","44123",41.601661,-81.539694,"1","Bagels, Restaurants, Food"
"116",53439,"Bubby's Bagels","Toronto","ON","M6B 3B5",43.718317,-79.429265,"1","Breakfast & Brunch, Event Planning & Services, Restaurants, Bagels, Caterers, Kosher, Food"
"117",183146,"Manhattan Bagel","Charlotte","NC","28277",35.0970774975,-80.7790989891,"1","Breakfast & Brunch, Delis, Vegetarian, Kosher, Vegan, Bagels, Food, Restaurants"
"118",144924,"Bagel Nosh","Gilbert","AZ","85233",33.3341319,-111.8075763,"1","Food, Sandwiches, Breakfast & Brunch, Restaurants, Bagels"
"119",535,"Einstein Bros Bagels","Las Vegas","NV","89149",36.2837875042,-115.287225086,"1","Breakfast & Brunch, Bagels, Food, Coffee & Tea, Restaurants, Sandwiches"
"120",143280,"Bruegger's Bagels","Stow","OH","44224",41.1997322,-81.4396676,"1","Sandwiches, Breakfast & Brunch, Restaurants, Food, Bagels"
"121",121500,"The Bagel Cafe","Las Vegas","NV","89136",36.1590987,-115.3376537,"0","Cafes, Food, Restaurants, American (Traditional), Bagels"
"122",168069,"Kiva's  Bagel Bar","Toronto","ON","M5H 3A9",43.6500952,-79.3848513,"1","Delis, Bagels, Breakfast & Brunch, Food, Restaurants"
"123",170925,"Panera Bread","Willoughby","OH","44094",41.627283,-81.431397,"1","Food, Coffee & Tea, Soup, Bagels, Restaurants, Breakfast & Brunch, Sandwiches, Salad"
"124",68212,"Station Kaffe","Montréal","QC","H3A 1T5",45.5009023,-73.5736691,"0","Food, Bagels, Bakeries, Coffee & Tea"
"125",31878,"Panera Bread","Pittsburgh","PA","15205",40.4403206,-80.1492465,"1","Soup, Bagels, Food, Breakfast & Brunch, Sandwiches, Salad, Restaurants"
"126",31385,"Arabica","Willoughby","OH","44094",41.640026,-81.40682,"0","American (Traditional), Sandwiches, Bagels, Food, Desserts, Restaurants, Coffee & Tea, Bakeries"
"127",159449,"Panera Bread","Amherst","OH","44001",41.4127637372,-82.2394618394,"1","Salad, Sandwiches, Breakfast & Brunch, Bakeries, Restaurants, Cafes, Soup, Bagels, Food"
"128",7004,"Brooklyn Bagels","Las Vegas","NV","89123",36.01979,-115.15036,"0","Food, Bagels"
"129",12182,"Panera Bread","North Olmsted","OH","44070",41.418357,-81.911685,"1","Breakfast & Brunch, Restaurants, Bagels, Food, Salad, Soup, Cafes, Bakeries, Sandwiches"
"130",85458,"Bruegger's Bagels","Pittsburgh","PA","15232",40.4507324,-79.935724,"1","Restaurants, Breakfast & Brunch, Sandwiches, Food, Bagels"
"131",103408,"Redheads Japa Cafe","Calgary","AB","T2R 0E2",51.0428936933,-114.0758754934,"1","Bagels, Buffets, Food, Japanese, Cafes, Tapas Bars, Restaurants, Breakfast & Brunch"
"132",14681,"Bruegger's Bagels","Pittsburgh","PA","15203",40.4289222,-79.9803032,"1","Sandwiches, Bagels, Restaurants, Breakfast & Brunch, Food"
"133",172978,"Gasoline Street Coffee","Pittsburgh","PA","15219",40.4353844922,-79.995624918,"1","Breakfast & Brunch, Coffee & Tea, Bakeries, Food, Cafes, Restaurants, Juice Bars & Smoothies, Bagels"
"134",171529,"The Nosh Cafe","Phoenix","AZ","85044",33.3308508709,-111.9786421111,"1","Bagels, Sandwiches, Coffee & Tea, Food, Breakfast & Brunch, Restaurants"
"135",135468,"Panera Bread","Toronto","ON","M3C 0H8",43.734813402,-79.3440060318,"1","Salad, Soup, Restaurants, Bagels, Food, Sandwiches, Breakfast & Brunch"
"136",169944,"The Madison Deli","Phoenix","AZ","85016",33.5157019634,-112.0469014803,"1","Restaurants, Bagels, Delis, Food"
"137",94879,"Smokey Jo's Bagel Bar & Deli","Toronto","ON","M1C 2L4",43.7896024133,-79.1399149189,"1","Restaurants, Delis, Burgers, Food, Coffee & Tea, Bagels"
"138",66519,"Dough Bakeshop","Toronto","ON","M4K 1N2",43.6764344,-79.3566296,"1","Desserts, Gluten-Free, Restaurants, Bagels, Bakeries, Ice Cream & Frozen Yogurt, Food"
"139",13019,"R.E.A.L. Bagel","Montréal","QC","H3W 3E3",45.4917185,-73.6463642,"1","Bagels, Food"
"140",89773,"Tim Horton's","Toronto","ON","M5H 3V9",43.6498592,-79.3820602,"1","Restaurants, Bagels, Donuts, Coffee & Tea, Cafes, Food"
"141",95731,"Brooklyn Bagel Deli","Henderson","NV","89074",36.0293246869,-115.0858483931,"0","Breakfast & Brunch, Food, Sandwiches, Bagels, Restaurants"
"142",122704,"Panera Bread","Las Vegas","NV","89148",36.0957996497,-115.2966007591,"1","Breakfast & Brunch, Soup, Food, Bagels, Salad, Restaurants, Sandwiches"
"143",165311,"Bagel Boat","Lake Wylie","SC","29710",35.1099757308,-81.0442433231,"1","Food Delivery Services, Event Planning & Services, Cafes, Sandwiches, Breakfast & Brunch, Caterers, Bagels, Food, Restaurants"
"144",143037,"Bagel Time","Toronto","ON","M4K 1R1",43.6787836894,-79.3468884006,"1","Bagels, Food, Sandwiches, Restaurants"
"145",155996,"Pearlee & Cille's Bagel Cafe","Belmont","NC","28012",35.2454935,-81.0373572,"1","Food, Desserts, Donuts, Bagels, Coffee & Tea, Kids Activities, Ice Cream & Frozen Yogurt, Active Life"
"146",97411,"Vegas 808","Las Vegas","NV","89101",36.1730572,-115.1450046,"1","Specialty Food, Convenience Stores, Ethnic Food, Food, Candy Stores, Bagels"
"147",112566,"Einstein Bros Bagels","Pittsburgh","PA","15213",40.4417577,-79.9551865,"1","Food, Bagels"
"148",133806,"Panera Bread","Pittsburgh","PA","15220",40.395932,-80.067397,"1","Soup, Restaurants, Breakfast & Brunch, Coffee & Tea, Bagels, Food, Bakeries, Salad, Sandwiches"
"149",30316,"Boss Coffee","Scottsdale","AZ","85255",33.696356776,-111.9246612765,"1","Restaurants, Food, Juice Bars & Smoothies, Cafes, Bagels, Sandwiches, Breakfast & Brunch, Internet Cafes, Coffee & Tea"
"150",135475,"Hot Bagels & Deli","Glendale","AZ","85308",33.6666947,-112.1878914,"1","Restaurants, Bagels, Food, Sandwiches, Breakfast & Brunch"
"151",124595,"Dunkin' Donuts","Pittsburgh","PA","15213",40.4422,-79.956316,"1","Bakeries, Bagels, Food, Donuts, Coffee & Tea"
"152",19177,"Einstein Bros Bagels","Glendale","AZ","85306",33.6111943,-112.18517,"1","Delis, Bagels, Restaurants, Food"
"153",118189,"Bagel Factory","Pittsburgh","PA","15217",40.438304,-79.9199261,"1","Food, Sandwiches, Restaurants, Specialty Food, Bagels, Delis"
"154",33001,"Java Jive Coffee & Tea Co","Toronto","ON","M4Y 2E4",43.6682927,-79.3818156,"0","Cafes, Sandwiches, Food, Bagels, Coffee & Tea, Restaurants, Breakfast & Brunch"
"155",21883,"Mike's Deli and Bagels","Concord","NC","28027",35.4109106703,-80.6664403528,"1","Bagels, Food, Restaurants, Breakfast & Brunch, Sandwiches, Delis"
"156",127211,"Ville Emard Bagels","Montréal","QC","H4E 3J1",45.4533798,-73.5939113,"1","Food, Bagels"
"157",12857,"The Best NY Bagel Deli","Cornelius","NC","28031",35.4787634,-80.8933777,"1","Restaurants, Food, Bagels"
"158",89956,"Tim Hortons","Calgary","AB","T2E 6Z8",51.12957843,-114.0086077899,"1","Donuts, Bagels, Food, Coffee & Tea"
"159",88900,"Cafe On the Go","Toronto","ON","M8X",43.6454388488,-79.5240855217,"1","Bagels, Food, Coffee & Tea"
"160",902,"Hot Bagels & Deli # 1","Litchfield Park","AZ","85340",33.5096682822,-112.3565273425,"1","Restaurants, Delis, Food, Bagels"
"161",22064,"1865 Coffee","Tempe","AZ","85281",33.4222101,-111.9384367,"1","Cafes, Sandwiches, Bagels, Coffee & Tea, Restaurants, Breakfast & Brunch, Food"
"162",182299,"Great Canadian Bagel","Ajax","ON","L1S 7K7",43.8419547,-79.0223692,"1","Bagels, Food"
"163",42033,"Panera Bread","Pittsburgh","PA","15235",40.429091169,-79.8130032421,"1","Salad, Bagels, Sandwiches, Food, Breakfast & Brunch, Soup, Bakeries, Restaurants"
"164",187042,"Panera Bread","South Euclid","OH","44118",41.5016104641,-81.5394338967,"1","Breakfast & Brunch, Restaurants, Bakeries, Soup, Bagels, Food, Salad, Sandwiches"
"165",174518,"Einstein Bros Bagels","Las Vegas","NV","89123",36.0175333439,-115.1174958806,"1","Bagels, Food, Bakeries"
"166",160730,"Aj's Fine Foods","Scottsdale","AZ","85250",33.6220938744,-111.8730840786,"1","Farmers Market, Seafood Markets, Coffee & Tea, Flowers & Gifts, Bagels, Restaurants, Shopping, Florists, Health Markets, Beer, Wine & Spirits, Grocery, Specialty Food, Barbeque, Bakeries, Food"
"167",101071,"Einstein Bros Bagels","Surprise","AZ","85374",33.641429,-112.354776,"1","Food, Bagels"
"168",56840,"Tortas Ahogadas El Pariente","North Las Vegas","NV","89030",36.2062789,-115.112654,"0","Imported Food, Bagels, Ethnic Food, Restaurants, Specialty Food, Mexican, Food"
"169",135452,"Java Express Cafe","Mentor","OH","44060",41.6732003205,-81.3392919302,"1","Sandwiches, Bagels, Cafes, Coffee & Tea, Food, Restaurants"
"170",12647,"Panera Bread","McMurray","PA","15317",40.263010369,-80.131316185,"1","Breakfast & Brunch, Sandwiches, Bagels, Restaurants, Food, Bakeries, Salad, Soup"
"171",40579,"Kokobelli Bagel Cafe","Mesa","AZ","85206",33.3945593,-111.6836794,"1","Sandwiches, Cafes, Breakfast & Brunch, Bagels, Food, Restaurants"
"172",176511,"Beauty's Luncheonette","Montréal","QC","H2T 2S5",45.5191426,-73.587511,"1","Diners, Breakfast & Brunch, Food, Delis, Bagels, Restaurants"
"173",127609,"Empire Bagels","Las Vegas","NV","89148",36.0772861605,-115.2981759269,"0","Delis, Restaurants, Breakfast & Brunch, Food, Bagels"
"174",142629,"Second Cup Colossus","Vaughan","ON","L4L 0B6",43.7889219,-79.5450052,"0","Food, Coffee & Tea, Bagels"
"175",192118,"Einstein Bros Bagels","Las Vegas","NV","89129",36.2188667,-115.2746367,"1","Bagels, Delis, Food, Restaurants, Sandwiches"
"176",112741,"Brueggers Bagels","Gilbert","AZ","85233",33.363016,-111.841114,"0","Restaurants, Sandwiches, Bagels, Food, Breakfast & Brunch"
"177",129171,"The Bagel Stop","Toronto","ON","M4W 3G7",43.6710978,-79.386063,"1","Bagels, Food"
"178",179556,"Dunkin' Donuts","Urbana","IL","61801",40.1167564392,-88.2114257812,"1","Food, Bagels, Donuts, Coffee & Tea"
"179",107159,"Einstein Bros Bagels","Charlotte","NC","28208",35.2223175,-80.9414618,"1","Food, Coffee & Tea, Bagels"
