"","business_id","name","city","state","postal_code","latitude","longitude","is_open","categories"
"180",77271,"Rising Star Coffee Roasters","Lakewood","OH","44107",41.477292,-81.784374,"1","Coffee Roasteries, Bagels, Food, Coffee & Tea"
"181",132254,"Panera Bread","Oakmont","PA","15139",40.52108,-79.841511,"1","Soup, Bagels, Breakfast & Brunch, Salad, Food, Restaurants, Sandwiches"
"182",2318,"Panera Bread","Cleveland","OH","44106",41.509763,-81.603852,"1","Salad, Breakfast & Brunch, Sandwiches, Soup, Bagels, Restaurants, Food, Bakeries"
"183",53792,"Chompie's","Phoenix","AZ","85032",33.6027713133,-111.9813721156,"1","Caterers, Delis, Bagels, Breakfast & Brunch, Event Planning & Services, Food, Bakeries, Restaurants"
"184",29540,"Brew at Juma","Shaker Heights","OH","44122",41.4642659,-81.5382528,"1","Coffee & Tea, Shopping, Arts & Entertainment, Beer, Wine & Spirits, Accessories, Nightlife, Sandwiches, Art Galleries, Bars, Fashion, Tapas/Small Plates, Bagels, Restaurants, Bakeries, Food"
"185",190264,"Loca Boba","Phoenix","AZ","85033",33.4780654,-112.2256247,"1","Macarons, Bagels, Food, Specialty Food, Juice Bars & Smoothies, Coffee & Tea"
"186",20300,"Bagels-N-More","Las Vegas","NV","89121",36.0996751,-115.1186361,"0","Food, Restaurants, Bagels"
"187",175300,"Bruegger's Bagels","Madison","WI","53705",43.061218,-89.486019,"0","Bagels, Breakfast & Brunch, Restaurants, Food, Sandwiches"
"188",174600,"Blenz Coffee","Calgary","AB","T2P 0Z1",51.0470607,-114.0764657,"1","Sandwiches, Bagels, Food, Restaurants, Coffee & Tea"
"189",189283,"Panera Bread","Pittsburgh","PA","15213",40.4416203898,-79.9566856027,"1","Bakeries, Breakfast & Brunch, Restaurants, Salad, Sandwiches, Bagels, Soup, Delis, Coffee & Tea, Food"
"190",159998,"Krispy Kreme","Las Vegas","NV","89109",36.1088418,-115.1721488,"1","Donuts, Bagels, Coffee & Tea, Food"
"191",170380,"Bruegger's Bagels","Fairlawn","OH","44333",41.1366611,-81.6345573,"1","Restaurants, Food, Sandwiches, Breakfast & Brunch, Bagels"
"192",72369,"Caribou Coffee and Einstein's Bagels","Gilbert","AZ","85295",33.3061994,-111.7589092,"1","Coffee & Tea, Bagels, Food"
"193",140536,"Viva Café","Las Vegas","NV","89169",36.1248998,-115.1350531,"1","Coffee & Tea, Juice Bars & Smoothies, Bagels, Cafes, Food, Tea Rooms, Sandwiches, Restaurants"
"194",160545,"Fractured Prune Doughnuts","Glendale","AZ","85305",33.5349973245,-112.2609967759,"1","Breakfast & Brunch, Pizza, Restaurants, Bakeries, Bagels, Desserts, Donuts, Food, Coffee & Tea"
"195",128656,"Fresh Blend Coffee & Sandwich Bar","Calgary","AB","T3A 0Z9",51.0920607,-114.1539556,"1","Cafes, Bakeries, Restaurants, Korean, Food, Coffee & Tea, Ethnic Food, Sandwiches, Bagels, Specialty Food"
"196",72450,"Big Apple Bagels","Henderson","NV","89074",36.0352661982,-115.0982050482,"1","Food, Restaurants, Sandwiches, Coffee & Tea, Bagels"
"197",7319,"Enchanted Cupcakes and More","Phoenix","AZ","85041",33.3796253,-112.1385527,"1","Cupcakes, Restaurants, Food, Donuts, Bakeries, Bagels, Desserts, Breakfast & Brunch, Custom Cakes"
"198",53978,"Panera Bread","Matthews","NC","28105",35.123889,-80.707596,"1","Sandwiches, Delis, Food, Restaurants, Soup, Breakfast & Brunch, Bagels, Salad"
"199",19944,"Everything Bagels","Phoenix","AZ","85016",33.524593147,-112.0471481325,"1","Bagels, Breakfast & Brunch, Sandwiches, Food, Restaurants, Coffee & Tea"
"200",34329,"Brickway Bagels","Mesa","AZ","85210",33.412437,-111.857159,"0","Food, Bagels, Shopping, Antiques"
"201",191566,"Panera Bread","Pittsburgh","PA","15238",40.4891772611,-79.8925406952,"1","Soup, Salad, Breakfast & Brunch, Bagels, Sandwiches, Food, Restaurants, Bakeries"
"202",145687,"Bruegger's Bagels","Hudson","OH","44236",41.2396502,-81.4453734,"1","Breakfast & Brunch, Bagels, Restaurants, Sandwiches, Food"
"203",11163,"Panera Bread","Henderson","NV","89014",36.0646853186,-115.039139986,"1","Soup, Food, Bakeries, Salad, Bagels, Breakfast & Brunch, Restaurants, Sandwiches"
"204",169176,"Tranches de Bonheur","Verdun","QC","H4H 1M9",45.454399,-73.567509,"1","Coffee & Tea, Breakfast & Brunch, Restaurants, Bagels, Canadian (New), Food, Cafes"
"205",71019,"Panera Bread","Brooklyn","OH","44144",41.423111,-81.760827,"1","Sandwiches, American (Traditional), Food, Restaurants, Soup, Breakfast & Brunch, Salad, Bagels"
"206",82145,"Panera Bread","Hudson","OH","44236",41.238893,-81.446344,"1","Bagels, Salad, Soup, Breakfast & Brunch, Restaurants, Food, Sandwiches"
"207",101496,"Fairmount Bagel","Montréal","QC","H2T 2M2",45.5229082,-73.5952772,"1","Bakeries, Food, Bagels"
"208",3243,"Panera Bread","Toronto","ON","M5B 1R8",43.6571142451,-79.3815341592,"1","Delis, Restaurants, Sandwiches, Food, Salad, Breakfast & Brunch, Soup, Bagels, Bakeries"
"209",135117,"Panera Bread","Thornhill","ON","L4J 3M8",43.809673,-79.457857,"0","Bagels, Salad, Breakfast & Brunch, Sandwiches, Restaurants, Bakeries, Internet Cafes, Soup, Food"
"210",2349,"Panera Bread","Madison","WI","53705",43.075946,-89.446009,"1","Food, Bagels, Soup, Breakfast & Brunch, Sandwiches, Restaurants, Salad"
"211",1079,"Bronze Cafe at The Market","Las Vegas","NV","89101",36.1682897,-115.1391277,"1","Coffee & Tea, Restaurants, Vegan, Salad, Bagels, Grocery, Juice Bars & Smoothies, Breakfast & Brunch, Food, Caterers, Event Planning & Services, Cafes, Sandwiches"
"212",55256,"Honeybee Donuts","Markham","ON","L3P 5E5",43.8682520508,-79.2846966907,"1","Breakfast & Brunch, Bagels, Donuts, Restaurants, Food"
"213",141167,"Affogato","Bellevue","PA","15202",40.496863,-80.058902,"0","Food, Coffee & Tea, Soup, Restaurants, Bagels"
"214",87864,"Bagel World","Toronto","ON","M3H 1S9",43.7368719,-79.4376865,"1","Bakeries, Bagels, Kosher, Food, Restaurants, Breakfast & Brunch"
"215",92360,"Tim Hortons","Toronto","ON","M5H 3B3",43.6478833787,-79.3850146607,"1","Food, Bakeries, Coffee & Tea, Donuts, Bagels"
"216",11167,"Cafe Sheli","Thornhill","ON","L4J 7Y3",43.8097134,-79.4515772,"1","Restaurants, Kosher, Bagels, Breakfast & Brunch, Food, Middle Eastern"
"217",144636,"Gotham Bagels","Madison","WI","53704",43.0769221065,-89.3835302639,"1","Food, Bagels, Delis, Breakfast & Brunch, Restaurants"
"218",26620,"Bruegger's Bagels","Cleveland","OH","44135",41.4109065,-81.8336741,"1","Food, Breakfast & Brunch, Salad, Bagels, Restaurants, Sandwiches"
"219",37094,"Granny Mac's Bake Shop","Harrisburg","NC","28075",35.321683,-80.659621,"0","Bakeries, Donuts, Bagels, Restaurants, Food, Pizza"
"220",6139,"Bagel St-Henri","Montréal","QC","H4C 1C8",45.4771946,-73.5904975,"1","Bakeries, Event Planning & Services, Food, Bagels, Caterers, Breakfast & Brunch, Restaurants, Sandwiches, Cafes"
"221",144147,"Bongiorno Bagels","Gilbert","AZ","85295",33.2929773888,-111.7889980227,"1","Restaurants, Sandwiches, Coffee & Tea, Bagels, Food"
"222",13918,"Coffee Bean & Tea Leaf","Henderson","NV","89052",35.999233,-115.104056,"1","Internet Cafes, Food, Coffee & Tea, Bagels"
"223",2591,"Bagels on Greene","Montréal","QC","H3Z 1P4",45.4862525,-73.5875134,"1","Restaurants, Grocery, Sandwiches, Internet Cafes, Salad, Food, Breakfast & Brunch, Bagels"
"224",17977,"Bagels On Fire","Toronto","ON","M4E 1G2",43.6728334,-79.2867277,"1","Bagels, Coffee & Tea, Breakfast & Brunch, Food, Restaurants"
"225",97467,"Bruegger's Bagels","Willoughby","OH","44094",41.607959,-81.440713,"1","Sandwiches, Bagels, Restaurants, Bakeries, Breakfast & Brunch, Food"
"226",59254,"New York Bagels N Bialys at SkySong","Scottsdale","AZ","85257",33.4643786,-111.9257504,"1","Breakfast & Brunch, Sandwiches, Restaurants, Bagels, Food, Delis"
"227",177251,"Port City Java","Charlotte","NC","28202",35.2279675,-80.8412983,"0","Restaurants, Bagels, Food, Wraps, Sandwiches, Coffee Roasteries, Coffee & Tea"
"228",53879,"What A Bagel","Ajax","ON","L1Z 0T4",43.8787194011,-79.0247792265,"1","Food, Bakeries, Restaurants, Breakfast & Brunch, Bagels"
"229",173316,"Big Apple Bagels","Tega Cay","SC","29708",35.0483346,-80.9922069,"0","Coffee & Tea, Delis, Food, Bagels, Restaurants"
"230",133635,"Passenger's Cafe","Cleveland","OH","44113",41.4830039,-81.7028128,"1","Food, Coffee & Tea, Bagels"
"231",126476,"Life's A Bagel","Las Vegas","NV","89128",36.2003923,-115.2819365,"1","Food, Restaurants, Delis, Bagels, Sandwiches, American (Traditional)"
"232",11353,"Hinnawi Bros Bagel & Café","Montréal","QC","H2X 1E6",45.5166486,-73.567286,"1","Bagels, Food"
"233",177670,"The Roasted Bean","Las Vegas","NV","89109",36.1206533199,-115.1757013701,"1","Bagels, Food, Coffee & Tea, Bakeries"
"234",43462,"What A Bagel","North York","ON","M6A 2C5",43.7290402,-79.4316426,"0","Bagels, Food"
"235",104305,"Parker's PGH","Pittsburgh","PA","15226",40.3952468,-80.0224334,"1","Food, Restaurants, Sandwiches, Breakfast & Brunch, Coffee & Tea, Bagels"
"236",67067,"Einstein Bros Bagels","Las Vegas","NV","89169",36.102268,-115.156796,"1","Bagels, Food"
"237",7895,"Everything Bagels","Scottsdale","AZ","85251",33.4943831063,-111.925853344,"0","Coffee & Tea, Specialty Food, Food, Bagels"
"238",45711,"Donut Counter","North York","ON","M2K 1G4",43.7920037,-79.3927656,"1","Donuts, Food, Coffee & Tea, Bagels, Sandwiches, Restaurants"
"239",99859,"Chompie's","Tempe","AZ","85281",33.4224209766,-111.9199218246,"1","Delis, Bakeries, Caterers, Breakfast & Brunch, Food, Event Planning & Services, Restaurants, Bagels"
"240",43450,"Einstein Bros Bagels","Akron","OH","44313",41.109083,-81.5689488,"1","Restaurants, Bagels, Event Planning & Services, Food, Caterers"
"241",136712,"Nosh","Las Vegas","NV","89109",36.1142224,-115.1708505,"1","Bagels, Sandwiches, Restaurants, Food, Bakeries"
"242",47900,"OKO Bagels","Oakville","ON","L6J 7S8",43.4640778,-79.6734963,"1","Bagels, Coffee & Tea, Food, Restaurants, Sandwiches"
"243",190449,"Fresh Donuts","North Las Vegas","NV","89030",36.1962389,-115.1190162,"1","Bagels, Food, Donuts, Bakeries, Restaurants"
"244",16830,"Einstein Bros Bagels","Pittsburgh","PA","15220",40.4184859,-80.045437,"1","Food, Coffee & Tea, Bagels, Restaurants, Bakeries"
"245",44734,"Einstein Bros Bagels","Phoenix","AZ","85050",33.6793943306,-111.9752431288,"1","Sandwiches, Bagels, Food, Breakfast & Brunch, Salad, Restaurants"
"246",32924,"Dunkin' Donuts","Tempe","AZ","85284",33.3350123,-111.9620302,"1","Coffee & Tea, Donuts, Food, Bagels"
"247",177244,"Espresso Royale","Urbana","IL","61801",40.104703,-88.227208,"1","Coffee & Tea, Bagels, Restaurants, Food"
"248",93641,"Chompie's","Chandler","AZ","85226",33.2976955302,-111.9013309479,"1","American (New), Sandwiches, Bagels, Bakeries, Restaurants, Food, Delis, Event Planning & Services, Caterers, Breakfast & Brunch, Delicatessen"
"249",154913,"The Bagel Stop","Toronto","ON","M5K 1A1",43.6471768,-79.3815764,"1","Food, Bagels"
"250",164182,"Bistro du Marché","Montréal","QC","H4N 1K2",45.5333844403,-73.649352775,"1","Bistros, Bagels, Coffee & Tea, Food, Restaurants"
"251",114320,"The Original Brooklyn Water Bagel","Charlotte","NC","28277",35.0531562,-80.8471264,"0","Restaurants, Food, Breakfast & Brunch, Bagels, Coffee & Tea"
"252",95761,"What A Bagel","Toronto","ON","M5P 2W3",43.6888774,-79.412606,"1","Food, Bagels"
"253",170541,"CoffeeBytes","Madison","WI","53715",43.0730351,-89.3985695,"0","Food, Bagels, Coffee & Tea, Bakeries"
"254",170218,"Fionas Coffee Bar And Bakery","Willoughby","OH","44094",41.6398438,-81.4070361,"1","Bagels, Food, Bakeries, Coffee & Tea"
"255",128279,"Tim Hortons","Newmarket","ON","L3Y 8E6",44.0494999,-79.421662,"1","Coffee & Tea, Food, Donuts, Bagels"
"256",172559,"Tim Hortons","Toronto","ON","M6K 1M3",43.6405633025,-79.437282675,"1","Coffee & Tea, Donuts, Food, Bagels"
"257",89694,"Einstein Brothers Bagels","Madison","WI","53703",43.075054,-89.396524,"1","Restaurants, Food, Bagels"
"258",75982,"Black Rock Coffee Bar","Mesa","AZ","85206",33.389993,-111.719812,"1","Food, Juice Bars & Smoothies, Coffee & Tea, Bagels"
"259",160098,"Vinyl Rush Cafe","Mesa","AZ","85201",33.41644,-111.834415,"0","Coffee & Tea, Food, Bagels"
"260",108997,"Einstein Bros Bagels","Las Vegas","NV","89103",36.1147442926,-115.2002593785,"1","Bagels, Breakfast & Brunch, Restaurants, Coffee & Tea, Food, American (Traditional), Sandwiches"
"261",105855,"Café Vito","Montréal","QC","H2R 1G4",45.5384181,-73.6245508,"1","Coffee & Tea, Bagels, Food, Restaurants, Ice Cream & Frozen Yogurt, Cafes"
"262",64365,"Sunrise Donuts","Phoenix","AZ","85339",33.3789419421,-112.1346091984,"1","Food, Bagels, Breakfast & Brunch, Donuts, Restaurants"
"263",96589,"Beaubien Bagel","Montréal","QC","H2S 1S9",45.5364432,-73.6025898,"1","Bagels, Food, Bakeries"
"264",153090,"Panera Bread","Broadview Heights","OH","44147",41.29162,-81.675579,"1","Soup, Breakfast & Brunch, Salad, Bagels, Sandwiches, Food, Restaurants"
"265",115660,"Bagel Nosh","Mesa","AZ","85205",33.435594,-111.721028,"0","Restaurants, Bagels, Breakfast & Brunch, Food, Sandwiches, Coffee & Tea, Cafes"
"266",109501,"Joe Maxx Coffee","Las Vegas","NV","89123",36.0430342509,-115.1513231735,"1","Bagels, Breakfast & Brunch, Patisserie/Cake Shop, Ice Cream & Frozen Yogurt, Vegan, Sandwiches, Coffee & Tea, Cafes, Food, Restaurants"
"267",1177,"Fourth Ward Bread Co.","Charlotte","NC","28202",35.2324862,-80.8442261,"0","Bagels, Restaurants, Food, Bakeries, Breakfast & Brunch"
"268",162128,"D & R Bagels","Solon","OH","44139",41.386172,-81.441055,"1","Breakfast & Brunch, Food, Bagels, Delis, Restaurants"
"269",103911,"Panera Bread","Bainbridge Township","OH","44023",41.413695,-81.33986,"1","Soup, Bagels, Restaurants, Sandwiches, Bakeries, Salad, Breakfast & Brunch, Food"
"270",52879,"Bruegger's Bagels","Pittsburgh","PA","15217",40.437442,-79.9228098,"1","Breakfast & Brunch, Bagels, Restaurants, Sandwiches, Food, Bakeries"
"271",66185,"Einstein Bros Bagels","Phoenix","AZ","85022",33.6390795,-112.0661274,"1","Bagels, Delis, Food, Restaurants, Breakfast & Brunch"
"272",11098,"Espace Culinaire Fletchers","Montréal","QC","H2W 1Y8",45.5169489,-73.579716,"1","Restaurants, Breakfast & Brunch, Kosher, Tours, Hotels & Travel, Cafes, Bagels, Food, Food Tours"
"273",143097,"Einstein Bros","Scottsdale","AZ","85258",33.5800165,-111.8871341,"1","Food, Bagels"
"274",155541,"Bruegger's Bagels","South Euclid","OH","44121",41.5016486,-81.5184029,"0","Sandwiches, Bagels, Food, Breakfast & Brunch, Restaurants"
"275",64513,"What A Bagel","Richmond Hill","ON","L4C 8S7",43.8643271,-79.434961,"0","Food, Bagels"
"276",125876,"The Coffee Bean & Tea Leaf","Las Vegas","NV","89119",36.0847396851,-115.1510772705,"1","Food, Bagels, Desserts, Coffee & Tea"
"277",164403,"Average Joe's Café","Toronto","ON","M5T 1L9",43.6547744,-79.3997903,"0","Breakfast & Brunch, Coffee & Tea, Restaurants, Bagels, Food"
"278",18101,"Tim Hortons","Lachine","QC","H8T 1A4",45.4636126,-73.72026,"1","Donuts, Bagels, Coffee & Tea, Food"
"279",106108,"Big Apple Bagels","Sun Prairie","WI","53590",43.2004795,-89.2261423,"1","Food, Bagels, Delis, Breakfast & Brunch, Restaurants"
"280",14968,"Bagels Forever","Madison","WI","53705",43.074995,-89.441249,"1","Bakeries, Restaurants, Bagels, Food"
"281",104406,"Bagel World Thornhill","Thornhill","ON","L4J 9E9",43.8106965,-79.4543032,"1","Food, Bagels, Restaurants"
"282",123927,"Cafe Pan","Las Vegas","NV","89109",36.12168,-115.169457,"1","Bakeries, Bagels, Creperies, Food, Coffee & Tea, Restaurants"
"283",76820,"Dunkin Donuts  Baskin Robbins","Urbana","IL","61801",40.116757,-88.2113811,"1","Bagels, Ice Cream & Frozen Yogurt, Donuts, Food, Coffee & Tea"
"284",181969,"Panera Bread","Brecksville","OH","44141",41.3206373827,-81.6227467172,"1","Salad, Soup, Bakeries, Sandwiches, Restaurants, Breakfast & Brunch, Food, Coffee & Tea, Bagels"
"285",9171,"Bagel Etc","Montréal","QC","H2W 1Z3",45.5188821,-73.5839004,"1","Food, Bagels, Restaurants, Breakfast & Brunch"
"286",149456,"Einstein Bros","Mesa","AZ","85204",33.3802045,-111.787783,"1","Caterers, Delis, Event Planning & Services, Bagels, Restaurants, Food"
"287",88872,"Panera Bread","Mentor","OH","44060",41.684725,-81.295681,"1","Bagels, Restaurants, Soup, Sandwiches, Salad, Food, Breakfast & Brunch"
"288",103151,"Panera Bread","Pleasant Hills","PA","15236",40.3314729865,-79.9439789169,"1","Bakeries, Bagels, Restaurants, Soup, Salad, Sandwiches, Food, Breakfast & Brunch"
"289",66079,"The Bagel House","North York","ON","M5M 3Y6",43.7282997,-79.4182181,"1","Food, Bagels"
"290",62141,"Panera Bread","Sheffield Village","OH","44035",41.41887269,-82.0776329935,"1","Bagels, Restaurants, Cafes, Sandwiches, Salad, Soup, Bakeries, Food"
"291",52707,"St-Viateur Bagel","Laval","QC","H7L 5A3",45.5954549,-73.7554728,"1","Food, Restaurants, Cafes, Bagels, Canadian (New), Bakeries"
"292",64831,"Crosstown Deli & Bagel","Charlotte","NC","28212",35.204111,-80.744085,"0","Bagels, Restaurants, Internet Cafes, Delis, Food"
"293",87060,"Panera Bread","Mount Lebanon","PA","15228",40.3573572094,-80.0519013405,"1","Food, Restaurants, Breakfast & Brunch, Soup, Bagels, Sandwiches, Salad"
"294",113287,"Cast Iron Waffles","Huntersville","NC","28078",35.4427206,-80.8857951,"0","Restaurants, Breakfast & Brunch, Food, Bagels, Coffee & Tea"
"295",159530,"Einstein Bros Bagels","Pittsburgh","PA","15219",40.442098617,-79.9953344235,"1","Bagels, Food"
"296",17626,"Panera Bread","Madison","WI","53703",43.067837,-89.395321,"1","Sandwiches, Bakeries, Bagels, Food, Salad, Restaurants, Soup, Breakfast & Brunch"
"297",11384,"The Original New York Bagels","Davidson","NC","28036",35.5011616998,-80.8607937906,"1","Food, Bagels, American (Traditional), Breakfast & Brunch, Restaurants"
"298",23122,"Frickaccios Pizza Market","Fairview Park","OH","44126",41.439633,-81.870035,"0","Bakeries, Restaurants, Pizza, Food, Do-It-Yourself Food, Sandwiches, Bagels"
"299",6232,"Tim Hortons","Toronto","ON","M6R 2L3",43.6444476,-79.4481838,"1","Bagels, Breakfast & Brunch, Restaurants, Coffee & Tea, Donuts, Food, Sandwiches"
"300",146928,"Bruegger's Bagels","Strongsville","OH","44136",41.3061028,-81.834504,"1","Restaurants, Sandwiches, Food, Breakfast & Brunch, Bagels"
"301",24437,"Haymishe Bagel Shop","North York","ON","M6B 3B5",43.7182558,-79.42921,"1","Bagels, Bakeries, Food"
"302",31005,"St-Viateur Bagel","Montréal","QC","H2A 2Z4",45.5576333,-73.5957946,"1","Food, Bagels"
"303",145837,"Panera Bread","Concord","NC","28027",35.372239,-80.718169,"1","Soup, Bagels, Breakfast & Brunch, American (New), Bakeries, Salad, Sandwiches, Restaurants, Food"
"304",130777,"Tim Hortons","Calgary","AB","T2E 2Y4",51.0884699,-114.0628192,"1","Donuts, Food, Bagels, Coffee & Tea"
"305",132994,"The Great American Bagel","Las Vegas","NV","89119",36.080733,-115.147022,"1","Food, Bagels, Coffee & Tea, Restaurants, Sandwiches"
"306",167494,"Helious Cafe","Toronto","ON","M1S 0G5",43.7782272,-79.2810055,"0","Food, Restaurants, Coffee & Tea, Bagels, Cafes, Juice Bars & Smoothies"
"307",161348,"SPLAT! Coffee n' Such","Mount Holly","NC","28120",35.2756523028,-81.0275492475,"0","Bagels, Patisserie/Cake Shop, Food, Coffee & Tea, Bakeries, Desserts"
"308",10711,"Einstein Bros Bagels","Chagrin Falls","OH","44022",41.431263,-81.390773,"1","Bagels, Coffee & Tea, Food, Restaurants"
"309",106053,"M.T.L. Bagel","Côte Saint-Luc","QC","H4X 2A5",45.458584,-73.660824,"1","Bakeries, Bagels, Food"
"310",112006,"Hot Bagels & Deli","Surprise","AZ","85374",33.6393981175,-112.3523580239,"1","Breakfast & Brunch, Restaurants, Bagels, Delis, Food"
"311",53168,"Three Little Birds Cafe & Juice Bar","Glenshaw","PA","15116",40.5504619,-79.9141283,"1","Juice Bars & Smoothies, Cafes, Breakfast & Brunch, Coffee & Tea, Restaurants, Food, Bagels"
"312",134767,"Bagel World","Newmarket","ON","L3Y 5L8",44.048156,-79.478554,"1","Food, Restaurants, Breakfast & Brunch, Bagels"
"313",139730,"What A Bagel","Toronto","ON","M5G",43.6616006,-79.3861183,"0","Sandwiches, Bakeries, Restaurants, Food, Bagels, Breakfast & Brunch"
"314",105004,"mmmuffins","Toronto","ON","M5L 1G5",43.6486434,-79.3790251,"1","Food, Bagels, Bakeries"
"315",19209,"Panera Bread","Northfield","OH","44067",41.313541,-81.524147,"1","Breakfast & Brunch, Soup, Restaurants, Sandwiches, Bagels, Food, Salad"
"316",171663,"Einstein Bros Bagels","Phoenix","AZ","85003",33.639787,-112.1523934,"1","Breakfast & Brunch, Coffee & Tea, Food, Bagels, Restaurants, Delis"
"317",61996,"Einstein Bros","Cleveland","OH","44106",41.506638,-81.604965,"1","Fast Food, Food, Bagels, Restaurants"
"318",168222,"Sages Cafe","Cleveland","OH","44106",41.5045755,-81.6098195,"1","Food, Restaurants, Bagels, Coffee & Tea, Cafes"
"319",179671,"Einstein Bros Bagels","Scottsdale","AZ","85254",33.625707,-111.941594,"1","Delis, Food, Restaurants, Bagels"
"320",104056,"Top Fuel Espresso","Gilbert","AZ","85295",33.311299,-111.743798,"1","Food, Juice Bars & Smoothies, Coffee & Tea, Internet Cafes, Bagels"
"321",129262,"Constantinople Bakery & Coffee","Toronto","ON","M5V 2B5",43.6476148,-79.4026175,"0","Food, Coffee & Tea, Restaurants, Bagels, Turkish, Bakeries"
"322",108191,"Bagel Stop College Park","Toronto","ON","M5G 2C8",43.660489,-79.384447,"1","Food, Bagels"
"323",89582,"Barry Bagels Avon","Avon","OH","44011",41.4582393248,-82.0214197093,"1","Food, Salad, Bagels, Restaurants, Sandwiches"
"324",50061,"Panera Bread","Monroeville","PA","15146",40.438351,-79.765068,"1","Sandwiches, Soup, Food, Restaurants, Breakfast & Brunch, Bagels, Bakeries, Salad"
"325",135814,"The Great Canadian Bagel","Brampton","ON","L6W 3R1",43.7028646,-79.7379446,"1","Food, Bagels, Event Planning & Services, Caterers"
"326",132310,"Las Vegas Jerkys","Las Vegas","NV","89101",36.1721156,-115.1469038,"1","Candy Stores, Meat Shops, Food, Specialty Food, Bagels"
"327",57574,"Tim Hortons","Toronto","ON","M6H 1C5",43.6508953,-79.4394679,"1","Sandwiches, Breakfast & Brunch, Donuts, Food, Bagels, Coffee & Tea, Restaurants"
"328",116317,"Sunrise Donuts","Las Vegas","NV","89118",36.0711489,-115.2073958,"1","Ice Cream & Frozen Yogurt, Bagels, Donuts, Food, Juice Bars & Smoothies, Beverage Store"
"329",52756,"City Cafe","Pittsburgh","PA","15218",40.4332501,-79.8844159,"1","Food, Bagels, Juice Bars & Smoothies, Coffee & Tea"
"330",139397,"Einstein Bros Bagels","Phoenix","AZ","85021",33.554315,-112.0981949,"0","Delis, Bagels, Breakfast & Brunch, Food, Restaurants"
"331",18451,"Dunkin' Donuts","Stow","OH","44224",41.1810462184,-81.4829674019,"1","Food, Donuts, Fast Food, Restaurants, Bagels, Coffee & Tea"
"332",61765,"Bruegger's Bagels","Pittsburgh","PA","15231",40.4955233376,-80.2414157749,"1","Sandwiches, Food, Breakfast & Brunch, Bagels, Restaurants"
"333",75896,"Jubilee Donuts","Tallmadge","OH","44278",41.1005157,-81.4413176,"1","Donuts, Bagels, Food, Bakeries, Coffee & Tea"
"334",93032,"NY Bagels and Deli","Phoenix","AZ","85027",33.683323,-112.092428,"1","Restaurants, Delis, Bagels, Breakfast & Brunch, Food"
"335",160700,"Bagel Bar","Montréal","QC","",45.4583245457,-73.7492465973,"1","Food, Sandwiches, Restaurants, Bagels"
"336",107595,"Hava Java","Phoenix","AZ","85016",33.5109389274,-112.0135106288,"1","Bagels, Coffee & Tea, Restaurants, Bakeries, Food"
"337",180536,"The Original Sunrise Cafe","Las Vegas","NV","89123",36.0262328,-115.1193237,"1","Breakfast & Brunch, Food, American (Traditional), Restaurants, Bagels"
"338",133598,"Haute Coffee","Toronto","ON","M5R 1V5",43.6757247859,-79.4027011965,"1","Breakfast & Brunch, Nightlife, Food, Bagels, Restaurants, Sandwiches, Wine Bars, Coffee & Tea, Bars"
"339",171006,"Panera Bread","Strongsville","OH","44136",41.3084543,-81.8204263,"1","Food, Soup, Caterers, Sandwiches, Breakfast & Brunch, Bagels, Event Planning & Services, Salad, Restaurants"
"340",34386,"Rise & Shine a Steak & Egg Place","Las Vegas","NV","89147",36.1144185,-115.3065849,"1","Food, Sandwiches, Bagels, American (Traditional), Breakfast & Brunch, Restaurants, American (New)"
"341",30330,"Einstein Bros Bagels","Phoenix","AZ","85032",33.6123187276,-111.9942300466,"1","Restaurants, Bagels, Food, Breakfast & Brunch, Sandwiches, Delis"
"342",138832,"Pascal's Baguette & Bagels","Toronto","ON","M6P 1Y8",43.6655702,-79.4663124,"1","Bakeries, Bagels, Food"
"343",46940,"Poppy's Bagels & More","Charlotte","NC","28211",35.1708013351,-80.8069507642,"1","Bagels, Food, Breakfast & Brunch, Delis, Restaurants"
"344",156150,"Dunkin' Donuts","Tempe","AZ","85281",33.4494458,-111.9260961,"1","Food, Bagels, Donuts, Coffee & Tea"
"345",28177,"Panera Bread","Charlotte","NC","28262",35.31172178,-80.7451719046,"1","Soup, Breakfast & Brunch, Salad, Bagels, Food, Bakeries, Sandwiches, Coffee & Tea, Restaurants"
"346",168119,"Old Town Local","Scottsdale","AZ","85251",33.4924398,-111.9248112,"1","Ice Cream & Frozen Yogurt, Gelato, Juice Bars & Smoothies, Coffee & Tea, Bagels, Food"
"347",56607,"Panera Bread","Pittsburgh","PA","15206",40.456611,-79.914994,"1","Soup, Food, Bagels, Restaurants, Breakfast & Brunch, Coffee & Tea, Salad, Sandwiches"
"348",126388,"Dunkin' Donuts","Parma","OH","44134",41.3638598,-81.6853891,"1","Coffee & Tea, Donuts, Bagels, Food"
"349",97267,"Bruegger's Bagels","Charlotte","NC","28226",35.0890517,-80.867053,"1","Sandwiches, Breakfast & Brunch, Restaurants, Bagels, Food"
"350",56021,"The Bagel House","Toronto","ON","M5N 1A5",43.7039194,-79.4118118,"1","Bagels, Food"
"351",73285,"What A Bagel","Toronto","ON","M3H 5T4",43.779873568,-79.470070243,"1","Breakfast & Brunch, Bagels, Bakeries, Restaurants, Food"
"352",59758,"Einstein Bros Bagels","Phoenix","AZ","85018",33.494507,-111.9863667,"1","Restaurants, Sandwiches, Bagels, Delis, Food, Coffee & Tea"
"353",38052,"PHX Eats Cafe","Phoenix","AZ","85008",33.4495293,-111.9911107,"1","Bagels, American (New), Cafes, Food, Delis, Caterers, Restaurants, Breakfast & Brunch, American (Traditional), Burgers, Salad, Sandwiches, Event Planning & Services"
"354",93780,"Einstein's Bagels","Charlotte","NC","28280",35.2265794,-80.8428142,"0","Bagels, Restaurants, Food"
