"","business_id","name","city","state","postal_code","latitude","longitude","is_open","categories"
"706",11130,"Joel's Fireplace Repair & Renewal","Las Vegas","NV","89102",36.1462673,-115.1829873,"1","Home & Garden, Appliances, Fireplace Services, Barbeque, Appliances & Repair, Local Services, Home Services, Shopping, Restaurants"
"707",44554,"Everybody's Neighborhood Grill","Avondale","AZ","85392",33.4924121647,-112.3332156113,"0","American (Traditional), Restaurants, Barbeque, Soul Food"
"708",141626,"Buster Rhino's Southern BBQ","Toronto","ON","M6H 1A2",43.6544412,-79.4230321,"0","Food, Barbeque, Restaurants"
"709",153704,"Whats Crackin Cafe","Mesa","AZ","85215",33.4659371,-111.6864275,"1","Beer Bar, Breakfast & Brunch, Barbeque, Caterers, Bars, Event Planning & Services, Nightlife, Acai Bowls, Wine Bars, Cafes, Restaurants, American (Traditional), Cocktail Bars, Food, Pubs, Coffee & Tea"
"710",16991,"Bullies BBQ","Medina","OH","44256",41.1637599,-81.8621496,"0","Burgers, Restaurants, Beer, Wine & Spirits, Barbeque, Food"
"711",96460,"BBQ Concepts","Las Vegas","NV","89148",36.0968930847,-115.2967918928,"1","Home & Garden, Shopping, Barbeque, Restaurants, Grilling Equipment, Contractors, Masonry/Concrete, Home Services, Fireplace Services, Outdoor Furniture Stores"
"712",167310,"Glendale Sala Thai","Glendale","AZ","85303",33.5390281677,-112.2180099487,"1","Salad, Thai, Barbeque, Restaurants"
"713",26529,"Mother's Korean Grill","Las Vegas","NV","89102",36.1253808,-115.1959803,"0","Barbeque, Korean, Ethnic Food, Specialty Food, Vietnamese, Restaurants, Food"
"714",21131,"LongHorn Steakhouse","Phoenix","AZ","85035",33.4742811,-112.220006,"1","Barbeque, Steakhouses, Restaurants, American (Traditional)"
"715",168143,"Beckham's B&M Bar-B-Que","Cleveland","OH","44128",41.453824,-81.565259,"1","Chicken Shop, Restaurants, Barbeque, Seafood"
"716",134199,"Dickey's Barbecue Pit","Chandler","AZ","85225",33.2910789626,-111.840928942,"1","Southern, American (Traditional), Barbeque, Restaurants"
"717",179621,"Red Violin","Toronto","ON","M4K 1N2",43.6762554,-79.3581314,"0","Barbeque, Steakhouses, Restaurants, Brazilian"
"718",191516,"Big Mama's House of Southern Cuisine","Pittsburgh","PA","15201",40.4436243,-79.9958423,"0","Southern, Restaurants, Barbeque, Soul Food"
"719",27512,"Harry O's BBQ","Las Vegas","NV","89104",36.1512851,-115.1525326,"0","Restaurants, Barbeque"
"720",64312,"Rally Sports Bar + Smokehouse","Toronto","ON","M4A 2R4",43.7174661,-79.305012,"1","Sports Bars, Bars, Food, Comfort Food, Nightlife, Restaurants, Smokehouse, Barbeque"
"721",143293,"Arizona BBQ Company","Gilbert","AZ","85296",33.3225235,-111.7570877,"1","Restaurants, Food, Nightlife, Tacos, Bars, Barbeque, Desserts, Mexican"
"722",121008,"Old Carolina Barbecue Company","Stow","OH","44224",41.1556963341,-81.4070832815,"1","American (New), Restaurants, Food, Barbeque, Meat Shops, Specialty Food, American (Traditional)"
"723",61962,"Texas Roadhouse","Goodyear","AZ","85395",33.4641047,-112.3871902,"1","Barbeque, American (New), Restaurants, Steakhouses, American (Traditional)"
"724",75589,"Oakmont BBQ Company","Oakmont","PA","15139",40.5228382,-79.8324755,"1","Food, Restaurants, Barbeque, Food Trucks"
"725",95081,"Q TO U BBQ","Cave Creek","AZ","85331",33.7981800104,-111.9806216828,"1","Barbeque, Restaurants"
"726",32354,"King tasty BBQ","Toronto","ON","M4M 2H1",43.6651748,-79.3525018,"0","Chinese, Barbeque, Restaurants"
"727",22907,"Dickey's Barbecue Pit","Scottsdale","AZ","85260",33.6198065,-111.8922234,"1","Barbeque, Sandwiches, Restaurants, Salad, American (Traditional), Southern"
"728",144736,"1 Hawaiian Barbecue","North Las Vegas","NV","89081",36.266793,-115.116662,"1","Sandwiches, Hawaiian, Barbeque, Restaurants"
"729",183217,"Ho Ho Barbeque","Toronto","ON","M1V 5L6",43.8139148,-79.2915342,"1","Chinese, Barbeque, Restaurants"
"730",183845,"Kusina Ni Lorraine","Las Vegas","NV","89148",36.0978155097,-115.2977913219,"1","Restaurants, Specialty Food, Barbeque, Seafood, Soup, Grocery, Filipino, Food, Ethnic Food"
"731",99568,"Sonny's Real Pit Bar-B-Q","Charlotte","NC","28205",35.195245,-80.788236,"0","Barbeque, Restaurants"
"732",61679,"Hogs and Hops","Scottsdale","AZ","85253",33.564852,-111.9255724,"0","Restaurants, Barbeque"
"733",16773,"Smokey Bones Bar & Fire Grill","North Olmsted","OH","44070",41.4183043,-81.9074039,"0","Restaurants, Barbeque"
"734",192220,"It's All Good BBQ & More","Las Vegas","NV","89101",36.1671790283,-115.1459423291,"0","Fast Food, Barbeque, Restaurants"
"735",13663,"Lahore Tikka House","Toronto","ON","M4L 1Z3",43.6714591,-79.3246451,"1","Indian, Halal, Barbeque, Pakistani, Restaurants"
"736",109175,"Shane's Rib Shack","Concord","NC","28027",35.4158453,-80.6767418,"0","Barbeque, Restaurants, Southern"
"737",124573,"Happy's Pizza","Cleveland","OH","44128",41.4509503,-81.5654091,"1","Chicken Wings, Barbeque, Pizza, Restaurants"
"738",124281,"Ryno's BBQ","Gilbert","AZ","85295",33.299788968,-111.7434122086,"0","Food, Restaurants, Barbeque"
"739",159169,"AA Hawaiian Bbq","Las Vegas","NV","89108",36.218691,-115.242913,"0","Barbeque, Restaurants, Hawaiian"
"740",14788,"Rôtisserie St-Hubert","Montréal","QC","H8T 3G6",45.4412272448,-73.6929891455,"1","Chicken Shop, Barbeque, Restaurants"
"741",129984,"LongHorn Steakhouse","Strongsville","OH","44136",41.3123585,-81.8207402,"1","Steakhouses, Barbeque, Restaurants, American (Traditional)"
"742",71557,"Right Bauer Brewing","Sun Prairie","WI","53590",43.1828486,-89.2115205,"1","Restaurants, Barbeque, Food, Brewpubs, Breweries"
"743",70646,"Get It Quick","Monroeville","PA","15146",40.4487203112,-79.7806659713,"0","Restaurants, Barbeque"
"744",127594,"Freddie's Southern Style Rib House","Lyndhurst","OH","44124",41.520291,-81.486309,"0","Restaurants, Barbeque, Southern"
"745",179975,"Taste Good B-B-Q","Scarborough","ON","M1S 2B7",43.7863747,-79.2756345,"1","Restaurants, Chinese, Barbeque"
"746",123567,"Waldo's BBQ Express","Phoenix","AZ","85020",33.574496,-112.065478,"0","Bars, Nightlife, Restaurants, Event Planning & Services, Southern, Barbeque, Wine Bars, Caterers, Sandwiches, Beer Bar"
"747",21563,"R&R BBQ","Concord","NC","28027",35.400285,-80.697227,"1","Restaurants, Barbeque"
"748",135813,"Pig Out Bbq","Pickering","ON","L1V 1A8",43.8220847683,-79.1124629974,"1","Barbeque, Restaurants, Food, Burgers, Sandwiches"
"749",53883,"The Smokery Kitchen & Bar","Whitchurch-Stouffville","ON","L4A 1A5",43.970551,-79.2510948,"1","Cocktail Bars, Nightlife, Breakfast & Brunch, Restaurants, Barbeque, Canadian (New), Southern, Bars, Food, Beer, Wine & Spirits, Sandwiches"
"750",33335,"J&B's Pizza, BBQ And Deli","Mesa","AZ","85208",33.4081202,-111.615811,"0","Convenience Stores, Restaurants, Pizza, Shopping, Barbeque, Hot Dogs, Beer, Wine & Spirits, Tobacco Shops, Delis, Food"
"751",90522,"Taste Good","Scarborough","ON","M1S 5C9",43.8035019,-79.2873151,"1","Restaurants, Chinese, Barbeque"
"752",89135,"Los Chicos Brasa","Markham","ON","L3S 0B6",43.8503882,-79.2539052,"0","Chicken Wings, Brazilian, Specialty Food, Latin American, Barbeque, Restaurants, Peruvian, Food, Ethnic Food"
"753",185822,"Rôtisserie Corfou","Montréal","QC","H2X 1C2",45.5125261,-73.5691995,"1","Barbeque, Restaurants, Chicken Shop, Greek"
"754",150904,"Blues BarBQ","Henderson","NV","89014",36.069818,-115.044513,"0","Barbeque, Food, Restaurants, Meat Shops, Specialty Food"
"755",76977,"Thai Original BBQ Restaurant","Las Vegas","NV","89103",36.1151835,-115.2411327,"0","Barbeque, Restaurants, Thai"
"756",21717,"Buffalo Wild Wings","Madison","WI","53715",43.0731239429,-89.3984287977,"1","Sports Bars, Barbeque, American (Traditional), American (New), Restaurants, Bars, Chicken Wings, Nightlife"
"757",73843,"CopaCabana Brazilian Steakhouse","Vaughan","ON","L4L 5X8",43.784552,-79.565759,"1","Barbeque, Steakhouses, Restaurants, Brazilian, Latin American"
"758",67632,"Island Pot","Mississauga","ON","L5A 4E4",43.5819682,-79.6185932,"0","Caribbean, Restaurants, Barbeque, Vegetarian"
"759",16037,"Rôtisserie St-Hubert","Saint-Jean-sur-Richelieu","QC","J3A 1L2",45.3346351,-73.2686358,"1","Barbeque, Restaurants, Chicken Shop, Canadian (New)"
"760",60457,"LongHorn Steakhouse","Medina","OH","44256",41.1650605,-81.8627817,"1","Steakhouses, Barbeque, Restaurants, American (Traditional)"
"761",61530,"Holy Smokez BBQ Sandwiches","Mississauga","ON","L4Y 2C3",43.6041675,-79.5904118,"1","Sandwiches, Barbeque, Restaurants"
"762",23734,"Xin Jiang Barbecue Restaurant","Scarborough","ON","M1W 3V8",43.8042341,-79.331505,"1","Chinese, Barbeque, Restaurants"
"763",38788,"Live Fire Q","Henderson","NV","89014",36.0719030757,-115.08053854,"0","Restaurants, Sandwiches, Breakfast & Brunch, Mexican, Barbeque, American (Traditional)"
"764",74921,"Dickey's Barbecue Pit","Gilbert","AZ","85295",33.30635,-111.749906,"1","American (Traditional), Barbeque, Restaurants, Southern"
"765",42568,"Branding Iron Cook House","Mentor","OH","44060",41.687649,-81.337813,"0","Barbeque, Restaurants"
"766",8454,"Bow Bulgogi House","Calgary","AB","T3E 0B7",51.0374724,-114.1378966,"1","Barbeque, Restaurants, Korean"
"767",57803,"L & L Hawaiian Barbecue","Las Vegas","NV","89148",36.0839386843,-115.2968803623,"1","Barbeque, Event Planning & Services, Hawaiian, Restaurants, Caterers"
"768",139885,"Taste Cafe","Calgary","AB","T2P 5E9",51.0515864,-114.0750507,"1","Barbeque, Restaurants, Bakeries, Asian Fusion, Breakfast & Brunch, Cafes, Food"
"769",12685,"Logan's Roadhouse","Monroe","NC","28110",35.0105345,-80.5634186,"1","Barbeque, Burgers, Restaurants, Steakhouses, American (Traditional)"
"770",92890,"Wingstop","Urbana","IL","61802",40.1134471,-88.2030657,"0","Restaurants, Barbeque"
"771",86366,"Montana's BBQ & Bar","Calgary","AB","T3G 4J8",51.128558078,-114.2028415133,"1","American (Traditional), Canadian (New), Restaurants, Comfort Food, Steakhouses, Barbeque, French"
"772",189608,"Chez Vincent","Longueuil","QC","J4H 1M6",45.5359789,-73.5083315,"1","Restaurants, Pizza, Burgers, Barbeque, Seafood"
"773",79226,"Hansol","Cleveland","OH","44114",41.5098858804,-81.6625014693,"0","Korean, Restaurants, Seafood, Soup, Barbeque"
"774",54607,"Gilley's","Las Vegas","NV","89109",36.1239879384,-115.1706583336,"1","Adult Entertainment, Bars, Sports Bars, Barbeque, Music Venues, Arts & Entertainment, Nightlife, Restaurants"
"775",56977,"Rib Crib","Aurora","ON","L4G 7N2",44.004241,-79.4472438,"0","Restaurants, Barbeque, American (Traditional)"
"776",137955,"Dickey's Barbecue Pit","Surprise","AZ","85374",33.6382133,-112.4155026,"1","Restaurants, Barbeque, American (Traditional), Southern"
"777",155667,"Wilson's Bar-B-Q","Pittsburgh","PA","15212",40.4562105,-80.014453,"1","Restaurants, Barbeque"
"778",138517,"Kasai Grill House","Toronto","ON","M6G 1B8",43.6553262,-79.41618,"1","Japanese, Barbeque, Sushi Bars, Korean, Restaurants"
"779",30046,"Rôtisserie Scores","Laval","QC","H7T 1A1",45.5556423,-73.7497424,"1","Restaurants, Chicken Shop, American (Traditional), Fast Food, Barbeque"
"780",179706,"Arizona Grill Lounge","Etobicoke","ON","M9W 5X8",43.6837428,-79.5929134,"1","Pubs, Bars, Nightlife, Mexican, Barbeque, Restaurants, Steakhouses"
"781",72605,"Stir Krazy Mongolian Grill","Las Vegas","NV","89169",36.107194,-115.1521048,"0","Asian Fusion, Restaurants, Chinese, Barbeque"
"782",23837,"Jalapeño Buck's","Mesa","AZ","85213",33.4792917767,-111.7532024156,"1","Barbeque, Mexican, Restaurants, Sandwiches"
"783",49594,"Koryo Korean Barbeque","Calgary","AB","T2N 1M7",51.0656372949,-114.1026449494,"1","Korean, Barbeque, Restaurants"
"784",158639,"Moon China Bistro - Ocotillo","Chandler","AZ","85248",33.2605025,-111.8569511,"1","Soup, Barbeque, Noodles, Restaurants, Chicken Wings, Chinese"
"785",112651,"Boston Market","Glendale","AZ","85308",33.6378,-112.201868,"1","Restaurants, Comfort Food, American (Traditional), Barbeque, Fast Food"
"786",104468,"The Dixie Pig Rock Hill","Rock Hill","SC","29732",34.9760960721,-81.0055751626,"1","Restaurants, Food, American (Traditional), Barbeque, Coffee & Tea"
"787",170125,"Happy's Pizza","Cleveland","OH","44109",41.4504147,-81.7014333,"1","Chicken Wings, Pizza, Seafood, Restaurants, Barbeque"
"788",39004,"Puzzlers Restaurant & Lounge","McKeesport","PA","15132",40.332814,-79.847123,"1","Barbeque, Restaurants, Nightlife, American (New), Hot Dogs, American (Traditional), Breakfast & Brunch, Bars"
"789",175761,"Daldongnae","Toronto","ON","M2M 3W5",43.7897298,-79.4182688,"1","Restaurants, Barbeque, Korean"
"790",40746,"Fox Smokehouse Bbq","Boulder City","NV","89005",35.9717498,-114.8458477,"1","Restaurants, Event Planning & Services, American (Traditional), Caterers, Barbeque, Burgers"
"791",105755,"LongHorn Steakhouse","Concord","NC","28025",35.446819,-80.5991685,"1","Barbeque, Restaurants, Steakhouses, American (Traditional)"
"792",53981,"Swiss Chalet Rotisserie & Grill","Toronto","ON","M1T 1A3",43.7733050681,-79.3217043851,"1","Restaurants, American (Traditional), Comfort Food, Barbeque"
"793",51961,"Big Island Hawaiian BBQ","Gilbert","AZ","85295",33.2976051,-111.7470923,"1","Hawaiian, Barbeque, Restaurants"
"794",90070,"#1 Hawaiian Barbecue","Las Vegas","NV","89119",36.0819201,-115.1195258,"1","Restaurants, Hawaiian, Seafood, Barbeque"
"795",35028,"One Plus One BBQ","Toronto","ON","M1V 5N1",43.822058,-79.298592,"1","Barbeque, Chinese, American (Traditional), Restaurants"
"796",80749,"AJ's Mongolian BBQ","Phoenix","AZ","85051",33.5734857,-112.1257641,"0","Mongolian, Barbeque, Restaurants, Chinese"
"797",49845,"KOOYI Korean Grill","Toronto","ON","M5T 2L4",43.6541714,-79.4015556,"0","Tapas/Small Plates, Barbeque, Restaurants, Korean"
"798",95170,"Hungry Hollow Smokehouse & Grille","Georgetown","ON","L7G 4A5",43.6502055414,-79.9120616913,"1","Barbeque, Southern, Restaurants, Caterers, Smokehouse, Food, Event Planning & Services"
"799",99551,"Mademoiselle Urban Restobar","Montréal","QC","H2V 4G3",45.5204804,-73.5970186,"1","Canadian (New), Barbeque, Nightlife, Korean, Arts & Entertainment, Restaurants, Cabaret, Bars, Music Venues"
"800",35173,"Bolero","Calgary","AB","T2H 0L3",50.9921485,-114.070811,"1","Barbeque, Brazilian, Buffets, Restaurants, Steakhouses"
"801",126127,"Peter's Creek Pub","Finleyville","PA","15332",40.2500112,-80.0156978,"1","Barbeque, Restaurants"
"802",177431,"Cave Creek Smokehouse","Cave Creek","AZ","85331",33.8314777,-111.945564,"0","American (New), Restaurants, Venues & Event Spaces, Barbeque, Burgers, Event Planning & Services, American (Traditional)"
"803",127864,"Shane's Rib Shack","Indian Land","SC","29707",35.0119916,-80.8514385,"0","Barbeque, Restaurants"
"804",72162,"Joe's Smokehouse","Toronto","ON","M4M 1L6",43.6629851,-79.3304991,"0","Local Flavor, Restaurants, Barbeque, Burgers, Sandwiches"
"805",171686,"Harbin Bbq","Toronto","ON","M1V",43.8058644129,-79.2878439277,"1","Chinese, Barbeque, Restaurants"
"806",31578,"Pig-N-Vittles","Monroe","NC","28110",35.0134447,-80.5728348,"1","Event Planning & Services, Restaurants, Caterers, Barbeque"
"807",169468,"Bill Johnson's Big Apple Restaurants","Mesa","AZ","85203",33.4155617,-111.8099713,"0","Barbeque, American (Traditional), Restaurants"
"808",174953,"Smokin Thyme Kitchen","Lakewood","OH","44107",41.4768617,-81.7920728,"1","Burgers, Food, Sandwiches, Restaurants, Barbeque, Food Delivery Services"
"809",39835,"A & J Chicago Style Bar-B-Q","Phoenix","AZ","85016",33.5258838,-112.047946,"0","Restaurants, Barbeque"
"810",14790,"Blues","Urbana","IL","61803",40.1068632,-88.2218637,"0","Barbeque, Restaurants"
"811",66851,"Winking Lizard Tavern","Mayfield Heights","OH","44124",41.5222777822,-81.4352662666,"1","American (New), Barbeque, Restaurants, Bars, Nightlife, Pubs"
"812",150573,"Leo's Island BBQ","Peoria","AZ","85382",33.6369813,-112.2238249,"1","Seafood, Barbeque, Hawaiian, Restaurants"
"813",144511,"Project BBQ","Las Vegas","NV","89101",36.171570172,-115.1453998871,"1","Tacos, Food, Restaurants, Mexican, Food Trucks, Barbeque"
"814",157343,"Rôtisserie Scores","Saint-Leonard","QC","H1S 1N2",45.594185,-73.573899,"1","Restaurants, Barbeque, Canadian (New), Chicken Shop"
"815",166795,"LongHorn Steakhouse","Charlotte","NC","28262",35.3174783,-80.7783761,"1","Barbeque, Steakhouses, American (Traditional), Restaurants"
"816",7931,"Red Apple Grill","Las Vegas","NV","89145",36.1591089,-115.2509355,"0","Burgers, Restaurants, Barbeque, Local Flavor"
"817",56145,"New System BBQ","Montréal","QC","H4C 1P3",45.4806558,-73.5792397,"1","Pizza, Restaurants, Seafood, Barbeque, American (New), Canadian (New)"
"818",181840,"Old Hickory House Restaurant","Charlotte","NC","28213",35.277916,-80.765813,"0","Specialty Food, Food, Barbeque, Restaurants"
"819",142398,"Rick's Cookhouse","Newmarket","ON","L3Y 2P3",44.0603398,-79.455764,"1","Barbeque, Food, Restaurants"
"820",26291,"L & L Hawaiian Barbecue","Las Vegas","NV","89128",36.1945097103,-115.2597342432,"1","Barbeque, Restaurants, Hawaiian, Food"
"821",82408,"Queen City Q","Charlotte","NC","28202",35.2272493,-80.8386173,"1","Restaurants, Barbeque, Nightlife, Bars, Southern"
"822",109867,"Harley-Davidson Las Vegas Cafe","Las Vegas","NV","89109",36.1077582129,-115.1723747896,"0","Barbeque, American (Traditional), Restaurants, Burgers"
"823",80257,"TangTangTang 2","Las Vegas","NV","89139",36.03172,-115.2443042,"1","Barbeque, Restaurants, Korean, Soup"
"824",20025,"Famous Daves Legendary Pit Barbecue","Phoenix","AZ","85003",33.4495511,-112.0789355,"1","Restaurants, Barbeque"
"825",149642,"Thai Original BBQ Restaurant","Las Vegas","NV","89104",36.1535041186,-115.1516318321,"0","Barbeque, Restaurants, Thai"
"826",163063,"Winking Lizard","Peninsula","OH","44264",41.2413988215,-81.5489393374,"1","Pubs, Nightlife, Barbeque, Dive Bars, American (Traditional), Restaurants, Bars"
"827",74953,"Memphis Championship Barbecue","Las Vegas","NV","89130",36.2496745,-115.2459836,"0","Restaurants, Barbeque"
"828",129368,"Korean BBQ & Rolls","Henderson","NV","89014",36.070010215,-115.0822645426,"0","Japanese, Restaurants, Barbeque, Korean"
"829",99580,"Pita Land","Toronto","ON","M5S 2T9",43.6653855,-79.4034771,"1","Barbeque, Restaurants, Chicken Shop, Middle Eastern, Mediterranean"
"830",48002,"Black Dog Smoke & Ale House","Urbana","IL","61801",40.1138182155,-88.2076892527,"1","Barbeque, Restaurants"
"831",786,"Cappys Pizza & Ribs","Pittsburgh","PA","15234",40.3650949637,-80.0240921974,"0","Food, Food Delivery Services, Barbeque, Restaurants, Pizza"
"832",41478,"The Tavern of Solon","Solon","OH","44139",41.386172,-81.441055,"0","Lounges, Barbeque, Restaurants, Nightlife, American (Traditional), Pubs, Bars"
"833",101724,"Mabuhay Philippine Cuisine","Madison","WI","53715",43.0531664,-89.3958811,"0","Restaurants, Asian Fusion, Barbeque, American (Traditional), Filipino"
"834",2186,"Bojangles","Fort Mill","SC","29715",35.0860907,-80.9328191,"0","Barbeque, Restaurants"
"835",176376,"Wings & a Prayer","Pittsburgh","PA","15218",40.4201684,-79.8848138,"1","Restaurants, Sandwiches, Soul Food, Comfort Food, Barbeque"
"836",166331,"Luv Me Tender BBQ","Phoenix","AZ","85016",33.480678,-112.020834,"1","Restaurants, Barbeque"
"837",59348,"Rotuno's Texas Style Barbeque","Elyria","OH","44035",41.3889815,-82.0772816,"0","Restaurants, Barbeque"
"838",172747,"Ohana Hawaiian BBQ","Las Vegas","NV","89139",36.044477535,-115.244002752,"1","Chinese, Restaurants, Hawaiian, Barbeque"
"839",18927,"Two Bite Saloon","Toronto","ON","M6G 1M3",43.6623595,-79.4239763,"0","Bars, Nightlife, Restaurants, Barbeque"
"840",91117,"Peace -N- Hominy Q","Belmont","NC","28012",35.2430105,-81.0285592,"1","Appliances, Breakfast & Brunch, Barbeque, Home & Garden, Southern, Shopping, American (Traditional), Hot Dogs, Burgers, Restaurants"
"841",65517,"Garden Korean Restaurant","Las Vegas","NV","89104",36.1418945096,-115.142273627,"1","Korean, Barbeque, Restaurants"
"842",83573,"Les Voltigeurs Restaurant","Laval","QC","H7L 1M5",45.6111972,-73.7925582,"1","Restaurants, Pizza, Steakhouses, Italian, Breakfast & Brunch, Sandwiches, Barbeque, Greek, Delicatessen, Food"
"843",178867,"Jim 'N Nick's Bar-B-Q","Charlotte","NC","28273",35.1050414819,-80.9898836505,"1","Event Planning & Services, Barbeque, Restaurants, Caterers, Southern, Sandwiches"
"844",98934,"Happy's Pizza","East Cleveland","OH","44112",41.5292446,-81.5826699,"1","Seafood, Italian, Chicken Wings, Restaurants, Food Delivery Services, Food, Barbeque, Pizza"
"845",82713,"Rick's Rollin Smoke BBQ & Tavern","Las Vegas","NV","89101",36.161205,-115.145457,"1","Bars, Beer Bar, Barbeque, Restaurants, Sandwiches, Nightlife"
"846",143524,"Erie Street Kitchen","Kent","OH","44240",41.1527359,-81.3590069,"1","Southern, Restaurants, American (Traditional), Sandwiches, Gluten-Free, Barbeque, Seafood"
"847",91612,"Open Pitt Barb-B-Que","Cleveland","OH","44108",41.5415303,-81.5990311,"1","Barbeque, Soul Food, Restaurants"
"848",173785,"Pho D'licious","Las Vegas","NV","89102",36.125883,-115.203712,"0","Restaurants, Barbeque, Soup, Vietnamese"
"849",103371,"Woodstock BBQ","Lakewood","OH","44107",41.4771083783,-81.7841436042,"1","Restaurants, Barbeque, Food, Nightlife, Beer, Wine & Spirits, Bars, Beer Bar, Smokehouse"
"850",61056,"Asian King Buffet","Mississauga","ON","L5J 2B4",43.5125352,-79.6487822,"1","Sushi Bars, Chinese, Barbeque, Buffets, Restaurants, Asian Fusion"
"851",93420,"HARRY O's BBQ","Las Vegas","NV","89102",36.12596,-115.184846,"0","Restaurants, Barbeque"
"852",39266,"Mapo Korean BBQ","Toronto","ON","M6G 1L2",43.6640454,-79.4167575,"1","Restaurants, Korean, Barbeque"
"853",70041,"Tiger BBQ","Toronto","ON","M1V 4E7",43.8260765,-79.278128,"1","Chinese, Restaurants, Barbeque"
"854",160351,"Alfred & Charlies BBQ House","Gastonia","NC","28054",35.252767,-81.1480179,"0","Barbeque, Restaurants"
"855",123497,"TheSmoke","Vaughan","ON","L4H 0A2",43.8465186947,-79.5539368111,"1","Restaurants, Barbeque"
"856",28684,"Goose's Barbeque & Pub","Charlotte","NC","28227",35.210659,-80.6861459,"0","Barbeque, Restaurants"
"857",57659,"Happy's Pizza","North Las Vegas","NV","89030",36.1960828329,-115.1431488532,"1","Barbeque, Pizza, Chicken Wings, Restaurants"
"858",111566,"Island Style B.B.Q.","Las Vegas","NV","89147",36.1248977,-115.2791715,"0","Barbeque, Hawaiian, Restaurants"
"859",59160,"Buffalo Browns Wings and Things","Phoenix","AZ","85008",33.4658346,-111.9904267,"0","Restaurants, Chicken Wings, Barbeque"
"860",174705,"The Pizza Company","Pittsburgh","PA","15224",40.4657853,-79.9555582,"0","Sandwiches, Restaurants, Pizza, Barbeque"
"861",178548,"Deli Green Stop","Montréal","QC","H4E 3H6",45.4570945,-73.5953407,"1","Barbeque, Delis, Poutineries, Sandwiches, Breakfast & Brunch, Hot Dogs, Restaurants"
"862",23877,"Grand View Buffet","Pittsburgh","PA","15212",40.447428,-80.022353,"1","Restaurants, Buffets, Food, Barbeque, American (New)"
"863",183448,"Red River BBQ","Phoenix","AZ","85022",33.6399,-112.0520458,"0","Sandwiches, Restaurants, Barbeque, American (Traditional), Pizza"
"864",97547,"Dillons KC BBQ","Peoria","AZ","85381",33.6102448987,-112.2464681927,"1","Barbeque, Restaurants, Bars, Nightlife, American (Traditional), Sports Bars"
"865",53077,"Tom's BBQ","Chandler","AZ","85286",33.2648230964,-111.8591107156,"1","Restaurants, Barbeque"
"866",168880,"Wood Firepit & Tap","Toronto","ON","M4E 1E1",43.6708278,-79.2964059,"0","Barbeque, Restaurants"
"867",142105,"Hooters","Montréal","QC","H3G 2B2",45.4977023,-73.5764459,"1","Nightlife, Sports Bars, Chicken Wings, Restaurants, Bars, Barbeque"
"868",67515,"Texas Roadhouse","Madison","WI","53704",43.133746,-89.298753,"1","Restaurants, Steakhouses, American (Traditional), Barbeque"
"869",65232,"Yum Yum BBQ","Calgary","AB","T2A 6K5",51.0609369108,-113.9846420276,"1","Restaurants, Barbeque, Fast Food, Korean"
"870",119764,"Diablos","Montreal","QC","H2X 2B5",45.5142451,-73.573006,"1","Southern, Barbeque, Restaurants, American (Traditional), Steakhouses"
"871",92718,"P-Dub's BBQ","Las Vegas","NV","89169",36.1256442093,-115.1349692792,"1","Barbeque, Restaurants"
"872",191558,"Evil Swine BBQ","Pittsburgh","PA","15222",40.4475255,-79.9933976,"1","Barbeque, Food, Food Trucks, Restaurants"
"873",62088,"MJ's BBQ - Chicken & Fish","Phoenix","AZ","85034",33.4474046927,-112.0288648094,"0","Fish & Chips, Barbeque, Soul Food, Chicken Wings, Restaurants"
"874",99616,"Texas Bbq Cafe","Las Vegas","NV","89103",36.11492,-115.237825,"0","Barbeque, Cajun/Creole, Restaurants"
"875",70807,"Adamson Barbecue","Toronto","ON","M4G 2B6",43.7124962,-79.3531121,"1","Barbeque, Restaurants"
"876",102622,"Buckingham Smokehouse Bar-B-Q","Las Vegas","NV","89108",36.2029728,-115.2424433,"0","Barbeque, Restaurants"
"877",52731,"The Carbon Bar","Toronto","ON","M5C 1S2",43.6531872634,-79.3747868766,"1","Restaurants, Bars, Barbeque, Southern, Cocktail Bars, Canadian (New), American (Traditional), Nightlife"
"878",133656,"Thaison","Montréal","QC","H2S 2S5",45.538205,-73.613683,"1","Restaurants, Chinese, Vietnamese, Barbeque"
"879",134588,"South Side BBQ Company","Pittsburgh","PA","15203",40.4293753,-79.9817846,"1","Street Vendors, Barbeque, Food Trucks, Food, Restaurants"
"880",70759,"LongHorn Steakhouse","Mesa","AZ","85210",33.3885222,-111.8577435,"1","Restaurants, Steakhouses, Seafood, Barbeque, American (Traditional)"
"881",181187,"Rising Grill","Cleveland","OH","44114",41.5097822,-81.6624628,"1","Barbeque, Restaurants, Korean"
"882",178183,"Dunn'ss Famous","Montréal","QC","H4N 1J8",45.5347018,-73.6592746,"0","Barbeque, Restaurants"
"883",20829,"Mesquite Bbq Catering","Montréal","QC","H4A 3J6",45.4773056,-73.6150785,"0","Restaurants, Event Planning & Services, Caterers, Barbeque"
"884",171292,"Tony Roma's","Calgary","AB","T2Z 3V8",50.930702,-113.972669,"1","American (Traditional), Steakhouses, Restaurants, Seafood, Barbeque"
