"","business_id","name","city","state","postal_code","latitude","longitude","is_open","categories"
"355",152524,"Ron's Grilled Barbeque and Kabobs","Las Vegas","NV","89148",36.0782601,-115.2985593,"1","Restaurants, Mediterranean, Middle Eastern, Barbeque, Greek"
"356",162667,"Boney Fingers BBQ","Cleveland","OH","44114",41.4999744,-81.6902403,"1","Event Planning & Services, Barbeque, Salad, Breakfast & Brunch, Restaurants, Caterers"
"357",188835,"BBQ CLE","Cleveland","OH","44135",41.4338855,-81.7917346,"1","Barbeque, Latin American, Restaurants, Event Planning & Services, Caterers"
"358",98412,"Québec Smoked Meat","Montréal","QC","H3K 1J1",45.4831141,-73.561756,"1","Specialty Food, Food, Meat Shops, Restaurants, Delis, Barbeque"
"359",29986,"Texas Meltz","Las Vegas","NV","89102",36.145219,-115.2048529391,"1","Southern, Restaurants, Fast Food, Barbeque, Food, Sandwiches, Desserts"
"360",133258,"Fort Mill BBQ","Fort Mill","SC","29708",35.0627828,-80.9920002,"0","Southern, Gluten-Free, Restaurants, Barbeque"
"361",54143,"Blair Street Brew & BBQ","Madison","WI","53703",43.0785923,-89.3783104,"0","Barbeque, Restaurants"
"362",32760,"Mesa Grill","Las Vegas","NV","89109",36.1171245659,-115.174792707,"1","American (Traditional), Restaurants, Mexican, New Mexican Cuisine, Barbeque, Spanish, Southern, Tex-Mex, American (New)"
"363",157865,"Dukes Rib House & Grille","Pittsburgh","PA","15220",40.3939438279,-80.0632630227,"1","American (Traditional), Barbeque, Restaurants"
"364",141283,"The Proper Pig Smokehouse","Lakewood","OH","44107",41.485585,-81.815822,"1","Smokehouse, Food, Food Trucks, Sandwiches, Restaurants, Barbeque"
"365",70291,"Famous Dave's","Las Vegas","NV","89123",36.043483,-115.171085,"0","Restaurants, Barbeque"
"366",146409,"Mochiko Chicken","Las Vegas","NV","89102",36.1487348,-115.2099431,"1","American (New), Hawaiian, Chicken Shop, Chicken Wings, Comfort Food, Asian Fusion, Restaurants, Food, Barbeque, Bubble Tea, American (Traditional), Southern"
"367",7720,"BBQ Shak","Las Vegas","NV","89139",36.055414,-115.241332,"0","Barbeque, Restaurants"
"368",49253,"Harvey's & Swiss Chalet Combo","Scarborough","ON","M1T 1A3",43.7730667478,-79.3217573762,"1","Barbeque, American (Traditional), Fast Food, Restaurants, Burgers"
"369",100934,"Bâton Rouge Steakhouse & Bar","Toronto","ON","M5B 2H6",43.6538951,-79.3801867,"0","Restaurants, Gluten-Free, Steakhouses, Seafood, Barbeque"
"370",89540,"Smoke 'N The Real Q","Peoria","AZ","85345",33.5628981,-112.2585703,"0","Restaurants, Caterers, Event Planning & Services, Barbeque"
"371",127908,"The Dream BBQ","Pittsburgh","PA","15208",40.4530376642,-79.8911726475,"1","Soul Food, Chicken Wings, Restaurants, Barbeque"
"372",36677,"Marky & Sparky's Smokehouse","Toronto","ON","M6P 1S3",43.660199,-79.4797899,"0","Barbeque, Restaurants"
"373",75849,"Rôtisserie Kiri-Piri","Montréal","QC","H2T 1R4",45.5201491517,-73.5861530313,"0","Portuguese, Barbeque, Restaurants"
"374",47235,"Big B's Texas BBQ","Henderson","NV","89052",36.003414165,-115.1175117865,"1","Sandwiches, Restaurants, Salad, American (Traditional), Southern, Barbeque"
"375",6032,"Dixie's Tavern","Charlotte","NC","28202",35.2277289,-80.837321,"0","Sandwiches, Nightlife, Cajun/Creole, Sports Bars, Barbeque, Bars, Pubs, Restaurants"
"376",51879,"Bar-B Barn","Montréal","QC","H3H 2K5",45.4945217,-73.576321,"1","Restaurants, Barbeque, Soul Food"
"377",185657,"Mary Brown's","Brampton","ON","L6W 3C9",43.6945685,-79.7491965,"1","Barbeque, Restaurants, Chicken Wings"
"378",186233,"All Fired Up","North Ridgeville","OH","44039",41.3972664272,-81.9954115525,"1","Bars, Nightlife, Burgers, Barbeque, Restaurants"
"379",131318,"Bama's Southern Kitchen","Pittsburgh","PA","15226",40.3951787,-80.0225039,"0","Restaurants, Barbeque, Soul Food"
"380",176392,"Stacy's Smokehouse BBQ","Scottsdale","AZ","85254",33.5820579,-111.9289958,"0","American (Traditional), Barbeque, Sandwiches, Restaurants"
"381",68573,"BBQ Chinois","Montréal","QC","H3H",45.4944693,-73.5798446,"0","Barbeque, Restaurants, Chinese"
"382",77840,"Dan Marino's Fine Food & Spirits","Las Vegas","NV","89109",36.1245963217,-115.1465865767,"0","Restaurants, Barbeque, American (Traditional), Burgers"
"383",97848,"Al & B's Barbeque","Cleveland","OH","44135",41.4335801,-81.8023272,"1","Barbeque, Restaurants"
"384",109678,"Montana's BBQ & Bar","Mississauga","ON","L4W 1C2",43.644913,-79.63457,"1","Restaurants, Food, Barbeque, Comfort Food, Canadian (New), Steakhouses, Nightlife"
"385",123157,"Mucho Burrito","Montréal","QC","H2X 3Y2",45.5074075531,-73.564099744,"1","Mexican, Barbeque, Restaurants"
"386",64150,"Grill'n Go","Montréal","QC","H2C 1T3",45.5675759658,-73.6539808289,"1","Chicken Wings, Restaurants, Barbeque, Steakhouses, Portuguese, Sandwiches"
"387",91224,"Black Angus Steakhouse","Toronto","ON","M8X 2X3",43.6452181628,-79.5219870799,"1","Restaurants, Barbeque, Bars, Steakhouses, Nightlife"
"388",105939,"Hole 'n One","Sun City West","AZ","85375",33.6550266,-112.3534643,"1","Barbeque, American (Traditional), Restaurants, Breakfast & Brunch"
"389",159037,"Handlebar J","Scottsdale","AZ","85254",33.5832099,-111.9276099,"1","American (New), Bars, Steakhouses, Music Venues, Arts & Entertainment, Dance Clubs, Barbeque, Country Dance Halls, Nightlife, American (Traditional), Burgers, Restaurants"
"390",96862,"Rôtisserie St-Hubert","Sainte-Adèle","QC","J8B 2N2",45.946514,-74.127088,"1","Chicken Shop, Food, Barbeque, Chicken Wings, Restaurants"
"391",4645,"Vic's Hong Kong Style Café","Calgary","AB","T2G 0B6",51.0503667344,-114.062853845,"1","Barbeque, Chinese, Restaurants"
"392",103132,"Kimchi Korean Bbq","Las Vegas","NV","89109",36.131875,-115.163618,"1","Korean, Barbeque, Restaurants"
"393",135816,"My Mother's Restaurant","Phoenix","AZ","85015",33.496074,-112.1003113,"1","Desserts, Restaurants, Barbeque, Sandwiches, Food, Pizza"
"394",13852,"Texas Roadhouse","Pittsburgh","PA","15237",40.5620812755,-80.0259171054,"1","Burgers, Barbeque, American (Traditional), Sandwiches, Restaurants, Steakhouses"
"395",37576,"Bill Johnson's Big Apple Restaurants","Goodyear","AZ","85338",33.4610622,-112.3415599,"0","Restaurants, Barbeque, Steakhouses, American (Traditional)"
"396",30846,"Dickey's Barbecue Pit","Tempe","AZ","85281",33.424665,-111.934767,"1","Southern, Event Planning & Services, American (Traditional), Caterers, Sandwiches, Barbeque, Restaurants"
"397",150214,"Easy Time BBQ","Las Vegas","NV","89146",36.1261864,-115.2233683,"0","Asian Fusion, Food, Juice Bars & Smoothies, Bubble Tea, Coffee & Tea, Restaurants, Barbeque, Chinese"
"398",131397,"Big Ern's BBQ","Las Vegas","NV","89101",36.167526,-115.138435,"1","Barbeque, Restaurants"
"399",74589,"Maple City Taps & Eatery","Chardon","OH","44024",41.5803216,-81.242825,"1","Pizza, Barbeque, Restaurants, American (Traditional)"
"400",183688,"Rôtisserie Scores","Brossard","QC","J4Y 0G4",45.4492368,-73.4426237,"1","Restaurants, Steakhouses, Chicken Wings, Chicken Shop, Barbeque"
"401",160266,"Steak And Stone","Mesa","AZ","85215",33.462996,-111.719339,"1","Barbeque, Restaurants, Steakhouses"
"402",71566,"Chicken Master","Brampton","ON","L7A 2X9",43.7136665,-79.799599,"1","Chicken Wings, Restaurants, Barbeque"
"403",107324,"Joe Chicago","Saint-Laurent","QC","H4N 2W2",45.5356456,-73.6649422,"0","Burgers, American (Traditional), Barbeque, Delis, Restaurants, Pizza"
"404",109576,"CJ's Texas Barbeque","Las Vegas","NV","89117",36.1432226,-115.2622884,"0","Barbeque, Restaurants"
"405",180205,"Lovejoys Kansas City Bar-B-Q","Phoenix","AZ","85022",33.639197,-112.064368,"0","Barbeque, Restaurants"
"406",170478,"The Corktown Kitchen","Toronto","ON","M5A 1K9",43.6532485,-79.3623477,"0","Asian Fusion, Canadian (New), Vietnamese, Sandwiches, American (Traditional), Restaurants, Barbeque"
"407",21679,"Bodrick's Bar-B-Q Rib Tips","Charlotte","NC","28206",35.2687946,-80.8378437,"0","Restaurants, Barbeque"
"408",170059,"Peter's Reggae Kitchen","North York","ON","M2J 4A8",43.7883567,-79.3291698,"0","Barbeque, Restaurants, Caribbean"
"409",8843,"SNS Diner","North Las Vegas","NV","89030",36.22162,-115.126378,"1","Restaurants, Barbeque, Diners"
"410",85873,"LongHorn Steakhouse","Cuyahoga Falls","OH","44221",41.1195369,-81.4784828,"1","Steakhouses, American (Traditional), Restaurants, Barbeque"
"411",22212,"BBQ","Montréal","QC","H2Y 2A6",45.5008349,-73.5564927,"1","Restaurants, Barbeque"
"412",141959,"Bill Spoon's Barbecue","Charlotte","NC","28217",35.1596107023,-80.8767139511,"1","Barbeque, Restaurants"
"413",11332,"Monteiro Grillades Portugaises","Montréal","QC","H3T 1X1",45.4971773255,-73.6215633899,"1","Restaurants, Portuguese, Sandwiches, Barbeque, Halal"
"414",175832,"Stacy's Pampered Pig","Phoenix","AZ","85013",33.487248,-112.082387,"0","Restaurants, Soul Food, Barbeque, Southern"
"415",10562,"Rose and Sons","Toronto","ON","M6G 3G8",43.675786,-79.403665,"1","Mediterranean, Coffee & Tea, Food, Comfort Food, Restaurants, Diners, Canadian (New), Barbeque, Breakfast & Brunch"
"416",143780,"Cool Bar","Las Vegas","NV","89102",36.127655,-115.1979112,"1","Karaoke, Chinese, Restaurants, Asian Fusion, Nightlife, Barbeque, Bars"
"417",90206,"Happy's Pizza","Garfield Hts","OH","44125",41.4262354,-81.6129562,"1","Chicken Wings, Barbeque, Pizza, Restaurants"
"418",45336,"Coin Mechoui","Chateauguay","QC","J6K 4Y7",45.3624936,-73.7136226,"0","Barbeque, Food, Restaurants"
"419",105008,"Blues Bar-B-Q","Henderson","NV","89014",36.069818,-115.044513,"0","Barbeque, Food, Restaurants"
"420",113043,"LongHorn Steakhouse","Phoenix","AZ","85032",33.5988384,-111.9827632,"1","Steakhouses, American (Traditional), Barbeque, Restaurants"
"421",8881,"Sammy's BBQ & Deli","Toronto","ON","M5R 3G1",43.6653686,-79.4115376,"0","Delis, Barbeque, Restaurants, Greek"
"422",137524,"Rock Store Bar-B-Q","Stallings","NC","28104",35.0819793,-80.6925926,"1","Barbeque, Restaurants"
"423",15716,"Jabo's Smoke House and Saloon","Pittsburgh","PA","15224",40.4629895,-79.9521097,"0","Restaurants, Food, Smokehouse, Barbeque, Hair Salons, Beauty & Spas"
"424",9832,"Le Cristal Chinois","Montréal","QC","H4K 1M9",45.5286318,-73.7217072,"1","Restaurants, Pan Asian, Chinese, Barbeque"
"425",59634,"Goen Yakiniku","Richmond Hill","ON","L4B 3P7",43.8415653484,-79.3993877428,"1","Diners, Steakhouses, Japanese, Barbeque, Noodles, Restaurants"
"426",10860,"Mario's BBQ","Vaughan","ON","L6A 0A5",43.8465298,-79.5359349,"0","Restaurants, Barbeque, Portuguese"
"427",106835,"LongHorn Steakhouse","Pittsburgh","PA","15237",40.5712919,-80.0229697,"1","Steakhouses, American (Traditional), Restaurants, American (New), Barbeque"
"428",38078,"Honmachi","Las Vegas","NV","89183",36.012764,-115.136056,"0","Steakhouses, Vegetarian, Restaurants, Japanese, Barbeque, Tapas Bars, Live/Raw Food"
"429",182950,"Viet Noodle Bar","Las Vegas","NV","89146",36.1265668,-115.2132314,"1","Soup, Vietnamese, Barbeque, Restaurants"
"430",29209,"Ke Charcoal Grill & Sushi","Calgary","AB","T3C 0Y1",51.0393051974,-114.0949554249,"1","Sushi Bars, Barbeque, Japanese, Restaurants"
"431",69048,"The Notorious P I G","Phoenix","AZ","85032",33.6119171,-112.0125521,"0","Barbeque, Restaurants"
"432",116493,"Bill Johnson's Big Apple Restaurants","Phoenix","AZ","85008",33.4506964,-112.0000523,"0","Steakhouses, Restaurants, Barbeque, Local Flavor"
"433",60146,"Champions Seafood Grill and Bar","Markham","ON","L3R 1J5",43.8562278234,-79.304366,"0","Barbeque, Seafood, Bars, Nightlife, Restaurants"
"434",152884,"Brown Barn","Chardon","OH","44024",41.527434,-81.257394,"1","Barbeque, Restaurants"
"435",21921,"B's Smokehouse Bbq","Las Vegas","NV","89178",36.0194241518,-115.2792438778,"1","Food, Barbeque, Street Vendors, Restaurants, Food Trucks"
"436",165565,"Dickey's Barbecue Pit","Las Vegas","NV","89118",36.0875159,-115.243704,"1","Barbeque, American (Traditional), Southern, Restaurants"
"437",140701,"City Barbeque","Charlotte","NC","28262",35.310381,-80.746777,"1","Restaurants, Caterers, Barbeque, Event Planning & Services"
"438",101779,"Nando's Chickenland","Brampton","ON","L6T 4S3",43.7246911,-79.7163741,"0","Restaurants, Barbeque"
"439",24360,"Ironwood Cafe","Cleveland","OH","44111",41.4497744,-81.8171009,"0","Restaurants, Nightlife, Bars, Sports Bars, Event Planning & Services, American (New), Barbeque, Caterers"
"440",59941,"Mr. Ribs & Mrs. Rice","Las Vegas","NV","89102",36.126894,-115.195024,"0","Food Trucks, Restaurants, Food, Barbeque"
"441",125533,"ATL Wings","Phoenix","AZ","85018",33.479889,-111.997771,"1","Barbeque, Food, Chicken Wings, Soul Food, Restaurants"
"442",122636,"Yum Yum BBQ & Chicken","Calgary","AB","T3B 4M9",51.0752702,-114.1673836,"1","Barbeque, Restaurants, Food"
"443",132756,"Famous BBQ Express","Toronto","ON","M5V 2A5",43.6491857,-79.39415,"0","Restaurants, Barbeque"
"444",161941,"Hwaro","Spring Valley","NV","89146",36.1270307944,-115.209860464,"1","Korean, Buffets, Barbeque, Restaurants"
"445",29704,"Potbelly BBQ","Charlotte","NC","28203",35.2146586,-80.8599193,"1","Barbeque, Restaurants, Food Trucks, Food, Caterers, Event Planning & Services, Sandwiches"
"446",71913,"Cherry Blossom Chinese Restaurant","Charlotte","NC","28277",35.0953817,-80.7780359,"1","Barbeque, Seafood, Ethnic Food, Chinese, Restaurants, Food, Specialty Food, Soup"
"447",49729,"Winner Bbq","Thornhill","ON","L3T 0C7",43.8035434,-79.4195738,"1","Chinese, Fast Food, Barbeque, Restaurants"
"448",87847,"Bites and Brews","Pittsburgh","PA","15232",40.4556962,-79.9308834,"0","Pizza, Chicken Wings, Barbeque, Beer Bar, Nightlife, Restaurants, Bars"
"449",122015,"Fresh BBQ Innovations","Scottsdale","AZ","85260",33.622208,-111.904186,"1","Nightlife, Vegan, American (New), Whiskey Bars, Breakfast & Brunch, Restaurants, Barbeque, Bars"
"450",146289,"Wild Wing","Mississauga","ON","L5M 7L9",43.5585072739,-79.7418349852,"1","Restaurants, Chicken Wings, Barbeque"
"451",91449,"Tom's BBQ","Mesa","AZ","85215",33.4516018,-111.7226332,"1","Food, Food Trucks, Barbeque, Salad, Restaurants, American (Traditional), Event Planning & Services, Caterers"
"452",121498,"Benny's Burgers & BBQ","Sun City","AZ","85351",33.6372393,-112.2754603,"1","Hot Dogs, American (Traditional), Restaurants, Barbeque, Burgers"
"453",184879,"Bats BBQ","Rock Hill","SC","29732",34.9790608,-81.0051466,"0","Mexican, Barbeque, Restaurants"
"454",134378,"The Grille Restaurant & Bar","Etobicoke","ON","M8Z 1V1",43.6177085,-79.5428851,"1","Nightlife, American (Traditional), Greek, Bars, Diners, Barbeque, Breakfast & Brunch, Restaurants"
"455",27520,"Southern RUB Smokehouse","Vaughan","ON","L4L 1S6",43.7837466,-79.5747244,"0","Barbeque, Restaurants, Southern"
"456",14282,"Sage Garden BBQ & Catering","Charlotte","NC","28205",35.196533,-80.7903369,"0","Food Delivery Services, Barbeque, Food, Restaurants, Event Planning & Services, Caterers, American (New)"
"457",5216,"Logan's Roadhouse","Gastonia","NC","28056",35.260224,-81.128767,"1","American (Traditional), Steakhouses, Restaurants, Barbeque"
"458",2259,"Big Bone BBQ & Wicked Wings","Whitby","ON","L1N 9K3",43.8995341,-78.9384357,"1","Restaurants, Southern, Chicken Wings, Barbeque"
"459",106876,"Soul Kitchen BBQ","Calgary","AB","T2T 0H7",51.017283863,-114.0265638381,"1","Food, Restaurants, Cajun/Creole, Food Trucks, Barbeque"
"460",53297,"Kings Corner","Toronto","ON","M5V 1N3",43.6436172,-79.405205,"0","Barbeque, Breakfast & Brunch, Steakhouses, Burgers, Sandwiches, Restaurants, Fish & Chips"
"461",119321,"Love Hawaiian BBQ","Glendale","AZ","85301",33.5243379,-112.2037058,"1","Barbeque, Restaurants, Japanese, Hawaiian, Seafood, Ramen"
"462",21972,"Best Of The Best DJ's","Las Vegas","NV","89139",36.055128,-115.242644,"1","Event Planning & Services, Fashion, Food Court, Bakeries, Food, Ice Delivery, Nail Salons, Pizza, Home & Garden, Pilates, Beauty & Spas, Party & Event Planning, Furniture Rental, Music Venues, Home Services, Auto Repair, Fitness & Instruction, Karaoke, Fur Clothing, Electronics, Automotive, Lighting Fixtures & Equipment, Local Services, Active Life, Furniture Repair, Nightlife, Cafes, Italian, Restaurants, Photo Booth Rentals, Furniture Stores, Shopping, DJs, Barbeque, Arts & Entertainment, Audio/Visual Equipment Rental, Party Equipment Rentals"
"463",88526,"WB Chinese Cooking","Richmond Hill","ON","L4B 3B1",43.8439761,-79.3878015,"1","Chinese, Restaurants, Barbeque"
"464",160770,"Hayden Block Smoke & Whiskey","Calgary","AB","T2N 3P3",51.0526549,-114.0882959,"1","Barbeque, Nightlife, Whiskey Bars, American (Traditional), Restaurants, Bars"
"465",58055,"Dickey's Barbecue Pit","Las Vegas","NV","89107",36.1725319,-115.197258,"1","Barbeque, Restaurants, Southern, American (Traditional)"
"466",171730,"Original Chicken & Ribs","Charlotte","NC","28216",35.2529397,-80.855963,"1","Barbeque, Restaurants, Event Planning & Services, Caterers"
"467",16153,"Gyu-Kaku Japanese BBQ","Toronto","ON","M5C 2G2",43.6516056,-79.3748812,"1","Japanese, Barbeque, Restaurants"
"468",183123,"A Taste of Silk BBQ","Phoenix","AZ","85037",33.5081323,-112.2918161,"1","Barbeque, Restaurants"
"469",75533,"L&L Hawaiian Barbecue","Las Vegas","NV","89149",36.2707534,-115.2666723,"1","Barbeque, Hawaiian, Restaurants"
"470",83272,"RD's Southern BBQ","Mississauga","ON","L5T 3A1",43.6454686903,-79.704356119,"1","Restaurants, Barbeque, Southern"
"471",50617,"Blowin' Smoke BBQ","Waunakee","WI","53597",43.174189,-89.4134032,"0","Restaurants, Food Trucks, Barbeque, Sandwiches, Food"
"472",98840,"Smoakie Kitchen","Laveen Village","AZ","85339",33.3776603,-112.1680448,"1","Smokehouse, Food, Restaurants, Barbeque"
"473",166670,"Nevada Chicken Cafe","Las Vegas","NV","89113",36.0636453,-115.2520481,"1","Wraps, Restaurants, American (Traditional), Sandwiches, Cafes, Salad, Chicken Wings, Food, Barbeque"
"474",177526,"Smoke Bourbon Bar-B-Q House","Toronto","ON","M6G 1G5",43.6603391,-79.4150747,"1","Barbeque, Restaurants"
"475",2964,"Gyubee Japanese BBQ - Downtown","Toronto","ON","M5S 1W7",43.6671472,-79.400645,"1","Barbeque, Do-It-Yourself Food, Restaurants, Steakhouses, Japanese, Food"
"476",169168,"Logan's Roadhouse","Mesa","AZ","85201",33.3019012,-111.7430967,"0","American (Traditional), Bars, Barbeque, Steakhouses, Nightlife, Restaurants"
"477",55814,"YZ's Hot Pot & BBQ","Tempe","AZ","85282",33.406526,-111.924348,"1","Nightlife, Bars, Barbeque, Asian Fusion, Hot Pot, Restaurants"
"478",4008,"Sina's Bbq","Mississauga","ON","L4W 1P1",43.6298591,-79.6357782,"1","Restaurants, Barbeque"
"479",22768,"Ave Seoul","Montréal","QC","H4L 3M2",45.5128093,-73.6803233,"1","Korean, Barbeque, Restaurants"
"480",160730,"Aj's Fine Foods","Scottsdale","AZ","85250",33.6220938744,-111.8730840786,"1","Farmers Market, Seafood Markets, Coffee & Tea, Flowers & Gifts, Bagels, Restaurants, Shopping, Florists, Health Markets, Beer, Wine & Spirits, Grocery, Specialty Food, Barbeque, Bakeries, Food"
"481",151115,"Kathy's Southern Cooking","Las Vegas","NV","89121",36.1292353,-115.0925631,"0","Restaurants, Barbeque, Soul Food, Southern, American (New)"
"482",68193,"Briskit Gourmet Slow Cooked Sandwiches","Brampton","ON","L6T 4Z4",43.6923259956,-79.7000226659,"1","Breakfast & Brunch, Event Planning & Services, Restaurants, Gluten-Free, Barbeque, Sandwiches, Burgers, Caterers"
"483",176566,"Lakeshore Bbq","Denver","NC","28037",35.2160166,-80.8320292,"1","Fashion, Used, Vintage & Consignment, Shopping, Barbeque, American (New), Home & Garden, Restaurants"
"484",10197,"Gyubee Japanese BBQ - Markham","Markham","ON","L3R 5J2",43.8157563,-79.3500531,"1","Japanese, Korean, Restaurants, Barbeque, Steakhouses"
"485",176332,"Little AAA","Toronto","ON","M4L 1C4",43.6636892,-79.3287505,"1","Restaurants, Barbeque"
"486",36758,"Kababish Restaurant","Calgary","AB","T3J 3W1",51.0821378,-114.0126372,"0","Caterers, Event Planning & Services, Restaurants, Pakistani, Halal, Barbeque"
"487",46402,"BBQ House","Mesa","AZ","85202",33.363563,-111.876153,"1","Barbeque, Buffets, Korean, Steakhouses, Restaurants"
"488",96141,"360 Seahood","Toronto","ON","M1W",43.8039075,-79.2870353,"0","Asian Fusion, Barbeque, Restaurants, Chinese"
"489",123009,"Aloha Hawaiian BBQ","Las Vegas","NV","89120",36.072454464,-115.1013189233,"1","Restaurants, Barbeque, Hawaiian"
"490",100134,"Dae Jang Keum Korean BBQ & Tofu Restaurant","Las Vegas","NV","89102",36.1258698833,-115.1923266481,"1","Restaurants, Korean, Barbeque"
"491",44289,"Lancaster's BBQ","Huntersville","NC","28078",35.3513949,-80.888219,"1","Restaurants, Barbeque, Salad, Bars, Nightlife, Seafood"
"492",116720,"L & L Hawaiian Barbecue","Las Vegas","NV","89123",36.0209001,-115.1247688,"1","Restaurants, Barbeque, Hawaiian"
"493",168958,"Garionban","Las Vegas","NV","89103",36.1259897637,-115.2024704218,"1","Restaurants, Barbeque, Soup, Korean"
"494",138961,"Bootleggers Modern American Smokehouse","Scottsdale","AZ","85251",33.4922045,-111.9255493,"1","Smokehouse, American (New), Cocktail Bars, Food, Nightlife, Bars, Comfort Food, Barbeque, Restaurants"
"495",118446,"Wild Wing","Toronto","ON","M1P 5B7",43.7727485,-79.2803748,"1","Barbeque, Food, American (Traditional), Restaurants, Chicken Wings"
"496",99411,"James Cheese Back Ribs","Toronto","ON","M5T 2G6",43.65687,-79.39924,"1","Korean, Restaurants, Japanese, Asian Fusion, Barbeque"
"497",129814,"Long Time No See","Scarborough","ON","M1W 2P3",43.8105131,-79.3379876,"1","Chinese, Barbeque, Restaurants"
"498",93982,"B.B.Ques","Toronto","ON","M5S 2H7",43.6632022,-79.4022766,"0","Barbeque, Caterers, Juice Bars & Smoothies, Restaurants, Food, Vegetarian, Event Planning & Services"
"499",54939,"Sota BBQ Coréen","Montréal","QC","H3H 1M2",45.4935173,-73.5798552,"1","Korean, Barbeque, Restaurants"
"500",192590,"Rôtisserie St-Hubert","Piedmont","QC","J0R 1R3",45.8900853,-74.1460249,"1","Restaurants, Barbeque, Chicken Shop"
"501",134779,"Oming's Kitchen","Las Vegas","NV","89145",36.1683449,-115.2659777,"1","Barbeque, Event Planning & Services, Food Trucks, Food, Street Vendors, Caterers, Restaurants, Filipino"
"502",49258,"Elliott's BBQ and Steakhouse","Pittsburgh","PA","15236",40.3253741,-79.956298,"0","Bars, Restaurants, Nightlife, Food, Steakhouses, Barbeque"
"503",112864,"Sonny's BBQ","Charlotte","NC","28217",35.1629543,-80.8865704,"1","Restaurants, Barbeque, American (New), Event Planning & Services, Caterers"
"504",10955,"Wonton Gourmet & BBQ","Cleveland","OH","44114",41.5089027,-81.6662795,"1","Chinese, Restaurants, Cantonese, Barbeque"
"505",11726,"Patrick's Grill","Mcfarland","WI","53558",42.983861,-89.302204,"0","Dive Bars, Sandwiches, Nightlife, Restaurants, Bars, Barbeque"
"506",174978,"Drake BBQ","Toronto","ON","M6J",43.6430884,-79.424424,"0","Restaurants, Barbeque"
"507",151491,"TooGood Cafe","Markham","ON","L3R",43.8656562,-79.3109674,"0","Food, Coffee & Tea, Juice Bars & Smoothies, Delis, Cafes, Restaurants, Barbeque"
"508",112500,"Ono Hawaiian BBQ","Peoria","AZ","85305",33.5521645466,-112.2576272371,"1","Barbeque, Restaurants, Hawaiian"
"509",174388,"Boomerang Grill","Whitby","ON","L1N 2M1",43.8795880079,-78.9428199828,"0","Burgers, Breakfast & Brunch, Barbeque, American (Traditional), Cafes, Restaurants"
"510",2582,"Wheelfish","Pittsburgh","PA","15237",40.5395819,-79.9914534,"1","Barbeque, Bars, American (Traditional), Nightlife, American (New), Restaurants"
"511",8560,"Brisketburgh","Pittsburgh","PA","15222",40.4475255,-79.9933976,"1","Restaurants, Food, Barbeque, Food Trucks"
"512",117880,"Big Mitch BBQ","Litchfield Park","AZ","85340",33.5175689155,-112.3441605745,"0","American (Traditional), Soul Food, Event Planning & Services, Food Delivery Services, Food, Caterers, Barbeque, Restaurants"
"513",148165,"Tony Roma's","Pineville","NC","28134",35.0855733,-80.8809029,"0","American (Traditional), Restaurants, Barbeque"
"514",120859,"Pacer's Ribhouse","Euclid","OH","44132",41.5989218,-81.5036784,"0","Restaurants, Barbeque"
"515",47121,"Sura BBQ Buffet","Las Vegas","NV","89102",36.12695,-115.201296,"1","Barbeque, Korean, Buffets, Restaurants"
"516",163784,"Rotisseries Benny","Saint-Hubert","QC","J3Y 1A7",45.4763534,-73.4450414,"1","Barbeque, Restaurants"
"517",169308,"Angry Crab Shack","Goodyear","AZ","85338",33.4502610986,-112.3589181527,"1","Cajun/Creole, Restaurants, Barbeque, Southern, Seafood"
"518",36558,"Phoenix BBQ and Grilling School","Mesa","AZ","85210",33.3894245,-111.834734,"1","Cooking Schools, Education, Specialty Schools, Food, Barbeque, Restaurants"
"519",103646,"Le Grand Ribfest de Montréal","Montréal","QC","H2Y 2E2",45.5066651,-73.5521832,"1","Barbeque, Arts & Entertainment, American (Traditional), Festivals, Restaurants"
"520",96976,"Ichiban Korean BBQ & Sushi","Tempe","AZ","85281",33.4143548,-111.9262937,"0","Japanese, Restaurants, Barbeque, Korean"
"521",124663,"Ono Hawaiian BBQ","Avondale","AZ","85392",33.4611694844,-112.3397907341,"1","Hawaiian, Seafood, Barbeque, Japanese, Restaurants, Korean"
"522",153333,"Rôtisserie Scores","Laval","QC","H7M 2X9",45.5824829899,-73.7051455831,"1","Chicken Shop, Barbeque, French, Restaurants"
"523",30304,"Serrano Bar-B-Q","Montréal","QC","H2T 2L4",45.523856,-73.60093,"1","Chicken Shop, Sandwiches, Restaurants, Barbeque"
"524",10872,"Copacabana Brazilian Steakhouse","Toronto","ON","M5H 1W7",43.6483440823,-79.3878309801,"1","Nightlife, Steakhouses, Bars, Restaurants, Barbeque, Brazilian"
"525",121262,"Markham Ribfest and Music Festival","Markham","ON","L3R 9W3",43.84951,-79.321413,"1","Arts & Entertainment, Restaurants, Festivals, Barbeque"
"526",39156,"The Salt Lick Bar-BQ","Las Vegas","NV","89136",36.1569658,-115.3335939,"0","Restaurants, Barbeque"
"527",74179,"Holy Smoke BBQ","Calgary","AB","T2G 4B5",51.0116418987,-114.0517008305,"1","Restaurants, Barbeque, Food"
"528",101131,"Restaurant Hot Africa","Montréal","QC","H3W 1X4",45.4865264,-73.6270046,"1","African, Barbeque, Restaurants"
