"","business_id","name","city","state","postal_code","latitude","longitude","is_open","categories"
"1068",58917,"Juste à Coté","Montréal","QC","H2X 1B7",45.5152979105,-73.5712410018,"1","Restaurants, Barbeque, Burgers, Cafes, Salad, Sandwiches, Pizza"
"1069",97612,"Wild Wing","Brampton","ON","L7A 2Y7",43.6818944,-79.8155758,"1","Barbeque, Chicken Wings, Canadian (New), Restaurants, Fast Food, Burgers"
"1070",188896,"Red Rice","Las Vegas","NV","89123",36.0182434258,-115.1180470926,"1","Comfort Food, Event Planning & Services, Salad, Food, Restaurants, Guamanian, Local Flavor, Barbeque, Caterers, Hawaiian, Specialty Food, Ethnic Food, Asian Fusion"
"1071",125343,"L&L Hawaiian BBQ","Phoenix","AZ","85027",33.7112906335,-112.1111088532,"1","Hawaiian, Fast Food, Restaurants, Barbeque"
"1072",37869,"Allstars Bar & Grill","Brampton","ON","L6T 2W9",43.708274,-79.695066,"1","Nightlife, Karaoke, Bars, Restaurants, Barbeque"
"1073",60480,"J & J Bar-B-Que","Toronto","ON","M5T 1L8",43.6544824,-79.4014126,"0","Restaurants, Barbeque, Sandwiches"
"1074",156361,"Red Rooster Portuguese BBQ","Newmarket","ON","L3Y 7C1",44.0601807443,-79.4801145209,"1","Barbeque, Restaurants, Portuguese, Chicken Shop"
"1075",105658,"LongHorn Steakhouse","Huntersville","NC","28078",35.441455,-80.866159,"1","Steakhouses, American (Traditional), Restaurants, Barbeque"
"1076",65849,"LULU Hawaiian BBQ 2","Las Vegas","NV","89149",36.2898612,-115.2856644,"1","Hawaiian, Seafood, Restaurants, Barbeque"
"1077",45577,"Feng Kee BBQ House","Calgary","AB","T3K 5P4",51.1426333,-114.0714837,"1","Chinese, Barbeque, Restaurants"
"1078",140691,"Oak and Embers Tavern","Chesterland","OH","44026",41.521822,-81.355998,"1","Nightlife, Barbeque, Bars, Restaurants, Beer Bar"
"1079",146828,"East Court & Mike's BBQ","Scarborough","ON","M1S 5J5",43.7883024,-79.2699019,"1","Restaurants, Barbeque, Chinese"
"1080",180468,"Famous Dave's Bar-B-Que","Las Vegas","NV","89030",36.2406450132,-115.1138313135,"1","Barbeque, Food, Restaurants, Comfort Food, American (Traditional)"
"1081",83723,"Dickey's Barbecue Pit","Middleton","WI","53562",43.089992551,-89.5232093386,"1","Caterers, Barbeque, Sandwiches, Restaurants, Event Planning & Services, American (Traditional), Southern"
"1082",43159,"Farmer's BBQ","Charlotte","NC","28262",35.3402728,-80.7649282,"0","Sandwiches, Caterers, Barbeque, Event Planning & Services, Desserts, Restaurants, Food"
"1083",157748,"Smokehaus","Scottsdale","AZ","85251",33.4903252383,-111.9264790043,"0","Burgers, Sports Bars, Sandwiches, Bars, Barbeque, Restaurants, Nightlife"
"1084",66966,"Dickey's Barbecue Pit","Mesa","AZ","85210",33.3649896,-111.8596067,"1","Restaurants, Barbeque, Southern, Caterers, Event Planning & Services, American (Traditional), Sandwiches"
"1085",6995,"Baju BBQ","Toronto","ON","M6J 2N7",43.6540798848,-79.4135576349,"0","Restaurants, Barbeque"
"1086",46897,"BimQ","Toronto","ON","M4Y 1Z4",43.6662962,-79.3849551,"0","Barbeque, Korean, Restaurants"
"1087",75390,"Gecko Grill","Gilbert","AZ","85233",33.3655334,-111.7881503,"0","Barbeque, Mexican, Restaurants"
"1088",134885,"Christina's Bakery & Grill","Brampton","ON","L6X 1M9",43.6877365,-79.7625452,"0","Food, Desserts, Restaurants, Bakeries, Barbeque, Portuguese"
"1089",178740,"Smoque N' Bones","Toronto","ON","M6J 1G4",43.6457027819,-79.4107432752,"1","American (Traditional), Barbeque, Restaurants, Comfort Food"
"1090",5396,"Smoke BBQ Taqueria","Pittsburgh","PA","15201",40.4700107,-79.9611342,"1","Restaurants, Barbeque, Burgers, Mexican, Tacos"
"1091",111099,"Porky Pine Pete's SmokeHouse BBQ","Madison","WI","53717",43.058782,-89.512554,"0","Barbeque, Restaurants"
"1092",178939,"Midwood Smokehouse","Charlotte","NC","28205",35.2210244,-80.8148537,"1","Barbeque, Pizza, Restaurants, Smokehouse, Food, American (Traditional)"
"1093",64413,"Whiskey Rose Saloon","Chandler","AZ","85248",33.2475042,-111.8430927,"0","Restaurants, Barbeque, Bars, Burgers, American (Traditional), Nightlife"
"1094",144029,"Paradise Hawaiian BBQ","Tempe","AZ","85281",33.4245349584,-111.9352028076,"1","Barbeque, Ethnic Food, Specialty Food, Hawaiian, Restaurants, Food, Korean"
"1095",54469,"Tim's Corner Bar","West Elizabeth","PA","15088",40.2727427,-79.8959742,"1","Nightlife, Bars, Barbeque, American (Traditional), Seafood, Restaurants"
"1096",25550,"Rôtisserie Scores","Saint-Jérôme","QC","J7Y 2G4",45.7785491354,-74.016465,"1","Restaurants, Chicken Shop, Canadian (New), Fast Food, Barbeque"
"1097",129319,"Jerk BBQ Haven","Mississauga","ON","L4Z 0A4",43.597116,-79.662243,"1","Barbeque, Restaurants"
"1098",104323,"Barbeques Galore","Chandler","AZ","85249",33.2800321,-111.7955867,"1","Restaurants, Barbeque, Shopping, Appliances, Home & Garden"
"1099",159709,"Jin's Kitchen and Club","Las Vegas","NV","89146",36.1273969,-115.2240685,"1","Karaoke, Barbeque, Chicken Wings, Seafood, Bars, Steakhouses, American (Traditional), Nightlife, Restaurants, Lounges"
"1100",119146,"Montana's BBQ & Bar","North York","ON","M3J 3N3",43.786606,-79.4714871,"1","Barbeque, Restaurants, Bars, Canadian (New), Nightlife, Comfort Food, Steakhouses"
"1101",5300,"Cook Out","Charlotte","NC","28273",35.1215097,-80.9498363,"1","Burgers, Hot Dogs, Barbeque, Restaurants, Fast Food"
"1102",95432,"Boardwalk Billy's Raw Bar And Ribs","Charlotte","NC","28262",35.3106136,-80.7496372,"1","Bars, Sports Bars, Sandwiches, Nightlife, American (Traditional), Diners, Barbeque, Restaurants"
"1103",160931,"Jinmee Korean Cuisine","Thornhill","ON","L3T 0A2",43.8421546986,-79.3904357404,"0","Barbeque, Korean, Restaurants"
"1104",50099,"The Gorilla","Lakewood","OH","44107",41.4771746247,-81.7733764558,"1","Hot Dogs, Ice Cream & Frozen Yogurt, Restaurants, Food, Barbeque, Fast Food"
"1105",12305,"Sam Woo BBQ","Scarborough","ON","M1W 3Y1",43.815527,-79.3221013,"1","Restaurants, Barbeque"
"1106",3828,"L & L Hawaiian Barbecue","Las Vegas","NV","89109",36.1426344,-115.1375486,"1","Restaurants, Barbeque, Fast Food, Hawaiian"
"1107",116136,"Arisu Korean BBQ & Sushi","Toronto","ON","M6G 1K4",43.6650813,-79.4126923,"1","Caterers, Sushi Bars, Japanese, Barbeque, Korean, Event Planning & Services, Restaurants"
"1108",188679,"Bobby Q - Mesa","Mesa","AZ","85204",33.3850902,-111.8061349,"1","Restaurants, American (New), Gluten-Free, Burgers, Barbeque"
"1109",433,"Ono Hawaiian BBQ","Surprise","AZ","85374",33.6394146,-112.3585047,"1","Restaurants, Hawaiian, Barbeque"
"1110",75387,"Kobi Korean BBQ","Vaughan","ON","L4J 7Y1",43.7971653719,-79.4246841967,"1","Barbeque, Korean, Restaurants"
"1111",184301,"CK's Tavern & Grill","Phoenix","AZ","85048",33.3058134,-111.9932433,"1","American (Traditional), Pool Halls, Barbeque, Arts & Entertainment, Sports Bars, Music Venues, Sandwiches, Bars, Restaurants, Nightlife, Burgers, Karaoke"
"1112",54123,"Mon Ami - Korean BBQ","Montréal","QC","H4V 1S7",45.4678344,-73.6386551,"1","Restaurants, Barbeque, Buffets, Korean"
"1113",143170,"Assembly Chef's Hall","Toronto","ON","M5H 2G4",43.6503522,-79.3837951,"1","Japanese, Barbeque, Ramen, Public Markets, Pizza, Food Court, Restaurants, Food, Cafes, Vegan, Sushi Bars, Shopping, Diners, Bars, Breakfast & Brunch, Coffee & Tea, Nightlife"
"1114",60649,"SMS Catering Services","Charlotte","NC","28205",35.212474823,-80.7720108032,"1","Caterers, Restaurants, Wedding Planning, Venues & Event Spaces, Event Planning & Services, Barbeque"
"1115",161561,"Honey Bear's BBQ","Phoenix","AZ","85008",33.4514039,-111.973603,"1","Restaurants, Barbeque, Soul Food"
"1116",15811,"Double Wide Grill","Pittsburgh","PA","15203",40.4286257397,-79.9712989479,"1","Bars, Barbeque, Restaurants, Nightlife, American (Traditional), Vegetarian"
"1117",51361,"Magal BBQ","Las Vegas","NV","89102",36.1268216,-115.196836,"1","Korean, Steakhouses, Restaurants, Barbeque"
"1118",154303,"Brickhouse BBQ","Madison","WI","53703",43.0740793,-89.3931756,"0","Nightlife, Bars, Event Planning & Services, Restaurants, Barbeque, Venues & Event Spaces, Pubs"
"1119",86640,"Station des Sports","Laval","QC","H7L 4P8",45.5902344,-73.7415477,"1","Restaurants, Nightlife, Fast Food, Burgers, Bars, Barbeque, Sports Bars, Comfort Food"
"1120",41034,"New Sun BBQ","Toronto","ON","M1V 5L6",43.8139148,-79.2915342,"1","Restaurants, Chinese, Barbeque"
"1121",172997,"Montana's BBQ & Bar","Etobicoke","ON","M8Z 6C7",43.6238986203,-79.5162963867,"1","Canadian (New), Barbeque, Restaurants, Comfort Food, Steakhouses"
"1122",91313,"The Improper Pig","Charlotte","NC","28211",35.1766346433,-80.7996419534,"1","Nightlife, Bars, Restaurants, Barbeque, Chicken Wings, Sandwiches, Korean"
"1123",179603,"Top Gourmet of China","Vaughan","ON","L4J 2L1",43.7973566759,-79.4258245383,"1","Chinese, Seafood, Restaurants, Barbeque"
"1124",36124,"Mesh Peri-Peri Grill","Mississauga","ON","L5V",43.6091328156,-79.6978229284,"0","Restaurants, Fast Food, Barbeque, Portuguese"
"1125",94092,"Mr G's","Charlotte","NC","28208",35.2137894,-80.9276213,"1","Barbeque, Restaurants, Greek"
"1126",177878,"The Rib Crib","Elizabeth","PA","15037",40.272121,-79.8721868,"1","Barbeque, Nightlife, Restaurants, American (Traditional), Bars"
"1127",126539,"Iqbal Kebab & Sweet Centre","Toronto","ON","M4H 1H2",43.7065383,-79.351572,"1","Restaurants, Food, Pakistani, Grocery, Barbeque, Seafood"
"1128",59767,"La Mâle Bouffe","Montréal","QC","H1W 1S6",45.5482486,-73.5424351,"0","Sandwiches, Poutineries, Barbeque, Restaurants"
"1129",103401,"Branca","Toronto","ON","M6K 1V4",43.6499275,-79.4390283,"0","Cocktail Bars, Restaurants, Barbeque, Steakhouses, Argentine, Nightlife, Bars"
"1130",133160,"Nando's","Markham","ON","L3S 3J9",43.853368,-79.2539432,"1","Barbeque, Portuguese, Chicken Shop, Restaurants"
"1131",3635,"Firehouse Subs","Chandler","AZ","85226",33.3058409818,-111.9462968409,"1","Burgers, Sandwiches, Barbeque, Restaurants"
"1132",10341,"John Mull's Meats & Road Kill Grill II","Las Vegas","NV","89131",36.336473,-115.2091453,"1","Barbeque, Butcher, Food, Restaurants, Specialty Food, Meat Shops"
"1133",30430,"Nando's Flame Grilled Chicken","Toronto","ON","M4G 4E8",43.7130336385,-79.3597540197,"1","Restaurants, American (Traditional), Chicken Wings, South African, African, Portuguese, Barbeque"
"1134",165345,"Uncle Smoke Cookhouse","Toronto","ON","M6R 1X6",43.6551712,-79.4524461,"1","Restaurants, Barbeque"
"1135",125159,"Mesquite Grill and Sports Bar","Gilbert","AZ","85233",33.3777002,-111.8322785,"1","Sports Bars, Barbeque, American (Traditional), Bars, Nightlife, Restaurants"
"1136",148717,"Astor House","Phoenix","AZ","85006",33.472824,-112.056064,"0","Breakfast & Brunch, Bars, American (New), Barbeque, Restaurants, Nightlife"
"1137",12417,"Charlie's Barbeque","Akron","OH","44320",41.0830871,-81.5889418,"0","Desserts, Barbeque, Pizza, Food, Restaurants"
"1138",148748,"Tick Tock Tavern","Cleveland","OH","44102",41.4873908,-81.7671191,"1","Chicken Wings, Barbeque, American (Traditional), Restaurants, Diners, Dive Bars, Pubs, Greek, Bars, Nightlife"
"1139",166769,"Vic Hong Restaurant","Richmond Hill","ON","L4S 1P3",43.876528,-79.4107135,"0","Barbeque, Vietnamese, Restaurants"
"1140",160364,"HEK Yeah BBQ","Phoenix","AZ","85032",33.623899,-112.031235,"1","American (Traditional), Gluten-Free, Barbeque, Local Flavor, Restaurants"
"1141",120217,"Rockefeller's Grille","McKees Rocks","PA","15136",40.4680611,-80.0948826,"1","American (Traditional), Barbeque, Sandwiches, Chicken Wings, Nightlife, Restaurants"
"1142",161022,"Hammered Hog BBQ Hall & Saloon","Phoenix","AZ","85032",33.5973316,-112.0140001,"0","Restaurants, Barbeque"
"1143",47807,"Coyote Alley","Surprise","AZ","85374",33.6402375,-112.421939,"0","Sports Bars, Nightlife, Dance Clubs, Karaoke, Restaurants, Barbeque, Bars"
"1144",16600,"Rack Shack BBQ","Phoenix","AZ","85014",33.4943518,-112.0597232,"1","Restaurants, Barbeque"
"1145",62970,"Dom Carlos","Montréal","QC","H2L 2J4",45.5220602857,-73.5526797926,"1","Restaurants, Barbeque, Portuguese"
"1146",128182,"Hadley's","Toronto","ON","M6H",43.6534105,-79.4272729,"0","Canadian (New), Restaurants, Diners, American (New), Barbeque"
"1147",26112,"Swiss Chalet Rotisserie & Grill","Toronto","ON","M4E 1E3",43.6717603,-79.2929524,"1","American (Traditional), Comfort Food, Restaurants, Barbeque"
"1148",125184,"Ono Hawaiian BBQ","Phoenix","AZ","85018",33.479889,-111.997771,"1","Caterers, Hawaiian, Event Planning & Services, Restaurants, Barbeque"
"1149",107402,"P'Dubs BBQ","Las Vegas","NV","89169",36.1241882,-115.1351839,"1","Soul Food, Restaurants, Chicken Wings, Food Court, Barbeque"
"1150",170745,"Wheelhouse","Pittsburgh","PA","15212",40.447203,-80.022159,"1","Barbeque, Restaurants, Sports Bars, Food, American (Traditional), Bars, Nightlife, American (New), Lounges"
"1151",115540,"Steel City Rib House","Pittsburgh","PA","15206",40.4629977,-79.9239872,"0","Barbeque, Restaurants"
"1152",101371,"Voodoo Wing Co","Las Vegas","NV","89108",36.2185398,-115.2431106,"1","Restaurants, Chicken Wings, Barbeque, Food"
"1153",114801,"Rôtisserie Scores","Brossard","QC","J4Z 1A6",45.47496,-73.4660764,"1","Chicken Wings, Restaurants, Fast Food, Chicken Shop, Barbeque"
"1154",146024,"Yung Kee BBQ","Markham","ON","L3R 9V7",43.8284695,-79.3059812,"0","Chinese, Fast Food, Barbeque, Restaurants"
"1155",89058,"Briskit Gourmet Slow Cooked Sandwiches","Brampton","ON","L6W 3W6",43.6953286,-79.7345625,"0","Sandwiches, Breakfast & Brunch, Restaurants, Barbeque"
"1156",126126,"Babe's Soul Food Restaurant","Cleveland","OH","44102",41.4680498,-81.7492201,"1","Soul Food, Barbeque, Restaurants"
"1157",181568,"Hillbilly's Barbeque & Steaks","Lowell","NC","28098",35.263714,-81.091149,"1","Barbeque, Restaurants, Steakhouses"
"1158",50330,"Famous Dave's Bar-B-Que","Henderson","NV","89014",36.0642117,-115.0436798,"1","Barbeque, Restaurants, American (Traditional), Comfort Food"
"1159",71666,"Gui","Toronto","ON","M2M 3X1",43.793208,-79.4192262,"1","Restaurants, Barbeque, Korean"
"1160",7753,"BBQ Creole","Brossard","QC","J4Z 3G3",45.4748044,-73.4435636,"1","Restaurants, Barbeque"
"1161",160439,"G's BBQ Lounge","Litchfield Park","AZ","85340",33.5106926,-112.3415139,"0","Arts & Entertainment, Bars, Nightlife, Lounges, Performing Arts, Barbeque, Restaurants"
"1162",36701,"Whitmore's BBQ Vegas","Las Vegas","NV","88901",36.18,-115.14,"1","Event Planning & Services, Restaurants, Barbeque, Southern, Caterers"
"1163",118394,"Uncle Redd's BBQ","Penn Hills","PA","15235",40.4824325,-79.8087719,"1","Restaurants, Barbeque"
"1164",62387,"All Star Wings and Ribs - Pickering","Pickering","ON","L1V 4H7",43.8453214795,-79.0709474008,"1","Chicken Wings, Restaurants, Barbeque"
"1165",108884,"Troutman's Bar-B-Q","Concord","NC","28025",35.4364364,-80.6041279,"1","Restaurants, Barbeque"
"1166",186440,"Smokin Piggy","Bradford","ON","L3Z 2B2",44.1138071016,-79.5647992815,"0","Cajun/Creole, Restaurants, Southern, Barbeque"
"1167",116568,"Ranucci's BBQ & Grill","Belmont","NC","28012",35.243155,-81.028482,"0","Barbeque, Restaurants, American (Traditional)"
"1168",3346,"LV Food Junky","Las Vegas","NV","89101",36.1701761,-115.1404649,"1","American (New), Tapas Bars, Caterers, Food, Barbeque, Food Trucks, Restaurants, Event Planning & Services"
"1169",143410,"Arirang Korean BBQ","Las Vegas","NV","89119",36.1154417,-115.1338935,"1","Barbeque, Korean, Restaurants"
"1170",153296,"Master Kim's Korean BBQ","Las Vegas","NV","89113",36.0607048,-115.2780632,"1","Restaurants, Korean, Barbeque"
"1171",134526,"K Star BBQ","Peoria","AZ","85345",33.5704697,-112.2503239,"1","Food, Barbeque, Caterers, Food Trucks, Restaurants, Event Planning & Services, Street Vendors"
"1172",111325,"Zam Zam Tikka and Kabab","Toronto","ON","M1K 1N8",43.7072508,-79.2695536,"1","Barbeque, Pakistani, Indian, Restaurants"
"1173",74191,"Big T's BBQ & Smokehouse","Calgary","AB","T2M 4N5",51.0708223,-114.1170388,"1","Diners, Restaurants, Breakfast & Brunch, Barbeque"
"1174",100319,"Bobby Q - Biltmore","Phoenix","AZ","85016",33.510151,-112.0137937,"1","Restaurants, Nightlife, Cocktail Bars, Steakhouses, Bars, Barbeque, American (Traditional)"
"1175",179858,"Dumpling & More","Toronto","ON","M5T 1G7",43.6536125,-79.3958219,"1","Chinese, Barbeque, Asian Fusion, Noodles, Restaurants"
"1176",52179,"Blazin Bills","Burton","OH","44021",41.386302,-81.176968,"1","Restaurants, Barbeque"
"1177",127599,"Smoke BBQ House","Toronto","ON","M6G 2V7",43.660505,-79.4146616,"0","Restaurants, Barbeque"
"1178",144477,"Virgil's Real BBQ - Las Vegas","Las Vegas","NV","89109",36.1176620311,-115.1704301328,"1","Music Venues, Barbeque, Bars, Nightlife, Arts & Entertainment, Caterers, American (Traditional), Venues & Event Spaces, Event Planning & Services, Restaurants, Salad, Chicken Wings"
"1179",80299,"Jangwon","Toronto","ON","M6G 1L5",43.6638341,-79.4177528,"1","Korean, Barbeque, Food, Do-It-Yourself Food, Restaurants"
"1180",187288,"Hot Sauce Williams Barbecue Restaurant","Cleveland","OH","44103",41.5017823,-81.6339479,"0","Soul Food, Barbeque, Fast Food, Restaurants"
"1181",181311,"Yan Grill and Hot Pot","Mesa","AZ","85202",33.4125028,-111.8737663,"1","Chinese, Kebab, Barbeque, Restaurants, Asian Fusion, Seafood, Hot Pot"
"1182",75302,"Popular Pot Inc / Zhuang Yuan Bbq Bar","Toronto","ON","M5T 2G3",43.6558075,-79.3989112,"1","Barbeque, Restaurants, Chinese"
"1183",104729,"Bill Johnson's Big Apple Restaurants","Phoenix","AZ","85017",33.494408,-112.126279,"0","American (Traditional), Restaurants, Barbeque, Steakhouses"
"1184",120408,"Big Cuz's Catering","Phoenix","AZ","85022",33.6088111,-112.0669661,"1","Restaurants, Party & Event Planning, Food, Event Planning & Services, Caterers, Food Trucks, Barbeque"
"1185",53783,"Night Market","Toronto","ON","M2N 5N2",43.7625993,-79.4115064,"1","Asian Fusion, Barbeque, Korean, Restaurants"
"1186",117633,"B&B Burger & Beer","Las Vegas","NV","89109",36.122727,-115.170355,"0","Nightlife, Restaurants, Cocktail Bars, Bars, Burgers, Beer Bar, Italian, Barbeque"
"1187",30611,"Christown Spectrum","Phoenix","AZ","85015",33.5224329,-112.0962964,"1","Barbeque, Shopping Centers, Shopping, Restaurants"
"1188",152596,"The Grill on Mill","Tempe","AZ","85281",33.4269477,-111.9404332,"0","Nightlife, Barbeque, Restaurants, Sandwiches, Bars"
"1189",21309,"Native Grill & Wings","Goodyear","AZ","85394",33.4641460987,-112.3881429369,"1","Chicken Wings, American (New), Restaurants, Nightlife, Sports Bars, Bars, Burgers, Barbeque"
"1190",79447,"Old School","Toronto","ON","M6J 1V1",43.6519218754,-79.4083632901,"1","American (Traditional), Restaurants, Barbeque, Breakfast & Brunch, Nightlife, Bars"
"1191",69722,"Chez Milot","Boisbriand","QC","J7G 1B1",45.6389651923,-73.7879622343,"1","Seafood, Restaurants, Barbeque, Italian"
"1192",122327,"Rôtisserie St-Hubert","Vaudreuil-Dorion","QC","J7V 7W1",45.3791496502,-74.0207569233,"1","Restaurants, Barbeque, Chicken Shop, Chicken Wings"
"1193",1233,"Delicia","Laval","QC","H7X 3S5",45.5225407,-73.784724,"1","Barbeque, Restaurants, Canadian (New)"
"1194",90812,"Liberty Station - DC Ranch","Scottsdale","AZ","85255",33.6748775,-111.888578,"1","Barbeque, American (Traditional), Restaurants"
"1195",29470,"Galito's Flame Grilled Chicken","Vaughan","ON","L4L 2V5",43.7925324,-79.547604,"0","Restaurants, Barbeque"
"1196",70613,"Little Master","Toronto","ON","M2N 5R6",43.7758099,-79.414276,"0","Barbeque, Asian Fusion, Restaurants, Chinese"
"1197",110422,"Boss's Slow Smoked BBQ","Henderson","NV","89014",36.0740484,-115.082902,"1","Sandwiches, Event Planning & Services, Barbeque, Restaurants, Food Trucks, Caterers, Salad, Food"
"1198",122466,"521 BBQ & Grill","Fort Mill","SC","29707",34.9362399,-80.8379247,"1","Chicken Wings, Restaurants, Barbeque, Burgers"
"1199",4066,"Two Sons Barbeque","Denver","NC","28037",35.4603506,-80.9931736,"1","Barbeque, Restaurants"
"1200",101129,"Ole Smokehouse 1","Charlotte","NC","28209",35.170862,-80.850106,"0","Barbeque, Restaurants"
"1201",106665,"Birmingham Bridge Tavern","Pittsburgh","PA","15203",40.4245046,-79.9645459,"1","Barbeque, Restaurants, Bars, Nightlife"
"1202",112122,"Restaurant de la Place","Chateauguay","QC","J6J 3H6",45.3631075,-73.7138553,"1","Pizza, Italian, Barbeque, Restaurants, Seafood, Greek"
"1203",78363,"Off Street BBQ","New Eagle","PA","15067",40.2078506,-79.9470972,"1","Restaurants, Barbeque, Sandwiches"
"1204",94565,"Annina's Bakeshop and Catering","Goodwood","ON","L0C 1A0",44.0371607,-79.1962325,"1","Restaurants, Burgers, Sandwiches, Food, Pizza, Barbeque"
"1205",45239,"Best Aroma Kitchen","Toronto","ON","M2J 4A8",43.787461,-79.329808,"1","Barbeque, Restaurants, Chinese"
"1206",161731,"Rags Real Chicken and Waffles Catering","Youngtown","AZ","85363",33.5939082,-112.2998107,"0","Barbeque, Chicken Shop, Southern, Event Planning & Services, Soul Food, Professional Services, Caterers, Restaurants"
"1207",157615,"Insadong Korean BBQ Restaurant","Calgary","AB","T2A 6L8",51.061637,-113.981058,"1","Ethnic Food, Specialty Food, Food, Restaurants, Korean, Imported Food, Barbeque"
"1208",115309,"Food Fight Bbq","Brampton","ON","L6S 0E7",43.7492877,-79.6977842,"1","Barbeque, Restaurants, American (Traditional)"
"1209",152492,"Halo Restaurant & Bar","Las Vegas","NV","89102",36.1423922,-115.2094174,"1","Asian Fusion, American (New), Barbeque, Bars, Nightlife, Restaurants"
"1210",110133,"Bubba's Barbecue","Charlotte","NC","28216",35.3060842,-80.8542466,"1","Restaurants, Barbeque"
"1211",89416,"The Haze","Madison","WI","53703",43.0747393,-89.3813418,"0","Restaurants, Asian Fusion, Barbeque"
"1212",56820,"LongHorn Steakhouse","Surprise","AZ","85374",33.63846,-112.3640582,"1","Restaurants, Steakhouses, American (Traditional), Barbeque"
"1213",59217,"Dupont Bbq Chicken","Toronto","ON","M6P 3S6",43.6655841,-79.4526989,"1","Barbeque, Restaurants, Chicken Wings"
"1214",122607,"Pig Out BBQ","Toronto","ON","M5S 2H7",43.6631821,-79.4025671,"1","American (Traditional), Restaurants, Sandwiches, Barbeque"
"1215",36410,"The Red House","Calgary","AB","T2G 3K6",51.0187810936,-114.0282646175,"1","Korean, Barbeque, Restaurants, Breakfast & Brunch, Cafes"
"1216",157863,"Barbecue World","Concord","ON","L4K 4Z8",43.8110311,-79.5377071,"1","Barbeque, Shopping, Restaurants"
"1217",169411,"Rôtisserie Scores","Lasalle","QC","H8N 1Y5",45.4316191,-73.6311594,"1","Restaurants, Chicken Shop, Food, Barbeque, Fast Food"
"1218",69136,"Fist of Fusion Island Grill","Las Vegas","NV","89113",36.0546591,-115.2621343,"1","Asian Fusion, Hawaiian, Restaurants, Barbeque"
"1219",8861,"Pammie's Ribs Chicken & Fish","Akron","OH","44320",41.0841395,-81.5711951,"0","Seafood, Chicken Wings, Barbeque, Restaurants, Soul Food"
"1220",142425,"Pork on a Fork Catering","Phoenix","AZ","85023",33.641336,-112.096903,"1","Barbeque, Restaurants, Arts & Entertainment, Festivals, Event Planning & Services, Caterers"
"1221",81016,"King's Noodle Restaurant","Toronto","ON","M5T 2E7",43.6531048,-79.3985413,"1","Chinese, Restaurants, Noodles, Food, Barbeque, Imported Food, Specialty Food, Ethnic Food"
"1222",74685,"Rôtisserie St-Hubert","Montréal","QC","H3B 2S2",45.4969715,-73.5692076,"1","Chicken Shop, Barbeque, Restaurants"
"1223",165323,"RUBS American BBQ","Laval","QC","H7L 5R7",45.589136835,-73.7873706673,"1","Barbeque, Restaurants, Southern, Sandwiches"
"1224",72194,"Mt Pleasant Bar-B-Q","Cleveland","OH","44120",41.4662294,-81.5933666,"1","Restaurants, Barbeque"
"1225",29805,"Prince BBQ","Markham","ON","L3R 9V6",43.8263314,-79.3051004,"1","Fast Food, Restaurants, Barbeque, Chinese"
"1226",132899,"JB's Eat-A-Bite BBQ","Madison","WI","53713",43.0419642,-89.3939141,"0","Restaurants, Barbeque, Italian"
"1227",182342,"Big City BBQ","Mesa","AZ","85210",33.3871396,-111.8566133,"0","Barbeque, Restaurants"
"1228",180873,"The Chicken Nest","North York","ON","M6B 4K2",43.71854,-79.429872,"1","Barbeque, Restaurants, Chicken Wings"
"1229",137413,"Starlite BBQ","Scottsdale","AZ","85251",33.4949703,-111.916354,"1","Bars, Cocktail Bars, Nightlife, American (Traditional), Restaurants, Barbeque, Breakfast & Brunch"
"1230",149346,"Bâton Rouge Steakhouse & Bar","Laval","QC","H7T 1C8",45.5710730773,-73.7512054964,"1","Barbeque, Seafood, American (Traditional), Canadian (New), Restaurants, Nightlife, Gluten-Free, Steakhouses, Bars"
"1231",115033,"The Rib Cage Smokehouse and Bar","Cleveland Heights","OH","44118",41.499155,-81.5656209,"1","Food, Smokehouse, Barbeque, Restaurants, Nightlife, Bars, Chicken Wings"
"1232",20504,"Red Hot & Blue","West Homestead","PA","15120",40.4071242,-79.9164495,"0","Restaurants, Barbeque"
"1233",89327,"Mr Beijing","Las Vegas","NV","89119",36.1151541,-115.1480156,"0","Vegetarian, Restaurants, Barbeque, Chinese"
"1234",166765,"The Broken Spoke","Charlotte","NC","28217",35.1860008,-80.8814186,"1","Restaurants, Tapas Bars, Nightlife, Distilleries, Barbeque, Food, Beer Bar, Venues & Event Spaces, Cocktail Bars, Event Planning & Services, Specialty Food, Bars, Whiskey Bars, American (New)"
"1235",98290,"Sonny's BBQ","Rock Hill","SC","29730",34.976638,-80.9837834,"1","Restaurants, American (New), Caterers, Barbeque, Event Planning & Services"
"1236",176188,"Pink Hong BBQ House","Toronto","ON","M1S 2B4",43.7887581,-79.2687965,"0","Chinese, Restaurants, Barbeque"
"1237",54574,"The Chickery","Toronto","ON","M5V 2L4",43.6475596,-79.3961288,"0","Chicken Wings, Chicken Shop, Event Planning & Services, Party & Event Planning, Barbeque, Salad, Sandwiches, Restaurants, Comfort Food"
"1238",92303,"Bobbee O's BBQ","Charlotte","NC","28269",35.3497049,-80.8420243,"1","American (Traditional), Southern, Restaurants, Soul Food, Barbeque, American (New)"
"1239",151848,"Bar-B-Q Boss","Akron","OH","44320",41.0845537,-81.5517115,"1","Seafood, Sandwiches, Restaurants, Barbeque"
