"","business_id","name","city","state","postal_code","latitude","longitude","is_open","categories"
"1350",112324,"My Granny's Banana Pudding","Mesa","AZ","85202",33.3629304866,-111.8753578429,"1","Restaurants, Chicken Wings, Southern, Soul Food, Food Delivery Services, Desserts, Event Planning & Services, Venues & Event Spaces, Food, Breakfast & Brunch, Caterers"
"1351",19521,"Butter Baker","Toronto","ON","M5G 1C3",43.6558371,-79.3844562,"1","Desserts, Patisserie/Cake Shop, Food, Bakeries, Coffee & Tea"
"1352",151876,"The Pie Shack","Toronto","ON","M6P 1R2",43.6622426,-79.4721591,"0","Desserts, Food"
"1353",144077,"Decadent Desserts","Toronto","ON","M5X 1B8",43.6486362,-79.3817439,"1","Food, Desserts"
"1354",90914,"Chola's","Concord","NC","28027",35.363335,-80.711935,"0","Desserts, Restaurants, Food, Indian"
"1355",41429,"Brett's Ice Cream","Toronto","ON","M4L 1G6",43.6673192,-79.3129084,"1","Food, Ice Cream & Frozen Yogurt, Coffee & Tea, Desserts"
"1356",13068,"Zoyo Neighborhood Yogurt","Laveen","AZ","85339",33.3762309237,-112.1711554751,"1","Ice Cream & Frozen Yogurt, Desserts, Food"
"1357",44527,"Pino Gelato","Charlotte","NC","28208",35.2192700517,-80.9450774647,"1","Gelato, Desserts, Food, Ice Cream & Frozen Yogurt"
"1358",57013,"The Cheesecake Cafe","Calgary","AB","T2H 0L9",50.9857529,-114.0708076,"1","Restaurants, Bakeries, Breakfast & Brunch, Food, Cafes, Desserts, Canadian (New)"
"1359",86999,"Maya Ice-Cream Rolls & Indian Food","Phoenix","AZ","85032",33.6017858736,-111.9820744796,"1","Ice Cream & Frozen Yogurt, Food, Desserts"
"1360",55497,"Gennaro's Pizza & Pub","Pittsburgh","PA","15203",40.4285784,-79.9810547,"1","Restaurants, Sandwiches, Food, Greek, Pizza, Italian, Desserts"
"1361",47691,"Cold Stone Creamery","Toronto","ON","M5S 2B4",43.6690053,-79.3892014,"0","Ice Cream & Frozen Yogurt, Desserts, Food"
"1362",28743,"Cracker Barrel Old Country Store","Urbana","IL","61802",40.1334488,-88.1995086,"1","American (Traditional), Caterers, Event Planning & Services, Restaurants, Food, Comfort Food, Desserts, Southern, Breakfast & Brunch, Salad"
"1363",182751,"San Gennaro","Montréal","QC","H2S 1K7",45.532785,-73.6111769,"1","Coffee & Tea, Event Planning & Services, Cafes, Caterers, Bakeries, Food, Desserts, Pizza, Restaurants"
"1364",191751,"Salon de Thé CHAÏ Tea Lounge","Montréal","QC","H2X 2H7",45.5095134,-73.5739897,"1","Food, Cafes, Restaurants, Coffee & Tea, Desserts, Tea Rooms"
"1365",81381,"Froyo Twist","Mentor","OH","44060",41.6731327,-81.3392177,"1","Food, Ice Cream & Frozen Yogurt, Desserts"
"1366",54978,"Pizza My Dear","Las Vegas","NV","89147",36.115208074,-115.2939914167,"0","Restaurants, Desserts, Chicken Wings, Pizza, Food Delivery Services, Food, Salad"
"1367",90042,"Estia Cafe","Toronto","ON","M4E 1T3",43.6806566,-79.2858686,"0","Desserts, Ice Cream & Frozen Yogurt, Food, Coffee & Tea"
"1368",20122,"Creamberry","Las Vegas","NV","89139",36.043749912,-115.2439988142,"1","Acai Bowls, Specialty Food, Ice Cream & Frozen Yogurt, Shaved Ice, Juice Bars & Smoothies, Macarons, Food, Desserts"
"1369",94081,"La Michoacana","Madison","WI","53719",43.0566445,-89.4974411,"1","Desserts, Ice Cream & Frozen Yogurt, Food"
"1370",56814,"Lulu's On The Move","Las Vegas","NV","89109",36.128561,-115.1711298,"0","Sandwiches, Breakfast & Brunch, Restaurants, Food, Food Stands, Desserts"
"1371",154103,"Bahama Buck's","Chandler","AZ","85248",33.2465672,-111.8426523,"1","Desserts, Food, Shaved Ice, Acai Bowls, Juice Bars & Smoothies"
"1372",54366,"Shawarma Brothers","Airdrie","AB","T4B 3K8",51.2713203,-114.0180047,"0","Desserts, Middle Eastern, Mediterranean, Food, Salad, Lebanese, Restaurants, Fast Food"
"1373",190772,"Smallcakes","Huntersville","NC","28078",35.4058765929,-80.8651548252,"1","Desserts, Food, Bakeries, Cupcakes"
"1374",104098,"Yogurt Ranch","Mesa","AZ","85206",33.3851450947,-111.6873871205,"0","Desserts, Restaurants, Ice Cream & Frozen Yogurt, American (New), Food"
"1375",180729,"Mr Puffs","Montréal","QC","H4N 3K1",45.5334062412,-73.6552040283,"1","Food, Patisserie/Cake Shop, Coffee & Tea, Desserts"
"1376",126139,"Hook Fish and Chicken","McKees Rocks","PA","15136",40.4725522,-80.0731923,"1","Fish & Chips, Food Delivery Services, Restaurants, Chicken Shop, Desserts, Food"
"1377",27531,"Crêpes à GoGo Spadina","Toronto","ON","M5S 2J2",43.6664590538,-79.4041928167,"1","Desserts, Food, Cafes, Restaurants, Specialty Food, French, Creperies"
"1378",157877,"Pour Coffeehouse","Las Vegas","NV","89119",36.0661492,-115.1190162,"1","Caribbean, Sandwiches, Vegan, Juice Bars & Smoothies, Coffee & Tea, American (Traditional), Cafes, Restaurants, Food, Desserts"
"1379",177724,"Bouchon Bakery at the Venetian Theater","Las Vegas","NV","89109",36.12291,-115.170716,"1","Desserts, Food, French, Sandwiches, Bakeries, Restaurants"
"1380",11516,"Iced for Life","Chandler","AZ","85249",33.229636,-111.791111,"0","Desserts, Bakeries, Food, Cupcakes"
"1381",189044,"Cherry on Top - Frozen Yogurt","Las Vegas","NV","89113",36.066304,-115.255162,"0","Food, Ice Cream & Frozen Yogurt, Desserts"
"1382",127684,"Miami Cafe","Phoenix","AZ","85004",33.4561612,-112.0739321,"0","Pizza, Desserts, Beer, Wine & Spirits, Food, Italian, Restaurants"
"1383",82209,"MoCa","Cleveland","OH","44102",41.4852646,-81.7574148,"0","Coffee & Tea, Desserts, Food"
"1384",29271,"Sticks and Shakes","Las Vegas","NV","89131",36.276841,-115.2078289522,"0","Gelato, Juice Bars & Smoothies, Restaurants, Bakeries, Desserts, Food"
"1385",43244,"Thai Thai","Lakewood","OH","44107",41.4769144417,-81.7890876699,"1","Food, Bubble Tea, Thai, Desserts, Restaurants, Vegan"
"1386",90744,"Oh! Yogurt","Pittsburgh","PA","15224",40.4618764521,-79.9494252238,"0","Desserts, Food, Ice Cream & Frozen Yogurt, Do-It-Yourself Food"
"1387",166637,"Le Parva","Montréal","QC","H2L 5C4",45.5156800161,-73.5626163166,"1","Food, Nightlife, Cafes, Coffee & Tea, Desserts, Cocktail Bars, Bistros, Restaurants, Breakfast & Brunch, Bars"
"1388",86317,"Humble Wine Bar","Lakewood","OH","44107",41.4850751,-81.803588,"1","Desserts, Restaurants, Food, Vegan, Bars, Pizza, Nightlife, Lounges, Tapas/Small Plates, Wine Bars"
"1389",156128,"Rita's Italian Ice - Custard- Happiness","Glendale","AZ","85308",33.654599,-112.188573,"1","Shaved Ice, Desserts, Ice Cream & Frozen Yogurt, Food"
"1390",61524,"Cafe Mania","Toronto","ON","M4Y 1Z5",43.6667781,-79.3853133,"0","Food, Desserts"
"1391",98875,"Jamie's Italian Square One","Mississauga","ON","L5B 2C9",43.592748,-79.643027,"1","Desserts, Italian, Food, Pizza, Restaurants"
"1392",147067,"Dairy Queen","Las Vegas","NV","89148",36.0696703,-115.2983435,"1","Restaurants, Desserts, Food, Fast Food, Juice Bars & Smoothies, Ice Cream & Frozen Yogurt"
"1393",27864,"Kakayo Chocolate Company","Toronto","ON","M4L 1G1",43.6660075,-79.3180783,"0","Food, Specialty Food, Desserts, Chocolatiers & Shops"
"1394",72929,"Foxcroft Wine Co - Dilworth","Charlotte","NC","28203",35.202596,-80.845205,"1","Nightlife, Food, Bars, Restaurants, Tapas/Small Plates, Beer Bar, Beer, Wine & Spirits, American (New), Wine Bars, Desserts"
"1395",105884,"Erin's Fine Foods Deli","Pittsburgh","PA","15222",40.4423639516,-80.0000734166,"1","Desserts, American (New), Coffee & Tea, Caterers, Food, Delis, Event Planning & Services, Restaurants"
"1396",158590,"Le Dolci","Toronto","ON","M6J 1W7",43.6504845,-79.4158693,"1","Bakeries, Desserts, Food"
"1397",178149,"Cherryblossom Noodle Cafe","Phoenix","AZ","85014",33.5098020416,-112.061086646,"1","Bakeries, Italian, Food, Ramen, Desserts, Sushi Bars, Restaurants, Noodles, Asian Fusion, Japanese"
"1398",100938,"Sul & Bean - Korean Dessert Cafe","Richmond Hill","ON","L4C 1V7",43.8643271,-79.434961,"1","Desserts, Food"
"1399",190951,"Why Not Pizza","Charlotte","NC","28215",35.223467,-80.727712,"1","Vegan, Sandwiches, Chicken Wings, Restaurants, Specialty Food, American (Traditional), Cheesesteaks, Food, Desserts, Pizza"
"1400",33120,"DeVille Luxury Coffee & Pastries","Calgary","AB","T2S 0W4",51.0466771,-114.0634218,"0","Food, Desserts, Restaurants, Coffee & Tea, Sandwiches"
"1401",140986,"JinJu Chocolates","Las Vegas","NV","89118",36.054893,-115.244062,"1","Desserts, Food, Specialty Food, Coffee & Tea, Chocolatiers & Shops"
"1402",25247,"Kin Kin Bakery & Bubble Tea","Markham","ON","L3T 5W4",43.8204923,-79.3984661,"1","Food, Bakeries, Bubble Tea, Desserts"
"1403",166764,"Golden Bubbles","Toronto","ON","M1V 0C8",43.8052,-79.289643,"1","Cafes, Waffles, Ice Cream & Frozen Yogurt, Restaurants, Desserts, Patisserie/Cake Shop, Food"
"1404",11261,"Lebanese Bakery","Toronto","ON","M1R 2Z6",43.7457253,-79.2922346,"1","Food, Desserts, Bakeries"
"1405",55913,"The Sweet Tooth Fairy","Gilbert","AZ","85234",33.3779490765,-111.7409683764,"1","Cupcakes, Desserts, Bakeries, Food, Specialty Food, Candy Stores"
"1406",134761,"The Great Maratha","Toronto","ON","M6C 2C4",43.7000376,-79.4292572,"1","Chinese, Desserts, Food, Restaurants, Indian"
"1407",84321,"Crêpes on Main","Markham","ON","L3R 2G8",43.8666746151,-79.311793372,"0","Desserts, Food"
"1408",50362,"A1 Sweets & Restaurant","Oakville","ON","L6H 6N9",43.483749,-79.713028,"1","Desserts, Caterers, Event Planning & Services, Food, Restaurants, Indian, Vegetarian"
"1409",16413,"Sunset Soul Food","Charlotte","NC","28217",35.3033706,-80.8578061,"1","Seafood, Soul Food, Restaurants, Desserts, Salad, Food"
"1410",183939,"Mango Mania","Calgary","AB","T2E 2R1",51.0619517393,-114.0627545491,"1","Sandwiches, Asian Fusion, Restaurants, Desserts, Food, Taiwanese, Bubble Tea"
"1411",25234,"Raspados Solaris","Phoenix","AZ","85020",33.5700759,-112.0656616,"1","Desserts, Ice Cream & Frozen Yogurt, Shaved Ice, Fruits & Veggies, Food, Specialty Food"
"1412",109420,"Cee Cee's On The Corner","Glendale","AZ","85301",33.5408597,-112.1833135,"0","Sandwiches, Food, Desserts, Mexican, Restaurants"
"1413",136813,"Snow Ono Shave Ice","Las Vegas","NV","89101",36.1697096,-115.1236952,"0","Food Delivery Services, Ice Cream & Frozen Yogurt, Food Stands, Restaurants, Food, Hawaiian, Desserts, Shaved Ice"
"1414",184485,"Ethel's Chocolate Lounge","Las Vegas","NV","89109",36.1277253,-115.1744147,"0","Specialty Food, Desserts, Food, Chocolatiers & Shops"
"1415",41175,"Yofresco Frozen Yogurt","Las Vegas","NV","89109",36.127962,-115.167986,"0","Desserts, Food, Ice Cream & Frozen Yogurt"
"1416",184534,"Butter Avenue Yonge & Lawrence","Toronto","ON","M4N 2N3",43.7341998,-79.4045305,"0","Desserts, Food, Bakeries, Restaurants, Cafes"
"1417",288,"She Bakes","Las Vegas","NV","89146",36.135635,-115.2304131,"1","Active Life, Caterers, Desserts, Health & Medical, Event Planning & Services, Health Markets, Nutritionists, Specialty Food, Food"
"1418",57337,"Nugateau Patisserie","Toronto","ON","M6J 1E6",43.6466882,-79.4060888,"1","Desserts, Bakeries, Food"
"1419",109508,"Sweet Pea Dessert Cafe","Scarborough","ON","M1V 5N1",43.8221402,-79.2985083,"0","Desserts, Food, Chinese, Restaurants"
"1420",168677,"Sucre Patisserie & Cafe","Calgary","AB","T2R 0B5",51.0436795351,-114.0816693881,"1","Desserts, Bakeries, Food, Patisserie/Cake Shop, Macarons, Cafes, Restaurants, Coffee & Tea, Specialty Food"
"1421",26758,"4 U Tea House","Montréal","QC","H3H 1M1",45.4934573,-73.5794861,"0","Desserts, Food, Tea Rooms, Coffee & Tea"
"1422",43157,"PinkaBella Cupcakes Surprise","Surprise","AZ","85379",33.6080326,-112.3558969,"1","Bakeries, Cupcakes, Custom Cakes, Desserts, Food"
"1423",4958,"Fit and Sweet Bakery","Toronto","ON","M6H 1N9",43.6586166,-79.4422898,"0","Sandwiches, Bakeries, Desserts, Vegan, Restaurants, Food"
"1424",72515,"Custom Cakes","Mississauga","ON","L5V 2K6",43.5975338,-79.6865179,"1","Desserts, Party & Event Planning, Food, Event Planning & Services, Bakeries"
"1425",6806,"The Shake Shack","Charlotte","NC","28214",35.2402275,-80.9733015,"0","Ice Cream & Frozen Yogurt, Desserts, Food"
"1426",105220,"Soufi's","Toronto","ON","M6J 1E5",43.6466397,-79.4074075,"1","Coffee & Tea, Breakfast & Brunch, Syrian, Desserts, Middle Eastern, Food, Cafes, Restaurants"
"1427",65903,"Elizabeth's Moments Of Joy","Gilbert","AZ","85296",33.3345698,-111.7383162,"0","Desserts, Food, Bakeries, Food Delivery Services"
"1428",106316,"New Orleans Sno Ball","Phoenix","AZ","85014",33.5221451,-112.0649741,"0","Food, Shaved Ice, Ice Cream & Frozen Yogurt, American (New), Local Flavor, Desserts, Restaurants"
"1429",80323,"Irie Vibes Caribbean Restaurant & Catering","Charlotte","NC","28206",35.2497143,-80.8155085,"1","Caribbean, Caterers, Restaurants, Specialty Food, Desserts, Food, Event Planning & Services, Seafood"
"1430",17521,"Dears Cafeteria","Toronto","ON","M5T 1G5",43.6542373,-79.3925858,"0","Cafes, Desserts, Food, Taiwanese, Restaurants"
"1431",8800,"Ben & Jerry's","Charlotte","NC","28207",35.2034665,-80.8243724,"1","Event Planning & Services, Ice Cream & Frozen Yogurt, Bakeries, Desserts, Restaurants, Caterers, Food"
"1432",29692,"King of Wings","Las Vegas","NV","89107",36.1752776,-115.2064866,"0","Chicken Wings, Hot Dogs, Food, Desserts, Restaurants"
"1433",72614,"Charidise","Toronto","ON","M5T 1L1",43.6558904,-79.3931774,"1","Restaurants, Desserts, Taiwanese, Food, Tea Rooms"
"1434",12953,"Alminz Kakanin","Vaughan","ON","L4J 6W9",43.7962244,-79.4300868,"1","Filipino, Restaurants, Desserts, Food"
"1435",12482,"Crepe Shack","Las Vegas","NV","89148",36.0979917,-115.2977607,"0","Food, Specialty Food, Coffee & Tea, Restaurants, Desserts, Creperies"
"1436",156121,"Yogurty's Yogurt","Toronto","ON","M6J",43.6468568253,-79.4067303023,"1","Food, Ice Cream & Frozen Yogurt, Desserts"
"1437",103281,"XO Gelato","Toronto","ON","M4S 2N2",43.7053513,-79.3887929,"1","Desserts, Ice Cream & Frozen Yogurt, Food"
"1438",166322,"Maddy's Fatty's","Cornelius","NC","29031",35.481649,-80.885037,"0","Event Planning & Services, Caterers, Bakeries, Food, Desserts"
"1439",36029,"Baklawa King","Mississauga","ON","L5R 0G2",43.5971440515,-79.6622520675,"1","Desserts, Specialty Food, Bakeries, Food"
"1440",158336,"Arepa Café","Toronto","ON","M5V 2B3",43.6479538471,-79.4008710352,"1","Latin American, Salad, Coffee & Tea, Desserts, Venezuelan, Restaurants, Food"
"1441",117461,"Antojitos Y Neveria Chayo's","Phoenix","AZ","85009",33.4649748006,-112.1509725606,"1","Ice Cream & Frozen Yogurt, Food, Fruits & Veggies, Specialty Food, Desserts"
"1442",165484,"Rita's","Las Vegas","NV","89101",36.1611641704,-115.1456702873,"0","Desserts, Ice Cream & Frozen Yogurt, Specialty Food, Food, Shaved Ice"
"1443",132417,"Creamistry","Scottsdale","AZ","85251",33.50171,-111.9276182,"1","Desserts, Food, Coffee & Tea, Ice Cream & Frozen Yogurt"
"1444",43454,"Melting Pot Café","Montréal","QC","H3T 1Y5",45.4967947,-73.6237951,"1","Restaurants, Cafes, Bubble Tea, Food, Desserts"
"1445",65184,"Il Terrazzo","Scottsdale","AZ","85251",33.5075550518,-111.9489055198,"0","Restaurants, Beer, Wine & Spirits, Nightlife, Desserts, Bars, Breakfast & Brunch, Food, Italian"
"1446",148706,"Prantl's Bakery","Pittsburgh","PA","15222",40.4411315,-80.0020805,"1","Bakeries, Desserts, Food, Patisserie/Cake Shop, Custom Cakes"
"1447",136754,"Alizé","Las Vegas","NV","89103",36.1144756162,-115.1948296933,"0","Nightlife, French, Wine Bars, Desserts, Bars, Food, Restaurants"
"1448",58335,"Cafe de Paris","Toronto","ON","M1S 3V1",43.8039094,-79.2883456,"1","Food, Cafes, Coffee & Tea, Restaurants, Ice Cream & Frozen Yogurt, Desserts"
"1449",99368,"Chatime","Brossard","QC","J4X 2S6",45.4490759,-73.4705071,"1","Food, Bubble Tea, Juice Bars & Smoothies, Desserts"
"1450",65245,"Aladdin Market","Las Vegas","NV","89119",36.10036,-115.128945,"1","Food, Grocery, International Grocery, Desserts"
"1451",138145,"Dairy Queen","Belmont","NC","28012",35.249065533,-81.0210511833,"1","American (Traditional), Desserts, Restaurants, Food, American (New), Fast Food, Ice Cream & Frozen Yogurt"
"1452",95325,"The Cookie Bar","Las Vegas","NV","89109",36.1205151222,-115.1752707175,"1","Desserts, Event Planning & Services, Gift Shops, Caterers, Food Delivery Services, Food, Flowers & Gifts, Bakeries, Bridal, Party & Event Planning, Shopping, Food Trucks"
"1453",176007,"Café Nikkita Rose","Montréal","QC","H1V 3N7",45.5571902,-73.5510363,"1","Event Planning & Services, Desserts, Bakeries, Food, Caterers"
"1454",112328,"Cacao 70","Montreal","QC","H3H 1M6",45.491464,-73.582297,"1","Canadian (New), Cafes, Chocolatiers & Shops, Food, Specialty Food, Breakfast & Brunch, Restaurants, Desserts, American (New)"
"1455",25892,"Debbie's Boutique Café","Ajax","ON","L1S 2H6",43.8501699,-79.0210826,"1","Food, Restaurants, Coffee & Tea, Sandwiches, Desserts"
"1456",181560,"Rockaberry","Montréal","QC","H3C 1K8",45.4919261842,-73.5653467991,"1","Restaurants, Bakeries, Salad, Food, Cafes, Desserts, Soup"
"1457",69235,"Dirt Dog","Las Vegas","NV","89139",36.0359228984,-115.2429071871,"1","Hot Dogs, Street Vendors, Food, Restaurants, American (Traditional), American (New), Desserts, Gastropubs"
"1458",62210,"Cupcake Junkie Bakery & Cafe","Whitby","ON","L1N",43.8761291,-78.9408644,"1","Sandwiches, Food, Restaurants, Desserts, Bakeries, Cafes"
"1459",34429,"Crave American Kitchen & Sushi Bar","Summerlin","NV","89135",36.1510974636,-115.3328087367,"0","Sushi Bars, American (New), Restaurants, Gluten-Free, Food, Desserts"
"1460",35968,"Tasti D-Lite","Las Vegas","NV","89109",36.105762,-115.172213,"0","Ice Cream & Frozen Yogurt, Desserts, Food"
"1461",15919,"Honey Hut","Brunswick","OH","44212",41.2500833664,-81.842061444,"1","Food, Restaurants, Ice Cream & Frozen Yogurt, Specialty Food, Desserts"
"1462",175448,"The Whining Pig - Gilbert","Gilbert","AZ","85295",33.304851,-111.756208,"1","Pubs, Restaurants, Sandwiches, Nightlife, Lounges, Desserts, Food, Wine Bars, Beer Bar, Bars"
"1463",72158,"Maxima Bakery & Cake House","Calgary","AB","T2E 2R8",51.064898,-114.0630348,"1","Restaurants, Food, Desserts, Chinese, Bakeries"
"1464",107728,"Nothing Bundt Cakes","Goodyear","AZ","85395",33.4655048323,-112.3563579172,"1","Cupcakes, Bakeries, Food, Desserts"
"1465",138985,"Luna Bakery Cafe","Cleveland","OH","44106",41.5005333,-81.5921431,"1","Custom Cakes, Food, Restaurants, Bakeries, Breakfast & Brunch, Desserts, Cafes"
"1466",12094,"The Fudgery","Charlotte","NC","28202",35.225324,-80.842187,"0","Food, Desserts"
"1467",174622,"Cakes By Elen","Las Vegas","NV","89103",36.1231108819,-115.2236644492,"0","Desserts, Bakeries, Event Planning & Services, Caterers, Food"
"1468",105690,"Breadcrafters Bakery & Cafe","Phoenix","AZ","85032",33.6009221527,-111.9786944841,"1","Event Planning & Services, Bakeries, Delis, Food, Salad, Breakfast & Brunch, Restaurants, Caterers, Sandwiches, Desserts"
"1469",141712,"Noisette Pastry Works","Markham","ON","L3T 6G7",43.8231839,-79.3695125,"0","Bakeries, Desserts, Food"
"1470",23033,"Auntie Anne's","Pittsburgh","PA","15202",40.454709,-80.157187,"1","Desserts, Bakeries, Food"
"1471",85880,"The Cheesecake Factory","Las Vegas","NV","89145",36.1646282753,-115.2892069902,"1","American (New), Food, Restaurants, Salad, American (Traditional), Desserts"
"1472",127811,"Amy's Donut Factory & Gourmet Creamery","Henderson","NV","89052",35.9784823,-115.0991352,"0","Ice Cream & Frozen Yogurt, Desserts, Donuts, Food"
"1473",77637,"Cinn City Bakery","Las Vegas","NV","89169",36.1259335,-115.1352534,"1","Specialty Food, Food, Desserts, Restaurants, Cupcakes, Bakeries, Coffee & Tea, Food Court"
"1474",57010,"Sweet Beginnings","Willoughby","OH","44094",41.6398512,-81.4063963,"1","Custom Cakes, Chocolatiers & Shops, Desserts, Candy Stores, Food, Cooking Classes, Specialty Food, Arts & Crafts, Shopping, Cooking Schools, Education, Specialty Schools"
"1475",16630,"Cupsie Daisy","Kent","OH","44240",41.1536674,-81.3578859,"1","Restaurants, Desserts, Cupcakes, Vegan, Food"
"1476",81045,"Peace Love and Little Donuts of Peters Township","Canonsburg","PA","15317",40.2624223,-80.1359685,"1","Bakeries, Donuts, Food, Desserts"
"1477",61230,"Pâtisserie de Gascogne","Westmount","QC","H3Z 1G6",45.4795076,-73.6032908,"0","Desserts, Food"
"1478",127358,"The Well","Toronto","ON","M6J 2Z4",43.6467114104,-79.4196724864,"0","Restaurants, Bars, Food, Coffee & Tea, Beer, Wine & Spirits, Desserts, Nightlife, Cafes"
"1479",141805,"Evalion Ice-Cream & Exotic Desserts","Markham","ON","L3R 0Y5",43.8261994,-79.3063174,"0","Coffee & Tea, Ice Cream & Frozen Yogurt, Food, Desserts"
"1480",50931,"Rawlicious","Toronto","ON","M6S 1M8",43.6522588,-79.4722672,"0","Food, Restaurants, Live/Raw Food, Vegan, Desserts, Vegetarian"
"1481",188227,"Rita's Italian Ice","Charlotte","NC","28205",35.220861,-80.810139,"1","Ice Cream & Frozen Yogurt, Shaved Ice, Desserts, Food"
"1482",113569,"Gigi's Cupcakes of Charlotte","Charlotte","NC","28210",35.1480241,-80.8333234,"1","Desserts, Bakeries, Food, Cupcakes"
"1483",134824,"Auntie Anne's","Toronto","ON","M6H 1K8",43.6567224756,-79.436125,"0","Desserts, Bakeries, Food, Restaurants, Fast Food, Pretzels"
"1484",97511,"Classic Cakes And Confections","Phoenix","AZ","85028",33.58462,-112.011927,"0","Bakeries, Desserts, Specialty Food, Chocolatiers & Shops, Food"
"1485",126191,"Dessert Specialists","Charlotte","NC","28262",35.3305218,-80.7078191,"1","Food, Desserts"
"1486",100088,"Popeyes Louisiana Kitchen","Rock Hill","SC","29732",34.9699412,-80.9928488,"1","American (Traditional), Food, Seafood, Fast Food, Chicken Wings, Restaurants, Sandwiches, Desserts"
"1487",137400,"Chatime","Brampton","ON","L6T 4P9",43.7068032,-79.7347682,"1","Desserts, Food, Bubble Tea"
"1488",157939,"Cook Out","Charlotte","NC","28210",35.0915732,-80.8691066,"1","Restaurants, Desserts, Food, Fast Food, American (Traditional), Hot Dogs, Burgers"
"1489",115408,"Cafe 8","Mesa","AZ","85206",33.3920951,-111.7181478,"1","Desserts, Gluten-Free, Breakfast & Brunch, Restaurants, Food, Sandwiches, Vegetarian, Mediterranean, Vegan"
"1490",107704,"Fenik's Frozen Custard","Avon Lake","OH","44012",41.48328,-82.019745,"1","Food, Desserts, Ice Cream & Frozen Yogurt"
"1491",183049,"Lavazza Espression","Toronto","ON","M5J 2Y6",43.6391846597,-79.3824890256,"1","Desserts, Food, Coffee & Tea, Ice Cream & Frozen Yogurt"
"1492",50760,"Baskin-Robbins","Las Vegas","NV","89131",36.2810681,-115.2613934,"1","Ice Cream & Frozen Yogurt, Desserts, Custom Cakes, Food"
"1493",143193,"Emporio: A Meatball Joint","Pittsburgh","PA","15222",40.443966,-79.9964184,"1","Nightlife, Italian, Food, Bars, Desserts, American (New), Gluten-Free, Restaurants"
"1494",33373,"Calories","Westmount","QC","H3Z 3C9",45.4872666,-73.5866792,"0","Bakeries, Food, Desserts, Cafes, Restaurants"
"1495",24799,"Braddah's Island Style","Las Vegas","NV","89113",36.0552046,-115.2509345,"0","Mexican, Asian Fusion, Food, Restaurants, Hawaiian, Desserts, Fast Food"
"1496",81189,"Menchie's Frozen Yogurt","Charlotte","NC","28203",35.2025235,-80.8450227,"1","Ice Cream & Frozen Yogurt, Food, Desserts"
"1497",88477,"Berlingo","Calgary","AB","T2S 0J3",51.0322726,-114.0705024,"1","Chocolatiers & Shops, Food, Specialty Food, Ice Cream & Frozen Yogurt, Desserts"
"1498",115755,"Presotea","Montréal","QC","H2Z 1B9",45.507852,-73.560001,"1","Taiwanese, Bubble Tea, Desserts, Food, Restaurants"
"1499",12373,"Zoyo Frozen Yogurt -Ahwatukee","Phoenix","AZ","85048",33.304759,-111.97768,"1","Food, Do-It-Yourself Food, Desserts, Gelato, Ice Cream & Frozen Yogurt"
"1500",93542,"Oxygen Restaurant & Lounge","Toronto","ON","M2N 2Z8",43.7619966,-79.4086976,"0","Desserts, Lounges, Food, Restaurants, Bars, Mediterranean, Nightlife"
"1501",166549,"ADONIS","Brossard","QC","J4Y 0G4",45.4507002,-73.4408137,"1","Grocery, Food, Pizza, Desserts, Restaurants"
"1502",10671,"Kekou Gelato House","Toronto","ON","M5T 1L1",43.6559827,-79.3926865,"1","Ice Cream & Frozen Yogurt, Food, Desserts, Cafes, Restaurants"
"1503",138669,"OMG! it's Yogurt","Toronto","ON","M5C 2C5",43.6506232,-79.3764788,"0","Food, Desserts, Ice Cream & Frozen Yogurt"
"1504",151472,"The Place","Toronto","ON","M5E 1M1",43.6478686,-79.3738152,"1","Food, Shopping, Coffee & Tea, Desserts, Flowers & Gifts, Patisserie/Cake Shop"
"1505",69820,"The Buttercream Bake Shoppe","Calgary","AB","T2T 0A7",51.037657,-114.085132,"0","Desserts, Food, Bakeries"
"1506",177427,"Rita's Italian Ice","Charlotte","NC","28277",35.0234585511,-80.8486682194,"1","Ice Cream & Frozen Yogurt, Shaved Ice, Food, Desserts"
"1507",125876,"The Coffee Bean & Tea Leaf","Las Vegas","NV","89119",36.0847396851,-115.1510772705,"1","Food, Bagels, Desserts, Coffee & Tea"
"1508",55448,"Gigi's Cupcakes of Scottsdale","Scottsdale","AZ","85260",33.6302281,-111.8878353,"0","Cupcakes, Custom Cakes, Bakeries, Desserts, Food"
"1509",152436,"Stephano's Greek & Mediterranean Grill","Las Vegas","NV","89119",36.1049744,-115.1359993,"1","Desserts, Bars, Mediterranean, Middle Eastern, Greek, Restaurants, Nightlife, Hookah Bars, Food, Beer, Wine & Spirits"
"1510",23668,"Grandma Campbell's Fresh Bake","Cleveland","OH","44113",41.4846863,-81.7030619,"0","Desserts, Bakeries, Food"
"1511",40651,"Ben & Jerry's","Las Vegas","NV","89109",36.1209539,-115.1721151,"1","Food, Ice Cream & Frozen Yogurt, Desserts"
"1512",55005,"Mr. Hero","Cleveland","OH","44107",41.4805418,-81.7694315,"1","Desserts, Sandwiches, Delis, Food, Restaurants"
"1513",155825,"Itea Boba & Dessert","Las Vegas","NV","89119",36.1157001611,-115.1352533428,"1","Desserts, Tea Rooms, Food, Coffee & Tea, Bubble Tea"
"1514",73892,"Sweet House Dessert","Markham","ON","L3R 9X3",43.8417462664,-79.321657531,"1","Desserts, Food, Asian Fusion, Restaurants"
"1515",146814,"Broadway Cheesecake","Laval","QC","H7V 4C2",45.5574513,-73.7443317,"0","Restaurants, Desserts, Food, Sandwiches, Bakeries"
"1516",56076,"Starbucks","Las Vegas","NV","89158",36.10815,-115.1749,"1","Nightlife, Coffee & Tea, Coffeeshops, Desserts, Food"
