"","business_id","name","city","state","postal_code","latitude","longitude","is_open","categories"
"679",47983,"Scala's Italian Ice","Phoenix","AZ","85032",33.641795,-111.994984,"0","Ice Cream & Frozen Yogurt, Desserts, Food"
"680",62068,"Coffee Zona","Phoenix","AZ","85014",33.5133606072,-112.0652211397,"1","Restaurants, Shopping, Food, Coffee & Tea, Cafes, Bakeries, Vinyl Records, Books, Mags, Music & Video, Breakfast & Brunch, Patisserie/Cake Shop, Desserts"
"681",32531,"Dufflet Pastries","Toronto","ON","M4P 2J5",43.7156889,-79.400567,"1","Food, Bakeries, Desserts"
"682",67354,"Nothing Bundt Cakes","Huntersville","NC","28078",35.4437386,-80.8787251,"1","Desserts, Cupcakes, Bakeries, Food"
"683",10871,"Cracker Barrel Old Country Store","Phoenix","AZ","85027",33.6817121,-112.114006,"1","Comfort Food, Event Planning & Services, American (Traditional), Caterers, Salad, Grocery, Breakfast & Brunch, Desserts, Food, Restaurants, Southern"
"684",32971,"Dessert Kitchen","Markham","ON","L3R 8X6",43.8534767,-79.3369524,"1","Food, Restaurants, Canadian (New), Chinese, Asian Fusion, Desserts"
"685",132675,"Fiiz Drinks","Mesa","AZ","85205",33.415794,-111.7405755,"1","Specialty Food, Food, Cupcakes, Popcorn Shops, Desserts"
"686",72650,"Popcorn Girl","Las Vegas","NV","89117",36.159875,-115.278848,"1","Desserts, Food, Specialty Food, Popcorn Shops"
"687",24579,"Cocoa Locale","Montréal","QC","H2V 4E7",45.5184059,-73.5926199,"1","Bakeries, Desserts, Specialty Food, Chocolatiers & Shops, Food"
"688",83123,"Blueberry Hill Family Restaurant ","Las Vegas","NV","89103",36.1149483,-115.2075811,"1","Salad, Bars, Nightlife, Food, Bakeries, Desserts, American (Traditional), American (New), Restaurants, Breakfast & Brunch"
"689",93368,"Red Mango","Las Vegas","NV","89169",36.125037,-115.135656,"1","Food, Juice Bars & Smoothies, Desserts, Ice Cream & Frozen Yogurt"
"690",61417,"Because Baked Goods","Scottsdale","AZ","85257",33.468955398,-111.9104301693,"1","Cupcakes, Bakeries, Food, Food Delivery Services, Desserts"
"691",69153,"Yofee Coffee","Richmond Hill","ON","L4C 9Y2",43.8853629,-79.4667547,"0","Food, Bakeries, Coffee & Tea, Desserts"
"692",63402,"Zoyo Neighborhood Yogurt","Phoenix","AZ","85020",33.5379772777,-112.0569678508,"1","Ice Cream & Frozen Yogurt, Food, Desserts"
"693",54610,"Rawlicious","Markham","ON","L3P 1Y1",43.878174,-79.2611265,"1","Desserts, American (New), Vegetarian, Vegan, Restaurants, Juice Bars & Smoothies, Food, Live/Raw Food"
"694",111189,"Gluuteny Bakery","Pittsburgh","PA","15217",40.4351892,-79.9226113,"1","Vegan, Bakeries, Food, Gluten-Free, Restaurants, Desserts"
"695",116965,"San Francisco Chocolate Factory","Scottsdale","AZ","85254",33.611891,-111.961031,"0","Food, Desserts"
"696",137862,"Gullifty's Restaurant","Pittsburgh","PA","15217",40.435293,-79.923154,"0","American (New), Food, Desserts, Restaurants"
"697",185062,"Life is Sweet","Toronto","ON","M4E 1G9",43.6738003,-79.2826983,"0","Food, Bakeries, Desserts"
"698",157616,"I Do! Wedding Cakes","Toronto","ON","M6B 4J3",43.7019117,-79.4528109,"1","Food, Desserts"
"699",157666,"Chuchote Thai Bistro & Desserts","Las Vegas","NV","89102",36.1440225,-115.195896,"1","Thai, Beer, Wine & Spirits, Food, Desserts, Restaurants, Comfort Food"
"700",15469,"Blizz Frozen Yogurt - Bally's Hotel & Casino","Las Vegas","NV","89109",36.1143218567,-115.1708662882,"1","Juice Bars & Smoothies, Food, Ice Cream & Frozen Yogurt, Desserts, Creperies, Restaurants"
"701",135816,"My Mother's Restaurant","Phoenix","AZ","85015",33.496074,-112.1003113,"1","Desserts, Restaurants, Barbeque, Sandwiches, Food, Pizza"
"702",131793,"Bar Cocoa","Charlotte","NC","28202",35.2261709,-80.84149,"1","Specialty Food, Desserts, Chocolatiers & Shops, Restaurants, Breakfast & Brunch, Food"
"703",141541,"Chocolate Shoppe Ice Cream","Middleton","WI","53562",43.1053100891,-89.5101417974,"1","Desserts, Ice Cream & Frozen Yogurt, Food"
"704",2146,"Z'Tejas Southwestern Grill","Phoenix","AZ","85028",33.5834449,-111.9770187,"1","Nightlife, Bars, Salad, Food, Restaurants, Mexican, Tex-Mex, Desserts"
"705",1880,"Bubblemania Cafe","Calgary","AB","T2E 1K3",51.066584,-114.053856,"1","Asian Fusion, Chicken Wings, Food, Cafes, Chinese, Desserts, Juice Bars & Smoothies, Restaurants"
"706",76092,"Wicked Bakery","Phoenix","AZ","85037",33.6216076,-112.0310202,"0","Food, Desserts, Bakeries, Restaurants, Coffee & Tea"
"707",184397,"Pascal's Patisserie - Take & Bake French Pastries","Calgary","AB","T2H 1J1",51.0073917,-114.0609309,"0","Breakfast & Brunch, Food, Restaurants, Desserts, Do-It-Yourself Food, Bakeries, Specialty Food"
"708",145549,"Wild Wing","Thornhill","ON","L3T 2S2",43.8322629551,-79.4054093666,"1","Food, Chicken Wings, Hot Dogs, Restaurants, Desserts"
"709",13434,"Sweet Tooth Rolled Ice Cream","Calgary","AB","T2G 1H3",51.0376304,-114.0630496,"1","Desserts, Ice Cream & Frozen Yogurt, Food"
"710",113976,"Tom's Dairy Freeze","Etobicoke","ON","M8Y 1K5",43.6278936,-79.4965981,"1","Desserts, Restaurants, Fast Food, Food, Burgers, Ice Cream & Frozen Yogurt"
"711",85859,"Waffle Bar @ Venitian","Las Vegas","NV","89109",36.1223999,-115.1703345,"0","Desserts, Waffles, Restaurants, Food, Breakfast & Brunch"
"712",109671,"Cococo Chocolaterie Bernard Callebaut","Calgary","AB","T2G 5L1",51.040201,-114.0614356,"1","Desserts, Specialty Food, Food, Chocolatiers & Shops"
"713",102866,"Soup Du Jour","Gibsonia","PA","15101",40.5942955229,-79.9698965803,"1","Soup, Specialty Food, Grocery, Event Planning & Services, Cafes, Coffee & Tea, Food, Caterers, Desserts, Restaurants"
"714",93179,"Rita's","Las Vegas","NV","89118",36.0904881,-115.2433104,"0","Food, Shaved Ice, Ice Cream & Frozen Yogurt, Desserts"
"715",53671,"Cold Stone Creamery","Las Vegas","NV","89117",36.1469882062,-115.2994772733,"1","Ice Cream & Frozen Yogurt, Custom Cakes, Food, Cupcakes, Restaurants, Desserts"
"716",191575,"Le Pain Quotidien","Toronto","ON","M4W 3Y8",43.671967,-79.3879187,"0","Breakfast & Brunch, Food, Restaurants, Belgian, Desserts"
"717",69965,"Menchie's Frozen Yogurt - Chandler Gateway","Chandler","AZ","85226",33.3066543,-111.8987314,"1","Food, Ice Cream & Frozen Yogurt, Desserts"
"718",30582,"Cookies by Design","North Olmsted","OH","44070",41.5032926,-81.5012444,"1","Shopping, Flowers & Gifts, Food, Desserts, Specialty Food, Bakeries"
"719",146931,"La Islena Market","Las Vegas","NV","89108",36.2038436838,-115.2432589178,"1","Fruits & Veggies, Specialty Food, Food, Butcher, Meat Shops, Grocery, Desserts"
"720",142792,"Halo-Halo Kitchen","Phoenix","AZ","85051",33.56674,-112.1359928,"1","Nightlife, Karaoke, Filipino, Desserts, Restaurants, Food, Ice Cream & Frozen Yogurt, Asian Fusion"
"721",66519,"Dough Bakeshop","Toronto","ON","M4K 1N2",43.6764344,-79.3566296,"1","Desserts, Gluten-Free, Restaurants, Bagels, Bakeries, Ice Cream & Frozen Yogurt, Food"
"722",148348,"Rita's Italian Ice","Glendale","AZ","85308",33.6521011727,-112.233681745,"1","Shaved Ice, Desserts, Food, Ice Cream & Frozen Yogurt"
"723",66174,"Swirl It Self Serve Froyo","Chandler","AZ","85224",33.3191497,-111.8740975,"0","Food, Ice Cream & Frozen Yogurt, Do-It-Yourself Food, Desserts"
"724",32746,"Muru Crêpe","Montréal","QC","H2Y 1C7",45.5099721,-73.5524526,"1","Food, Restaurants, Creperies, Breakfast & Brunch, Coffee & Tea, French, Desserts"
"725",190818,"Birch Bistro","Toronto","ON","M4S 2M9",43.7045219,-79.3883282,"1","Desserts, Bistros, Restaurants, French, Food, Patisserie/Cake Shop"
"726",21236,"Big City Dogs","Charlotte","NC","28262",35.320054,-80.740913,"0","Hot Dogs, Food, Fast Food, Specialty Food, Restaurants, Desserts"
"727",181406,"Yo Love Frozen Yogurt","Chandler","AZ","85286",33.2776001867,-111.8743173304,"1","Food, Desserts, Ice Cream & Frozen Yogurt"
"728",2589,"La Piñata","Phoenix","AZ","85013",33.5173987,-112.0820793,"1","Desserts, Bars, Nightlife, Mexican, Food, Restaurants"
"729",181941,"Mama's Coffee House","Pineville","NC","28134",35.0894822,-80.8963429,"0","Beer, Wine & Spirits, Desserts, Coffee & Tea, Restaurants, Food, Cafes"
"730",43027,"Torched Goodness","Scottsdale","AZ","85254",33.615544,-111.954623,"0","Street Vendors, Food Trucks, Local Flavor, Desserts, Food"
"731",42479,"Starbucks","Las Vegas","NV","89109",36.10201,-115.17023,"1","Coffeeshops, Nightlife, Food, Desserts, Coffee & Tea"
"732",144981,"Foxxy Lady's Let's Party Cupcakes","Las Vegas","NV","89120",36.0535633,-115.1089806,"0","Desserts, Restaurants, Street Vendors, Food, Food Stands, Bakeries"
"733",172576,"Novel Ice Cream","Phoenix","AZ","85007",33.4554224747,-112.0866099,"1","Food, Ice Cream & Frozen Yogurt, Desserts, Donuts"
"734",161203,"Les Délices de l'Érable","Montréal","QC","H2Y 1G6",45.5062751,-73.5531172,"1","Food, Specialty Food, Restaurants, Desserts, Cafes"
"735",154556,"Greg's Ice Cream","Toronto","ON","M5A 3C4",43.6501816073,-79.3602697368,"1","Desserts, Food, Ice Cream & Frozen Yogurt"
"736",150117,"Iana Bakery","Mississauga","ON","L4Z 2V4",43.615992,-79.6405114,"0","Bakeries, Desserts, Food, Coffee & Tea, Restaurants, Italian"
"737",140679,"Double Ming Chinese Dessert","Scarborough","ON","M1S 4T5",43.804083,-79.288352,"1","Food, Desserts, Restaurants, Chinese"
"738",99147,"Tizzerts","Charlotte","NC","28217",35.1900264,-80.8871971,"1","Bakeries, Cupcakes, Food, Desserts"
"739",162366,"Premium Sweets","Mississauga","ON","L5S 1R6",43.6667031364,-79.6843831372,"1","Restaurants, Bangladeshi, Food, Desserts"
"740",181543,"Chocolats Geneviève Grandbois","Montréal","QC","H4C 2G3",45.4795202,-73.5769653,"1","Chocolatiers & Shops, Desserts, Food, Specialty Food"
"741",126706,"Studio B Buffet","Henderson","NV","89044",35.9650723,-115.1679801,"1","Restaurants, Seafood, Desserts, Specialty Food, Food, Buffets"
"742",14784,"Piece of Cake Desserts","Mesa","AZ","85205",33.4155853,-111.7489151,"0","Food, Bakeries, Desserts"
"743",91899,"Caffe Di Portici","Toronto","ON","M5R 1E9",43.6726242,-79.3885437,"1","Desserts, Pizza, Restaurants, Coffee & Tea, Food, Italian, Cafes"
"744",125276,"Tropical Fruit N'Ice Raspados","Phoenix","AZ","85008",33.4667851,-112.0125656,"1","Mexican, Desserts, Food, Restaurants, Shaved Ice"
"745",109079,"No. 37 Sandwich Bar","Leeds","XWY","LS6 4EP",45.456999,-73.59525,"1","Bakeries, Food, Desserts, Restaurants, Sandwiches"
"746",8563,"Home","Toronto","ON","M6H 3S5",43.6589628,-79.4398479,"1","Food, Desserts, Cafes, Bakeries, Restaurants"
"747",33344,"Simple Simon Pies","Calgary","AB","T2H 1C3",50.985765,-114.0512,"1","Desserts, Specialty Food, Food, Bakeries"
"748",112344,"Tutti Frutti","Toronto","ON","M5B 1L2",43.6612184,-79.382814,"1","Food, Candy Stores, Desserts, Specialty Food"
"749",153698,"Bourbon & Bones","Scottsdale","AZ","85251",33.4970073,-111.9264107,"1","Food, Steakhouses, Desserts, Nightlife, American (New), Restaurants, Bars, Beer, Wine & Spirits"
"750",171314,"Pâtisserie Petit Lapin","Westmount","QC","H3Z 2M8",45.4780115,-73.6015144,"1","Desserts, Event Planning & Services, Food, Caterers, Bakeries"
"751",102506,"Gelato 64","Gilbert","AZ","85296",33.3419429,-111.7213885,"1","Ice Cream & Frozen Yogurt, Gelato, Desserts, Food, Event Planning & Services, Caterers"
"752",174849,"Cleveland Mofongo Latin Grill","Cleveland","OH","44111",41.4617422,-81.7683554,"1","Food, Latin American, Caribbean, Restaurants, Desserts"
"753",86117,"Aberdeen Delicatessen","Toronto","ON","M1V 4A1",43.8039202,-79.2863821,"1","Desserts, Restaurants, Food, Chinese"
"754",155996,"Pearlee & Cille's Bagel Cafe","Belmont","NC","28012",35.2454935,-81.0373572,"1","Food, Desserts, Donuts, Bagels, Coffee & Tea, Kids Activities, Ice Cream & Frozen Yogurt, Active Life"
"755",92541,"Pretty Girls Maid Cafe","Las Vegas","NV","89102",36.1263392,-115.1983146,"0","Food, Restaurants, Japanese, Desserts, Asian Fusion, Bubble Tea"
"756",31970,"Carson Kitchen","Las Vegas","NV","89101",36.1678783157,-115.1406404749,"1","Bars, Restaurants, Nightlife, Cocktail Bars, American (New), Seafood, Gastropubs, Food, Comfort Food, Salad, Tapas/Small Plates, Burgers, Desserts, Vegan"
"757",16349,"Millie Creperie","Toronto","ON","M5T 1L8",43.6549488111,-79.3996712565,"1","Desserts, Food, Creperies, Restaurants, Japanese"
"758",140290,"Schlotzsky's","Phoenix","AZ","85023",33.6405614,-112.0918742,"1","Bakeries, Fast Food, Food, Desserts, Restaurants, Pizza, Sandwiches, Delis, Cafes"
"759",110393,"Zoyo Frozen Yogurt - Mesa","Mesa","AZ","85203",33.4375232,-111.7886214,"1","Ice Cream & Frozen Yogurt, Restaurants, Food, Do-It-Yourself Food, Desserts"
"760",40222,"Let Them Eat Cake","Phoenix","AZ","85018",33.4797974,-111.9787718,"0","Desserts, Bakeries, Food, Bridal, Shopping"
"761",156901,"Patisserie La Legende","Montréal","QC","H2Z 1K1",45.507348,-73.560264,"0","Desserts, Food, Chinese, Restaurants, Bakeries"
"762",46328,"Waffelato","Las Vegas","NV","89101",36.1679308157,-115.1380770635,"1","Food, Restaurants, Ice Cream & Frozen Yogurt, Waffles, Desserts, Juice Bars & Smoothies, Gelato"
"763",130175,"Piccolina Gelato E Altra Roba","Toronto","ON","M5V 2M9",43.6441594,-79.3998093,"1","Food, Desserts"
"764",54074,"Exotique Glace","Markham","ON","L3R 2G5",43.8794429,-79.2611614,"0","Food, Ice Cream & Frozen Yogurt, Desserts"
"765",96449,"Coppeneur Chocolatier","Calgary","AB","T2P 1B4",51.0454011,-114.0635263,"0","Desserts, Chocolatiers & Shops, Food, Specialty Food"
"766",159788,"Loren's Vegas Delights","Las Vegas","NV","89119",36.071028,-115.1319412,"1","Desserts, Food, Bakeries, Event Planning & Services, Caterers"
"767",84577,"Rita's Italian Ice","Wexford","PA","15090",40.6048668,-80.0504144,"1","Shaved Ice, Desserts, Food, Ice Cream & Frozen Yogurt"
"768",112574,"Ellie's","University Heights","OH","44118",41.5011766,-81.5182261,"1","Bakeries, Coffee & Tea, Kosher, Food, Desserts, Ice Cream & Frozen Yogurt, Restaurants, Waffles, Juice Bars & Smoothies"
"769",184459,"Beignet Babe","Chandler","AZ","85225",33.3091946,-111.8210866,"1","Restaurants, Food Stands, Desserts, French, Street Vendors, Food, Farmers Market"
"770",64930,"Cococo Chocolaterie Bernard Callebaut","Calgary","AB","T2T 0A1",51.03771,-114.0816657,"1","Desserts, Food, Shopping, Specialty Food, Chocolatiers & Shops"
"771",177768,"Friendz Catering","Las Vegas","NV","89102",36.1462673,-115.1829873,"1","Event Planning & Services, Food Delivery Services, Food, Desserts, Caterers"
"772",176259,"ZenQ","Markham","ON","L3R 1J5",43.8567815,-79.3039721,"1","Food, Desserts"
"773",94174,"Café Olimpico","Montréal","QC","H2T 2L1",45.524085405,-73.6002284288,"1","Coffee & Tea, Desserts, Restaurants, Food, Ice Cream & Frozen Yogurt, Cafes"
"774",53479,"Sprinkles Cupcakes","Scottsdale","AZ","85251",33.5026855808,-111.9259310887,"1","Cupcakes, Desserts, Bakeries, Food"
"775",161554,"Butter Avenue","Toronto","ON","M5V 2A9",43.6483455547,-79.3977569285,"1","Specialty Food, Coffee & Tea, Food, Bakeries, Macarons, Desserts"
"776",175760,"Fast Eddie's Diner","Phoenix","AZ","85051",33.5388426,-112.1326376,"0","Food, American (Traditional), Restaurants, Desserts, Diners, Burgers"
"777",176120,"Sierra Bonita Grill","Phoenix","AZ","85014",33.5377757,-112.0645671,"1","Restaurants, Desserts, Gluten-Free, Bars, Nightlife, Event Planning & Services, Venues & Event Spaces, Food, Mexican, Burgers, American (Traditional)"
"778",82484,"Beyond Decadence","Huntersville","NC","28078",35.410694,-80.8428504,"1","Cupcakes, Desserts, Food, Patisserie/Cake Shop, Bakeries, Caterers, Event Planning & Services"
"779",82326,"Fiiz Drinks","Henderson","NV","89052",36.0016682,-115.1043302,"1","Desserts, Food, Internet Cafes, Specialty Food, Popcorn Shops"
"780",39598,"Perfect Blend Bakery & Espresso Bar","Toronto","ON","M9N 1W8",43.7012959056,-79.5201511235,"1","Food, Restaurants, Bakeries, Creperies, Desserts, Coffee & Tea, Cafes"
"781",125750,"Sugar N Spice Cafe","Toronto","ON","M6A 2T5",43.7208066,-79.4562054,"0","Cafes, Restaurants, Food, Desserts"
"782",189562,"Bite Me Breads & Cookies","Surprise","AZ","85374",33.6399115,-112.3040376,"0","Desserts, Food, Bakeries"
"783",26168,"Symposium Cafe Restaurant & Lounge","Thornhill","ON","L3T 2C6",43.827252,-79.426972,"1","Food, Bars, Cafes, Coffee & Tea, Desserts, Lounges, American (Traditional), Restaurants, Breakfast & Brunch, Nightlife, Brazilian"
"784",121871,"8 Below Ice Cream","Mentor","OH","44060",41.659182,-81.368236,"1","Ice Cream & Frozen Yogurt, Food, Desserts, Thai, Restaurants"
"785",80502,"U Green T","Montréal","QC","H3A 1T5",45.501023,-73.573092,"0","Desserts, Coffee & Tea, Food, Ice Cream & Frozen Yogurt"
"786",8472,"Smile Lao Thai","Tempe","AZ","85282",33.4059958,-111.9258616,"0","Restaurants, Laotian, Food, Thai, Desserts"
"787",30447,"Simple Gourmet","Pittsburgh","PA","15221",40.4179157,-79.8485663,"0","Restaurants, Sandwiches, Food, American (New), Desserts"
"788",104362,"Simply Sweet Cupcakes, Cookies & More","Fairview Park","OH","44126",41.44031,-81.867691,"0","Food, Desserts, Restaurants, Bakeries, Food Stands"
"789",96200,"Yogoberri","Toronto","ON","M2M 3W6",43.7905111,-79.4187394,"0","Korean, Ice Cream & Frozen Yogurt, Bakeries, Desserts, Restaurants, Food"
"790",83027,"Tropical Sno","Glendale","AZ","85304",33.5966160583,-112.2004659523,"1","Desserts, Food"
"791",11359,"Prima Pizza & Cafe","Las Vegas","NV","89139",36.0484864,-115.2243463,"0","Chicken Wings, Desserts, Pizza, Restaurants, Italian, Food"
"792",165493,"Meli Baklava & Chocolate","Scarborough","ON","M1P 4S8",43.7697986,-79.2803428,"0","Chocolatiers & Shops, Food, Bakeries, Desserts, Specialty Food"
"793",21624,"FroYozen","Cornelius","NC","28031",35.4801783,-80.8566764,"1","Ice Cream & Frozen Yogurt, Food, Desserts, Gelato"
"794",99674,"Rita's Ice","Toronto","ON","M5T 2V8",43.657072,-79.403318,"0","Food, Desserts, Ice Cream & Frozen Yogurt"
"795",183022,"Pâtisserie Wawel","Montréal","QC","H2X 2V4",45.514102,-73.5731879,"0","Desserts, French, Food, Breakfast & Brunch, Bakeries, Sandwiches, Restaurants"
"796",134399,"The Coffee Bean & Tea Leaf","Scottsdale","AZ","85254",33.6341299,-111.9243289,"1","Food, Desserts, Coffee & Tea"
"797",9586,"CherryBerry Yogurt Bar","Charlotte","NC","28204",35.2128207,-80.8358973,"0","Food, Ice Cream & Frozen Yogurt, Desserts"
"798",56952,"Custom Created Cakes By Brandi","Chandler","AZ","85224",33.3260297,-111.8747445,"1","Food, Desserts, Custom Cakes, Cupcakes, Bakeries"
"799",84978,"Villa Madina","Toronto","ON","M6H 4A9",43.6546747067,-79.4351534838,"1","Food, Restaurants, Middle Eastern, Desserts, Sandwiches"
"800",57247,"O Gelato","Gilbert","AZ","85296",33.3346675,-111.7844293,"1","Food, Gelato, Desserts"
"801",17774,"The Sweet Shoppe & Nut House","Tempe","AZ","85281",33.4226005021,-111.94028534,"0","Pretzels, Specialty Food, Ice Cream & Frozen Yogurt, Chocolatiers & Shops, Desserts, Gelato, Candy Stores, Food"
"802",94919,"The Gabardine","Toronto","ON","M5H 2W9",43.6509626,-79.3814224,"1","Restaurants, American (New), Food, Desserts, Canadian (New), Breakfast & Brunch, Diners"
"803",124087,"Bloom Bindery","Middleton","WI","53562",43.0957765,-89.5117714,"1","Bakeries, Bookstores, Shopping, Food, Coffee & Tea, Desserts, Books, Mags, Music & Video"
"804",132296,"Sunterra Market","Calgary","AB","T2G 0Z7",51.0415326,-114.0605592,"1","Restaurants, Lounges, Food, Nightlife, Beer, Wine & Spirits, Delis, Desserts, Bars, Grocery"
"805",177079,"FruitLand Las Vegas","Las Vegas","NV","89123",36.0525864119,-115.1692427769,"1","Restaurants, Desserts, Specialty Food, Food, Farmers Market, Fruits & Veggies, Gluten-Free, Health Markets, Grocery"
"806",158382,"ChillSpot by SasaSweets","Las Vegas","NV","89101",36.1675261791,-115.1384350285,"0","Shaved Ice, Food, Ice Cream & Frozen Yogurt, Desserts"
"807",148926,"Lather and Shave","North Las Vegas","NV","89084",36.286771,-115.176118,"0","Desserts, Shaved Ice, Food Trucks, Food"
"808",132514,"Better Bit of Butter Cookies","Lyndhurst","OH","44124",41.5199459,-81.4866536,"0","Desserts, Bakeries, Food"
"809",18646,"Dirt Dog - Las Vegas Strip","Las Vegas","NV","89109",36.113791,-115.171633,"1","Hot Dogs, Restaurants, Street Vendors, Desserts, Food"
"810",14098,"Rita's Italian Ice","Cuyahoga Falls","OH","44223",41.1386102,-81.5090409,"0","Food, Ice Cream & Frozen Yogurt, Shaved Ice, Desserts"
"811",90627,"Nielsen’s Frozen Custard","Las Vegas","NV","89123",36.0171469,-115.1171168,"1","Food, Ice Cream & Frozen Yogurt, Gelato, Desserts"
"812",142879,"Snowbowl","Richmond Hill","ON","L4C 1V7",43.8643271,-79.434961,"0","Food, Desserts, Coffee & Tea"
"813",117208,"U-Swirl","Scottsdale","AZ","85253",33.5289115,-111.925864,"0","Ice Cream & Frozen Yogurt, Desserts, Food"
"814",21610,"Bluekiwi","Hudson","OH","44236",41.240972,-81.440866,"0","Food, Ice Cream & Frozen Yogurt, Desserts"
"815",170269,"M For Macaron","Calgary","AB","T2H",50.9849921,-114.0717091,"0","Food Stands, Restaurants, Food, Desserts"
"816",88070,"Orange Leaf Frozen Yogurt","Gates Mills","OH","44040",41.5389277,-81.4382222,"0","Desserts, Ice Cream & Frozen Yogurt, Food, Do-It-Yourself Food"
"817",34818,"Zeppe's Pizzeria","Mentor","OH","44060",41.670138,-81.339511,"1","Desserts, Restaurants, Chicken Wings, Italian, Event Planning & Services, Pizza, Caterers, Food"
"818",54976,"Yo Fresco Frozen Yogurt","Las Vegas","NV","89107",36.1725319,-115.197258,"0","Desserts, Food, Ice Cream & Frozen Yogurt"
"819",4925,"Trattoria D'Amico","Phoenix","AZ","85044",33.3321869,-111.979151,"1","Restaurants, Event Planning & Services, Italian, Bars, Nightlife, American (New), Wine Bars, Caterers, Desserts, Food"
"820",135619,"Oscar's Qcos Mexican Restaurant","Middleton","WI","53562",43.1037525039,-89.4930547848,"0","Mexican, Food, Restaurants, Desserts"
"821",55191,"Mirabelle Fine Pastries","Urbana","IL","61801",40.1124479,-88.2084132,"0","Desserts, Food, Restaurants, Bakeries"
"822",86004,"Beaver Tails","Toronto","ON","M6K 3C3",43.6330599,-79.4225567,"1","Desserts, Restaurants, Food, Food Stands"
"823",35708,"Cicis","Las Vegas","NV","89108",36.2151476891,-115.24276793,"1","Desserts, Restaurants, Buffets, Pizza, American (Traditional), Food, Italian"
"824",133420,"Sugary Swirls","Toronto","ON","M5R 3G8",43.6728084,-79.4141944,"0","Food, Coffee & Tea, Bakeries, Desserts"
"825",77768,"Frangipane Patisserie","Toronto","ON","M5R 2S6",43.6749646,-79.405548,"0","Food, Desserts"
"826",9592,"Sugar Marmalade","Vaughan","ON","L4K 5Y6",43.8280793141,-79.537005746,"1","Desserts, Food, Chinese, Restaurants, Taiwanese"
"827",1335,"Punjabi Tadka","Brampton","ON","L6R",43.7645426989,-79.749285295,"1","Indian, Food Delivery Services, Ethnic Food, Food, Restaurants, Specialty Food, Desserts"
"828",189027,"Mario's Bake Shop","Nobleton","ON","L0G 1N0",43.9086951,-79.6528731,"0","Bakeries, Caterers, Event Planning & Services, Food, Desserts"
"829",62215,"Lindt Chocolate Shop - Scarborough","Scarborough","ON","M1B 2W4",43.811346,-79.244061,"1","Specialty Food, Shopping, Wholesale Stores, Candy Stores, Chocolatiers & Shops, Desserts, Food"
"830",25542,"Bruxie","Las Vegas","NV","89109",36.103262,-115.174101,"1","Desserts, Food, Breakfast & Brunch, Waffles, Sandwiches, Restaurants"
"831",5167,"Bolo Cakery","Calgary","AB","T3A 2G8",51.104048,-114.1653804,"1","Custom Cakes, Bakeries, Desserts, Food"
"832",33652,"Tea Lounge","Las Vegas","NV","89158",36.1062048737,-115.1743502972,"1","Tea Rooms, Coffee & Tea, Tapas Bars, Restaurants, Food, Desserts"
"833",68124,"QC Tea Bar","Charlotte","NC","28273",35.1524177302,-80.9511873047,"1","Bubble Tea, Desserts, Coffee & Tea, Juice Bars & Smoothies, Food"
"834",20856,"Yogurt Time","Chandler","AZ","85224",33.3191497,-111.8740975,"0","Ice Cream & Frozen Yogurt, Bubble Tea, Food, Desserts, Restaurants"
"835",109583,"Bakery Gateau","Vaughan","ON","L4J 1V7",43.7989185,-79.4213717,"1","Restaurants, Bakeries, Food, Desserts, Korean"
"836",19529,"The Tempered Room","Toronto","ON","M6K 1L7",43.641465,-79.433149,"1","Restaurants, Desserts, French, Bakeries, Food, Cafes"
"837",17328,"Spot Crepes & Tea","Toronto","ON","M5T 2G6",43.6564001433,-79.399150704,"1","Cafes, Specialty Food, Juice Bars & Smoothies, Asian Fusion, Food, Coffee & Tea, Creperies, Restaurants, Ethnic Food, Desserts"
"838",26913,"Lemon Falls","Chagrin Falls","OH","44022",41.4319934,-81.3927167,"1","Desserts, Food, Breakfast & Brunch, American (New), Restaurants, Sandwiches"
"839",133774,"Modern Donut","Las Vegas","NV","89144",36.1780112,-115.3133908,"0","Donuts, Bakeries, Flowers & Gifts, Comfort Food, Food, Desserts, Shopping, Restaurants, Food Delivery Services"
"840",88132,"Bouche Bakery","Lakewood","OH","44107",41.4833253,-81.7709198,"1","Bakeries, Desserts, Gluten-Free, Restaurants, Food"
"841",133286,"Pfannkuchen Köln","Toronto","ON","M4N 2N4",43.7313035986,-79.4036535899,"0","Desserts, Sandwiches, Coffee & Tea, Creperies, Specialty Food, Food, German, French, Restaurants"
"842",69662,"Miss Hickory's Tea Room","Strongsville","OH","44136",41.3114320696,-81.8014888465,"1","Tea Rooms, Sandwiches, Food, Restaurants, Desserts"
"843",166294,"Luna Gelateria","Scottsdale","AZ","85253",33.5670464,-111.9254673,"1","Food, Desserts, Ice Cream & Frozen Yogurt, Gelato"
"844",138210,"Mamie Clafoutis","Outremont","QC","H2V 1K7",45.5215942,-73.6141033,"1","Restaurants, Sandwiches, Desserts, Coffee & Tea, Food, Bakeries"
"845",155634,"Cupkates","Las Vegas","NV","89101",36.1679035,-115.138142,"0","Desserts, Cupcakes, Food"
"846",13102,"Gagan Sweets","Vaughan","ON","L4K 5Y6",43.828134,-79.538466,"1","Food, Restaurants, Indian, Desserts, Vegetarian"
"847",186153,"Kensington Natural Bakery","Toronto","ON","M5S 1X8",43.66565,-79.4092064,"1","Bakeries, Desserts, Vegetarian, Food, Restaurants, Health Markets, Shopping, Specialty Food"
"848",74887,"Creamistry","Phoenix","AZ","85018",33.4941043,-111.988346,"1","Food, Ice Cream & Frozen Yogurt, Desserts"
