"","business_id","name","city","state","postal_code","latitude","longitude","is_open","categories"
"1854",41719,"Honey Bee Bakery","Madison","WI","53703",43.0833196,-89.3724769,"1","Desserts, Bakeries, Food, Farmers Market, Custom Cakes"
"1855",41552,"Ice Scroll Cafe & Creamery","Las Vegas","NV","89148",36.056157,-115.2813044,"0","Food, Coffee & Tea, Bakeries, Ice Cream & Frozen Yogurt, Desserts, Bubble Tea"
"1856",186385,"Renaissance Patisserie","Charlotte","NC","28211",35.1561632,-80.8309453,"1","Food, Bakeries, Restaurants, Desserts, French"
"1857",188800,"Ethel M Chocolate","Henderson","NV","89014",36.0738472,-115.072077,"1","Gift Shops, Shopping, Specialty Food, Arts & Entertainment, Desserts, Food, Tasting Classes, Botanical Gardens, Flowers & Gifts, Education, Local Flavor, Chocolatiers & Shops"
"1858",123193,"Grind Burger","Highland Heights","OH","44143",41.5389782,-81.4783134,"0","Food, Desserts, American (New), Restaurants, Burgers, Bars, Lounges, Beer, Wine & Spirits, Nightlife"
"1859",7742,"Iceburgh's Bistro","Irwin","PA","15642",40.3318413,-79.7097723,"1","Food, Desserts, Wraps, Restaurants, Salad, Pizza"
"1860",84205,"Persis Biryani Indian Grill","Charlotte","NC","28277",35.0561027527,-80.8541183472,"0","Desserts, Restaurants, Salad, Food, Indian"
"1861",158630,"PiesAnna","Verdun","QC","H4H 1K4",45.4538036,-73.5721551,"0","Party & Event Planning, Event Planning & Services, Fast Food, Restaurants, Desserts, Food, Bakeries"
"1862",142641,"Menchie's Frozen Yoghurt","Dollard-des-Ormeaux","QC","H9G 1X2",45.4721773374,-73.8322427957,"1","Food, Ice Cream & Frozen Yogurt, Restaurants, Desserts"
"1863",168617,"Nothing Bundt Cakes","Upper St. Clair","PA","15241",40.3473383437,-80.0584258405,"1","Food, Cupcakes, Bakeries, Desserts"
"1864",41461,"Pâtisserie Du Soleil","Calgary","AB","T2W 4N4",50.9402385,-114.1198679,"1","Restaurants, Desserts, Food, Breakfast & Brunch, Sandwiches, Bakeries, Caterers, French, Event Planning & Services"
"1865",165172,"IHOP","Charlotte","NC","28217",35.1795,-80.88411,"1","American (Traditional), Sandwiches, Burgers, Restaurants, American (New), Desserts, Breakfast & Brunch, Food"
"1866",126779,"Bombay Grille","Charlotte","NC","28226",35.0890517,-80.867053,"1","Indian, Salad, Restaurants, Desserts, Seafood, Food"
"1867",151916,"Lee's Sandwiches","Peoria","AZ","85381",33.6090048,-112.2208106,"1","Coffee & Tea, Restaurants, Food, Desserts, Vietnamese, Juice Bars & Smoothies, Sandwiches, Breakfast & Brunch, Asian Fusion, Fast Food"
"1868",124207,"Dessert de Taiwan","Montréal","QC","H2Z 1C1",45.5074403,-73.5604525,"1","Food, Desserts"
"1869",114523,"Swiss Chalet Rotisserie & Grill","Scarborough","ON","M1P 4P5",43.778664,-79.25701,"1","Desserts, Restaurants, Food, Canadian (New), Sandwiches, American (New)"
"1870",76799,"La Diperie","Toronto","ON","M4K 1P1",43.6776306925,-79.3520714472,"1","Desserts, Food, Ice Cream & Frozen Yogurt"
"1871",176314,"CobblerWorld","Pittsburgh","PA","15222",40.4448733,-79.994473,"1","Bakeries, Breakfast & Brunch, Desserts, Food, Restaurants"
"1872",144007,"Cookies by Design","Las Vegas","NV","89103",36.1166433961,-115.2096911116,"1","Flowers & Gifts, Shopping, Desserts, Bakeries, Food"
"1873",142920,"Coffee Culture","Ajax","ON","L1S 7L7",43.8428148586,-79.0213188529,"1","Coffee & Tea, Desserts, Food"
"1874",60282,"Sunny SnoBalls","Chandler","AZ","85225",33.2931634,-111.8249526,"1","Shaved Ice, Desserts, Food, Ice Cream & Frozen Yogurt"
"1875",12442,"Cupz","Las Vegas","NV","89178",36.020846,-115.277262,"0","Restaurants, Mediterranean, Coffee & Tea, Food, American (New), Desserts"
"1876",81787,"Bahama Buck's","Mesa","AZ","85209",33.3749476,-111.6870796,"1","Coffee & Tea, Food, Ice Cream & Frozen Yogurt, Shaved Ice, Juice Bars & Smoothies, Desserts"
"1877",137661,"My Favorite Sweet Shoppe","Bridgeville","PA","15017",40.3826179,-80.0951259,"1","Candy Stores, Specialty Food, Gelato, Chocolatiers & Shops, Desserts, Cupcakes, Food"
"1878",167500,"Gigi's Cupcakes of Phoenix","Phoenix","AZ","85018",33.5090311,-111.99631,"0","Desserts, Cupcakes, Food, Bakeries"
"1879",171740,"Rita's Italian Ice","Pittsburgh","PA","15238",40.4882642,-79.8797105,"1","Shaved Ice, Desserts, Ice Cream & Frozen Yogurt, Food"
"1880",51261,"Marouf Tochal","Toronto","ON","M2N 2N1",43.7745489,-79.4144613,"1","Desserts, Food"
"1881",59751,"Rashmi's Bakery","Mississauga","ON","L5C 1T7",43.578896,-79.6490702,"1","Desserts, Food, Bakeries"
"1882",27437,"Octave","Montréal","QC","H2L 3M2",45.521568,-73.5664314,"1","Bakeries, Food, Coffee & Tea, Desserts"
"1883",179991,"Charlotte's Homemade Goodies","Mississauga","ON","L4Z 3E4",43.6288349439,-79.667045268,"1","Sandwiches, Bakeries, Restaurants, Food, Desserts, Soup"
"1884",163757,"The Coffee Tree Roasters","Pittsburgh","PA","15216",40.3886253,-80.0495267,"1","Desserts, Restaurants, Bakeries, Cafes, Coffee Roasteries, Food, Coffee & Tea"
"1885",144613,"Mrs Field & Pretzelmaker","Toronto","ON","M5B 2L7",43.6537079631,-79.3810494647,"1","Desserts, Food"
"1886",51269,"Snow Time","Toronto","ON","M1V 4W8",43.8062607389,-79.2892820566,"1","Shaved Snow, Korean, Food, Restaurants, Desserts, Ice Cream & Frozen Yogurt"
"1887",107204,"San Pietro","Montréal","QC","H2E 1T8",45.5491421,-73.6057307,"1","Food, Pizza, Bakeries, Desserts, Restaurants"
"1888",131285,"Gong Cha","Toronto","ON","M4Y 1Z2",43.66556,-79.3845599,"1","Desserts, Food, Coffee & Tea, Bubble Tea"
"1889",108140,"Mixers Ice Cream & Boba","Las Vegas","NV","89118",36.086412,-115.2438272,"1","Coffee & Tea, Food, Juice Bars & Smoothies, Bubble Tea, Ice Cream & Frozen Yogurt, Gelato, Desserts"
"1890",53858,"Dairy Queen","Henderson","NV","89015",36.0411283,-114.9786554,"1","Fast Food, Ice Cream & Frozen Yogurt, Restaurants, Desserts, Food"
"1891",154232,"Raspados House","Phoenix","AZ","85040",33.3924467,-112.0653938,"1","Food, Ice Cream & Frozen Yogurt, Desserts"
"1892",139006,"Corner Mercantile","Pittsburgh","PA","15222",40.4404928,-80.0003042,"1","Breakfast & Brunch, Bakeries, Convenience Stores, Delis, Food, Desserts, Restaurants"
"1893",130503,"Dean & DeLuca","Charlotte","NC","28210",35.1460114,-80.8252838,"0","Candy Stores, Delis, Desserts, Bakeries, Chocolatiers & Shops, Beer, Wine & Spirits, Restaurants, Coffee & Tea, Specialty Food, Grocery, Cheese Shops, Food"
"1894",27854,"Thrifty Ice Cream","Las Vegas","NV","89122",36.1111032763,-115.0641670078,"1","Restaurants, Food, Desserts, Ice Cream & Frozen Yogurt, American (New)"
"1895",75415,"Pâtisserie","Verdun","QC","H4G 1W3",45.4609433605,-73.5674142838,"1","Bakeries, Desserts, Food"
"1896",112806,"Zwirl","Phoenix","AZ","85044",33.317289,-111.9777108,"0","Food, Desserts, Ice Cream & Frozen Yogurt"
"1897",190834,"Film Cafe by Eative","Toronto","ON","M5T 2L6",43.655074,-79.4024461,"1","Breakfast & Brunch, Asian Fusion, Beer Bar, Nightlife, Bars, Juice Bars & Smoothies, Food, Coffee & Tea, Specialty Food, Ice Cream & Frozen Yogurt, Comfort Food, Japanese, Restaurants, Desserts, Cafes"
"1898",33711,"Starbucks","Las Vegas","NV","89119",36.093274,-115.175986,"1","Food, Coffeeshops, Desserts, Coffee & Tea, Nightlife, Restaurants"
"1899",192134,"Yojié Japanese Fondue","Las Vegas","NV","89117",36.1454693,-115.30089,"1","Restaurants, Fondue, Food, Japanese, Specialty Food, Hot Pot, Desserts, Asian Fusion"
"1900",46312,"Demetris Pizza","Calgary","AB","T2N 3R5",51.0528046,-114.1052022,"1","Food, Pizza, Desserts, Salad, Restaurants"
"1901",160695,"Frosty Roll","Toronto","ON","M5T 2L9",43.6569169,-79.4031663,"0","Desserts, Ice Cream & Frozen Yogurt, Food"
"1902",191195,"Jean Philippe Patisserie","Las Vegas","NV","89109",36.1119459216,-115.1768767834,"0","Desserts, Food, Coffee & Tea, Restaurants, Cafes"
"1903",154524,"Chill Out Gelato Cafe","Phoenix","AZ","85073",33.4588994,-112.0662616,"0","Desserts, Ice Cream & Frozen Yogurt, Food"
"1904",23427,"Honeymoon Sweets","Tempe","AZ","85282",33.3934436,-111.9482615,"1","Bakeries, Restaurants, Food, Coffee & Tea, Patisserie/Cake Shop, Custom Cakes, Desserts"
"1905",160593,"The Golden Apple Confectionery","Toronto","ON","M6K 3P6",43.653226,-79.3831843,"0","Specialty Food, Event Planning & Services, Candy Stores, Desserts, Caterers, Chocolatiers & Shops, Food"
"1906",83246,"Sugar Rush Cakes","Montréal","QC","H3B 1X8",45.5002465,-73.5680941,"1","Bakeries, Food, Desserts, Custom Cakes, Event Planning & Services, Caterers"
"1907",51249,"Lick It Gelato","Toronto","ON","M5J",43.6393159275,-79.3849030137,"1","Food, Coffee & Tea, Food Delivery Services, Desserts, Ice Cream & Frozen Yogurt"
"1908",66355,"The Crepe Club","Gilbert","AZ","85295",33.311104877,-111.7414915567,"0","Breakfast & Brunch, Food, Gelato, Desserts, Creperies, Restaurants"
"1909",130025,"Levetto","Thornhill","ON","L4J 0C1",43.8363758794,-79.4808229668,"1","Beer, Wine & Spirits, Food, Italian, Salad, Desserts, Pizza, Restaurants"
"1910",152092,"Switchin' Kitchens","Charlotte","NC","28277",35.0394091,-80.79371,"1","Food, Vegetarian, Restaurants, American (Traditional), Desserts"
"1911",4880,"Pelican's Snoballs","Charlotte","NC","28273",35.12826,-80.8762,"1","Food, Desserts, Shaved Ice"
"1912",81567,"CCs Sweet Potato Pies","Charlotte","NC","28216",35.3202223,-80.8875861,"0","Restaurants, American (Traditional), Desserts, Cheesesteaks, Food"
"1913",103657,"Snack Bar","Las Vegas","NV","89119",36.1079183842,-115.1364018447,"0","Mexican, Sandwiches, Food, Juice Bars & Smoothies, Desserts, Hot Dogs, Restaurants, Cafes, Ice Cream & Frozen Yogurt"
"1914",131606,"Peace Treats","Toronto","ON","M6J 2Z6",43.6471969,-79.4196377,"1","Desserts, Food, Ice Cream & Frozen Yogurt, Donuts, Coffee & Tea"
"1915",129094,"Caldense & Bakery","Toronto","ON","M6S 2S6",43.6655422,-79.4886508,"1","Coffee & Tea, Food, Desserts, Bakeries"
"1916",55403,"Zeppe's Tavern & Pizzeria","Newbury","OH","44065",41.4638981,-81.2421874,"1","Chicken Wings, Desserts, Gastropubs, Nightlife, Restaurants, Pizza, Italian, Wraps, Caterers, Event Planning & Services, Food, Burgers, Bars"
"1917",134605,"Madison Sourdough Patisserie","Madison","WI","53703",43.0800604,-89.3694798,"0","Cafes, Ice Cream & Frozen Yogurt, Desserts, Food, Restaurants"
"1918",144823,"I Deal Coffee","Toronto","ON","M4L 1E9",43.6658792,-79.3189651,"0","Desserts, Food, Coffee & Tea"
"1919",190684,"Ambrosi's Pizza","Mayfield Heights","OH","44124",41.5196463,-81.4718332,"0","Restaurants, Desserts, Chicken Wings, Pizza, Food"
"1920",98180,"Haagen Dazs Shop","Phoenix","AZ","85016",33.5103980241,-112.0278909802,"0","Juice Bars & Smoothies, Food, Ice Cream & Frozen Yogurt, Desserts"
"1921",35586,"St Phillips Fine Bakeries","Woodbridge","ON","L4L 2V5",43.81864,-79.602766,"1","Italian, Bakeries, Food, Coffee & Tea, Restaurants, Desserts"
"1922",51492,"Moji Japanese Eatery","Markham","ON","L3R 9W5",43.860138283,-79.3033482627,"1","Ramen, Sushi Bars, Seafood, Restaurants, Japanese, Ice Cream & Frozen Yogurt, Desserts, Food, Asian Fusion"
"1923",11154,"0109 Dessert & Chocolate","Toronto","ON","M1V 0B3",43.8144936,-79.2949245,"1","Desserts, Cafes, Food, Specialty Food, Restaurants, Chocolatiers & Shops"
"1924",35400,"Roll Avenue - Ice Cream Rolls","Tempe","AZ","85281",33.4224419234,-111.9249733796,"1","Food, Desserts, Ice Cream & Frozen Yogurt"
"1925",170978,"Balkan Bakery","Phoenix","AZ","85022",33.6411185,-112.0473308,"0","Bakeries, Ethnic Food, Food, Desserts, Specialty Food"
"1926",55726,"Ben & Jerry's","Charlotte","NC","28209",35.171873,-80.849032,"1","Food, Ice Cream & Frozen Yogurt, Desserts"
"1927",145713,"Cast Iron Waffles","Charlotte","NC","28210",35.1522668638,-80.8402774677,"0","Food, Breakfast & Brunch, Coffee & Tea, Desserts, Belgian, Restaurants"
"1928",188205,"Eureka Chocolates and Gifts","Pittsburgh","PA","15232",40.4511817,-79.9344636,"1","Coffee & Tea, Shopping, Arts & Crafts, Chocolatiers & Shops, Desserts, Flowers & Gifts, Candy Stores, Specialty Food, Cards & Stationery, Event Planning & Services, Food"
"1929",1101,"La Crémière","Montréal","QC","H2X 1K5",45.510496,-73.563095,"0","Food, Desserts, Ice Cream & Frozen Yogurt"
"1930",54962,"Cookies by Design","Mcfarland","WI","53558",43.0182916,-89.2989893,"1","Shopping, Bakeries, Cupcakes, Gift Shops, Desserts, Flowers & Gifts, Food"
"1931",17905,"Tango Cafe","Pittsburgh","PA","15217",40.4296328,-79.9231618,"0","Restaurants, Food, Desserts, Latin American, Coffee & Tea, Sandwiches"
"1932",80405,"Petite Thuet","Toronto","ON","M4W 2L9",43.6803146,-79.3910249,"1","Specialty Food, Bakeries, Desserts, Restaurants, French, Food"
"1933",29857,"Insomnia Cookies","Madison","WI","53703",43.0749862362,-89.3929550797,"1","Desserts, Food, Bakeries"
"1934",158929,"Booster Juice","Toronto","ON","M5J 1E6",43.6453166,-79.3804073,"1","Food, Desserts, Juice Bars & Smoothies"
"1935",126922,"The Cake & Cookie Spot","Pittsburgh","PA","15217",40.4333704,-79.923237,"0","Food, Desserts, Bakeries"
"1936",166218,"Vaigai","Glendale","AZ","85308",33.6368740353,-112.183147673,"1","Restaurants, Food, Seafood, Indian, Buffets, Desserts"
"1937",62958,"Cicis","Charlotte","NC","28273",35.1190101589,-80.9574144334,"1","Restaurants, Pizza, Food, Chicken Wings, American (Traditional), Desserts"
"1938",184900,"Krispy Kreme","Mesa","AZ","85202",33.4152664996,-111.8741107379,"1","Bakeries, Food, Coffee & Tea, Breakfast & Brunch, Restaurants, Donuts, Desserts"
"1939",168081,"Max Brenner","Las Vegas","NV","89109",36.1191259407,-115.1772566948,"0","Desserts, American (New), Chocolatiers & Shops, Food, Breakfast & Brunch, Bars, Restaurants, Nightlife, Specialty Food, Coffee & Tea"
"1940",34972,"Rosen's Cinnamon Buns","Toronto","ON","M6G 1C9",43.6543345,-79.4222314,"1","Food, Patisserie/Cake Shop, Bakeries, Desserts"
"1941",153480,"It's the Icing On the Cake","Toronto","ON","M4L 1C3",43.6636477,-79.3298035,"1","Desserts, Food"
"1942",83994,"Menchie's","Calgary","AB","T2E 7P4",51.1096790738,-114.0414522844,"1","Food, Do-It-Yourself Food, Desserts, Ice Cream & Frozen Yogurt"
"1943",42977,"Williams Coffee Pub","Toronto","ON","M9W 5L7",43.7289981,-79.6082171,"0","Bakeries, Coffee & Tea, Desserts, Food"
"1944",127736,"Lokuras","Las Vegas","NV","89103",36.122741,-115.208699,"1","Ice Cream & Frozen Yogurt, Food, New Mexican Cuisine, Desserts, Shaved Ice, Restaurants, Mexican"
"1945",150519,"Cupcrazed Cakery","Fort Mill","SC","29708",35.0286149,-80.9675499,"1","Bakeries, Custom Cakes, Aquariums, Cupcakes, Food, Desserts, Active Life"
"1946",138152,"Burrachos Fresh Mexican Grill","Sun Prairie","WI","53590",43.1864694,-89.2667417,"1","Food, Salad, Desserts, Mexican, Restaurants"
"1947",130722,"Bomba Tacos & Rum","Akron","OH","44333",41.1342696794,-81.6382378712,"1","Restaurants, Desserts, Bars, Food, Nightlife, Latin American"
"1948",125400,"Bar Laitier Blanche Neige","Longueuil","QC","J4T 2W1",45.4890732,-73.4640431,"1","Ice Cream & Frozen Yogurt, Food, Desserts"
"1949",12914,"Java Boba","Peoria","AZ","85345",33.5534183337,-112.2700040295,"1","Coffee & Tea, Food, Juice Bars & Smoothies, Desserts"
"1950",111885,"Agave Blue Frozen Yogurt","Goodyear","AZ","85395",33.4654749,-112.3556386,"0","Desserts, Ice Cream & Frozen Yogurt, Food"
"1951",58644,"Haute Cakes Gourmet Baking","Scottsdale","AZ","85257",33.468848,-111.910516,"0","Custom Cakes, Bakeries, Desserts, Cupcakes, Food"
"1952",181285,"Orange Leaf Frozen Yogurt","Verona","WI","53593",42.9938374523,-89.5210370015,"1","Ice Cream & Frozen Yogurt, Food, Desserts, Do-It-Yourself Food"
"1953",27357,"Banh Mi & Che Cali","Toronto","ON","M5T 2E7",43.6536791,-79.3984583,"0","Desserts, Vietnamese, Sandwiches, Food, Restaurants"
"1954",93413,"Go For Tea","Toronto","ON","M1V",43.8147868018,-79.2926247804,"1","Chinese, Coffee & Tea, Tea Rooms, Desserts, Restaurants, Food"
"1955",91131,"Simple Simon Pies","Calgary","AB","T2T 0A3",51.0383482577,-114.0765974298,"1","Restaurants, Bakeries, Food, Comfort Food, Specialty Food, Desserts"
"1956",96693,"Bliss & Co. Cupcakes & Desserts","Calgary","AB","T2P 4L2",51.0453246,-114.0581012,"1","Desserts, Food"
"1957",185154,"PappaRoti","Montréal","QC","H3B 1A2",45.5058432,-73.5671939,"0","Juice Bars & Smoothies, Desserts, Bakeries, Coffee & Tea, Food"
"1958",183353,"Twelve Cakes Bakery","Phoenix","AZ","85022",33.6263543,-112.0663899,"0","Desserts, Food, Cupcakes, Bakeries"
"1959",35569,"Les Glaceurs","Montreal","QC","H2Y 2V8",45.504812,-73.5559543,"1","Food, Desserts, Bakeries, Ice Cream & Frozen Yogurt"
"1960",96754,"Sheridan's Frozen Custard","Henderson","NV","89052",36.0015752,-115.1077968,"0","Desserts, Ice Cream & Frozen Yogurt, Food"
"1961",175686,"Nothing Bundt Cakes","Phoenix","AZ","85018",33.4957936857,-111.9892305583,"1","Desserts, Bakeries, Cupcakes, Food"
"1962",179822,"Antojitos Lindamar","Chandler","AZ","85225",33.3135908963,-111.8508688733,"1","Restaurants, Mexican, Desserts, Ice Cream & Frozen Yogurt, Food, Shaved Ice"
"1963",52500,"Waffle Taco","Phoenix","AZ","85019",33.5235933,-112.1350807,"1","Waffles, Ice Cream & Frozen Yogurt, Desserts, Restaurants, Food"
"1964",165679,"Menchie's Frozen Yogurt","Madison","WI","53719",43.0570896,-89.5092997,"0","Desserts, Ice Cream & Frozen Yogurt, Food"
"1965",41470,"Chez José","Montréal","QC","H2W 1H4",45.5187285,-73.5778979,"1","Desserts, Breakfast & Brunch, Sandwiches, Cafes, Portuguese, Food, Bakeries, Soul Food, Restaurants, Vegetarian, Vegan"
"1966",177558,"The Old Curiosity Tea Shop","Markham","ON","L3P 1X7",43.8773785,-79.2605103,"1","Food, Tea Rooms, Coffee & Tea, Desserts"
"1967",101254,"À la Folie","Montréal","QC","H2J 1X8",45.50361,-73.571405,"0","Desserts, Food, Bakeries"
"1968",191858,"Coffee Culture","Mississauga","ON","L5W 0E6",43.638155,-79.7156672,"1","Restaurants, Food, Breakfast & Brunch, Coffee & Tea, Desserts"
"1969",164490,"FruiteaO","Toronto","ON","M2M 2E4",43.7872946,-79.4171501,"0","Food, Desserts, Taiwanese, Tea Rooms, Restaurants, Juice Bars & Smoothies"
"1970",46896,"Le Macaron","Henderson","NV","89014",36.0673487,-115.0421293,"0","Food, Bakeries, Desserts"
"1971",166150,"Starbucks","Las Vegas","NV","89119",36.096102,-115.176483,"1","Coffee & Tea, Nightlife, Food, Coffeeshops, Desserts"
"1972",178184,"Manan Bakery","Las Vegas","NV","89103",36.1150513,-115.2365638,"1","Coffee & Tea, Restaurants, Food, Creperies, Cupcakes, Custom Cakes, Desserts, Bakeries"
"1973",144704,"Baskin-Robbins","Gilbert","AZ","85233",33.3770748833,-111.7889728708,"1","Ice Cream & Frozen Yogurt, Desserts, Food"
"1974",5305,"Soma Chocolatemaker","Toronto","ON","M5A 3C4",43.6507179,-79.3580246,"0","Desserts, Chocolatiers & Shops, Food, Specialty Food, Coffee & Tea"
"1975",139514,"Hardee's","Huntersville","NC","28078",35.4083094,-80.8550333,"1","Breakfast & Brunch, Food, Desserts, Burgers, Restaurants"
"1976",96335,"FIKA","Toronto","ON","M5T 2J9",43.6535844,-79.4004303,"1","Restaurants, Coffee & Tea, Sandwiches, Desserts, Food"
"1977",126770,"Pastries A-La-Carte","Pittsburgh","PA","15236",40.3393325563,-79.9615242464,"1","Desserts, Bakeries, Food"
"1978",158204,"Hammerhead Coffee","Champaign","IL","61820",40.1166758,-88.229763,"1","Coffee & Tea, Restaurants, Breakfast & Brunch, Desserts, Food"
"1979",148720,"Treehouse Bakery","Phoenix","AZ","85007",33.4462721,-112.0893682,"0","Specialty Food, Desserts, Vegan, Food, Restaurants, Bakeries"
"1980",43916,"Eatalie","Lachine","QC","H8T 2L7",45.4366938142,-73.7055408229,"1","Coffee & Tea, Bakeries, Restaurants, Italian, Food, Cafes, Sandwiches, Desserts"
"1981",135209,"Sugar Factory","Las Vegas","NV","89109",36.1092976932,-115.1719519123,"1","Shopping, Gift Shops, Candy Stores, Flowers & Gifts, Food, Chocolatiers & Shops, Ice Cream & Frozen Yogurt, Desserts, Specialty Food"
"1982",159519,"Cakes To You","Mentor","OH","44060",41.6539705,-81.3765309,"1","Cupcakes, Desserts, Food"
"1983",8044,"TCBY","Indian Land","SC","29707",34.956902512,-80.8543609073,"0","Desserts, Ice Cream & Frozen Yogurt, Food"
"1984",30894,"Notre-Boeuf-de-Grâce","Montréal","QC","H4A 1W8",45.4702569,-73.6157559,"1","Food, Breakfast & Brunch, Fast Food, Restaurants, Burgers, Desserts"
"1985",122117,"Sausalido","Pittsburgh","PA","15224",40.4624598,-79.9500828,"1","American (New), Desserts, Restaurants, Modern European, Caterers, Event Planning & Services, Food"
"1986",49953,"Qoola","Toronto","ON","M3J 1P3",43.7741348,-79.5036081,"1","Food, Do-It-Yourself Food, Desserts, Ice Cream & Frozen Yogurt"
"1987",69584,"Marios Pizza House","North Versailles","PA","15137",40.3715495,-79.8278578,"1","Chicken Wings, Food Stands, Food, Restaurants, Soup, Desserts, Salad, Gluten-Free, Pizza"
"1988",192171,"Rocky Mountain Chocolate Factory","Phoenix","AZ","85050",33.676354,-111.9736513,"0","Specialty Food, Food, Desserts, Chocolatiers & Shops, Candy Stores"
"1989",27731,"Caffe Demetre","Mississauga","ON","L5T 2Y3",43.6374814124,-79.6915986272,"1","Restaurants, Desserts, Ice Cream & Frozen Yogurt, Cafes, Creperies, Food"
"1990",60626,"Kabab Je Rotisserie and Grille","Charlotte","NC","28277",35.0611103,-80.817254,"1","Food, Salad, Vegetarian, Sandwiches, Mediterranean, Desserts, Restaurants, Middle Eastern"
"1991",168869,"Tutti Frutti","Calgary","AB","T2R 0S9",51.0381445,-114.0808321,"0","Ice Cream & Frozen Yogurt, Food, Desserts, Do-It-Yourself Food"
"1992",162560,"Rockefeller's","Cleveland Heights","OH","44118",41.5163216,-81.5688418,"0","Beer, Wine & Spirits, Nightlife, Lounges, Food, Desserts, Restaurants, Bars"
"1993",86994,"ZenQ","Mississauga","ON","L5B 0G4",43.585817447,-79.6467258409,"1","Restaurants, Desserts, Taiwanese, Bubble Tea, Coffee & Tea, Food"
"1994",172529,"Freddy's Frozen Custard & Steakburgers","Concord","NC","28025",35.4339043,-80.604135,"1","Restaurants, Ice Cream & Frozen Yogurt, Burgers, Food, Fast Food, Desserts"
"1995",92338,"Starbucks","Las Vegas","NV","89121",36.115125,-115.1181591,"1","Desserts, Coffee & Tea, Restaurants, Food, Sandwiches"
"1996",152667,"America Donuts","Las Vegas","NV","89109",36.1023786,-115.1745465,"1","Desserts, Food, Bakeries, Donuts"
"1997",181667,"Dessert Cafe Momo","Montréal","QC","H4A 1C7",45.4766661552,-73.6221967265,"1","Desserts, Coffee & Tea, Restaurants, Food, Cafes"
"1998",141428,"Swig n' Sweets","Gilbert","AZ","85297",33.2971976586,-111.7471590613,"1","Juice Bars & Smoothies, Desserts, Beverage Store, Food"
"1999",94736,"Mon Aimee Chocolat","Pittsburgh","PA","15222",40.4518096,-79.9831077,"1","Chocolatiers & Shops, Food, Desserts, Specialty Food, Flowers & Gifts, Shopping"
"2000",119485,"Scaddabush Italian Kitchen & Bar","Toronto","ON","M1P 2K2",43.7777285062,-79.2545693769,"1","Pizza, Nightlife, Food, Italian, Desserts, Restaurants, Bars"
"2001",36678,"The Cheesecake Factory","Madison","WI","53719",43.0571911,-89.5054669,"1","Restaurants, Desserts, American (Traditional), American (New), Seafood, Food, Salad"
"2002",104327,"Sweet Lee's","Verdun","QC","H4G 1V7",45.4625913,-73.5670182,"1","Bakeries, Desserts, Cafes, Restaurants, Comfort Food, Food"
"2003",52650,"Me and My Yogurt","North Las Vegas","NV","89031",36.2756199,-115.1448127909,"0","Desserts, Food, Ice Cream & Frozen Yogurt, Local Flavor, Do-It-Yourself Food, Shaved Ice"
"2004",126464,"Love Yogurt","Pittsburgh","PA","15203",40.428181,-79.975218,"0","Ice Cream & Frozen Yogurt, Desserts, Food"
"2005",127492,"Non Solo Pane","Dorval","QC","H9S 4M2",45.4408616,-73.7311225,"1","Restaurants, Food, Ice Cream & Frozen Yogurt, Desserts, Bakeries, Italian"
"2006",176604,"Fous Truck","Montréal","QC","H2J 1G2",45.5086699,-73.5539925,"1","Bakeries, Food Trucks, Desserts, Food"
"2007",59461,"Paletas Betty","Chandler","AZ","85225",33.3024838,-111.8424892,"1","Food, Ice Cream & Frozen Yogurt, Desserts"
"2008",46167,"Macaron Bar","Pittsburgh","PA","15237",40.5427765775,-80.0076448917,"1","Desserts, Food"
"2009",67325,"HK Sweets","North York","ON","M6A 2T2",43.7205888,-79.455741,"1","Bubble Tea, Hong Kong Style Cafe, Restaurants, Asian Fusion, Comfort Food, Desserts, Food"
"2010",114522,"The Lobster Trap","Vaughan","ON","L4L 0C1",43.7982384,-79.5481384,"1","Coffee & Tea, Food, Desserts, Seafood, Restaurants"
"2011",148870,"La Flor de Michoacan Ice Cream","North Las Vegas","NV","89030",36.207711,-115.108393,"1","Ice Cream & Frozen Yogurt, Desserts, Juice Bars & Smoothies, Food"
"2012",29299,"La Diperie","Montréal","QC","H4L 3M3",45.5136998,-73.681626,"1","Ice Cream & Frozen Yogurt, Desserts, Food"
"2013",29661,"Gigi's Cupcakes","Las Vegas","NV","89101",36.1716577,-115.1463616,"0","Desserts, Food"
"2014",38105,"Crème & Chocolats","Mesa","AZ","85204",33.3833756,-111.7570152,"1","Specialty Food, Chocolatiers & Shops, Restaurants, Desserts, Creperies, Food, Ice Cream & Frozen Yogurt"
"2015",95511,"Nuestros Famous Pizza & Wings","Peoria","AZ","85345",33.585613,-112.243924,"1","American (Traditional), Restaurants, Sandwiches, Italian, Pizza, Food, Desserts, Chicken Wings, Food Delivery Services"
"2016",152158,"Cold Stone Creamery","Scottsdale","AZ","85254",33.6239702021,-111.9283807615,"0","Food, Bakeries, Ice Cream & Frozen Yogurt, Juice Bars & Smoothies, Desserts"
"2017",15943,"Riverdale Perk Cafe","Toronto","ON","M4K 3C4",43.6712556,-79.3467092,"1","Sandwiches, Breakfast & Brunch, Desserts, Cafes, Food, Coffee & Tea, Restaurants"
"2018",186684,"Miss Cora's Kitchen","Toronto","ON","M5T 2K2",43.6544252,-79.4005439,"0","Bakeries, Restaurants, Sandwiches, Event Planning & Services, Food, Desserts, Caterers"
"2019",180505,"Petite Thuet","Toronto","ON","M5H 1A1",43.648715,-79.378109,"0","Coffee & Tea, Desserts, Food"
"2020",148489,"Dolce21 Dessert House","Markham","ON","L3R 0Y5",43.826067,-79.306218,"0","Desserts, Coffee & Tea, Ice Cream & Frozen Yogurt, Juice Bars & Smoothies, Food"
"2021",63919,"Cool Cakes and Pastries","Mississauga","ON","L5N",43.548269584,-79.5898286696,"1","Bakeries, Food, Desserts"
