"","business_id","name","city","state","postal_code","latitude","longitude","is_open","categories"
"784",175771,"Poke Bar","Charlotte","NC","28204",35.2098341,-80.8356164,"1","Asian Fusion, Hawaiian, Sushi Bars, Food, Restaurants, Poke"
"785",141336,"Oyshi Sushi","Las Vegas","NV","89139",36.047306,-115.244158,"1","Sushi Bars, American (New), Japanese, Restaurants"
"786",158172,"Pacific East Japanese Restaurant","Cleveland Heights","OH","44118",41.51154,-81.579857,"1","Sushi Bars, Restaurants, Malaysian, Japanese"
"787",82004,"Takamatsu's","Glendale","AZ","85307",33.5376736,-112.3578583,"0","Japanese, Restaurants, Korean, Sushi Bars"
"788",94115,"Oishi Sushi","Markham","ON","L3T 3C3",43.823539734,-79.4251480523,"1","Japanese, Restaurants, Sushi Bars"
"789",170637,"Table 45","Cleveland","OH","44106",41.5017377,-81.618879,"1","Lounges, Nightlife, Bars, American (New), Restaurants, Sushi Bars"
"790",101314,"New China Cuisine","North Las Vegas","NV","89031",36.2602484642,-115.1562764144,"1","Chinese, Japanese, Seafood, Salad, Sushi Bars, Food, Food Delivery Services, Restaurants"
"791",152168,"Liu Lius Asian Bistro","Fort Mill","SC","29708",35.0284881,-80.9673065,"0","Chinese, Sushi Bars, Restaurants"
"792",160329,"Fujo","Charlotte","NC","28202",35.2235104,-80.8441795,"1","Soup, Noodles, Sushi Bars, Asian Fusion, Restaurants"
"793",176002,"Sakana Sushi & Grill","Mesa","AZ","85206",33.3810074687,-111.68665063,"1","Japanese, Restaurants, Sushi Bars, Asian Fusion"
"794",76917,"Japango","Toronto","ON","M5G 1P5",43.655066,-79.385297,"1","Restaurants, Sushi Bars"
"795",82480,"Crispy Roll","Toronto","ON","M5V",43.6502379,-79.3892903,"0","Restaurants, Japanese, Sushi Bars"
"796",37396,"Tomo sushi","Mississauga","ON","L5C 3Y8",43.5683850711,-79.6652514832,"1","Sushi Bars, Japanese, Restaurants"
"797",89693,"Thai Basil","North Las Vegas","NV","89031",36.2623265,-115.1780313,"1","Chinese, Thai, Sushi Bars, Restaurants"
"798",67461,"Cece Sushi","Toronto","ON","M1T 3K2",43.7784777,-79.3089281,"0","Sushi Bars, Japanese, Restaurants"
"799",104730,"Kame Omakase","Las Vegas","NV","89128",36.1947692,-115.2524715,"1","Seafood, Japanese, Restaurants, Sushi Bars"
"800",81068,"Makimono","Toronto","ON","M9W 1J1",43.6909078983,-79.575564784,"1","Restaurants, Sushi Bars"
"801",182695,"How Do You Roll","Charlotte","NC","28202",35.225394,-80.84395,"0","Sushi Bars, Vegan, Food, Restaurants"
"802",77195,"Top Sushi","Toronto","ON","M5T 1P7",43.6588013,-79.3944347,"1","Food, Sushi Bars, Restaurants"
"803",609,"Hanabi Japanese Restaurant","Cleveland","OH","44113",41.4999177314,-81.6987037928,"1","Restaurants, Sushi Bars, Japanese"
"804",53739,"Kaikaki Japanese Restaurant","Toronto","ON","M2N 6J4",43.791884,-79.392358,"1","Japanese, Sushi Bars, Restaurants"
"805",155720,"Ohjah Japanese Steakhouse","Henderson","NV","89074",36.044715,-115.1008555,"1","Japanese, Restaurants, Sushi Bars, Steakhouses, Teppanyaki"
"806",93247,"Sushi Hour","Oakville","ON","L6H 0E9",43.4984959,-79.7069453,"1","Restaurants, Japanese, Sushi Bars"
"807",108993,"Senjyu Asian Fusion","Whitchurch-Stouffville","ON","L4A 1T2",43.9689424025,-79.2595766387,"0","Asian Fusion, Sushi Bars, Restaurants"
"808",136083,"Su&Shi","Mississauga","ON","L5B 2C9",43.592098,-79.639562,"1","Food Court, Asian Fusion, Sushi Bars, Restaurants"
"809",90691,"Sapporo Revolving Sushi","Las Vegas","NV","89102",36.1258702,-115.2045308,"1","Japanese, Restaurants, Sushi Bars, Seafood, Conveyor Belt Sushi"
"810",21951,"Xtreme Sushi & Sterling Steakhouse","Las Vegas","NV","89123",36.0261968,-115.1204704,"0","Japanese, Restaurants, Steakhouses, Sushi Bars"
"811",155817,"Orange Fish Sushi House","Mississauga","ON","L5H 3A1",43.5318042,-79.6127068,"1","Restaurants, Seafood, Sushi Bars"
"812",81351,"Mikasa Sushi Bar","Laval","QC","H7X 3E6",45.521997,-73.7930019,"1","Sushi Bars, Japanese, Restaurants"
"813",133932,"Yellowtail by Chef Akira Back","Las Vegas","NV","89109",36.1135089591,-115.1750483518,"1","Japanese, Steakhouses, Restaurants, Food, Beer, Wine & Spirits, Sushi Bars"
"814",126363,"Akita Sushi","Bradford","ON","L3Z 0G1",44.1087302409,-79.5865004271,"1","Japanese, Restaurants, Sushi Bars"
"815",141587,"Ho Su Bistro","Toronto","ON","M4P 2E6",43.7085199,-79.3989279,"0","Restaurants, Korean, Japanese, Sushi Bars"
"816",108535,"Sado Sushi","Toronto","ON","M6C 2E2",43.7192755,-79.3431482,"0","Sushi Bars, Restaurants"
"817",68090,"Sekushi Japanese Restaurant","Las Vegas","NV","89109",36.112803,-115.170581,"1","Restaurants, Sushi Bars, Tapas/Small Plates, Japanese"
"818",32958,"Natural Sushi Japanese Restaurant","Toronto","ON","M4Y 2B3",43.668287,-79.3861968,"0","Japanese, Sushi Bars, Restaurants"
"819",187991,"The Grand Blue","Scottsdale","AZ","85260",33.582229,-111.9232574,"0","Seafood, Specialty Food, Restaurants, Sushi Bars, Food, Seafood Markets"
"820",92083,"Akaihana Sushi & Grill","Phoenix","AZ","85021",33.5544667,-112.1110064,"1","Sushi Bars, Japanese, Restaurants"
"821",102372,"Sushi Yu Mi","Montréal","QC","H4A 1T1",45.47595,-73.60653,"1","Sushi Bars, Restaurants"
"822",82185,"Masa","Calgary","AB","T3H 4C7",51.0654398974,-114.2083103419,"1","Restaurants, Japanese, Sushi Bars"
"823",34139,"Maki Sushi","Thornhill","ON","L4J 0A7",43.8116260664,-79.4542529861,"0","Restaurants, Sushi Bars, Japanese"
"824",2242,"Shogun","Gastonia","NC","28054",35.2540313,-81.1785179,"1","Sushi Bars, Steakhouses, Restaurants, Japanese"
"825",42199,"Masako Plus Sushi","Saint-Jean-sur-Richelieu","QC","J3A 1M1",45.3295313,-73.2808181,"1","Restaurants, Sushi Bars"
"826",51371,"Gastonia Grill & Sushi Buffet","Gastonia","NC","28054",35.2606566,-81.1501218,"1","Sushi Bars, American (Traditional), Restaurants, Asian Fusion, Buffets"
"827",39246,"Y2 Cafe","Charlotte","NC","28211",35.176399,-80.802262,"0","Sushi Bars, Restaurants, Vegetarian"
"828",175703,"Karin","Montréal","QC","H3X 1T7",45.4829186,-73.6294696,"1","Japanese, Restaurants, Korean, Sushi Bars"
"829",101904,"Yonaka Modern Japanese","Las Vegas","NV","89103",36.114935,-115.209737,"0","Japanese, Tapas/Small Plates, American (New), Sushi Bars, Restaurants, Asian Fusion"
"830",70736,"Yamaza Sushi","Montréal","QC","H2Z 1J4",45.5080868264,-73.5597191019,"0","Asian Fusion, Sushi Bars, Restaurants"
"831",156662,"Asiana Fusion Sushi","Cornelius","NC","28031",35.4842111667,-80.8788418,"1","Restaurants, Sushi Bars, Noodles, Asian Fusion, Salad, Chinese, Japanese"
"832",157268,"The One Sushi","Calgary","AB","T2A 7X6",51.061385552,-113.9840321236,"1","Korean, Thai, Restaurants, Sushi Bars"
"833",150104,"Tsunami Asian Grill & Sushi Bar","Las Vegas","NV","89109",36.1214517,-115.1696112,"0","Sushi Bars, Japanese, Vietnamese, Korean, Chinese, Restaurants, Thai"
"834",122562,"Atami Sushi","Phoenix","AZ","85023",33.612328,-112.0992761,"0","Restaurants, Sushi Bars"
"835",81272,"Ramen Noodle","Las Vegas","NV","89129",36.2210742,-115.3285773,"1","Ramen, Sushi Bars, Restaurants, Noodles, Japanese"
"836",36995,"Hissho Sushi","Charlotte","NC","28273",35.1288204,-80.9770054,"1","Restaurants, Japanese, Sushi Bars"
"837",37297,"Nomé Izakaya","Toronto","ON","M3C 0E1",43.733535,-79.3452181,"1","Sushi Bars, Tapas Bars, Bars, Restaurants, Nightlife"
"838",121125,"Fusia","Las Vegas","NV","89136",36.229804,-115.072002,"0","Asian Fusion, Restaurants, Sushi Bars, Chinese"
"839",72035,"Ginza Sushi Restaurant","Woodbridge","ON","L4L 1A6",43.8067419076,-79.5509600155,"1","Sushi Bars, Restaurants, Japanese"
"840",154529,"Sushi Eye in Motion","Chandler","AZ","85225",33.3046323,-111.8420542,"0","Sushi Bars, Restaurants"
"841",112891,"Seoul BBQ & Sushi","Phoenix","AZ","85029",33.587091,-112.115786,"1","Korean, Restaurants, Sushi Bars, Barbeque"
"842",123979,"Gorilla Sushi","Las Vegas","NV","89119",36.0998776,-115.1269843,"1","Restaurants, Japanese, Asian Fusion, Sushi Bars"
"843",78903,"Moushi","Pointe-Claire","QC","H9G 1W9",45.4706152,-73.8316449,"1","Food, Sushi Bars, Poke, Acai Bowls, Restaurants"
"844",100455,"Sushi Shop Avenue du Parc","Montréal","QC","H2X 3P9",45.510319,-73.5750033,"1","Restaurants, Sushi Bars"
"845",86323,"The Grumpy Monk","Monroe","NC","28110",35.0201278,-80.5787262,"1","Restaurants, Bars, Pubs, American (New), Beer Bar, Nightlife, Sushi Bars"
"846",106911,"Watami Japanese Seafood Buffet & Grill","Parma","OH","44129",41.382427,-81.7398702,"0","Restaurants, Japanese, Seafood, Sushi Bars, Buffets"
"847",173184,"Osaka Japanese Bistro","Las Vegas","NV","89102",36.143962,-115.196995,"1","Restaurants, Sushi Bars, Japanese"
"848",4953,"Sushi Park","Mississauga","ON","L5K 1R8",43.527594,-79.6753349,"1","Sushi Bars, Restaurants"
"849",112618,"Miyako Sushi","Richmond Hill","ON","L4C 6E5",43.8487687,-79.4587283,"0","Japanese, Sushi Bars, Restaurants"
"850",62893,"Sushi Twister","Las Vegas","NV","89122",36.100622,-115.052917,"1","Restaurants, Japanese, Sushi Bars"
"851",114657,"Local Tavern","Painesville","OH","44077",41.7284579,-81.2564865,"1","Sushi Bars, Steakhouses, Breakfast & Brunch, Seafood, Restaurants, Burgers"
"852",189093,"Sushi Hiroyoshi Japanese Cuisine","Las Vegas","NV","89146",36.1599423,-115.2222337,"1","Restaurants, Seafood, Sushi Bars, Japanese"
"853",145044,"Kasa Moto","Toronto","ON","M5R 1B9",43.6705949,-79.3927837,"1","Restaurants, Japanese, Sushi Bars"
"854",88359,"D-lite's","Thornhill","ON","L4J 5K2",43.80458,-79.437904,"1","Kosher, Asian Fusion, Sushi Bars, Restaurants, Vegetarian"
"855",116900,"Tomo Japanese Cuisine","Goodyear","AZ","85395",33.463543,-112.341878,"1","Restaurants, Asian Fusion, Sushi Bars, Japanese"
"856",56864,"New Chinatown Buffet","Sheffield Village","OH","44035",41.419496,-82.0811004,"1","Buffets, Japanese, Restaurants, Sushi Bars, Chinese"
"857",104285,"Siracha Lounge","Chandler","AZ","85224",33.3021786,-111.8426724,"0","Japanese, Restaurants, Sushi Bars, Nightlife, Asian Fusion"
"858",15094,"Yuukai","Montréal","QC","H2V 4H1",45.52277,-73.604097,"0","Asian Fusion, Restaurants, Japanese, Sushi Bars"
"859",131826,"Kona Grill","Gilbert","AZ","85295",33.3078070226,-111.7422258859,"1","Asian Fusion, American (New), Restaurants, Sushi Bars"
"860",188319,"Yellow Tail Seafood Sushi Buffet Bar & Lounge","Akron","OH","44334",41.135894,-81.643931,"1","Sushi Bars, Restaurants, Japanese, Buffets"
"861",182604,"Sushi Zone","Toronto","ON","M4S 1Z7",43.7002165,-79.3971787,"1","Restaurants, Japanese, Sushi Bars"
"862",16091,"Restaurant Odaki","Montréal","QC","H3H 1M1",45.493037,-73.579658,"0","Restaurants, Buffets, Asian Fusion, Sushi Bars, Japanese"
"863",91340,"Sushi Bong","North York","ON","M2N 7A1",43.7748598,-79.4135222,"1","Restaurants, Sushi Bars, Japanese"
"864",22117,"Restaurant Soba","Montréal","QC","H4A 1T7",45.4750478,-73.6084148,"1","Sushi Bars, Seafood, Restaurants, Salad, Chinese"
"865",120086,"Tokyo","Moon","PA","15108",40.5212671,-80.2197775,"1","Teppanyaki, Sushi Bars, Japanese, Restaurants, Chinese"
"866",82031,"Temaki Sushi","Phoenix","AZ","85017",33.5257604,-112.1321251,"1","Restaurants, Sushi Bars"
"867",146237,"Akemi","Verdun","QC","H4G 2M5",45.4628842,-73.5688962,"1","Restaurants, Sushi Bars"
"868",5667,"Sushi Loco","Phoenix","AZ","85031",33.4945036,-112.1736666,"1","Restaurants, Sushi Bars, Mexican"
"869",185229,"Bonsa Sushi","Montréal","QC","H2J 2L6",45.5253028222,-73.5862414515,"1","Restaurants, Food, Sushi Bars"
"870",179577,"Samurai Japanese Steakhouse & Sushi","Henderson","NV","89014",36.063167,-115.037421,"1","Sushi Bars, Japanese, Restaurants, Steakhouses"
"871",143666,"McKnight Kitchen","Pittsburgh","PA","15237",40.5294531223,-80.0084148132,"1","Sushi Bars, Thai, Asian Fusion, Restaurants"
"872",887,"Sushi Now","Montréal","QC","H8N 1T7",45.428325,-73.629106,"1","Sushi Bars, Restaurants"
"873",36849,"Sushi Star","Huntersville","NC","28078",35.408682,-80.8630479,"1","Sushi Bars, Japanese, Restaurants"
"874",186916,"Bazara Asian Cuisine","Toronto","ON","M6J 2Z7",43.6484972,-79.4205958,"1","Sushi Bars, Asian Fusion, Restaurants"
"875",56335,"Muramoto Downtown","Madison","WI","53703",43.0747897,-89.3812071306,"1","Cocktail Bars, Nightlife, Bars, Restaurants, Asian Fusion, Sushi Bars"
"876",56285,"Osaka Japanese Bistro","Henderson","NV","89052",35.994116,-115.1004849,"1","Sushi Bars, Japanese, Restaurants"
"877",88902,"Just Japan","Etobicoke","ON","M8V 1K8",43.5972743509,-79.5214237004,"1","Restaurants, Japanese, Sushi Bars"
"878",4780,"168 Sushi Asian Buffet","Vaughan","ON","L4K 3B9",43.78738,-79.471494,"1","Buffets, Restaurants, Japanese, Sushi Bars, Chinese, Thai, Asian Fusion"
"879",49535,"Sushi Belle","Dollard-des-Ormeaux","QC","H9H 2A7",45.4874354268,-73.8478722936,"1","Restaurants, Caterers, Sushi Bars, Event Planning & Services"
"880",167486,"Sushi Factory","Henderson","NV","89052",35.9975649,-115.1025545,"0","Restaurants, Japanese, Sushi Bars"
"881",116666,"Sushi Date","Bolton","ON","L7E 1E8",43.8798484,-79.7375796,"1","Restaurants, Specialty Food, Sushi Bars, Food"
"882",73355,"SU&BU","Vaughan","ON","L4J 0B8",43.8160371,-79.4530377,"1","Sushi Bars, Restaurants"
"883",101207,"Omi Japanese Restaurant","Toronto","ON","M5A 2L2",43.6642408,-79.3681056,"0","Japanese, Restaurants, Sushi Bars"
"884",41934,"Chopsticks Express","Parma","OH","44129",41.3809254,-81.7460113,"1","Chinese, Restaurants, Japanese, Fast Food, Sushi Bars, Asian Fusion"
"885",85532,"The Villa","Whitby","ON","L1N 2N6",43.8768697,-78.9535278,"1","Japanese, Restaurants, Sushi Bars"
"886",48812,"Sushi Land","Montréal","QC","H2Y 1M6",45.50342,-73.558939,"1","Japanese, Seafood, Restaurants, Sushi Bars, Salad, Sandwiches"
"887",115176,"Mai","Charlotte","NC","28269",35.3354154,-80.7962441,"0","Sushi Bars, Japanese, Restaurants"
"888",83884,"World of Feng Shui","Las Vegas","NV","89102",36.1260842,-115.1933381,"1","Sushi Bars, Home Decor, Home & Garden, Professional Services, Feng Shui, Shopping, Restaurants"
"889",110494,"Sushi Jinjin","Montréal","QC","H2T 2K7",45.525447,-73.59949,"1","Restaurants, Sushi Bars, Korean"
"890",46863,"Sushi Mori","Toronto","ON","M4P 1A6",43.7072458,-79.3974545,"1","Restaurants, Japanese, Korean, Sushi Bars"
"891",148279,"Pearl of the Orient","Rocky River","OH","44116",41.4768217,-81.8497567,"1","Thai, Asian Fusion, Vietnamese, Chinese, Restaurants, Sushi Bars"
"892",183509,"Kabuki Dining Bar","Las Vegas","NV","89119",36.1162576,-115.1378386,"0","Restaurants, Italian, Japanese, Sushi Bars"
"893",127503,"GOGI","Chandler","AZ","85224",33.3372575074,-111.8759357929,"1","Sushi Bars, Restaurants, Korean, Seafood, Food"
"894",19788,"Hiroba Sushi","Henderson","NV","89052",35.9976736,-115.1016838,"1","Japanese, Restaurants, Sushi Bars"
"895",9178,"Sushi 4 U","Mississauga","ON","L5N 5R3",43.5910643,-79.7421782,"1","Restaurants, Sushi Bars"
"896",77941,"Wang & King Asian Cafe","Charlotte","NC","28273",35.1195903,-80.9567545,"1","Chinese, Sushi Bars, Asian Fusion, Japanese, Thai, Restaurants"
"897",135702,"Akari Sushi","Madison","WI","53719",43.047485,-89.5026303,"1","Restaurants, Japanese, Sushi Bars"
"898",19144,"Dai Ichi Sushi Restaurant","Mississauga","ON","L5L 5S3",43.5256892539,-79.6835439411,"1","Korean, Japanese, Restaurants, Sushi Bars"
"899",71395,"Tai Pei","Pittsburgh","PA","15238",40.4876529256,-79.8806163564,"1","Taiwanese, Sushi Bars, Restaurants, Chinese"
"900",46013,"Sushi 4 U","Newmarket","ON","L3Y 3Z3",44.052675,-79.4569286,"0","Chinese, Restaurants, Sushi Bars, Seafood, Asian Fusion, Japanese"
"901",54261,"Asia Garden","Strongsville","OH","44136",41.2781816355,-81.7852382394,"1","Chinese, Japanese, Sushi Bars, Thai, Restaurants"
"902",79171,"O-Ku Sushi","Charlotte","NC","28203",35.2092456,-80.8607013,"1","Restaurants, Sushi Bars, Seafood, Japanese, Asian Fusion"
"903",94239,"Ikemen Ramen Bar","Calgary","AB","T2N 1V5",51.0534534295,-114.0861896323,"1","Asian Fusion, Restaurants, Sushi Bars, Ramen, Japanese"
"904",69654,"Sushi Shop Exchange Tower","Toronto","ON","M5X 1A9",43.648528,-79.3833359,"1","Sushi Bars, Restaurants"
"905",150841,"Toshi Sushi","Toronto","ON","M5V 1M1",43.644371,-79.3993073,"0","Sushi Bars, Japanese, Restaurants"
"906",29907,"Mi Ne Sushi","Aurora","ON","L4G 7R2",44.018435,-79.447837,"1","Japanese, Sushi Bars, Specialty Food, Food, Restaurants, Ethnic Food"
"907",175905,"Umi Sushi","Verdun","QC","H3E 1T8",45.4674737,-73.5415261,"1","Japanese, Sushi Bars, Restaurants"
"908",156346,"China Buffet","Charlotte","NC","28205",35.1972547,-80.7693723,"1","Buffets, Restaurants, Japanese, Chinese, Sushi Bars"
"909",152181,"Sushi Kitchan Japanese Cuisine","Calgary","AB","T2C 4J2",50.9630987,-114.0113272,"0","Japanese, Sushi Bars, Restaurants"
"910",76187,"Delux","Phoenix","AZ","85016",33.511221,-112.013908,"1","Nightlife, Bars, American (Traditional), Beer, Wine & Spirits, Burgers, Food, Fast Food, Restaurants, Sushi Bars"
"911",157836,"Hana Sushi","Phoenix","AZ","85027",33.6551102,-112.081677,"1","Japanese, Restaurants, Sushi Bars"
"912",131005,"Noodletasia","Huntersville","NC","28078",35.4073854016,-80.8632606394,"0","Japanese, Sushi Bars, Chinese, Noodles, Restaurants"
"913",80515,"Sushi Ai","Calgary","AB","T3K 0S6",51.167014,-114.089651,"1","Restaurants, Sushi Bars"
"914",64622,"Narai Thai + Sushi","Scottsdale","AZ","85260",33.6274748,-111.8952238,"0","Japanese, Thai, Restaurants, Sushi Bars"
"915",135226,"Kyoto Bowl","Phoenix","AZ","85013",33.509984,-112.083543,"0","Sushi Bars, Restaurants, Japanese"
"916",114370,"Akimi Japanese Cuisine","Richmond Hill","ON","L4S 0B5",43.8960372,-79.4033037,"1","Japanese, Sushi Bars, Restaurants"
"917",186108,"Casa de Plata","Avondale","AZ","85323",33.4484452976,-112.3079475463,"1","Mexican, Restaurants, Sushi Bars, Seafood"
"918",26102,"House Modern Sushi Restaurant","Mesa","AZ","85204",33.384436,-111.802817,"1","Sushi Bars, Restaurants, Japanese, Asian Fusion"
"919",53536,"Ronda Sushi","Montréal","QC","H1N 1E6",45.5874581,-73.5398517,"1","Sushi Bars, Restaurants"
"920",33862,"Ebi Sushi","Toronto","ON","M6G 1M4",43.6600210207,-79.4257186455,"0","Restaurants, Sushi Bars, Japanese"
"921",190933,"Yama Sushi","Las Vegas","NV","89102",36.126032,-115.19187,"1","Restaurants, Sushi Bars"
"922",20716,"Kona Grill","Phoenix","AZ","85054",33.67681,-111.966607,"1","Sushi Bars, American (Traditional), Hawaiian, Asian Fusion, Restaurants"
"923",32982,"Haiku Sushi","Montréal","QC","H2V 1V7",45.5204781,-73.6085912,"1","Sushi Bars, Restaurants"
"924",132895,"Nagoya Japanese Restaurant","Markham","ON","L3R 0A7",43.8425059,-79.3059487,"1","Sushi Bars, Restaurants, Japanese"
"925",99337,"Enso: Rolls & Bowls","Fairview Park","OH","44126",41.4617397,-81.8497388,"1","Restaurants, Asian Fusion, Japanese, Sushi Bars, Noodles"
"926",40535,"New Generation Sushi","Toronto","ON","M5S 1Y2",43.6657235,-79.4078842,"1","Sushi Bars, Restaurants, Japanese"
"927",51874,"Azan Wok","Pittsburgh","PA","15239",40.4619795636,-79.704999769,"1","Restaurants, Asian Fusion, Chinese, Japanese, Sushi Bars"
"928",134845,"Koishi Restaurant & Sushi Bar","Charlotte","NC","28263",35.1759709,-80.7971362,"1","Restaurants, Sushi Bars, Chinese, Japanese"
"929",32326,"New China Buffet","Mentor-on-the-Lake","OH","44060",41.7094114366,-81.3593401015,"1","Restaurants, Sushi Bars, Buffets, Chinese"
"930",6662,"Miyaki Sushi","Toronto","ON","M5A 4M8",43.6496019911,-79.3660331767,"1","Sushi Bars, Japanese, Restaurants"
"931",1856,"Restaurant Muramoto","Madison","WI","53703",43.0745112925,-89.3792792157,"0","Sushi Bars, Restaurants, Asian Fusion"
"932",37476,"Hana Japanese Eatery","Phoenix","AZ","85013",33.5173704626,-112.0828243311,"1","Sushi Bars, Japanese, Restaurants"
"933",20996,"Sushi Ko Restaurant","Scottsdale","AZ","85260",33.5804903596,-111.8804253259,"1","Sushi Bars, Restaurants"
"934",179259,"Akita","Montréal","QC","H1P 3B5",45.599874,-73.577564,"1","Restaurants, Sushi Bars, Japanese"
"935",189906,"Sushi Newman","Lasalle","QC","H8N 1X7",45.437975,-73.624881,"1","Japanese, Restaurants, Sushi Bars"
"936",58413,"Sushi Nomi","Toronto","ON","M6R 2K6",43.6412663,-79.4469665,"0","Restaurants, Sushi Bars"
"937",149219,"Eastwind Sushi & Grill","Phoenix","AZ","85032",33.6108205645,-111.9774969726,"1","Restaurants, Sports Bars, Asian Fusion, Nightlife, Bars, Sushi Bars, Japanese"
"938",74092,"Sushi Moto","North York","ON","M2N 5N6",43.763983,-79.41138,"1","Nightlife, Wine Bars, Restaurants, Bars, Japanese, Sushi Bars"
"939",9659,"Enjoy Sushi","Phoenix","AZ","85004",33.4484911,-112.0744277,"0","Restaurants, Sushi Bars"
"940",8507,"Well Being In The Box","Las Vegas","NV","89146",36.1429917,-115.2254682,"0","Asian Fusion, Korean, Japanese, Sushi Bars, Restaurants"
"941",174425,"Nori Sushi Scottsdale","Scottsdale","AZ","85260",33.6382752958,-111.8632113484,"1","Asian Fusion, Lounges, Sushi Bars, Restaurants, Japanese, Bars, Nightlife"
"942",95250,"Katoreya","Pointe-Claire","QC","H9R 5B1",45.4649099,-73.7858281,"1","Sushi Bars, Restaurants, Japanese"
"943",60083,"Katana","Pittsburgh","PA","15216",40.3899009,-80.0406617,"1","Japanese, Restaurants, Sushi Bars, Steakhouses, Chinese"
"944",84234,"Sushi Net","Montréal","QC","H2X 1L4",45.5121378,-73.5621761,"1","Restaurants, Sushi Bars, Vietnamese"
"945",55120,"Inochi Express","Montréal","QC","H2R 1N7",45.5358982,-73.6205693,"1","Sushi Bars, Japanese, Restaurants"
"946",129247,"Little Tokyo Bistro","Pittsburgh","PA","15203",40.4281973,-79.9753305,"1","Sushi Bars, Korean, Restaurants, Japanese"
"947",65219,"Golden Taipei","Charlotte","NC","28269",35.3346884,-80.8135014,"1","Asian Fusion, Chinese, Sushi Bars, Restaurants, Japanese"
"948",138517,"Kasai Grill House","Toronto","ON","M6G 1B8",43.6553262,-79.41618,"1","Japanese, Barbeque, Sushi Bars, Korean, Restaurants"
"949",178149,"Cherryblossom Noodle Cafe","Phoenix","AZ","85014",33.5098020416,-112.061086646,"1","Bakeries, Italian, Food, Ramen, Desserts, Sushi Bars, Restaurants, Noodles, Asian Fusion, Japanese"
"950",119821,"Gonoe Sushi","Toronto","ON","M3B 2W6",43.7459197,-79.3463013,"1","Sushi Bars, Japanese, Restaurants"
"951",164089,"Kenko Sushi & Teriyaki","Cleveland","OH","44106",41.5083472,-81.6055447,"1","Asian Fusion, Sushi Bars, Bubble Tea, Food, Ethnic Food, Japanese, Specialty Food, Restaurants"
"952",118456,"Urawa Sushi","Toronto","ON","M5H 1X6",43.6482311,-79.3892564,"1","Japanese, Restaurants, Sushi Bars"
"953",148995,"Fuji","Concord","NC","28027",35.4295111,-80.6078019,"0","Sushi Bars, Restaurants, Japanese"
"954",102439,"RA Sushi Bar Restaurant","Scottsdale","AZ","85251",33.4919777,-111.9259023,"1","Restaurants, Sushi Bars, Asian Fusion, Japanese"
"955",74390,"Lucky Noodle","Markham","ON","L3R",43.8336238577,-79.3065843992,"1","Restaurants, Soup, Chinese, Food, Sushi Bars, Noodles, Japanese, Coffee & Tea"
"956",165681,"Sushiro","Las Vegas","NV","89101",36.1719092333,-115.115041472,"1","Buffets, Seafood, Sushi Bars, Japanese, Restaurants"
"957",74713,"Sushi Yasu","La Prairie","QC","J5R 5E6",45.4141,-73.483072,"1","Sushi Bars, Restaurants"
"958",178042,"Wasabi Japanese Steakhouse","Elyria","OH","44035",41.3949916,-82.1077815,"1","Steakhouses, Sushi Bars, Restaurants, Japanese"
"959",47070,"Main Sushi","Markham","ON","L3P 5T3",43.8789048,-79.2611734,"1","Restaurants, Japanese, Sushi Bars"
"960",163088,"TORCH Pressed Sushi","Toronto","ON","M2M 3W5",43.7894818475,-79.4181949273,"1","Restaurants, Sushi Bars, Japanese"
"961",98803,"Kuu Sushi","Vaughan","ON","L4J 3M8",43.8097489968,-79.4578952661,"1","Japanese, Restaurants, Sushi Bars"
"962",48078,"K Sushi Bar & Grill","Glendale","AZ","85302",33.5678807,-112.1537964,"0","Korean, Japanese, Restaurants, Sushi Bars"
"963",162207,"Kami Sushi","Toronto","ON","M6R 2L3",43.6439217,-79.4479795,"1","Restaurants, Sushi Bars"
"964",2463,"Tokyo Japanese Restaurant","Las Vegas","NV","89104",36.143672,-115.1409598,"0","Sushi Bars, Restaurants, Japanese"
"965",142919,"BF Sushi","Las Vegas","NV","89118",36.072482,-115.243565,"1","Japanese, Sushi Bars, Restaurants"
"966",92342,"Sail Sushi","Scarborough","ON","M1E 2M8",43.7659173,-79.1916725,"1","Dim Sum, Thai, Japanese, Sushi Bars, Restaurants, Chinese, Salad"
"967",151190,"Haru Sushi And Grill","Glendale","AZ","85308",33.6656143734,-112.2017465039,"1","Restaurants, Sushi Bars, Japanese"
"968",119060,"Banzai Cowboy Sushi & Martini Bar","Scottsdale","AZ","85255",33.6729823,-111.8904749,"0","Sushi Bars, Lounges, Nightlife, Restaurants, Japanese, Bars"
"969",161692,"Sushi Shop","Saint-Laurent","QC","H4R 1P8",45.4926722401,-73.7097450346,"1","Restaurants, Japanese, Sushi Bars"
"970",119335,"Axia Cafe","Markham","ON","L3R 0Y5",43.8261994,-79.3063175,"1","Japanese, Korean, Sushi Bars, Restaurants"
"971",2665,"Swish","Las Vegas","NV","89117",36.1430744239,-115.2632621672,"1","Hot Pot, Japanese, Restaurants, Sushi Bars"
"972",151213,"Edo Japan","Calgary","AB","T3R 0J1",51.156385,-114.15827,"1","Restaurants, Food, Japanese, Sushi Bars"
"973",170417,"Koi Restaurant","Las Vegas","NV","89109",36.110474891,-115.172241112,"1","Restaurants, Sushi Bars, Japanese"
"974",21980,"Sushi Wa","Henderson","NV","89052",36.0029457248,-115.1077555767,"1","Restaurants, Japanese, Sushi Bars"
"975",171806,"Sandai Sushi","Las Vegas","NV","89103",36.1161754766,-115.2256282958,"0","Sushi Bars, Asian Fusion, Restaurants, Korean"
"976",34834,"99 Cent Sushi","Toronto","ON","M5B 2E5",43.661442,-79.3789741,"0","Restaurants, Japanese, Sushi Bars"
"977",102310,"Original Fish Market","Pittsburgh","PA","15222",40.4441681,-79.994852,"0","Restaurants, Sushi Bars, Seafood, American (Traditional)"
"978",165561,"Kyjo's","Concord","NC","28025",35.4475856,-80.5996181,"0","Restaurants, Sushi Bars, Japanese, Thai, Asian Fusion"
"979",55953,"Hon Machi Sushi and cocktails","Chandler","AZ","85224",33.319397,-111.874962,"1","Pan Asian, Asian Fusion, Japanese, Seafood, Teppanyaki, Restaurants, Sushi Bars"
