"","business_id","name","city","state","postal_code","latitude","longitude","is_open","categories"
"394",47914,"Sea Salt Sushi & Oyster","Las Vegas","NV","89123",36.014137,-115.15498,"1","Restaurants, Sushi Bars, Seafood"
"395",15247,"A Plus Buffet Sushi Bar","Calgary","AB","T2H 0L3",50.9932729182,-114.0709654614,"1","Buffets, Sushi Bars, Restaurants, Diners, Japanese, Asian Fusion"
"396",112027,"China Garden","Irwin","PA","15642",40.33327,-79.744246,"1","Chinese, Restaurants, Sushi Bars"
"397",187950,"Noah Kosher Sushi","Toronto","ON","M3H 3P4",43.7471747991,-79.4358520205,"1","Japanese, Kosher, Restaurants, Sushi Bars"
"398",104546,"Cuco's Mexican Fusion","Madison","WI","53703",43.0744019,-89.379518,"0","Sushi Bars, Cocktail Bars, Bars, Restaurants, Nightlife, Mexican"
"399",118165,"Umiya Sushi","Las Vegas","NV","89103",36.1149943094,-115.2014029039,"1","Japanese, Restaurants, Sushi Bars, Seafood"
"400",110889,"Sushi Maru and Ramen","Markham","ON","L3T 7Z5",43.8421682,-79.3904432,"0","Restaurants, Sushi Bars"
"401",98805,"Ohya Sushi, Korean Grill & Bar","Phoenix","AZ","85054",33.656952686,-111.9323154032,"1","Restaurants, Nightlife, Bars, Sushi Bars, Beer Bar, Korean, Japanese"
"402",149820,"Misai Japanese","Calgary","AB","T2E 7C8",51.0810361,-114.0137196,"1","Sushi Bars, Japanese, Restaurants"
"403",165943,"Tokyo Garden","Calgary","AB","T2W 4X9",50.9637177226,-114.0729225724,"0","Restaurants, Sushi Bars, Japanese"
"404",25928,"O ' Sake","Terrebonne","QC","J6X 3A3",45.7109601,-73.6527673,"1","Restaurants, Asian Fusion, Sushi Bars"
"405",120550,"Oishii Sushi","Montréal","QC","H2V 1T5",45.5240053,-73.605427,"1","Restaurants, Sushi Bars, Japanese"
"406",12066,"Kabuki Japanese Restaurant","Las Vegas","NV","89119",36.0675357995,-115.1779719543,"1","Sushi Bars, Restaurants, Asian Fusion, Japanese"
"407",92872,"Tata Sushi & Grill","Calgary","AB","T3G 5T4",51.1523,-114.215075,"1","Sushi Bars, Japanese, Restaurants"
"408",55362,"Ohya Sushi, Korean Kitchen & Bar","Glendale","AZ","85306",33.6116508043,-112.1655679727,"1","Restaurants, Japanese, Sushi Bars, Korean, Nightlife, Bars"
"409",100527,"SU&BU","Toronto","ON","M5H 2R2",43.6501852983,-79.380569181,"1","Food Court, Restaurants, Asian Fusion, Japanese, Sushi Bars"
"410",141399,"Yanagi Sushi","Toronto","ON","M4J 1N4",43.6832029,-79.3249187,"1","Restaurants, Sushi Bars, Japanese, Korean"
"411",176066,"Japan Express","Glendale","AZ","85302",33.567925,-112.1709957,"1","Fast Food, Japanese, Restaurants, Sushi Bars"
"412",45283,"Roppongi Sushi & Bar","Huntersville","NC","28078",35.4092601518,-80.8601726798,"0","Japanese, Beer, Wine & Spirits, Food, Restaurants, Bars, Nightlife, Sushi Bars"
"413",59880,"Brian's Beach Sushi","Las Vegas","NV","89147",36.1139221,-115.2803993,"0","Japanese, Restaurants, Sushi Bars"
"414",67127,"Sushi Shop","Laval","QC","H7S 1M9",45.567389,-73.727605,"1","Sushi Bars, Restaurants"
"415",14555,"Hashi Sushi","Toronto","ON","M4G 3B7",43.7063204,-79.3755746,"0","Sushi Bars, Restaurants, Korean"
"416",60249,"CO","Charlotte","NC","28209",35.174959,-80.8487112,"1","Vietnamese, Korean, Asian Fusion, Sushi Bars, Restaurants"
"417",147397,"Roku","Calgary","AB","T3R 0R5",51.1524522341,-114.2113194609,"1","Japanese, Sushi Bars, Restaurants"
"418",32172,"Wabora","Toronto","ON","M5V 1H5",43.6430475967,-79.4020020962,"0","Japanese, Sushi Bars, Restaurants"
"419",131437,"Nobu","Las Vegas","NV","89109",36.1167433322,-115.1753682245,"1","Seafood, Sushi Bars, Japanese, Restaurants"
"420",186930,"L'Atelier Sushi","Sainte-Thérèse","QC","J7E 3H2",45.6392684,-73.8417798,"1","Sushi Bars, Asian Fusion, Restaurants, Pan Asian"
"421",81147,"Peking Tokyo","Fort Mill","SC","29708",35.046619,-80.991637,"1","Chinese, Sushi Bars, Japanese, Restaurants"
"422",174789,"Sumo Sushi","Toronto","ON","M8V 1J2",43.600991,-79.5033581,"1","Japanese, Sushi Bars, Restaurants, Korean"
"423",120274,"Stingray Sushi","Chandler","AZ","85226",33.31819,-111.969203,"0","Japanese, Restaurants, Sushi Bars"
"424",5923,"Makino Sushi & Seafood Buffet","Las Vegas","NV","89103",36.1186319921,-115.2084587597,"1","Seafood, Restaurants, Sushi Bars, Buffets, Japanese"
"425",5697,"Sushi Wabi","Las Vegas","NV","89128",36.197453,-115.279707,"1","Japanese, Sushi Bars, Restaurants"
"426",120167,"Coral Sushi","Huntersville","NC","28078",35.4427335,-80.8857543,"1","Japanese, Restaurants, Sushi Bars"
"427",108956,"KiKu Revolving Sushi","Glendale","AZ","85308",33.6542844625,-112.2348992304,"1","Restaurants, Korean, Sushi Bars, Japanese, Food"
"428",62549,"Mr. Kyoto","Champaign","IL","61820",40.1104378577,-88.2297856361,"0","Food, Asian Fusion, Sushi Bars, Poke, Ramen, Japanese, Restaurants, Gluten-Free"
"429",21205,"Sashimi House","North York","ON","M2J 5B3",43.77523,-79.330371,"1","Sushi Bars, Restaurants, Japanese"
"430",160251,"Kanda","Laval","QC","H7N 0A8",45.557206,-73.725266,"1","Restaurants, Sushi Bars"
"431",190003,"Japan Sushi","Toronto","ON","M5S 1X8",43.6655822,-79.4095666,"1","Restaurants, Japanese, Sushi Bars"
"432",147392,"EDO","Toronto","ON","M5N 1A5",43.7039578,-79.4128512,"0","Specialty Food, Restaurants, Sushi Bars, Food, Japanese, Ethnic Food, Asian Fusion"
"433",184000,"Red","Madison","WI","53703",43.072396,-89.387893,"0","Nightlife, Japanese, Lounges, Italian, Bars, Restaurants, Sushi Bars, Vegan"
"434",39945,"Way Sushi & Teppanyaki","Gilbert","AZ","85295",33.3049148,-111.7559224,"0","Sushi Bars, Restaurants"
"435",108555,"Ippei","Phoenix","AZ","85054",33.6556844,-111.9300279,"0","Restaurants, Japanese, Sushi Bars"
"436",99063,"Sushi Takashi","Las Vegas","NV","89146",36.1262291442,-115.2135073042,"1","Izakaya, Tapas/Small Plates, Sushi Bars, Restaurants, Japanese"
"437",169863,"Mac's Sushi","Toronto","ON","M6A 2T9",43.7246843,-79.4541729,"1","Japanese, Sushi Bars, Restaurants"
"438",99762,"Penn Cove Eatery","Pittsburgh","PA","15222",40.4426526,-79.9998171,"1","American (New), Restaurants, Sandwiches, Sushi Bars"
"439",29346,"Tokyo Express","Scottsdale","AZ","85251",33.4891917,-111.9272931,"0","Sushi Bars, Japanese, Restaurants, Fast Food"
"440",107317,"Akita Sushi","Vaughan","ON","L4L 0B2",43.7769996,-79.6039799,"1","Sushi Bars, Japanese, Restaurants"
"441",80346,"Kumo Japanese Seafood Buffet","Parma","OH","44134",41.403182,-81.6957670839,"1","Restaurants, Buffets, Japanese, Sushi Bars"
"442",98265,"Mi'hito Sushi Laboratory","Toronto","ON","M5G 1C9",43.6711378274,-79.3944513425,"1","Sushi Bars, Restaurants, Fast Food"
"443",22469,"Sushi Momo","Montréal","QC","H2J 2L5",45.5250677,-73.5849511,"0","Sushi Bars, Vegan, Restaurants, Japanese"
"444",129500,"Tokyo Sushi","Toronto","ON","M4Y 1J8",43.665598817,-79.3869840389,"1","Restaurants, Japanese, Sushi Bars"
"445",116832,"Geisha House Steak & Sushi","Las Vegas","NV","89148",36.0765586,-115.2986392,"0","Restaurants, Sushi Bars, Steakhouses, Japanese"
"446",149575,"Sushi On Shea","Scottsdale","AZ","85254",33.5826712,-111.929119,"0","Japanese, Sushi Bars, Restaurants"
"447",90286,"Sa-Fran Bistro & Sushi Bar","Montréal","QC","H2W 2M4",45.5206537,-73.5751227,"0","Restaurants, French, Sushi Bars"
"448",20331,"Sushi And Rolls","Ajax","ON","L1S 7K8",43.8417620794,-79.0238448489,"1","Sushi Bars, Restaurants, Japanese"
"449",150311,"Toshi Japanese Restaurant","Brampton","ON","L6X 5A5",43.703302782,-79.78456823,"1","Sushi Bars, Restaurants, Japanese"
"450",150058,"Bonsai Japanese Steak & Sushi","Las Vegas","NV","89113",36.0556567698,-115.2432622919,"1","Teppanyaki, Steakhouses, Japanese, Sushi Bars, Restaurants"
"451",98145,"Poke & Sushi Burritos","Calgary","AB","T2S 0B4",51.0380277,-114.0752981,"1","Food, Restaurants, Asian Fusion, Poke, Sushi Bars, Japanese"
"452",87729,"Peninsula China Bistro","Cornelius","NC","28031",35.4795,-80.893231,"0","Sushi Bars, Restaurants, Asian Fusion, Japanese, Chinese"
"453",58558,"Koi Poke","Scottsdale","AZ","85255",33.6515426,-111.886156,"1","Poke, Food, Hawaiian, Sushi Bars, Restaurants"
"454",74129,"Goong Sushi","Montréal","QC","H3S 2B2",45.503072,-73.637308,"1","Restaurants, Sushi Bars"
"455",31588,"Momo San","Toronto","ON","M5T 1L2",43.6561388094,-79.3933851206,"1","Restaurants, Nightlife, Cocktail Bars, Bars, Sushi Bars, Japanese"
"456",189984,"Sushi House","Pittsburgh","PA","15217",40.432838,-79.9232072,"0","Restaurants, Sushi Bars"
"457",38574,"Sushi Rock","Beachwood","OH","44122",41.5004234,-81.4967959,"0","Restaurants, Japanese, Sushi Bars, Steakhouses"
"458",96983,"Sushi Station","Phoenix","AZ","85014",33.5090413504,-112.048302955,"1","Asian Fusion, Restaurants, Conveyor Belt Sushi, Japanese, Sushi Bars"
"459",140254,"Tokyo Boys","Henderson","NV","89014",36.0546891161,-115.0469030214,"1","Restaurants, Sushi Bars, Seafood, Japanese"
"460",43742,"Mac's Sushi","Toronto","ON","M3J 1P3",43.7742081,-79.4983331,"1","Japanese, Restaurants, Sushi Bars"
"461",89066,"Umi Sushi Express","Calgary","AB","T2P 3S1",51.0509887,-114.0720484,"1","Specialty Food, Sushi Bars, Ethnic Food, Food, Restaurants"
"462",99553,"Benihana","Scottsdale","AZ","85254",33.6348255,-111.9247221,"1","Japanese, Nightlife, Restaurants, Sushi Bars"
"463",11834,"Sushi Jun","Newmarket","ON","L3Y 6M8",44.051962,-79.4564927,"1","Japanese, Restaurants, Food, Sushi Bars"
"464",32204,"Jade Grille","Pittsburgh","PA","15228",40.3805957,-80.0448481,"1","Szechuan, Nightlife, Restaurants, Sushi Bars, Bars, Asian Fusion, Chinese, American (Traditional)"
"465",177439,"Empire Palace Asian Restaurant and Bar","Pittsburgh","PA","15237",40.56148,-80.0245729,"1","Japanese, Szechuan, Asian Fusion, Sushi Bars, Chinese, Dim Sum, Restaurants"
"466",51164,"Flaming Grill Buffet","Kannapolis","NC","28083",35.4500062867,-80.6088687479,"1","Chinese, Sushi Bars, Restaurants, Buffets"
"467",71323,"Sushi Gen","Toronto","ON","M4T 1Z6",43.6888585,-79.3947123,"1","Sushi Bars, Restaurants"
"468",55236,"Asahi Japanese Restaurant","Madison","WI","53715",43.0615382,-89.4008856,"1","Sushi Bars, Restaurants, Japanese"
"469",165833,"Bento Sushi","Mississauga","ON","L4V 1W1",43.6825751199,-79.6159664655,"1","Sushi Bars, Restaurants"
"470",103558,"Kiu Japanese Restaurant","Markham","ON","L6G 0E7",43.8496812,-79.3220427,"1","Sushi Bars, Tapas/Small Plates, Restaurants, Asian Fusion, Ramen, Japanese"
"471",90531,"Tora Sushi","Montréal","QC","H2S 1R2",45.5314502,-73.6072027,"1","Sushi Bars, Restaurants"
"472",94406,"koi sushi","Madison","WI","53703",43.0749781543,-89.3934160843,"1","Sushi Bars, Japanese, Szechuan, Restaurants, Chinese"
"473",15415,"Shiro Japanese Restaurant","Phoenix","AZ","85028",33.5837094,-111.9777841,"0","Restaurants, Sushi Bars"
"474",3609,"Uptown Sushi","Calgary","AB","T2R 1K9",51.0429559,-114.0885973,"0","Sushi Bars, Restaurants"
"475",63856,"Robo Sushi","Toronto","ON","M3B 1Y6",43.7548156,-79.3494478,"1","Dim Sum, Chinese, Restaurants, Sushi Bars"
"476",115850,"Culichi Town","Las Vegas","NV","89130",36.2014618841,-115.1951955074,"1","Sushi Bars, Mexican, Restaurants, New Mexican Cuisine, Seafood"
"477",33190,"Yokohama Japanese Cuisine","Markham","ON","L3R 5Y3",43.821399,-79.3251137,"1","Restaurants, Sushi Bars"
"478",61923,"Table Top Grill And Sushi","Phoenix","AZ","85019",33.5239046,-112.1493903,"0","Restaurants, Vietnamese, Sushi Bars, Korean"
"479",169095,"Restaurant Sakura Chi","Saint-Eustache","QC","J7R 5B8",45.5720317,-73.915516,"1","Restaurants, Sushi Bars"
"480",185486,"Umi Sushi Express","Pickering","ON","L1V 1B8",43.8359681961,-79.0863091844,"1","Sushi Bars, Restaurants"
"481",110232,"Mikasas Sushi Bar","Montréal","QC","H4N 2W2",45.5360917,-73.6650913,"0","Japanese, Sushi Bars, Restaurants"
"482",190619,"Zend'O","Boucherville","QC","J4B 1B8",45.5903827,-73.4371504,"1","Restaurants, Sushi Bars"
"483",11500,"Daily Sushi Japanese Restaurant","Toronto","ON","M5B 2H5",43.6616374,-79.3816808,"1","Sushi Bars, Restaurants, Japanese"
"484",119277,"Sushi & Rolls","Pittsburgh","PA","15219",40.4383265,-79.9990769,"1","Restaurants, Sushi Bars"
"485",87846,"TJ Buffet Sushi And Grill","Tarentum","PA","15084",40.572477,-79.799775,"1","Sushi Bars, Chinese, Restaurants, Seafood"
"486",13475,"Sushi Mountain","Whitby","ON","L1N 2K7",43.8867164481,-78.9136228451,"1","Restaurants, Japanese, Sushi Bars"
"487",79702,"Nobu Las Vegas","Las Vegas","NV","89169",36.1091636136,-115.1534932852,"1","Restaurants, Japanese, Sushi Bars, Latin American, Asian Fusion"
"488",94508,"Yokoso Japanese Steakhouse","Homestead","PA","15120",40.4090643,-79.9157974,"1","Japanese, Steakhouses, Sushi Bars, Restaurants"
"489",156778,"Ichi Ban Japanese Restaurant & Sushi","Phoenix","AZ","85004",33.4793412,-112.0736877,"0","Japanese, Restaurants, Sushi Bars"
"490",144838,"Sushi Lounge & steakhouse","Boulder City","NV","89005",35.972819,-114.848784,"0","Sushi Bars, Steakhouses, Japanese, Restaurants"
"491",21543,"M Sushi & Grill","Champaign","IL","61820",40.1076853,-88.2436688,"0","Seafood, Korean, Japanese, Restaurants, Sushi Bars, Asian Fusion"
"492",105039,"Restaurant Sushi Moo-Shi","Greenfield Park","QC","J4V 2L9",45.491086,-73.4884315,"1","Restaurants, Sushi Bars"
"493",78823,"The Parkdale Drink","Toronto","ON","M6K 1L4",43.6419757,-79.4304835,"1","Nightlife, Sushi Bars, Restaurants, Lounges, Bars"
"494",3711,"Gohyang Restaurant","Toronto","ON","M9A 1C2",43.6449713,-79.5327411,"1","Korean, Restaurants, Asian Fusion, Thai, Noodles, Wine Bars, Sushi Bars, Chinese, Nightlife, Bars, Dim Sum"
"495",188750,"The Signature Kitchen","Toronto","ON","M4J 1N4",43.6831128,-79.3248315,"0","Restaurants, Sushi Bars"
"496",146279,"Satori Sushi","Scottsdale","AZ","85260",33.6384065047,-111.8635260916,"0","Restaurants, Sushi Bars, Japanese"
"497",101137,"Bluewater Grill","Phoenix","AZ","85016",33.5101676,-112.0449114,"1","Seafood Markets, Food, American (Traditional), Specialty Food, Venues & Event Spaces, Event Planning & Services, Seafood, Sushi Bars, Restaurants"
"498",124796,"Kasumi","Montréal","QC","H2L 3L2",45.51787,-73.5574607,"1","Sushi Bars, Tapas/Small Plates, Japanese, Restaurants"
"499",191690,"Tokyo Peking Asian Restaurant","Las Vegas","NV","89183",36.0069369,-115.1466693,"0","Asian Fusion, Restaurants, Salad, Sushi Bars, Japanese"
"500",25510,"The Sushi Bar","Toronto","ON","M4N 2M6",43.7318497,-79.4035568,"0","Sushi Bars, Japanese, Restaurants"
"501",65113,"Sushi N Rolls","Toronto","ON","M5E 1X6",43.6478500778,-79.3760866783,"1","Japanese, Sushi Bars, Restaurants"
"502",110820,"Eko Sushi","Montréal","QC","H4C 1P3",45.4803144,-73.5794934,"1","Sushi Bars, Restaurants, Japanese"
"503",121410,"Sushi Brokers","Scottsdale","AZ","85255",33.6405179,-111.9245358,"1","Japanese, Asian Fusion, Sushi Bars, Restaurants"
"504",189729,"Oishi","Champaign","IL","61822",40.1451443,-88.2585174,"1","Asian Fusion, Thai, Japanese, Sushi Bars, Restaurants"
"505",43187,"Moto Sushi","Phoenix","AZ","85016",33.5373335871,-112.0470648705,"1","Japanese, Restaurants, Sushi Bars, Asian Fusion"
"506",166738,"Fuji Japan","Rock Hill","SC","29732",34.9702063086,-80.9926740825,"1","Nightlife, Cocktail Bars, Steakhouses, Sushi Bars, Restaurants, Japanese, Bars"
"507",54204,"Wow Sushi","Markham","ON","L3S 0B5",43.84877254,-79.2535753113,"1","Sushi Bars, Japanese, Restaurants"
"508",73344,"Hana Sushi","Calgary","AB","T2S 1W2",51.0367988,-114.0717484,"1","Restaurants, Japanese, Sushi Bars"
"509",35584,"Sushi Nanami","Montréal","QC","H2S 2T6",45.5373654,-73.6151265,"1","Sushi Bars, Japanese, Restaurants"
"510",12578,"Shizen Japanese Restaurant","Las Vegas","NV","89145",36.1757918,-115.2907964,"1","Sushi Bars, Restaurants, Japanese"
"511",132733,"VIPS Sushi","Toronto","ON","M2N",43.7766653935,-79.4141433843,"1","Japanese, Restaurants, Sushi Bars"
"512",12400,"Yama Sushi","Las Vegas","NV","89119",36.115520451,-115.1349705842,"1","Sushi Bars, Restaurants, Japanese"
"513",29209,"Ke Charcoal Grill & Sushi","Calgary","AB","T3C 0Y1",51.0393051974,-114.0949554249,"1","Sushi Bars, Barbeque, Japanese, Restaurants"
"514",54290,"Zen Japanese Restaurant","Scarborough","ON","M1J 2E1",43.7372888,-79.2452244,"0","Sushi Bars, Japanese, Restaurants"
"515",14898,"Momo Sushi","Calgary","AB","T2H 0K1",50.9941501,-114.0716869,"0","Japanese, Restaurants, Sushi Bars"
"516",33334,"Wako Sushi + Sake Bar","Toronto","ON","M2N 5P7",43.7707977214,-79.4130886719,"1","Korean, Japanese, Sushi Bars, Restaurants"
"517",41550,"PROJECT:FISH","North York","ON","M2N0J4",43.7691830865,-79.4141297042,"1","Restaurants, Sushi Bars"
"518",63221,"Sushi Culiacan","Las Vegas","NV","89104",36.1601208,-115.0789273,"1","Asian Fusion, Restaurants, Seafood, Mexican, Sushi Bars"
"519",116793,"Nori Sushi","Montréal","QC","H1W 1B2",45.5407710012,-73.560804402,"1","Japanese, Restaurants, Sushi Bars, Vietnamese"
"520",18616,"Zuki Japanese Restaurant","Toronto","ON","M6E 2K3",43.6945463,-79.4561394,"1","Restaurants, Japanese, Sushi Bars"
"521",102674,"Ichiban Fish Market","Scarborough","ON","M1R 4C2",43.7592773,-79.3104222,"0","Restaurants, Japanese, Food, Seafood Markets, Sushi Bars, Specialty Food"
"522",18000,"Kaizen Fusion Roll & Sushi","Henderson","NV","89052",36.0028441,-115.1106772,"1","Restaurants, Sushi Bars"
"523",42868,"Umami Sushi","Toronto","ON","M6A 2C5",43.7286207,-79.431533,"1","Japanese, Kosher, Sushi Bars, Restaurants"
"524",165439,"Kimono Japanese Grill & Sushi","Toronto","ON","M5N 1A3",43.7041845,-79.4100306,"1","Food, Food Delivery Services, Japanese, Sushi Bars, Asian Fusion, Restaurants, Thai"
"525",141214,"Sushi Avenue","Champaign","IL","61820",40.110113,-88.233218,"0","Japanese, Sushi Bars, Restaurants, Korean"
"526",118059,"Kuka Sushi & Izakaya","Tempe","AZ","85281",33.4140954,-111.9186205,"1","Food, Ramen, Restaurants, Japanese, Sushi Bars, Beer, Wine & Spirits, Izakaya, Tapas/Small Plates"
"527",20066,"Hanabi Sushi and Rolls","Las Vegas","NV","89117",36.147262,-115.299964,"1","Beer, Wine & Spirits, Sushi Bars, Japanese, Restaurants, Ramen, Food"
"528",165919,"Echo Sushi","Phoenix","AZ","85086",33.7998310355,-112.1278555691,"1","Salad, Japanese, Restaurants, Sushi Bars, Soup"
"529",36657,"Geisha House Steak & Sushi","Las Vegas","NV","89121",36.1296013,-115.0927902,"1","Japanese, Restaurants, Sushi Bars, Steakhouses"
"530",32441,"Ichimi Sushi","Toronto","ON","M5G 1C9",43.6567548,-79.3837248,"1","Sushi Bars, Restaurants"
"531",110436,"Yanagi Sushi","Gilbert","AZ","85233",33.335884,-111.8089404,"1","Asian Fusion, Korean, Restaurants, Sushi Bars, Japanese"
"532",9531,"Tokyoto Sushi","Las Vegas","NV","89145",36.1605051,-115.2899166,"0","Sushi Bars, Japanese, Restaurants"
"533",50366,"Takumi Sushi Restaurant","Toronto","ON","M4Y 1X5",43.6625929,-79.3837934,"0","Sushi Bars, Japanese, Restaurants"
"534",91435,"Uni Sushi & Steak","Surprise","AZ","85374",33.6405519,-112.3577596,"1","Sushi Bars, Restaurants, Nightlife, Japanese, Bars"
"535",140741,"Bento Sushi","Calgary","AB","T2P 4K8",51.0461142,-114.0709375,"1","Sushi Bars, Restaurants"
"536",16778,"Sushi Bay","Henderson","NV","89074",36.0421192,-115.1014115,"1","Japanese, Sushi Bars, Restaurants, Breakfast & Brunch"
"537",37279,"Yogis Grill","Phoenix","AZ","85004",33.4478233877,-112.0726832002,"1","Restaurants, Sushi Bars, Japanese"
"538",174506,"Ha Ahn Korean Restaurant","Cleveland","OH","44114",41.5104851,-81.6696382,"1","Food, Sushi Bars, Korean, Restaurants, Japanese"
"539",52229,"La Perle Noire","Greenfield Park","QC","J4V 3N2",45.4863051,-73.4600234,"1","Sushi Bars, Restaurants"
"540",150669,"Mikasa Sushi Bar","Montréal","QC","H3A 1T6",45.5013472,-73.575652,"0","Restaurants, Sushi Bars"
"541",33389,"Kintaro Izakaya","Toronto","ON","M4Y 4C5",43.6641787,-79.3801067,"1","Restaurants, Sushi Bars, Nightlife, Tapas/Small Plates, Bars, Japanese"
"542",107157,"Stingray Sushi","Phoenix","AZ","85016",33.5105510376,-112.0262065579,"0","Pan Asian, Sushi Bars, Japanese, Restaurants"
"543",122301,"Umezono Sushi and Japanese Grill","Las Vegas","NV","89147",36.1004768,-115.3042796,"1","Japanese, Restaurants, Tapas Bars, Tapas/Small Plates, Izakaya, Sushi Bars, Noodles"
"544",106940,"Sakura Sushi","Phoenix","AZ","85044",33.348359,-111.983325,"1","Soup, Buffets, Japanese, Sushi Bars, Restaurants, Salad"
"545",108686,"Yum Yum BBQ","Las Vegas","NV","89113",36.0569676,-115.2800962,"0","Korean, Sushi Bars, Restaurants, Japanese, Hawaiian"
"546",10734,"KIBO Sushi & Tapas","Toronto","ON","M6C 1B2",43.6812098,-79.4264768,"1","Restaurants, Sushi Bars"
"547",137234,"Otani Japanese Restaurant","Mayfield Heights","OH","44124",41.5160471,-81.4502579,"1","Restaurants, Sushi Bars, Japanese"
"548",65877,"Ichiban Sushi House","Newmarket","ON","L3X 3A1",44.0330264214,-79.4774633646,"0","Sushi Bars, Restaurants"
"549",77022,"Restaurant Hana","Pittsburgh","PA","15201",40.4718139,-79.9598553,"0","Asian Fusion, Restaurants, Chinese, Sushi Bars, Japanese, Thai"
"550",117221,"Dragonfly Lounge","Cleveland","OH","44113",41.4859322,-81.704615,"0","Steakhouses, Nightlife, Bars, Restaurants, Lounges, Sushi Bars"
"551",107519,"Sushi Palace","Saint-Laurent","QC","H4L 5K8",45.5187115,-73.6996873,"1","Sushi Bars, Restaurants"
"552",160650,"Sushi Kamikaze","Brossard","QC","J4W 1M9",45.4607291,-73.4675608,"1","Sushi Bars, Restaurants, Vietnamese, Event Planning & Services, Caterers"
"553",179080,"Crop Sticks","Cleveland","OH","44113",41.499964,-81.706625,"0","Asian Fusion, Chinese, Sushi Bars, Restaurants"
"554",22277,"Pallets Food and Bar","Phoenix","AZ","85004",33.459054,-112.068953,"0","Japanese, Nightlife, Bars, Vietnamese, Cocktail Bars, Sushi Bars, Restaurants"
"555",121713,"Kona Grill","Vaughan","ON","L4H 4G3",43.773387002,-79.624633491,"1","Bars, Nightlife, Restaurants, American (New), Sushi Bars, Cocktail Bars"
"556",145625,"Akita Sushi","Scottsdale","AZ","85258",33.5691722,-111.8857245,"1","Sushi Bars, Restaurants"
"557",130869,"Restaurant Japon Sushi Bar","Saint-Laurent","QC","H4R 1J9",45.5127875,-73.6925514,"0","Sushi Bars, Restaurants"
"558",88944,"UBU Lounge","Calgary","AB","T2P 1M6",51.0473167,-114.0653571,"0","Restaurants, Japanese, Nightlife, Sushi Bars, Bars, Lounges"
"559",13637,"Niji Sushi Bar & Restaurant","Brossard","QC","J4Y 0A5",45.4417496975,-73.4399388111,"1","Japanese, Restaurants, Sushi Bars"
"560",61487,"Noh","Scottsdale","AZ","85258",33.5666604,-111.9185781,"1","Restaurants, Sushi Bars"
"561",171866,"Toko Japanese Steak House","Streetsboro","OH","44241",41.2402252,-81.337449,"1","Sushi Bars, Japanese, Restaurants, Food, Steakhouses"
"562",52527,"Sushi Friends","Toronto","ON","M4K 1P1",43.6775022,-79.3515315,"1","Food, Sushi Bars, Restaurants"
"563",165863,"Rising Sun","Las Vegas","NV","89169",36.114765,-115.160858,"0","Sushi Bars, Japanese, Restaurants, Coffee & Tea, Food"
"564",24931,"Mika Sushi","Oakville","ON","L6H 6X6",43.461167,-79.73749,"1","Restaurants, Sushi Bars, Japanese"
"565",145928,"Toro Sushi Bar","Montréal","QC","H3G 2E8",45.4976784,-73.5784059,"0","Restaurants, Asian Fusion, Sushi Bars"
"566",97583,"Sushi Shop","Montréal","QC","H4A 3J1",45.472748,-73.601636,"1","Restaurants, Sushi Bars"
"567",52362,"Sushi 111","Montréal","QC","H2H 1K6",45.5371405751,-73.5704015911,"1","Sushi Bars, Restaurants"
"568",58334,"Ubi Sushi","Montréal","QC","H2T 2K8",45.5249247,-73.5996982,"1","Restaurants, Asian Fusion, Sushi Bars, Grocery, Food, Japanese"
"569",109987,"Bross Sushi Bar & Grill","Calgary","AB","T2W 3N4",50.9535392,-114.1163065,"0","Sushi Bars, Japanese, Restaurants, Seafood, American (Traditional)"
"570",80555,"Cafe Wasabi","Las Vegas","NV","89117",36.1430817,-115.2536257,"0","Restaurants, Japanese, Sushi Bars"
"571",175892,"Magic Sushi","Toronto","ON","M6G 1B7",43.6554425,-79.4162469,"0","Sushi Bars, Restaurants"
"572",111270,"Yama Asian Fusion","Charlotte","NC","28211",35.157032,-80.823983,"1","Restaurants, Asian Fusion, Japanese, Sushi Bars"
"573",66164,"Sushido","Laval","QC","H7X 3S9",45.5283303142,-73.7871076539,"1","Japanese, Restaurants, Sushi Bars"
"574",147920,"Sushiman","Montréal","QC","H3B 3Y5",45.5031208828,-73.5702228919,"1","Sushi Bars, Restaurants"
"575",24112,"Sushi Shop","Toronto","ON","M5B 1L2",43.6612136,-79.3826809,"0","Restaurants, Japanese, Sushi Bars"
"576",51251,"Osaka Japanese & Chinese Restaurant","Cornelius","NC","28031",35.44946,-80.88965,"1","Restaurants, Chinese, Sushi Bars, Japanese"
"577",61917,"YuSushi Takeaway","Richmond Hill","ON","L4B 3P2",43.8461479,-79.3793528,"1","Sushi Bars, Japanese, Restaurants"
"578",72862,"Sushi Stop Udon & Grill","Mesa","AZ","85202",33.3626577,-111.8779117,"1","Sushi Bars, Restaurants, Japanese"
"579",145918,"Tim Sushi and Cafe","Markham","ON","L3R 0G6",43.854806,-79.33701,"1","Japanese, Cafes, Ramen, Restaurants, Sushi Bars"
"580",122263,"Jjanga Steak & Sushi","Las Vegas","NV","89148",36.0764492,-115.2986212,"1","Bars, Sushi Bars, Restaurants, Nightlife, Steakhouses, Karaoke, Breakfast & Brunch, Japanese, Teppanyaki"
"581",33416,"Feng Lz Habachi Sushi & Bar","Broadview Heights","OH","44147",41.3144329,-81.6864448,"1","Sushi Bars, Japanese, Restaurants"
"582",45915,"Sushi Queen","Charlotte","NC","28262",35.3344176397,-80.7132860188,"1","Sushi Bars, Restaurants, Japanese, Food Court"
"583",29340,"Krazy Sushi","Las Vegas","NV","89149",36.291501,-115.287007,"1","Restaurants, Sushi Bars, Japanese"
"584",143200,"Yonge Sushi","Toronto","ON","M4N 2N1",43.7334567708,-79.404206872,"1","Restaurants, Sushi Bars, Japanese"
"585",112345,"Bonsai Fusion","Charlotte","NC","28202",35.2272493,-80.8386173,"1","Asian Fusion, Restaurants, Sushi Bars"
"586",79437,"Sawa Sushi","Las Vegas","NV","89139",36.0398786,-115.192804,"1","Food, Sushi Bars, Restaurants"
"587",82235,"Little Buddha Restaurant & Sushi Bar","Las Vegas","NV","89103",36.1109751587,-115.2070999146,"0","Asian Fusion, Sushi Bars, Chinese, Restaurants"
"588",66089,"Wild Fusion","Brunswick","OH","44212",41.238834,-81.82297,"1","Sushi Bars, Restaurants, Chinese"
