"","business_id","name","city","state","postal_code","latitude","longitude","is_open","categories"
"1364",20212,"E Sushi","Toronto","ON","M5S 1Y3",43.6653068,-79.4104203,"0","Sushi Bars, Restaurants"
"1365",121509,"Shiatsu'ssage 365 Sports Massage","Las Vegas","NV","89117",36.1335222556,-115.2785455808,"1","Reflexology, Occupational Therapy, Physical Therapy, Restaurants, Sushi Bars, Massage, Acupuncture, Beauty & Spas, Rehabilitation Center, Home Services, Health & Medical, Massage Therapy, Plumbing"
"1366",184110,"Sushi Bomb","Las Vegas","NV","89129",36.2195112416,-115.3255732442,"1","Ethnic Food, Specialty Food, Food, Restaurants, Sushi Bars, Japanese"
"1367",187595,"Fuji Sushi & Hibachi","Middleton","WI","53562",43.0911123,-89.5275719,"1","Restaurants, Japanese, Sushi Bars, Soup"
"1368",186508,"Sushi-Ya Japan","Etobicoke","ON","M9W 1H7",43.6901517,-79.5759278,"1","Japanese, Restaurants, Sushi Bars"
"1369",15336,"Senor Sushi","Mesa","AZ","85202",33.3934822083,-111.8618545532,"1","Japanese, Restaurants, Latin American, Bars, Mexican, Nightlife, Asian Fusion, Sushi Bars"
"1370",58419,"Momo Sushi","Boulder City","NV","89005",35.9770560135,-114.8362144455,"1","Sushi Bars, Restaurants"
"1371",85990,"Blue Wasabi Sushi and Martini Bar","Scottsdale","AZ","85250",33.52681,-111.9246221,"0","Sushi Bars, Restaurants"
"1372",45232,"Sushi Moto","Las Vegas","NV","89102",36.1264133,-115.1949565,"0","Restaurants, Japanese, Buffets, Sushi Bars"
"1373",37725,"Let's Roll","North York","ON","M2N 7L4",43.7759013,-79.4132609,"0","Restaurants, Sushi Bars"
"1374",82622,"Engrained Cafe","Tempe","AZ","85287",33.4177551,-111.9343722,"1","Sushi Bars, Restaurants, American (New)"
"1375",18693,"Seoul Poke Bowl","Charlotte","NC","28209",35.1922563,-80.8733216,"1","Restaurants, Poke, Sushi Bars, Food, Hawaiian"
"1376",187754,"Kibo Summerhill","Toronto","ON","M4V 1G3",43.6827471,-79.3922553,"1","Sushi Bars, Restaurants"
"1377",50787,"Li-Ao Sushi","Calgary","AB","T2Y 4G9",50.9053634208,-114.1117855292,"1","Sushi Bars, American (New), Restaurants, Food"
"1378",142358,"Sakura Seoul","Markham","ON","L3T 0C7",43.8035434,-79.4195738,"1","Sushi Bars, Restaurants, Japanese, Korean"
"1379",51867,"Hiro Sushi Restaurant","Toronto","ON","M5A 1J4",43.6505112592,-79.3714514814,"1","Caterers, Restaurants, Sushi Bars, Event Planning & Services, Japanese"
"1380",160153,"Sushi-ko","Las Vegas","NV","89129",36.2399544742,-115.2496108557,"1","Japanese, Sushi Bars, Teppanyaki, Restaurants"
"1381",121191,"Tan Izakaya","Pittsburgh","PA","15232",40.4504837,-79.9351521,"0","Ramen, Japanese, Restaurants, Sushi Bars"
"1382",149025,"Mashita Sushi","Toronto","ON","M8Y 0A7",43.6241658336,-79.4900633767,"1","Sushi Bars, Japanese, Restaurants"
"1383",82134,"Masa Sushi & Teppanyaki","Toronto","ON","M4Y 1S1",43.6686680996,-79.3854890059,"0","Restaurants, Sushi Bars, Food, Food Delivery Services, Japanese"
"1384",43185,"Maple Sushi","Aurora","ON","L4G 2N9",43.9984142466,-79.4743014545,"0","Restaurants, Sushi Bars"
"1385",80221,"Sushi On the Run","Toronto","ON","M5B 2H4",43.660699,-79.3835531,"1","Sushi Bars, Event Planning & Services, Caterers, Restaurants"
"1386",167315,"Takumi Japanese Restaurant","Madison","WI","53704",43.124856371,-89.3101472672,"1","Japanese, Restaurants, Sushi Bars"
"1387",54719,"Oishi Maki","Whitby","ON","L1N 4H2",43.880649,-78.942214,"1","Japanese, Restaurants, Sushi Bars"
"1388",116136,"Arisu Korean BBQ & Sushi","Toronto","ON","M6G 1K4",43.6650813,-79.4126923,"1","Caterers, Sushi Bars, Japanese, Barbeque, Korean, Event Planning & Services, Restaurants"
"1389",182854,"Tomo Steakhouse & Sushi Bar","Strongsville","OH","44136",41.306052,-81.833935,"0","Sushi Bars, Restaurants, Japanese"
"1390",123584,"Journey Sushi & Seafood Buffet","Madison","WI","53704",43.120559,-89.305994,"1","Restaurants, Sushi Bars, Seafood, Buffets"
"1391",109182,"Sukiyaki House","Calgary","AB","T2P 1K3",51.0444854,-114.0660356,"1","Sushi Bars, Japanese, Restaurants"
"1392",170803,"John's Chinese & Sushi Restaurant","Pittsburgh","PA","15241",40.3527436,-80.051873,"0","Chinese, Restaurants, Sushi Bars"
"1393",143170,"Assembly Chef's Hall","Toronto","ON","M5H 2G4",43.6503522,-79.3837951,"1","Japanese, Barbeque, Ramen, Public Markets, Pizza, Food Court, Restaurants, Food, Cafes, Vegan, Sushi Bars, Shopping, Diners, Bars, Breakfast & Brunch, Coffee & Tea, Nightlife"
"1394",53043,"Gyoko Sushi & Bar","Toronto","ON","M4C 4H3",43.6858619724,-79.3111982569,"1","Sushi Bars, Restaurants"
"1395",41304,"TWIISTED Burgers & Sushi","Medina","OH","44256",41.153419,-81.864609,"1","Bars, Burgers, Nightlife, Restaurants, Sushi Bars, American (New), American (Traditional)"
"1396",143845,"Ginban Sushi","Phoenix","AZ","85048",33.3038863385,-111.9992128259,"1","Restaurants, Sushi Bars, Food, Specialty Food, Japanese"
"1397",183623,"Gallery Sushi","Toronto","ON","M5T 3K1",43.654381909,-79.3904685974,"1","Japanese, Restaurants, Sushi Bars"
"1398",1256,"Hokkaido Japanese Express","Concord","NC","28027",35.4295111,-80.6078019,"1","Japanese, Sushi Bars, Asian Fusion, Restaurants"
"1399",29398,"Kabuto","Las Vegas","NV","89146",36.1266230217,-115.2099628274,"1","Food, Restaurants, Sushi Bars, Japanese"
"1400",19043,"Sushi Style","Toronto","ON","M5B",43.6564276251,-79.3779705887,"1","Salad, Sushi Bars, Restaurants, Asian Fusion"
"1401",8462,"Sushi Ichiban Ellesmere","Toronto","ON","M1R 4C2",43.7592178597,-79.3111342209,"1","Restaurants, Sushi Bars, Japanese"
"1402",91799,"Oki Sushi","Madison","WI","53718",43.0853409,-89.276022,"1","Restaurants, Sushi Bars"
"1403",155932,"Imperial Wok Chinese Restaurant","Solon","OH","44139",41.3852806091,-81.4384078979,"1","Seafood, Chinese, Restaurants, Sushi Bars"
"1404",44574,"Ahipoki Bowl","Scottsdale","AZ","85257",33.4792331,-111.9257468,"1","Sushi Bars, Restaurants, Desserts, Poke, Soup, Seafood, Food, Hawaiian"
"1405",166805,"Maki My Way","Toronto","ON","M5V 1J5",43.6463565,-79.3900436,"0","Restaurants, Sushi Bars, Asian Fusion, Japanese"
"1406",92941,"Luke Wholey's Wild Alaskan Grille","Pittsburgh","PA","15222",40.4519212353,-79.982807323,"1","Sushi Bars, Bars, Cocktail Bars, Seafood, Restaurants, Nightlife, Dance Clubs"
"1407",122583,"Sushi Too","Pittsburgh","PA","15232",40.4507666,-79.9341321,"1","Sushi Bars, Japanese, Restaurants, Seafood"
"1408",185718,"The Warren Bar and Burrow","Pittsburgh","PA","15222",40.4426526,-79.9998171,"1","Sushi Bars, Cocktail Bars, Bars, Restaurants, Nightlife"
"1409",159950,"Osaka Sushi","Toronto","ON","M3C 1T2",43.7140387,-79.3342233,"1","Sushi Bars, Japanese, Restaurants"
"1410",155936,"Kabuki Japanese Restaurant","Glendale","AZ","85305",33.5339543188,-112.2610473633,"1","Japanese, Restaurants, Sushi Bars, Asian Fusion"
"1411",188716,"Zen Restaurant","Verona","PA","15147",40.5262656025,-79.8174745962,"1","Sushi Bars, Chinese, Restaurants, Pan Asian"
"1412",8283,"Globefish Sushi & Izakaya","Calgary","AB","T2H",51.000255,-114.073301,"1","Japanese, Sushi Bars, Restaurants"
"1413",123179,"Tides Seafood & Sushi Bar","Henderson","NV","89052",36.020263,-115.089969,"1","Restaurants, Sushi Bars, Seafood"
"1414",186867,"Kotta","Toronto","ON","M6K 1G2",43.6388353,-79.4284129,"1","Japanese, Sushi Bars, Restaurants"
"1415",3438,"Tsunami","Concord","NC","28027",35.364787,-80.710257,"1","Japanese, Restaurants, Sushi Bars"
"1416",126611,"Pei Wei","Chandler","AZ","85248",33.2611476514,-111.8605358899,"1","Chinese, Sushi Bars, Fast Food, Gluten-Free, Japanese, Restaurants, Salad, Asian Fusion"
"1417",164295,"Kiro Sushi","Toronto","ON","M4W 2G8",43.6722662303,-79.3874411896,"1","Sushi Bars, Japanese, Restaurants"
"1418",170221,"Koi Poke - The Plant","Chandler","AZ","85249",33.2473361,-111.7879276,"1","Poke, Hawaiian, Food, Restaurants, Sushi Bars"
"1419",98302,"PURE Sushi Colony","Phoenix","AZ","85014",33.5179419856,-112.0654482897,"1","Restaurants, Japanese, Sushi Bars, Asian Fusion"
"1420",179539,"Ho Sushi Express","Toronto","ON","M1H 3J1",43.7809966,-79.2474296,"1","Restaurants, Sushi Bars, Japanese"
"1421",168927,"Ichiban Sushi House","North York","ON","M2M 3X4",43.794269,-79.4201424,"1","Restaurants, Japanese, Sushi Bars"
"1422",17558,"Sakura Sushi Hibachi & Grill","Cornelius","NC","28031",35.4819535,-80.8845173,"1","Japanese, Restaurants, Chinese, Sushi Bars"
"1423",155511,"Okada","Las Vegas","NV","89109",36.1268768,-115.1658732,"0","Japanese, Sushi Bars, Restaurants"
"1424",38613,"Fuki Sushi Bar","Laval","QC","H7V 2V3",45.539786,-73.747793,"1","Sushi Bars, Restaurants, Japanese"
"1425",95679,"Osuka Sushi","Montréal","QC","H2W 1N7",45.5160812,-73.5743936,"1","Sushi Bars, Japanese, Restaurants"
"1426",144405,"Zanga Sushi","Montréal","QC","H2G 1K9",45.5410658,-73.5984212,"1","Sushi Bars, Japanese, Restaurants"
"1427",43361,"Rising Sun Japanese Restaurant & Sushi Bar","Las Vegas","NV","89117",36.1465677,-115.3007512,"0","Japanese, Sushi Bars, Restaurants"
"1428",49075,"Maiku Sushi","Pittsburgh","PA","15222",40.4490736802,-79.9872996658,"1","Sushi Bars, Restaurants"
"1429",186323,"Pho Cao","Tempe","AZ","85281",33.4369319,-111.9270714,"0","Restaurants, Nightlife, Vietnamese, Karaoke, Sushi Bars, Bars"
"1430",113808,"Manna Sushi","Calgary","AB","T2L 1V9",51.1013583,-114.1402969,"1","Ethnic Food, Sushi Bars, Japanese, Imported Food, Food, Specialty Food, Restaurants"
"1431",141082,"Sushi Chef","Montréal","QC","H1N 1B3",45.5753221,-73.5480649,"1","Restaurants, Sushi Bars"
"1432",68490,"Sushi Muramoto","Madison","WI","53705",43.0722438447,-89.4523339244,"1","Restaurants, Sushi Bars"
"1433",103622,"Sushi Garden","Newmarket","ON","L3Y 3E3",44.0761186,-79.4338628,"1","Japanese, Specialty Food, Sushi Bars, Restaurants, Food, Ethnic Food"
"1434",162340,"Sushi King","Las Vegas","NV","89121",36.1006736,-115.1002334,"1","Japanese, Restaurants, Hawaiian, Sushi Bars, Asian Fusion, Chinese"
"1435",41554,"Takara","Montréal","QC","H3A 1T5",45.5009341,-73.5737683,"1","Sushi Bars, Restaurants, Japanese"
"1436",36238,"Sushi Express","Toronto","ON","M4R",43.7066847,-79.3994865,"1","Restaurants, Japanese, Sushi Bars"
"1437",61589,"Ichiban Buffet","Champaign","IL","61821",40.1170483,-88.2783637,"0","Chinese, Sushi Bars, Restaurants, Buffets"
"1438",71,"Jade Garden Restaurant","Murrysville","PA","15668",40.426683,-79.6782316,"1","Restaurants, Sushi Bars, Chinese, Thai"
"1439",172457,"Hello Tokyo","Las Vegas","NV","89121",36.1162016009,-115.0901969472,"0","Seafood, Sushi Bars, Japanese, Restaurants"
"1440",66592,"Globefish Kensington","Calgary","AB","T2N 1Z7",51.0542528,-114.0943456,"1","Sushi Bars, Seafood, Restaurants"
"1441",400,"Sushi Fix","Glendale","AZ","85308",33.6371533,-112.2000542,"1","Japanese, Steakhouses, Restaurants, Sushi Bars"
"1442",112568,"Sushi Q","Phoenix","AZ","85021",33.5657923,-112.0991561,"0","Japanese, Restaurants, Sushi Bars"
"1443",192017,"Sushi Star","Matthews","NC","28105",35.1355697,-80.7381149,"1","Sushi Bars, Restaurants, Asian Fusion"
"1444",83067,"Le Ninja","Montréal","QC","H3G 2E3",45.4960685,-73.5757832,"0","Restaurants, Sushi Bars, Japanese"
"1445",165042,"Umami","Pittsburgh","PA","15201",40.4666498,-79.9642252,"1","Restaurants, Sushi Bars, Nightlife, Japanese, Bars"
"1446",168884,"Aiko Sushi","Montréal","QC","H2J 1Z5",45.5323969,-73.5746937,"1","Sushi Bars, Restaurants"
"1447",65722,"Kuu Bistro","Montréal","QC","H3B",45.5040678,-73.5680584,"1","Sushi Bars, Bars, Japanese, Restaurants, Nightlife"
"1448",69120,"SAKE Asian Cuisine & Sushi Bar","Pittsburgh","PA","15203",40.4272412,-79.9648354,"0","Sushi Bars, Asian Fusion, Restaurants"
"1449",32248,"Benji's Grill","Concord","NC","28027",35.4017664,-80.7597901,"0","Seafood, Japanese, American (New), Sushi Bars, Restaurants"
"1450",38325,"Takamatsu Of Chandler","Chandler","AZ","85225",33.3506971,-111.8430441,"0","Korean, Sushi Bars, Restaurants"
"1451",62556,"Silk Road Gourmet Chinese","Pittsburgh","PA","15236",40.3591070736,-80.0020897818,"1","Chinese, Sushi Bars, Restaurants, Japanese, Steakhouses"
"1452",27692,"Kinjo Sushi","Calgary","AB","T3A 5R8",51.1048977896,-114.1621478988,"1","Sushi Bars, Japanese, Restaurants"
"1453",24821,"Nakato Japanese Steakhouse","Charlotte","NC","28262",35.305848,-80.7542218,"1","Sushi Bars, Japanese, Restaurants"
"1454",16631,"Sushi Newtown","Montréal","QC","H3C 0R6",45.492304,-73.562307,"1","Restaurants, Sushi Bars"
"1455",62290,"Fusion Sushi - Ranchlands","Calgary","AB","T3G 2A7",51.12339953,-114.1982866812,"1","Japanese, Restaurants, Sushi Bars, Asian Fusion"
"1456",126022,"Red Ginger","Charlotte","NC","28202",35.2240551793,-80.8455877508,"1","Sushi Bars, Restaurants, Steakhouses"
"1457",141851,"Shogun Sushi & Ramen","Richmond Hill","ON","L4C 1T7",43.8738034759,-79.4370586772,"0","Restaurants, Sushi Bars, Japanese"
"1458",89505,"Sushi Garden","Toronto","ON","M4R 1A1",43.706514,-79.3995179,"0","Sushi Bars, Restaurants, Japanese"
"1459",30576,"Kushi-Ya","Calgary","AB","T2E 8K1",51.0590636,-114.0625183,"0","Japanese, Restaurants, Sushi Bars"
"1460",42604,"Omi Sushi","Toronto","ON","M1E 2M8",43.7659173,-79.1916725,"0","Restaurants, Beer, Wine & Spirits, Chinese, Sushi Bars, Japanese, Food"
"1461",34757,"Kobe Sushi","Mississauga","ON","L4Z 3M2",43.605611,-79.650811,"0","Restaurants, Japanese, Food, Seafood Markets, Specialty Food, Sushi Bars, Ethnic Food"
"1462",92878,"Fish Market Restaurant","Phoenix","AZ","85016",33.5101676,-112.0449114,"0","Restaurants, Sushi Bars, Seafood"
"1463",135677,"Fresh Wasabi","Peoria","AZ","85383",33.7114452,-112.2731482,"0","Restaurants, Sushi Bars"
"1464",22552,"Sushi Dépanneur","Montréal","QC","H2J 1Z1",45.526716,-73.580178,"1","Japanese, Sushi Bars, Restaurants"
"1465",125467,"netsui sushi","Calgary","AB","T2E 6W5",51.1320882254,-114.008214602,"1","Sushi Bars, Restaurants"
"1466",114037,"Sushi Ave","Gilbert","AZ","85234",33.3660198,-111.722666,"1","Japanese, Sushi Bars, Restaurants"
"1467",141844,"Megumi Sushi","Toronto","ON","M6R 2K3",43.6394976,-79.446731,"1","Restaurants, Sushi Bars, Japanese"
"1468",23900,"Uchi","Montréal","QC","H2L 3L7",45.519608,-73.561305,"1","Sushi Bars, Japanese, Restaurants"
"1469",79867,"Malee's Thai Bistro","Phoenix","AZ","85050",33.676431,-111.9761895,"0","Restaurants, Thai, Sushi Bars"
"1470",189832,"Kimama","Toronto","ON","M5V 1H2",43.6457321685,-79.38988287,"1","Korean, Restaurants, Sushi Bars"
"1471",95984,"Avocado Sushi","Toronto","ON","M5S 2B3",43.667781,-79.3884731,"1","Restaurants, Sushi Bars, Japanese"
"1472",127698,"Miso","Montréal","QC","H3Z 1P1",45.48895,-73.5845436,"1","Restaurants, Event Planning & Services, Japanese, Sushi Bars, Caterers"
"1473",161374,"La Rizière d'Asie","Châteauguay","QC","J6J 2R4",45.3589836423,-73.7195621424,"1","Asian Fusion, Sushi Bars, Restaurants"
"1474",174798,"Red Bowl Asian Bistro","Matthews","NC","28105",35.0820325883,-80.7289966546,"1","Asian Fusion, Chinese, Sushi Bars, Restaurants"
"1475",160901,"Takara","Madison","WI","53711",43.0503272,-89.4745296,"1","Japanese, Restaurants, Sushi Bars"
"1476",116153,"Hinata Sushi & Asian Cuisine","Whitby","ON","L1M",43.9573085254,-78.9615652549,"1","Japanese, Sushi Bars, Restaurants, Asian Fusion"
"1477",82849,"Sake Express","Clover","SC","29710",35.1204611287,-81.0895103413,"0","Seafood, Japanese, Sushi Bars, Restaurants"
"1478",174451,"Sushi On Roncy","Toronto","ON","M6R 2M3",43.6478044,-79.4494705,"1","Restaurants, Sushi Bars, Japanese"
"1479",75759,"Asuka Japanese Restaurant","Toronto","ON","M5R 1B9",43.6710152,-79.392729,"0","Japanese, Sushi Bars, Restaurants"
"1480",161471,"Noka Sushi","Toronto","ON","M5S 1Y4",43.6656165,-79.4088007,"0","Japanese, Gluten-Free, Sushi Bars, Restaurants"
"1481",186454,"Go Believe","Whitby","ON","L1N 7C5",43.8885538,-78.9036335,"0","Restaurants, Sushi Bars"
"1482",49651,"I Sushi","Montréal","QC","H2Z 1N7",45.5031932,-73.5622189,"1","Sushi Bars, Restaurants"
"1483",158441,"OBON Sushi Bar Ramen","Scottsdale","AZ","85254",33.6230421,-111.9243646,"1","Restaurants, Korean, Noodles, Ramen, Sushi Bars, Japanese"
"1484",93364,"Japan 49","Charlotte","NC","28273",35.1161412619,-80.9587213397,"1","Chinese, Restaurants, Sushi Bars, Noodles, Japanese, Teppanyaki, Asian Fusion"
"1485",1012,"Sushi Bay","Toronto","ON","M4C 3G5",43.696754,-79.329362,"1","Restaurants, Sushi Bars, Japanese"
"1486",71650,"Sushi Pro","Montréal","QC","H3K 1J8",45.478679,-73.5687031,"1","Japanese, Food, Restaurants, International Grocery, Sushi Bars"
"1487",90811,"A+ Sushi & Bibim","Toronto","ON","M6K 1L8",43.6409643067,-79.4343217932,"1","Restaurants, Korean, Sushi Bars, Japanese"
"1488",81165,"Fusion Sushi","Calgary","AB","T2N 1V5",51.0528487,-114.0863089,"1","Thai, Japanese, Sushi Bars, Restaurants"
"1489",82401,"Kibo Sushi House","North York","ON","M5M 2G1",43.7316079,-79.4189808,"1","Bars, Nightlife, Restaurants, Japanese, Sushi Bars"
"1490",188574,"Vip Sushi Restaurant","Thornhill","ON","L3T 2C6",43.8263863,-79.4263004,"0","Restaurants, Sushi Bars"
"1491",67970,"Osaka Japanese Steakhouse","Gilbert","AZ","85297",33.2803705027,-111.7887411775,"1","Japanese, Sushi Bars, Salad, Restaurants"
"1492",129623,"Watami Hibachi Steakhouse","West Mifflin","PA","15122",40.3486206,-79.9489279,"1","Steakhouses, Sushi Bars, Restaurants"
"1493",178873,"Yuki Sushi Bar","Montréal","QC","H2L 1S1",45.5229507,-73.5610406,"1","Sushi Bars, Restaurants, Japanese"
"1494",104494,"Sushi Royal","Montréal","QC","H2V 4E9",45.5193439,-73.5947283,"1","Sushi Bars, Restaurants, Japanese"
"1495",50205,"Yoshi Sushi","Montréal","QC","H2J 1J1",45.5352506,-73.5823539,"1","Restaurants, Sushi Bars"
"1496",1829,"General Sushi","Newmarket","ON","L3Y 2R9",44.0659765277,-79.4323628872,"1","Restaurants, Food, Desserts, Japanese, Sushi Bars"
"1497",43529,"Ichiban Sushi","Toronto","ON","M5E 1C7",43.6486648,-79.3743083,"1","Restaurants, Sushi Bars"
"1498",85446,"Tokyo Grill Express","Las Vegas","NV","89120",36.0724018,-115.1004216,"0","Food, Teppanyaki, Desserts, Japanese, Restaurants, Sushi Bars"
"1499",71263,"Solo Sushi Ya","Newmarket","ON","L3Y 2N6",44.0580178087,-79.4671871513,"1","Restaurants, Sushi Bars, Japanese, Brazilian"
"1500",144893,"Sushi Roku","Scottsdale","AZ","85251",33.5019692,-111.9240637,"1","Gluten-Free, Japanese, Restaurants, Lounges, Sushi Bars, Food, Nightlife, Bars"
"1501",131183,"Katana on Bay","Toronto","ON","M5H 2R2",43.6503044,-79.3804595,"1","Sushi Bars, Restaurants, Japanese, Asian Fusion"
"1502",129139,"Sushi Taxi - Griffingtown","Montréal","QC","H3J 1M3",45.4885758,-73.568285,"1","Asian Fusion, Japanese, Sushi Bars, Restaurants"
"1503",36989,"Sushi 101","Charlotte","NC","28209",35.171736,-80.847091,"1","Restaurants, Sushi Bars, Japanese, Noodles"
"1504",133281,"Toji Sushi","Toronto","ON","M9A 1C2",43.645143,-79.532489,"1","Food, Sushi Bars, Restaurants"
"1505",100264,"Kanda Plus","St-Leonard","QC","H1S 1V7",45.592348,-73.57094,"1","Tapas Bars, Sushi Bars, Restaurants, Asian Fusion"
"1506",105113,"Sho Izakaya","Toronto","ON","M6K 1L9",43.641153,-79.4344753,"1","Sushi Bars, Tapas/Small Plates, Restaurants, Japanese, Tapas Bars"
"1507",152261,"Tatami Sushi Bar and Restaurant","Montréal","QC","H2Y 1T1",45.5038733,-73.5571859,"1","Restaurants, Sushi Bars"
"1508",75251,"Uni Sushi","Greenfield Park","QC","J4V 2H9",45.484529,-73.467674,"1","Restaurants, Sushi Bars, Japanese"
"1509",83873,"Tataki Epiceries","Montréal","QC","H2W 1G9",45.5176815,-73.5788766,"1","Restaurants, Sushi Bars, Food, Specialty Food"
"1510",12203,"Sapporo","Las Vegas","NV","89147",36.1139286,-115.3042546,"0","Sushi Bars, Nightlife, Japanese, Bars, Lounges, Restaurants"
"1511",133187,"Sata Sushi","Montréal","QC","H1W 1P8",45.5427729,-73.546401,"1","Vegan, Restaurants, Sushi Bars, Japanese, Vegetarian"
"1512",23384,"Tekka Sushi","Joliette","QC","J6E 3H4",46.024605,-73.438382,"1","Sushi Bars, Restaurants"
"1513",13402,"Tru Sushi","Scottsdale","AZ","85251",33.497292,-111.9223571,"0","DJs, Restaurants, Cocktail Bars, Nightlife, Event Planning & Services, Bars, Sushi Bars"
"1514",76323,"Amico Sushi & Grill","Toronto","ON","M6G 1B4",43.6552619,-79.4141425,"0","Tapas Bars, Japanese, Sushi Bars, Restaurants"
"1515",44538,"Ichi Rock","Calgary","AB","T2P 0V7",51.0478485,-114.0819771,"1","Restaurants, Food, Ramen, Japanese, Sushi Bars"
"1516",110995,"Sushi Palace","Verdun","QC","H3E 1P4",45.4682723,-73.5413381,"0","Restaurants, Asian Fusion, Sushi Bars, Japanese"
"1517",55311,"Biwon Korean BBQ & Sushi Restaurant","Las Vegas","NV","89102",36.1439175,-115.1790272,"1","Asian Fusion, Sushi Bars, Korean, Restaurants, Barbeque, Japanese"
"1518",122190,"Harmonie Orientale","Lasalle","QC","H8N 1T7",45.4283025,-73.6294908,"1","Restaurants, Szechuan, Chinese, Sushi Bars"
"1519",36473,"Szechuan Spice","Pittsburgh","PA","15206",40.4571291,-79.9334864,"1","Hot Pot, Chinese, Restaurants, Sushi Bars, Japanese, Szechuan"
"1520",44154,"Poke Guys","Markham","ON","L6G 0E3",43.8505186,-79.3256871,"1","Hawaiian, Restaurants, Food, Sushi Bars, Poke"
"1521",134724,"Buffet At Asia","Las Vegas","NV","89146",36.1447113,-115.2422221,"1","Seafood, Sushi Bars, Korean, Restaurants, Chinese, Buffets, Dim Sum, Japanese"
"1522",98942,"Sushi Express","Madison","WI","53715",43.0733361,-89.396349,"1","Restaurants, Japanese, Sushi Bars"
"1523",135809,"Nori Sushi","Toronto","ON","M9V 1B4",43.742925,-79.5870572,"1","Restaurants, Japanese, Sushi Bars"
"1524",163451,"Sushi Dragon","Etobicoke","ON","M9W 1J1",43.6904475,-79.5762051,"0","Sushi Bars, Restaurants"
"1525",20375,"Hikari Uni Sushi","Phoenix","AZ","85033",33.4811859,-112.2015053,"0","Sushi Bars, Restaurants"
"1526",175986,"Restaurant Park","Westmount","QC","H3Z 2N4",45.4783516,-73.6029401,"1","Specialty Food, Asian Fusion, Bakeries, Restaurants, Food, Japanese, Health Markets, Seafood, Sushi Bars, Coffee & Tea"
"1527",105902,"Bibab Express","Toronto","ON","M4W 2H2",43.6731834412,-79.3881072998,"1","Sushi Bars, Restaurants"
"1528",181063,"Mr Poké Bowls & Rolls","Las Vegas","NV","89146",36.148114,-115.2426044,"0","Food, Japanese, Hawaiian, Mexican, Do-It-Yourself Food, Asian Fusion, Sushi Bars, Restaurants, Fast Food, Poke"
"1529",53005,"Kokoro Sushi","Toronto","ON","M6B 3J6",43.7090137,-79.4438066,"0","Restaurants, Sushi Bars"
"1530",91250,"Maison Du Japon","Markham","ON","L3R 1A8",43.8257944,-79.3526895,"0","Sushi Bars, Japanese, Restaurants"
"1531",156158,"Ste-Adèle Sushi","Sainte-Adèle","QC","J8B 1A7",45.94826,-74.126125,"1","Restaurants, Sushi Bars, Japanese"
"1532",132128,"Island Sushi & Grill","Las Vegas","NV","89123",36.018286,-115.1179043,"1","Japanese, Restaurants, Donuts, Food, Breakfast & Brunch, Hawaiian, Poke, Sushi Bars"
"1533",57706,"Bento Zushi","Calgary","AB","T2P 2W2",51.04642,-114.0671283,"1","Restaurants, Sushi Bars"
"1534",172354,"Avocado Sushi du Village","Pointe-Claire","QC","H9S 4K9",45.4292862,-73.8242416,"1","Restaurants, Sushi Bars, Japanese, Food"
"1535",162991,"Akai Hana Sushi & Grill","Goodyear","AZ","85338",33.4720905777,-112.3920142651,"1","Sushi Bars, Restaurants, Japanese"
"1536",94703,"Little Tokyo","Pittsburgh","PA","15228",40.3817844,-80.0443465,"1","Sushi Bars, Restaurants, Japanese"
"1537",159226,"Pure Sushi South","Scottsdale","AZ","85251",33.492761,-111.922982,"0","Restaurants, Japanese, Sushi Bars"
"1538",164003,"Kung Foo Noodle","Huntersville","NC","28078",35.446553,-80.879669,"1","Thai, Ramen, Noodles, Asian Fusion, Sushi Bars, Restaurants, Japanese, Chinese"
"1539",8631,"Yoshi's Grill","Huntersville","NC","28078",35.4060418164,-80.8646890311,"1","Japanese, Asian Fusion, Sushi Bars, Restaurants"
"1540",17348,"Hibachi Grill & Supreme Buffet","Las Vegas","NV","89110",36.1674186472,-115.0637319618,"1","Chinese, Buffets, Sushi Bars, Restaurants"
"1541",7797,"Kaze Sushi","Las Vegas","NV","89146",36.1280756,-115.2245664,"0","Japanese, Sushi Bars, Restaurants"
"1542",190900,"Lahaina Grill","Las Vegas","NV","89147",36.1064325,-115.3143315,"0","Sports Bars, Bars, Sushi Bars, Asian Fusion, Nightlife, Japanese, Restaurants, Hawaiian"
"1543",120063,"El Cachi Mexican Kitchen","Las Vegas","NV","89119",36.0977842437,-115.1483938464,"0","Seafood, Sushi Bars, Mexican, Restaurants"
"1544",23013,"Issi's Place","south Euclid","OH","44121",41.5017231245,-81.5202619135,"1","Sushi Bars, Restaurants, Vegetarian, Pizza"
"1545",72414,"Asakusa","Toronto","ON","M5V 1K1",43.6456244,-79.3935287,"0","Restaurants, Sushi Bars"
"1546",38871,"Sushi House","Las Vegas","NV","89142",36.1580682974,-115.0462754442,"1","Sushi Bars, Japanese, Restaurants"
"1547",140716,"Kibo Sushi","Toronto","ON","M5V 3P7",43.6466578,-79.3941256,"1","Japanese, Restaurants, Sushi Bars"
"1548",6730,"Buffet Asia","Henderson","NV","89014",36.0725902,-115.0799169,"0","Buffets, Chinese, Sushi Bars, Japanese, Seafood, Restaurants, Asian Fusion, Dim Sum, Korean, Thai"
"1549",62708,"Vua","Montréal","QC","H2X 3K3",45.5148967,-73.5621983,"1","Restaurants, Sushi Bars, Sandwiches, Asian Fusion, Vietnamese, Chinese"
"1550",52404,"Sung's House","Cleveland","OH","44115",41.5010661,-81.6808243,"1","Japanese, Sushi Bars, Korean, Restaurants"
"1551",163060,"Heart Sushi","Toronto","ON","M2J 5A7",43.777442469,-79.3438917026,"1","Japanese, Sushi Bars, Restaurants"
"1552",70985,"O-my Sushi","Las Vegas","NV","89145",36.1604854,-115.289963,"1","Restaurants, Japanese, Sushi Bars"
"1553",124898,"Hamaru Sushi","Toronto","ON","M3B 2M3",43.7552425,-79.3598514,"1","Sushi Bars, Seafood, Restaurants, Korean, Japanese"
"1554",104640,"Sushi Perrot","L'ile-Perrot","QC","J7V 4W7",45.3959716,-73.9576383,"1","Restaurants, Sushi Bars"
"1555",18273,"Kona Grill","Las Vegas","NV","89145",36.1638735074,-115.289943661,"1","Sushi Bars, Restaurants, Hawaiian, Asian Fusion, American (New)"
"1556",162504,"Mikado Sushi Robata","Toronto","ON","M1V 5M3",43.8100427,-79.3062067,"0","Sushi Bars, Restaurants, Japanese"
