"","business_id","name","city","state","postal_code","latitude","longitude","is_open","categories"
"496",99793,"Water Garden Cafe","Cleveland","OH","44102",41.4725574,-81.7370225,"1","American (Traditional), Vegetarian, Vegan, Restaurants, Cafes"
"497",153582,"Veganbites","Las Vegas","NV","89117",36.1435828564,-115.2511349542,"1","Vegan, Food, Restaurants, Bakeries, Breakfast & Brunch"
"498",82473,"Veggie Planet","Mississauga","ON","L5T1Y7",43.6731807,-79.6757568,"1","Vegetarian, Pizza, Indian, Restaurants, Vegan, Burgers"
"499",12346,"Madras Cafe","Charlotte","NC","28269",35.3424757,-80.7706758,"1","Restaurants, Indian, Vegetarian, Vegan, Buffets"
"500",100501,"Grabbagreen","Scottsdale","AZ","85260",33.584306,-111.922392,"0","Food, Vegetarian, Juice Bars & Smoothies, Asian Fusion, Breakfast & Brunch, Restaurants, Vegan"
"501",127982,"D'Lite Healthy On The Go","Scottsdale","AZ","85260",33.5816954645,-111.9232237654,"1","Sandwiches, American (New), Breakfast & Brunch, Vegan, Coffee & Tea, Restaurants, American (Traditional), Food"
"502",131549,"Nekter Juice Bar","Las Vegas","NV","89134",36.19185,-115.3053811,"1","Food, Juice Bars & Smoothies, Vegan, Restaurants, Acai Bowls, Gluten-Free"
"503",186195,"Hive Café","Montréal","QC","H3G 1M8",45.4970605,-73.5788022,"1","Restaurants, Sandwiches, Salad, Vegan"
"504",40154,"Sinatra","Las Vegas","NV","89109",36.129913,-115.165432,"1","Italian, Vegan, Restaurants"
"505",92192,"Thai Time Kitchen","Mesa","AZ","85204",33.3835901,-111.8027347,"1","Vegan, Restaurants, Thai, Gluten-Free"
"506",88033,"Ginger","Toronto","ON","M5S 1Y4",43.6655484,-79.409125,"0","Vegan, Restaurants, Vietnamese"
"507",93001,"Simon's Vegan Hot Dogs","Phoenix","AZ","85006",33.4704453,-112.0657354,"1","Vegan, Restaurants, Food Stands"
"508",144828,"PizzaRev","Henderson","NV","89014",36.0631269,-115.0453743,"1","Vegan, Pizza, Fast Food, Restaurants"
"509",30580,"Cinnaholic","Scarborough","ON","M1V 5P7",43.8355856,-79.253969,"1","Vegan, Restaurants, Bakeries, Food, Desserts"
"510",24488,"O'Bol","Montréal","QC","H5A 1K6",45.4999204,-73.5654861,"0","Vegetarian, Vegan, Food Stands, Restaurants, Fast Food"
"511",3793,"Long Life Vege Restaurant","Las Vegas","NV","89121",36.1143211,-115.0918871,"0","Vegan, Restaurants, Chinese, Vegetarian"
"512",113853,"The Fresh Fix of Heights","Cleveland","OH","44118",41.49859,-81.5655266,"1","Breakfast & Brunch, Vegan, Juice Bars & Smoothies, Restaurants, American (Traditional), Food"
"513",24370,"One Life Raw Juice Bar","Charlotte","NC","28209",35.1731814,-80.8400346,"0","Live/Raw Food, Food, Vegan, Restaurants, Juice Bars & Smoothies, Organic Stores"
"514",8687,"Alternative Junkie","Las Vegas","NV","89145",36.1683449,-115.2659777,"0","Food Stands, Vegetarian, Vegan, Street Vendors, Restaurants, Personal Chefs, Food Delivery Services, Organic Stores, Food, Event Planning & Services"
"515",166231,"Vegan Honey Company","Las Vegas","NV","89102",36.1503727871,-115.2051210246,"1","Specialty Food, Restaurants, Vegan, Honey, Farmers Market, Food"
"516",26423,"Studio.89","Mississauga","ON","L4W 0B8",43.6273691,-79.6270076,"1","Vegan, Cafes, Restaurants, Breakfast & Brunch, Community Service/Non-Profit, Local Services"
"517",149587,"Vivalia Bistro Express","Montréal","QC","H2Y 1T7",45.502488,-73.558276,"1","Sandwiches, Vegan, Gluten-Free, Organic Stores, Restaurants, Food, Vegetarian, Juice Bars & Smoothies, International"
"518",25364,"Pizzaiolo","Toronto","ON","M6S 4W4",43.6491819,-79.4834832,"1","Vegan, Pizza, Gluten-Free, Restaurants"
"519",13407,"Ta Lew Thai Bistro","Gilbert","AZ","85296",33.3231303,-111.7205811,"1","Vegan, Gluten-Free, Thai, Restaurants"
"520",168531,"Pane E Vino","Mississauga","ON","L4Z 3E8",43.6284956,-79.6734524,"1","Health Markets, Specialty Food, Soup, Food, Italian, Sandwiches, Coffee & Tea, Vegan, Salad, Restaurants"
"521",122137,"Banzo","Madison","WI","53704",43.1016722349,-89.3645954132,"1","Street Vendors, Restaurants, Food Trucks, Vegan, Mediterranean, Comfort Food, Gluten-Free, Food Stands, Food"
"522",19878,"Jerusalem Shawarma","Calgary","AB","T3E 6S9",51.0167158587,-114.1609223932,"1","Middle Eastern, Restaurants, Mediterranean, Vegan"
"523",143170,"Assembly Chef's Hall","Toronto","ON","M5H 2G4",43.6503522,-79.3837951,"1","Japanese, Barbeque, Ramen, Public Markets, Pizza, Food Court, Restaurants, Food, Cafes, Vegan, Sushi Bars, Shopping, Diners, Bars, Breakfast & Brunch, Coffee & Tea, Nightlife"
"524",84489,"Cinnaholic","Las Vegas","NV","89149",36.2716417492,-115.2676487752,"1","Food, Vegan, Bakeries, Desserts, Breakfast & Brunch, Restaurants"
"525",140375,"Flat Top Grill","Champaign","IL","61820",40.1114257,-88.2304288,"0","Restaurants, Vegetarian, Vegan, Gluten-Free, Do-It-Yourself Food, Asian Fusion, Food"
"526",79591,"The Brilliant Bagel","Scottsdale","AZ","85258",33.570389,-111.886452,"1","Bagels, Bakeries, Restaurants, Vegan, Food, Coffee & Tea, Vegetarian"
"527",15772,"iPho","Charlotte","NC","28209",35.1611334,-80.8492823,"0","Vegan, Soup, Sandwiches, Vegetarian, Chicken Wings, Restaurants, Vietnamese, Noodles"
"528",140903,"süüp health bar","Toronto","ON","M5B 1S8",43.6592409,-79.38286,"1","Restaurants, Salad, Vegetarian, Soup, Vegan, Bars, Nightlife"
"529",94363,"Cafe No Fur","Las Vegas","NV","89103",36.1260181,-115.2122806,"1","Vegan, American (New), Restaurants, Cafes, Bubble Tea, Specialty Food, Food, Ice Cream & Frozen Yogurt, Comfort Food, Health Markets, Juice Bars & Smoothies, American (Traditional), Breakfast & Brunch"
"530",44439,"Garden Gangsters","Toronto","ON","M6K 3E7",43.6381221,-79.4181561,"1","Juice Bars & Smoothies, Food, Restaurants, Vegan, Breakfast & Brunch"
"531",33513,"Copper Branch","Montreal","QC","H3H 1M9",45.4903748678,-73.583609933,"1","Gluten-Free, Vegan, Restaurants, Fast Food, Breakfast & Brunch, Burgers, Vegetarian"
"532",151731,"Pizzaiolo","Toronto","ON","M5T 1G1",43.6541957,-79.3910112,"1","Restaurants, Pizza, Gluten-Free, Vegan"
"533",93724,"Rancho Relaxo To Go","Toronto","ON","M6P 3S9",43.6646666838,-79.4556048791,"1","Mexican, Fast Food, Vegan, Restaurants"
"534",41241,"Mediterranean Majik Food Truck","Phoenix","AZ","85040",33.4040693,-112.029752,"1","Food Trucks, Greek, Restaurants, Moroccan, Middle Eastern, Food, Lebanese, Vegan, Mediterranean"
"535",80184,"Wilder Foods","Toronto","ON","M6P 2K8",43.6657238,-79.4648144,"1","Breakfast & Brunch, Food, Cafes, Vegan, Restaurants, Coffee & Tea"
"536",119123,"Wild Spork Food Truck","Mentor","OH","44060",41.6782705,-81.2982892,"1","Event Planning & Services, Comfort Food, Vegan, Caterers, Food, Food Trucks, Restaurants"
"537",98931,"CLE Urban Winery","Cleveland Heights","OH","44118",41.5002558,-81.5656893,"1","Wineries, Restaurants, Wine Tasting Room, Food, Arts & Entertainment, Vegan"
"538",91876,"Freedom Beat","Las Vegas","NV","89101",36.1719130639,-115.1412761852,"1","Bars, Restaurants, Vegan, American (Traditional), Sandwiches, Nightlife, American (New)"
"539",114585,"D'Lish Cafe","Phoenix","AZ","85013",33.4803014,-112.0805864,"0","Restaurants, Vegan, Food, Sandwiches, Salad, Wraps, American (New)"
"540",70178,"Star Ginger","Chandler","AZ","85048",33.2816398,-111.9729284,"1","Vietnamese, Asian Fusion, Vegan, Restaurants, Salad"
"541",68128,"Mint Indian Bistro","Las Vegas","NV","89147",36.1127048,-115.2781558,"1","Vegan, Restaurants, Nightlife, Bars, Event Planning & Services, Sports Bars, Halal, Indian, Caterers"
"542",123378,"Chef Lin Restaurant","Markham","ON","L3P 2R2",43.8748998,-79.2591737,"0","Vegan, Halal, Thai, Taiwanese, Chinese, Restaurants, Malaysian"
"543",76135,"Scramble, a breakfast & lunch joint","Phoenix","AZ","85016",33.508755,-112.030866,"1","Coffee & Tea, Breakfast & Brunch, Vegan, Restaurants, Food"
"544",99703,"Famoso Neapolitan Pizzeria","Calgary","AB","T2S 2S7",51.0321985,-114.0719307,"1","Restaurants, Cocktail Bars, Pizza, Bars, Nightlife, Italian, Vegan"
"545",161439,"La Folie du Koshary","Montréal","QC","H3H 2H9",45.4942876,-73.580311,"0","Vegetarian, Restaurants, Vegan, Halal, Middle Eastern, Egyptian"
"546",181531,"Pulp Kitchen","Toronto","ON","M4K 1P9",43.678381,-79.346957,"0","Vegan, Juice Bars & Smoothies, Restaurants, Food"
"547",90234,"Bloomer's","Toronto","ON","M6G 1M4",43.6621055,-79.4249966,"1","Bakeries, Vegan, Coffee & Tea, Food, Cafes, Restaurants"
"548",137335,"Hogtown Vegan","Toronto","ON","M5T 1S7",43.6570194014,-79.4053025544,"1","Restaurants, Vegan"
"549",43290,"Violette's Vegan Organic Cafe & Juice Bar","Las Vegas","NV","89117",36.1300414,-115.2777854,"1","Food, Vegan, Juice Bars & Smoothies, Restaurants, Vegetarian"
"550",3088,"The Annex HodgePodge","Toronto","ON","M5R",43.675098,-79.4065198,"0","Restaurants, Vegan, Sandwiches, Food, Delis, Juice Bars & Smoothies"
"551",104840,"LOV Centropolis","Laval","QC","H7T 2Z6",45.562116,-73.744859,"1","Vegan, Breakfast & Brunch, Gluten-Free, Vegetarian, Restaurants"
"552",167887,"Thai Style Noodle House","Las Vegas","NV","89139",36.0555646163,-115.2258749184,"1","Chinese, Food, Restaurants, Noodles, Thai, Vegan"
"553",61969,"Organic Shores","Phoenix","AZ","85032",33.6417709361,-111.9942912177,"0","Vegan, Live/Raw Food, Restaurants, Vegetarian"
"554",51815,"Pizzaiolo","Toronto","ON","M6C 2C4",43.7001121,-79.4288908,"1","Restaurants, Gluten-Free, Pizza, Vegan"
"555",156010,"Market Grille Cafe","Las Vegas","NV","89128",36.195285,-115.24816,"1","Mediterranean, Greek, Restaurants, Gluten-Free, Vegan, Vegetarian, Italian, Breakfast & Brunch"
"556",15462,"Raw Organic Juice Bar","Chandler","AZ","85224",33.2980166,-111.8772302,"1","Health Markets, Food, Restaurants, Vegan, Specialty Food, Juice Bars & Smoothies"
"557",190979,"True Food Kitchen","Scottsdale","AZ","85254",33.6242403752,-111.9243322313,"1","Vegetarian, Pizza, Vegan, Food, Restaurants, Salad, American (New)"
"558",241,"Bronze Cafe at The Center","Las Vegas","NV","89101",36.1619276,-115.1346287,"0","Cafes, Vegan, Gluten-Free, Restaurants, Coffee & Tea, Salad, Food, Sandwiches, Vegetarian"
"559",126622,"Café Venosa","Montréal","QC","H2J 2L2",45.5236727,-73.5818623,"0","Coffee & Tea, Food, Vegan, Restaurants"
"560",158759,"Brixx Wood Fired Pizza","Champaign","IL","61820",40.0900638618,-88.2464063362,"0","Nightlife, Bars, Pizza, Gluten-Free, Vegan, Restaurants, Sandwiches"
"561",171209,"Zoyo Frozen Yogurt - Downtown Phoenix","Phoenix","AZ","85007",33.4657540946,-112.0823049545,"1","Desserts, Do-It-Yourself Food, Food, Gelato, Vegan, Restaurants, Ice Cream & Frozen Yogurt"
"562",153493,"Hibiscus","Toronto","ON","M5H 3K6",43.6503522,-79.3837951,"1","Salad, Restaurants, Vegan, Gluten-Free"
"563",168034,"Bite Vegan Bakery","Las Vegas","NV","89145",36.1672546478,-115.2858479863,"0","Waffles, Restaurants, Desserts, Vegan, Food, Bakeries"
"564",63756,"Sprinly","Cleveland","OH","44106",41.5091257,-81.6089873,"1","Vegetarian, Event Planning & Services, Specialty Food, Vegan, Personal Chefs, Restaurants, Health Markets, Food, Food Delivery Services, Health & Medical, Nutritionists"
"565",108719,"India Garden","Lakewood","OH","44107",41.482634,-81.825452,"1","Vegan, Vegetarian, Pakistani, Restaurants, Indian"
"566",26349,"El 77","Montréal","QC","H2T 2J9",45.5266004,-73.6030502,"0","Vegetarian, Restaurants, Peruvian, Vegan"
"567",3699,"Dirty Dogs","Montréal","QC","H2X 1A1",45.5147539242,-73.574196964,"1","Restaurants, Canadian (New), Hot Dogs, Vegan, Burgers, Poutineries"
"568",86346,"Laroush","Kent","OH","44240",41.1505306,-81.3600448,"0","Restaurants, Vegetarian, Mediterranean, Vegan"
"569",113965,"Juicy Beets","Las Vegas","NV","89169",36.1188165,-115.1542185,"1","Restaurants, Food, Juice Bars & Smoothies, Vegan, Organic Stores, Bars, Nightlife"
"570",92123,"The Real Jerk","Toronto","ON","M4M 1Y7",43.667787,-79.3432553,"1","Vegan, Restaurants, Karaoke, Nightlife, Bars, Seafood, Caribbean, Lounges"
"571",92052,"Esquina","Montréal","QC","H2H 1V3",45.5330984,-73.5752325,"1","Food, Vegan, Restaurants, Coffee & Tea, Cafes"
"572",145092,"Brixx Wood Fired Pizza","Fort Mill","SC","29715",35.02608,-80.962041,"1","Pizza, Sandwiches, Restaurants, Salad, Vegan, Gluten-Free"
"573",75436,"Tertio Wine Bar","Phoenix","AZ","85012",33.488807,-112.065237,"1","Bars, Wine Bars, Vegetarian, Vegan, Food, Nightlife, Restaurants, Local Flavor, Beer, Wine & Spirits, Tapas/Small Plates"
"574",42742,"Cinnaholic","Henderson","NV","89074",36.029763,-115.085558,"1","Food, Vegan, Restaurants, Breakfast & Brunch, Bakeries, Desserts"
"575",133187,"Sata Sushi","Montréal","QC","H1W 1P8",45.5427729,-73.546401,"1","Vegan, Restaurants, Sushi Bars, Japanese, Vegetarian"
"576",37098,"The Cutting Board Cafe","Mesa","AZ","85209",33.374985,-111.687163,"1","Pizza, Coffee & Tea, Cafes, Food, Restaurants, Beer, Wine & Spirits, Vegetarian, Bakeries, Vegan, Gluten-Free"
"577",82884,"Blinders Burgers and Brunch","Las Vegas","NV","89149",36.2779342559,-115.2874583583,"1","Burgers, Restaurants, Vegetarian, Vegan, Breakfast & Brunch"
"578",142110,"Juice Up 412","Pittsburgh","PA","15206",40.4604323,-79.9252567,"0","Vegan, Juice Bars & Smoothies, Restaurants, Tapas Bars, Food"
"579",51329,"Grasshopper Restaurant","Toronto","ON","M5T 1S2",43.6577575,-79.4022423,"1","Vegan, Restaurants, Salad, Vegetarian"
"580",106839,"Lola Rosa","Montréal","QC","H2X 1W5",45.5073247805,-73.5757481897,"1","Vegetarian, Vegan, Caterers, Restaurants, Event Planning & Services"
"581",65677,"Nourish","Scottsdale","AZ","85251",33.5061904386,-111.9264364243,"0","Restaurants, Vegan, Gluten-Free, American (New)"
"582",16608,"Purple Potato","Henderson","NV","89052",36.0061287813,-115.1120727767,"1","Restaurants, Vegan, Sandwiches, Salad, Live/Raw Food, Juice Bars & Smoothies, Breakfast & Brunch, Vegetarian, Food Delivery Services, Food, Asian Fusion, American (New), Wraps, Seafood, Desserts"
"583",154580,"Planet Sub","Cuyahoga Falls","OH","44223",41.1481669,-81.5074443,"1","Restaurants, Salad, Delis, Gluten-Free, Sandwiches, Vegan"
"584",19614,"Doomie's Toronto","Toronto","ON","M6K 1L4",43.6415966738,-79.432222134,"1","Restaurants, Southern, Vegetarian, Vegan"
"585",49323,"Helio Terra Vegan Cafe","Cleveland","OH","44115",41.4986579,-81.6885632,"0","Food, Vegan, Restaurants, Vegetarian, Juice Bars & Smoothies"
"586",140764,"Reed & Co","Pittsburgh","PA","15201",40.4699783325,-79.9612197876,"1","Restaurants, Food, Juice Bars & Smoothies, Cafes, Vegan"
"587",127222,"POP","Toronto","ON","M5V 1C2",43.6424655,-79.3992542,"1","Salad, Food, Restaurants, Acai Bowls, Juice Bars & Smoothies, Vegan"
"588",65417,"Honey Bee Bakery","Medina","OH","44256",41.1385626577,-81.8642995324,"1","Coffee & Tea, Cafes, Vegan, Restaurants, Bakeries, Food"
"589",85162,"Crema Cafe","Madison","WI","53716",43.0785876,-89.3240091,"1","Breakfast & Brunch, Sandwiches, Vegan, Restaurants, Food, Coffee & Tea, Cafes"
"590",175535,"Original ChopShop","Chandler","AZ","85225",33.3020248413,-111.8420257568,"1","Restaurants, Breakfast & Brunch, American (New), Vegan, American (Traditional), Food, Salad, Juice Bars & Smoothies"
"591",164715,"Through Being Cool","Toronto","ON","M6H 1N7",43.6582976906,-79.4422688709,"1","Bakeries, Food, Vegan, Vegetarian, Restaurants"
"592",24094,"Pancho's Kitchen","Las Vegas","NV","89146",36.1588302,-115.2111651,"1","Vegan, Breakfast & Brunch, Restaurants, Mexican"
"593",4530,"Bubbles - Vegan Champagne Bar","Scottsdale","AZ","85254",33.5828975719,-111.930701,"0","Tapas Bars, Beer Bar, Nightlife, Food Delivery Services, American (New), Bars, Tapas/Small Plates, Champagne Bars, Food, Wine Bars, French, Desserts, Modern European, Speakeasies, Vegan, Restaurants"
"594",25824,"Vegan House","Phoenix","AZ","85003",33.449498,-112.0744168,"1","Vegetarian, Vegan, Restaurants, Thai"
"595",36793,"Dotty Dumpling's Dowry","Madison","WI","53703",43.0728191,-89.395561,"1","Vegetarian, Burgers, Breakfast & Brunch, Vegan, Nightlife, Restaurants, Bars, Pubs"
"596",73308,"Bow Tie Pizza","Calgary","AB","T2E 2Z6",51.0953781,-114.0628104,"1","Pizza, Restaurants, Gluten-Free, Vegan, Salad, Italian"
"597",128720,"Fresh on Crawford","Toronto","ON","M6J 1G3",43.6451384,-79.4149767,"1","Specialty Food, Vegetarian, Restaurants, Health Markets, Food, Vegan"
"598",177974,"Humble Root Organic","Newmarket","ON","L3Y 4Z1",44.056104,-79.4855044,"1","Live/Raw Food, Patisserie/Cake Shop, Gluten-Free, Vegan, Food, Desserts, Restaurants"
"599",110928,"Signs Restaurant","Toronto","ON","M4Y 1Z1",43.6646126,-79.3848159,"0","Food, Canadian (New), Restaurants, Beer, Wine & Spirits, Vegan, Gluten-Free"
"600",163996,"Livin' Lite Arizona","Phoenix","AZ","85305",33.5266690929,-112.2620048147,"0","Food Trucks, Food, Gluten-Free, Vegan, Restaurants"
"601",115310,"Indigo Crow Restaurant & Bar","Cave Creek","AZ","85331",33.8296784,-111.9289621,"1","Bars, Food, Nightlife, Vegan, Diners, Beer, Wine & Spirits, Restaurants, American (New), Steakhouses, Cafes"
"602",110137,"Sweet Home Baked Company","Las Vegas","NV","89145",36.1667834,-115.2861968,"0","Vegan, Bakeries, Farmers Market, Vegetarian, Food, Restaurants"
"603",159903,"Counter Cuisine","Las Vegas","NV","89117",36.159221,-115.236737,"0","Sandwiches, Food, Restaurants, American (New), Vegan, Salad, Food Court"
"604",139983,"GFY Burgers and Fries","Las Vegas","NV","89120",36.0833352,-115.0999753,"1","Fast Food, Restaurants, Food, Vegetarian, Food Stands, Food Trucks, Burgers, Pop-Up Restaurants, Vegan"
"605",70729,"YamChops","Toronto","ON","M6G 1C2",43.6550692606,-79.4182143631,"1","Food, Butcher, Vegan, Vegetarian, Restaurants, Juice Bars & Smoothies"
"606",13190,"Desert Roots Kitchen","Tempe","AZ","85281",33.4259738171,-111.940346,"1","Vegetarian, Gluten-Free, Restaurants, Vegan"
"607",144863,"Maha's","Toronto","ON","M4L 2R2",43.6716801,-79.3285772,"1","Breakfast & Brunch, Egyptian, Middle Eastern, Restaurants, Vegan, Sandwiches"
"608",95336,"Pulp Kitchen","Toronto","ON","M4M 1L1",43.6621626,-79.3347124,"0","Vegan, Sandwiches, Food, Juice Bars & Smoothies, Restaurants, Vegetarian"
"609",32905,"B.good","Toronto","ON","M4P 3A4",43.7069579,-79.3955634,"1","Event Planning & Services, Burgers, Gluten-Free, Caterers, Juice Bars & Smoothies, Restaurants, Vegan, Salad, Food"
"610",145786,"zpizza","Phoenix","AZ","85013",33.479992,-112.076718,"1","Food Delivery Services, Pizza, Restaurants, Food, Gluten-Free, Vegan"
"611",145165,"Greenhouse Juice","Toronto","ON","M5R 1W7",43.678934,-79.3907966,"1","Gluten-Free, Food, Restaurants, Nutritionists, Vegan, Juice Bars & Smoothies, Health & Medical"
"612",112332,"Genuine Fresche","Gilbert","AZ","85234",33.381267,-111.723478,"1","Restaurants, Live/Raw Food, Vegan, Juice Bars & Smoothies, Food, Acai Bowls"
"613",2432,"Mi & Stu","Lasalle","QC","H8N 2W9",45.4426192,-73.6292455,"1","Restaurants, Bakeries, Food, Vegan, Gluten-Free"
"614",55164,"Madras Masala","Toronto","ON","M6G 1L7",43.6631596,-79.4219229,"1","Restaurants, Southern, Gluten-Free, Vegan, Pakistani, Indian"
"615",48233,"Genghis Grill","Glendale","AZ","85032",33.6386479,-112.2172122,"1","Mongolian, Thai, American (Traditional), Asian Fusion, Korean, Chinese, Restaurants, Vegetarian, Vegan"
"616",14667,"Baan Thai Restaurant","Las Vegas","NV","89146",36.12558,-115.211031,"1","Restaurants, Thai, Vegetarian, Chinese, Vegan, Asian Fusion"
"617",45877,"Copper Branch","Montreal","QC","H2J 1Y4",45.5294766,-73.577983,"1","Gluten-Free, Restaurants, Burgers, Vegan, Vegetarian, Sandwiches, Breakfast & Brunch"
"618",96102,"Roman Candle Pizzeria","Madison","WI","53711",43.0571808,-89.428167,"1","Gluten-Free, Restaurants, Pizza, Vegetarian, Vegan, American (Traditional)"
"619",24997,"Bombay On the Lake","Etobicoke","ON","M8V 1K2",43.5999294,-79.507932,"1","Restaurants, Vegan, Halal, Indian"
"620",147082,"Copper Branch","Montreal","QC","H3G 2E2",45.4962735,-73.5752514,"1","Restaurants, Gluten-Free, Food, Organic Stores, Vegetarian, Vegan, Breakfast & Brunch"
"621",62423,"Community Cuisine","Phoenix","AZ","85034",33.4479847,-112.0325931,"1","Restaurants, Food, Vegetarian, Vegan"
"622",67425,"Nocochi","Montréal","QC","H3G 2J1",45.4975546,-73.5806444,"0","Vegan, Coffee & Tea, Food, Mediterranean, Sandwiches, Tea Rooms, Bakeries, Restaurants, Vegetarian"
"623",95151,"Fresco Mexican Grill & Salsa Bar","Kent","OH","44240",41.1525482318,-81.3579681368,"1","Food, Restaurants, Tex-Mex, Desserts, Vegan, Mexican, Gluten-Free, Caterers, Dance Clubs, Nightlife, Event Planning & Services, Bars"
"624",134018,"True Food Kitchen","Phoenix","AZ","85016",33.510369927,-112.027740589,"1","Vegan, Vegetarian, Salad, Restaurants, American (New)"
"625",133552,"Real Food Charlotte","Charlotte","NC","28203",35.208548,-80.86153,"0","Restaurants, Fruits & Veggies, Specialty Food, Food, Vegetarian, Live/Raw Food, Vegan"
"626",4711,"Pochiche","Montréal-West","QC","H4X 1Z2",45.453015,-73.646031,"1","Sandwiches, Lebanese, Middle Eastern, Vegetarian, Vegan, Mediterranean, Falafel, Restaurants"
"627",178728,"Chapati Indian Grill","Cleveland","OH","44106",41.5095423,-81.6040633,"1","Indian, Halal, Restaurants, Vegan"
"628",92599,"Sweet Hart Kitchen","Toronto","ON","M5T 1J3",43.6530311,-79.4041249,"1","Vegan, Food, Bakeries, Restaurants, Gluten-Free, Coffee & Tea"
"629",122898,"The Veggie Thali","Toronto","ON","M4A 2L8",43.7194176,-79.3010177,"1","Vegetarian, Himalayan/Nepalese, Indian, Restaurants, Vegan"
"630",60125,"Caribbean Grill Restaurant","Champaign","IL","61820",40.087699,-88.247455,"1","Vegan, Caribbean, Desserts, Food, Comfort Food, Vegetarian, Restaurants, Barbeque"
"631",26471,"Mama's Tofu","Toronto","ON","M6L 3C9",43.7045581,-79.4921887,"1","Vegetarian, Vietnamese, Vegan, Restaurants"
"632",6291,"honeygrow","Pittsburgh","PA","15206",40.4611774109,-79.9246995536,"1","Noodles, Vegetarian, Restaurants, Salad, American (Traditional), Vegan"
"633",47210,"Red Velvet Café","Las Vegas","NV","89109",36.1274875339,-115.171931875,"0","Vegan, American (New), Coffee & Tea, Food, Restaurants"
"634",113130,"Thai Cuisine Experts","Mississauga","ON","L5N 8C8",43.5757712,-79.7837247,"1","Halal, Restaurants, Thai, Vegan"
"635",42934,"Bear And The Honey Specialty Bakery","Phoenix","AZ","85013",33.5080943,-112.0863874,"1","Vegan, Food, Gluten-Free, Bakeries, Restaurants, Desserts"
"636",3628,"La Panthère Verte","Montréal","QC","H2T 1A8",45.5270543,-73.596918,"1","Food, Vegan, Restaurants, Vegetarian, Coffee & Tea"
"637",38802,"Pita Jungle","Phoenix","AZ","85050",33.6749041549,-111.9800812813,"1","Restaurants, Vegetarian, Vegan, Mediterranean, American (New)"
"638",185567,"Go Raw Cafe","Las Vegas","NV","89123",36.041104,-115.1208125,"0","Juice Bars & Smoothies, Vegetarian, Restaurants, Food, Live/Raw Food, Vegan"
"639",104599,"Rawlicious","Toronto","ON","M4W 1J5",43.6710319,-79.388209,"0","Live/Raw Food, Vegan, Restaurants, Vegetarian"
"640",49670,"Liliput Coffee and Cafe","Pittsburgh","PA","15213",40.4559244,-79.953763,"0","Restaurants, Coffee & Tea, Vegan, Food"
"641",162229,"Thailicious Authentic Thai & Vegan","Henderson","NV","89012",36.028178,-115.048607,"1","Restaurants, Thai, Vegetarian, Vegan"
"642",151349,"Amber's Smoked Vegan","Las Vegas","NV","89146",36.1586808,-115.2367199,"1","Restaurants, Southern, Soul Food, Vegan, Food, Breakfast & Brunch, Coffee & Tea, Barbeque"
"643",164553,"Table Thai Bar & Bistro","Las Vegas","NV","89120",36.0719295,-115.1069118,"1","Beer, Wine & Spirits, Vegan, Food, Thai, Restaurants"
"644",186106,"Zizis Vegan Take-Out","Charlotte","NC","28262",35.2970997,-80.7554037,"0","Restaurants, Vegetarian, Vegan"
"645",541,"The Vegan Duchess","Toronto","ON","M4P 2E6",43.7086263,-79.3989537,"0","Live/Raw Food, Food, Organic Stores, Restaurants, Vegan"
"646",31755,"Vegan Sweet Tooth","Woodmere","OH","44122",41.4631452,-81.4738784,"0","Bakeries, Food, Vegan, Restaurants"
"647",140661,"IGo VeGo","Madison","WI","53726",43.0764511,-89.3837848,"0","Health Markets, Restaurants, Fruits & Veggies, Vegetarian, Specialty Food, Vegan, Food"
"648",29295,"Copper Branch","Westmount","QC","H3Z 1H5",45.4772643,-73.6057336,"1","Vegan, Gluten-Free, Restaurants, Vegetarian"
"649",123561,"Zydeco Po-Boys","Las Vegas","NV","89101",36.1676174882,-115.1401374689,"0","Restaurants, Cajun/Creole, Vegan, Soul Food, Sandwiches, Southern"
"650",96980,"Red Velvet Cafe","Las Vegas","NV","89117",36.1432041,-115.262866,"0","Cafes, Vegetarian, American (New), Vegan, Restaurants"
"651",66562,"Ali Baba Restaurant","Cleveland","OH","44111",41.4606693,-81.7720292,"0","Middle Eastern, Vegan, Lebanese, Vegetarian, Restaurants"
"652",169333,"Good 'N Raw","Lakewood","OH","44107",41.4886311,-81.7718303,"0","Health Markets, Live/Raw Food, Restaurants, Juice Bars & Smoothies, Food, Vegan, Specialty Food"
"653",87744,"Live Organic Food Bar","Toronto","ON","M5R 1V7",43.675106,-79.4067793,"1","Vegan, Organic Stores, Gluten-Free, Live/Raw Food, Restaurants, Vegetarian, Juice Bars & Smoothies, Food"
"654",13173,"Calico Cafe","Toronto","ON","M6H 1M8",43.6591021,-79.439196,"0","Caterers, Restaurants, Event Planning & Services, Vegan, Vegetarian"
"655",139033,"Mandy's","Montréal","QC","H4A 1S9",45.4769153,-73.606333,"1","Restaurants, Canadian (New), Live/Raw Food, Salad, American (New), Cafes, Vegan, Soup"
"656",63839,"Fressen Restaurant","Toronto","ON","M5V 2B2",43.6479391,-79.4003492,"0","American (New), Vegetarian, Vegan, Restaurants"
"657",97508,"Boon Burger Café","Oakville","ON","L6M 4M2",43.4664073,-79.7452013,"1","Restaurants, Vegetarian, Burgers, Vegan"
"658",73212,"Cinnaholic","Las Vegas","NV","89147",36.113987085,-115.3086563945,"1","Food, Bakeries, Desserts, Breakfast & Brunch, Vegan, Restaurants"
"659",110317,"Greens and Proteins","Las Vegas","NV","89123",36.026212,-115.1193405,"1","Sandwiches, Cafes, Pizza, Vegetarian, Gluten-Free, American (Traditional), Restaurants, Breakfast & Brunch, Burgers, Vegan, Food, Juice Bars & Smoothies, American (New)"
