"","business_id","name","city","state","postal_code","latitude","longitude","is_open","categories"
"330",5934,"Spirit Organic Cafe","Gilbert","AZ","85233",33.3372062,-111.8084353,"1","Specialty Food, Fitness & Instruction, Vegetarian, Food, Coffee & Tea, Health & Medical, Nutritionists, Breakfast & Brunch, Juice Bars & Smoothies, Health Markets, Vegan, Live/Raw Food, Trainers, Organic Stores, Active Life, Restaurants"
"331",89384,"Arepera","Montréal","QC","H2X 1B4",45.5147831155,-73.5720007059,"1","Vegetarian, Gluten-Free, Restaurants, Venezuelan, Latin American, Vegan"
"332",33282,"The Heavenly Vegan","Las Vegas","NV","89101",36.1697096,-115.1236952,"1","Health Markets, Restaurants, Specialty Food, Food Delivery Services, Personal Chefs, Vegan, Food, Event Planning & Services, Caterers"
"333",166452,"Get Real Cafe","Toronto","ON","M6J 2Z6",43.6471904,-79.4199315,"0","Vegetarian, Vegan, Restaurants, Breakfast & Brunch"
"334",157877,"Pour Coffeehouse","Las Vegas","NV","89119",36.0661492,-115.1190162,"1","Caribbean, Sandwiches, Vegan, Juice Bars & Smoothies, Coffee & Tea, American (Traditional), Cafes, Restaurants, Food, Desserts"
"335",63083,"Leafy Sea Dragon","Phoenix","AZ","",33.4483771,-112.0740373,"1","Food Trucks, Vegan, Restaurants, Food"
"336",60154,"The Uprooted Kitchen","Gilbert","AZ","85296",33.3216632,-111.7262523,"1","Specialty Food, Organic Stores, Food, Local Flavor, Food Trucks, Fruits & Veggies, Vegan, Restaurants, Street Vendors, Vegetarian"
"337",43244,"Thai Thai","Lakewood","OH","44107",41.4769144417,-81.7890876699,"1","Food, Bubble Tea, Thai, Desserts, Restaurants, Vegan"
"338",86317,"Humble Wine Bar","Lakewood","OH","44107",41.4850751,-81.803588,"1","Desserts, Restaurants, Food, Vegan, Bars, Pizza, Nightlife, Lounges, Tapas/Small Plates, Wine Bars"
"339",22769,"Aladdin's Eatery","Pittsburgh","PA","15217",40.4378199,-79.9199427,"1","Vegan, Juice Bars & Smoothies, Food, Mediterranean, Nightlife, Bars, Soup, Restaurants, Vegetarian, Middle Eastern"
"340",143894,"A La Mode","Las Vegas","NV","89149",36.2684007,-115.2956118,"0","Restaurants, Gluten-Free, Food, Bakeries, Vegan"
"341",171076,"L'Gros Luxe Plateau","Montréal","QC","H2L 1A5",45.5215356836,-73.5754337451,"1","Restaurants, Cocktail Bars, Vegan, Canadian (New), Diners, Bars, Vegetarian, Nightlife, Breakfast & Brunch, Burgers, Sandwiches"
"342",190951,"Why Not Pizza","Charlotte","NC","28215",35.223467,-80.727712,"1","Vegan, Sandwiches, Chicken Wings, Restaurants, Specialty Food, American (Traditional), Cheesesteaks, Food, Desserts, Pizza"
"343",16202,"Juice Press","Las Vegas","NV","89109",36.1117900373,-115.1765809571,"1","Vegan, Food, Organic Stores, Juice Bars & Smoothies, Restaurants"
"344",129397,"Calii Love","Toronto","ON","M5X 1A9",43.648648,-79.381747,"1","Specialty Food, Food, Vegan, Restaurants, Acai Bowls, Juice Bars & Smoothies"
"345",116280,"Tinh Tam Trai","Vaughan","ON","L4K 5Y5",43.827523194,-79.5401382209,"1","Vegetarian, Vietnamese, Vegan, Restaurants"
"346",140688,"Tastybox","Phoenix","AZ","85006",33.4554106,-112.0648466,"1","Vegan, Food, Restaurants, American (New), Vegetarian"
"347",25238,"Urban Herbivore","Toronto","ON","M6H 1A6",43.6532415,-79.4271428,"0","Bakeries, Food, Restaurants, Vegan"
"348",63671,"Raw Aura","Mississauga","ON","L5G 1E3",43.5534272,-79.5841138,"1","Event Planning & Services, Restaurants, Vegan, Vegetarian, Caterers"
"349",179856,"Pizzaiolo","Toronto","ON","M4L 1S4",43.6690124,-79.3118849,"1","Gluten-Free, Vegan, Pizza, Restaurants"
"350",79830,"Copper Branch","Pointe-Claire","QC","H9R 4Y2",45.4683817,-73.8289929,"1","Vegan, Vegetarian, Restaurants, Fast Food, Gluten-Free"
"351",4958,"Fit and Sweet Bakery","Toronto","ON","M6H 1N9",43.6586166,-79.4422898,"0","Sandwiches, Bakeries, Desserts, Vegan, Restaurants, Food"
"352",187346,"Flaming Ice Cube","Cleveland","OH","44114",41.499241,-81.692709,"0","Vegan, Vegetarian, Restaurants"
"353",117243,"Munch","Solon","OH","44139",41.4235764,-81.4774021,"1","Restaurants, Vegetarian, Vegan, Sandwiches, Mediterranean"
"354",138102,"Spak Brothers Pizza and More","Pittsburgh","PA","15224",40.4650793,-79.9424916,"1","Vegan, Sandwiches, Vegetarian, Restaurants, Pizza, Salad"
"355",12279,"Simply Pure by Chef Stacey Dougan","Las Vegas","NV","89101",36.1679035,-115.138142,"1","Vegan, Restaurants, Vegetarian"
"356",54135,"Ital Vital","Scarborough","ON","M1L 3J4",43.7172743,-79.2936906,"1","Juice Bars & Smoothies, Caribbean, Restaurants, Food, Vegan"
"357",121525,"Plant Powered Prep","Chandler","AZ","85224",33.3519000409,-111.8579984283,"1","Vegan, Specialty Food, Health Markets, Juice Bars & Smoothies, Live/Raw Food, Restaurants, Food"
"358",42083,"Tin Front Cafe","Homestead","PA","15120",40.4072651,-79.9101652,"0","Bars, Coffee & Tea, Restaurants, Nightlife, Vegan, Vegetarian, American (New), Food"
"359",182131,"Isabela's","Las Vegas","NV","89128",36.2074847,-115.2682033,"0","Restaurants, Vegan, Seafood, Tapas/Small Plates"
"360",88863,"Bunner's","Toronto","ON","M6P 1Z7",43.6656916,-79.4714453,"1","Vegan, Bakeries, Gluten-Free, Food, Restaurants"
"361",105344,"Kupfert & Kim","Toronto","ON","M5J 2N8",43.6414118932,-79.3777328454,"1","Gluten-Free, Vegan, Restaurants, Vegetarian"
"362",169860,"Camros Organic Eatery","Toronto","ON","M4Y 2P2",43.6695258,-79.3855113,"0","Shopping, Gluten-Free, Specialty Food, Food, Vegetarian, Buffets, Health Markets, Persian/Iranian, Restaurants, Vegan"
"363",152100,"Tacotarian","Las Vegas","NV","89148",36.0763561,-115.2979731,"1","Vegan, Mexican, Restaurants, Tacos"
"364",63757,"Loving Hut","Pittsburgh","PA","15277",40.4459734242,-80.1582661486,"0","Vietnamese, Vegan, Restaurants, Vegetarian"
"365",25879,"Fubar","Toronto","ON","M6G 1LM",43.6633580757,-79.4185703357,"1","Vegetarian, Vegan, Nightlife, Beer Bar, Restaurants, Bars"
"366",151749,"Mandy's","Montréal","QC","H2T 2N9",45.5209621379,-73.5949444771,"1","Vegan, Restaurants, Salad, Live/Raw Food, Cafes, Soup, American (New), Canadian (New)"
"367",70343,"La Panthère Verte","Montréal","QC","H2X 3K4",45.515739,-73.5644282,"1","Restaurants, Beer, Wine & Spirits, Vegan, Food"
"368",109501,"Joe Maxx Coffee","Las Vegas","NV","89123",36.0430342509,-115.1513231735,"1","Bagels, Breakfast & Brunch, Patisserie/Cake Shop, Ice Cream & Frozen Yogurt, Vegan, Sandwiches, Coffee & Tea, Cafes, Food, Restaurants"
"369",191221,"Pita Jungle","Tempe","AZ","85281",33.4152240101,-111.9178978785,"0","Mediterranean, Vegetarian, American (New), Restaurants, Greek, Vegan"
"370",21815,"Pizzaiolo","Halton Hills","ON","L7G 1T9",43.6503023,-79.9122301,"1","Vegan, Pizza, Gluten-Free, Restaurants"
"371",58422,"Copper Branch","Toronto","ON","M5L 1E2",43.6481326,-79.3795089,"1","Breakfast & Brunch, Vegan, Restaurants, Gluten-Free, Vegetarian"
"372",147874,"AH-SAH-EE Cafe","Las Vegas","NV","89123",36.014137,-115.15498,"1","Vegan, Restaurants"
"373",16630,"Cupsie Daisy","Kent","OH","44240",41.1536674,-81.3578859,"1","Restaurants, Desserts, Cupcakes, Vegan, Food"
"374",34411,"Pizzaiolo","Mississauga","ON","L5G 1E1",43.5524836,-79.5849524,"1","Pizza, Restaurants, Vegan, Gluten-Free"
"375",42387,"That's a Wrap","Phoenix","AZ","85014",33.5095,-112.063826,"0","Vegetarian, Vegan, Beer, Wine & Spirits, Restaurants, Sandwiches, Food"
"376",50931,"Rawlicious","Toronto","ON","M6S 1M8",43.6522588,-79.4722672,"0","Food, Restaurants, Live/Raw Food, Vegan, Desserts, Vegetarian"
"377",150784,"Garden Grill","Las Vegas","NV","89145",36.1667834,-115.2861968,"1","Restaurants, Farmers Market, Street Vendors, Mexican, Vegan, Food, Tacos, Vegetarian"
"378",136220,"Urban Acorn Catering","Toronto","ON","M6S 3Y8",43.6553388,-79.4867923,"1","Event Planning & Services, Specialty Food, Personal Chefs, Caterers, Vegan, Food, Restaurants"
"379",115408,"Cafe 8","Mesa","AZ","85206",33.3920951,-111.7181478,"1","Desserts, Gluten-Free, Breakfast & Brunch, Restaurants, Food, Sandwiches, Vegetarian, Mediterranean, Vegan"
"380",108939,"The Green Owl Cafe","Madison","WI","53704",43.0922759,-89.355528,"1","Cafes, Restaurants, Diners, Vegan, Vegetarian"
"381",68947,"Harvest Noon","Toronto","ON","M5S 1C1",43.6607028,-79.4001796,"0","Restaurants, Vegan"
"382",94700,"Pizzaiolo","Toronto","ON","M5H 1X6",43.6479858,-79.3901015,"1","Vegan, Gluten-Free, Pizza, Restaurants"
"383",186324,"Pizza Fusion","Mesa","AZ","85215",33.4518585,-111.707131,"0","Food, Beer, Wine & Spirits, Gluten-Free, Vegan, Pizza, Restaurants"
"384",172260,"The Social Gardener","Toronto","ON","M4L 1Z1",43.6716439,-79.3253848,"1","Food, Restaurants, Coffee & Tea, Vegetarian, Vegan, Cafes, Farmers Market"
"385",53750,"Flour & Grounds","Henderson","NV","89014",36.0570059818,-115.0566596326,"0","Bakeries, Coffee & Tea, Vegan, Cafes, Food, Restaurants"
"386",30390,"Dolce Wraps","Fairview Park","OH","44126",41.4602726,-81.8522288,"1","Sandwiches, Vegan, Middle Eastern, Restaurants, Mediterranean"
"387",189665,"Panevino Italian Grille","Las Vegas","NV","89119",36.0708262285,-115.1628910428,"1","Italian, Nightlife, Beer, Wine & Spirits, Food, Vegan, Restaurants, Bars, Cocktail Bars"
"388",137219,"Earth Bistro Cafe","Cleveland","OH","44102",41.4863845,-81.7626989,"1","Food, Vegetarian, Breakfast & Brunch, Restaurants, Cuban, Vegan, Juice Bars & Smoothies"
"389",44925,"El Burro","Pittsburgh","PA","15218",40.4325712791,-79.8936523497,"1","American (Traditional), Mexican, Restaurants, Tacos, Vegan"
"390",169737,"Vegetarian Food Festival","Toronto","ON","M5J 2G8",43.6390687,-79.382896,"1","Arts & Entertainment, Restaurants, Festivals, Vegetarian, Vegan"
"391",112912,"Ruchi Vegetarian South Indian Cuisine","Chandler","AZ","85224",33.334688,-111.877793,"1","Restaurants, Vegetarian, Indian, Vegan"
"392",18517,"Karine's","Toronto","ON","M5T 3K5",43.654152,-79.391194,"1","Vegan, Vegetarian, Restaurants, Breakfast & Brunch"
"393",109273,"Merchant Street","Cleveland","OH","44113",41.479394,-81.6890041,"0","Food, Italian, Salad, Wine Bars, French, Fruits & Veggies, Specialty Food, Nightlife, Sandwiches, Gluten-Free, Vegan, Restaurants, Mediterranean, Bars"
"394",73834,"V's Caribbean Restaurant","Toronto","ON","M6M 4P7",43.6882775,-79.4924573,"1","Caribbean, Vegan, Restaurants"
"395",191491,"Tediberto's","Phoenix","AZ","85004",33.4587814,-112.0722749,"0","Vegan, Mexican, Restaurants"
"396",30419,"Cinnaholic","Westlake","OH","44145",41.4621363,-81.9561202,"1","Bakeries, Restaurants, Vegan, Desserts, Food"
"397",185325,"HUMMUS","Henderson","NV","89052",35.9936882,-115.1016894,"1","Mediterranean, Juice Bars & Smoothies, Food, Caterers, Vegan, Restaurants, Event Planning & Services, Wraps, Fast Food, Gluten-Free, Middle Eastern"
"398",127256,"Bean Sprouts Cafe","Phoenix","AZ","85004",33.4486919437,-112.0665119395,"1","Food, Sandwiches, Cafes, Gluten-Free, Juice Bars & Smoothies, Vegan, Restaurants"
"399",28825,"Fired Pie","Gilbert","AZ","85295",33.30792,-111.742816,"1","Restaurants, Vegan, Italian, Pizza, Salad"
"400",87138,"Pizzaiolo","Toronto","ON","M5S 2J2",43.6666378801,-79.4044644985,"1","Gluten-Free, Vegetarian, Restaurants, Vegan, Pizza"
"401",130303,"Mother Fool's Coffeehouse","Madison","WI","53703",43.0818991,-89.3657578,"1","Coffee & Tea, Food, Vegan, Restaurants"
"402",143753,"Zen-E-Lunchbox","Calgary","AB","T2G",51.0502225,-114.0627436,"0","Restaurants, Vegan"
"403",78486,"YC's Mongolian Grill","Chandler","AZ","85286",33.2788302,-111.7904534,"1","Restaurants, Asian Fusion, Vegan, Chinese, Specialty Food, Mongolian, Food, Buffets, Ethnic Food, Vegetarian"
"404",143977,"No Regrets Bar","Las Vegas","NV","89113",36.0668534,-115.2727308,"1","Sports Bars, Breakfast & Brunch, Cocktail Bars, Restaurants, Vegan, Bars, Nightlife"
"405",167979,"Mother Falafel","Las Vegas","NV","89118",36.0724991,-115.2436114,"1","Mediterranean, Falafel, Vegan, Restaurants, Middle Eastern"
"406",189773,"Hummus Factory Canada","Thornhill","ON","L4J 3W1",43.7989882,-79.4463191,"0","Restaurants, Kosher, Vegetarian, Vegan, Mediterranean"
"407",184224,"Sage Kitchen","Phoenix","AZ","85016",33.5065137,-112.0388443,"0","Restaurants, Spiritual Shop, Coffee & Tea, Gluten-Free, Vegetarian, Vegan, Health Markets, Food, Shopping, Specialty Food, Delicatessen, Health & Medical"
"408",120914,"E L Ruddy Co Cafe","Toronto","ON","M6J 1Y3",43.649445,-79.427766,"1","Coffee & Tea, Gluten-Free, Nightlife, Bars, Vegan, Vegetarian, Food, Restaurants"
"409",91779,"Fresh","Toronto","ON","M5E 1B3",43.6477534,-79.3742742,"1","Restaurants, Vegan, Vegetarian"
"410",69242,"El Cactus Veggie Vegan","Henderson","NV","89015",36.0335025,-114.9856516,"0","Vegetarian, Restaurants, Tex-Mex, Vegan, Mexican"
"411",161264,"Nēche Restaurant & Ultra Lounge","Las Vegas","NV","89119",36.0679611785,-115.1780364019,"0","Lounges, Bars, Restaurants, Vegetarian, Nightlife, Fast Food, Vegan, American (Traditional)"
"412",88150,"Forequarter","Madison","WI","53703",43.0822764,-89.3796112,"1","Beer Bar, Bars, Nightlife, Caterers, Restaurants, Event Planning & Services, American (New), Breakfast & Brunch, Vegetarian, Vegan"
"413",122283,"Kiffin","Montréal","QC","H2X 3L1",45.5174507,-73.5681999,"0","Restaurants, Arts & Crafts, Vegan, Cafes, Local Flavor, Comfort Food, Food Delivery Services, Bistros, Shopping, Gluten-Free, Gastropubs, Nightlife, Specialty Food, Cooking Classes, Tapas/Small Plates, Caterers, Food, Breakfast & Brunch, Event Planning & Services, Ice Cream & Frozen Yogurt"
"414",84012,"Copper Branch","Montreal","QC","H3Z 1X5",45.489145,-73.585604,"1","Restaurants, Gluten-Free, Breakfast & Brunch, Organic Stores, Vegan, Food, Fast Food, Vegetarian"
"415",164509,"Silk Thai","Chandler","AZ","85248",33.2334016,-111.857963,"1","Thai, Bars, Vegan, Cocktail Bars, Gluten-Free, Nightlife, Restaurants, Asian Fusion"
"416",159585,"Food de Toi","Montréal","QC","H4A 1H1",45.471529,-73.626887,"1","Specialty Food, Vegan, Gluten-Free, Restaurants, Food, Juice Bars & Smoothies, Health Markets, Vegetarian"
"417",20873,"Freshii","Charlotte","NC","28210",35.1520582191,-80.8396173906,"1","Food, Breakfast & Brunch, Salad, Restaurants, Juice Bars & Smoothies, Gluten-Free, Vegan"
"418",167684,"L'Gros Luxe","Montréal","QC","H2L 3V9",45.5218599,-73.5702641,"0","Vegan, Vegetarian, Restaurants"
"419",99353,"Buddha's Vegetarian Foods","Toronto","ON","M5T 1H9",43.6519184,-79.4033756,"1","Vegetarian, Vegan, Restaurants, Chinese"
"420",12729,"Vientiane Palace Restaurant","Madison","WI","53703",43.0755119,-89.3903706,"1","Restaurants, Thai, Vegan, Vietnamese, Vegetarian, Asian Fusion"
"421",5521,"Buddha Bowls","Mississauga","ON","L5G 1E9",43.5562233,-79.5810743,"0","Middle Eastern, Vegan, Halal, Gluten-Free, Restaurants"
"422",108775,"Alternative Junkie","Las Vegas","NV","89123",36.0166766781,-115.1182260431,"0","Food Stands, Vegan, Vegetarian, Organic Stores, Street Vendors, Food, Restaurants"
"423",85751,"Hopscotch","Toronto","ON","M5H 3Y2",43.648842,-79.379996,"1","Food, Restaurants, Salad, Vegetarian, Vegan, Juice Bars & Smoothies, Coffee & Tea"
"424",18449,"Chill","Tempe","AZ","85282",33.3947699,-111.9088938,"0","Restaurants, Ice Cream & Frozen Yogurt, Desserts, Food, Vegan"
"425",56256,"Bowlology","Las Vegas","NV","89119",36.1043905,-115.1367126,"1","Restaurants, Food, Poke, Acai Bowls, Gluten-Free, Juice Bars & Smoothies, Vegan"
"426",128241,"VegeNation","Henderson","NV","89052",36.0050994,-115.1127157,"1","Restaurants, Vegan"
"427",31122,"Grasshopper Restaurant","Toronto","ON","M6P 1Z8",43.6656129465,-79.4724570215,"1","Vegetarian, Vegan, Restaurants, Salad"
"428",78933,"24 Carrots Juice Bar & Cafe","Tempe","AZ","85283",33.363419,-111.9130587,"1","Cafes, Food, Breakfast & Brunch, Gluten-Free, Restaurants, Vegan, Vegetarian, Juice Bars & Smoothies"
"429",126717,"Fuel to Fit","Scottsdale","AZ","85251",33.4916072,-111.9187696,"1","Restaurants, Personal Chefs, Vegan, Food, Event Planning & Services, Food Delivery Services, Caterers, Health Markets, Specialty Food"
"430",111755,"Pizzaiolo","Toronto","ON","M5V 1K4",43.6446723,-79.398105,"1","Vegan, Gluten-Free, Restaurants, Pizza"
"431",177002,"Slice of Vegas","Las Vegas","NV","89119",36.094448,-115.176184,"1","Restaurants, Food, Pizza, Beer, Wine & Spirits, Vegan, Italian, Bars, Nightlife"
"432",55312,"Zoma Ethiopian Restaurant","Cleveland Heights","OH","44118",41.4984947,-81.5654675,"1","Gluten-Free, Vegetarian, African, Vegan, Seafood, Restaurants, Ethiopian"
"433",110077,"Nonya","Montréal","QC","H2T 2K3",45.5254798,-73.6040783,"1","Restaurants, Indonesian, Tapas/Small Plates, Vegetarian, Seafood, Vegan"
"434",87757,"YC's Mongolian Grill","Scottsdale","AZ","85256",33.5404748854,-111.8852450311,"1","Gluten-Free, Mongolian, Asian Fusion, Chinese, Vegan, Vegetarian, Restaurants"
"435",54032,"Veg-In YYC","Calgary","AB","T2G 0G4",51.047396,-114.059111,"1","Cafes, Restaurants, Vegan, Vegetarian"
"436",49505,"Conspire","Phoenix","AZ","85004",33.457788,-112.067113,"0","Vegan, Coffee & Tea, Food Delivery Services, Local Flavor, Arts & Crafts, Art Galleries, Food, Restaurants, Shopping, Arts & Entertainment"
"437",135653,"Cinnaholic","Indian Trail","NC","28079",35.051072,-80.6460016,"1","Food, Vegan, Bakeries, Restaurants, Desserts"
"438",134770,"The Dancing Dog Eatery & Juicery","Urbana","IL","61801",40.1127199,-88.2085029,"1","Vegetarian, Restaurants, Juice Bars & Smoothies, Sandwiches, Mexican, Tacos, Food, Kosher, Vegan, Desserts"
"439",54453,"Cinnaholic","Las Vegas","NV","89139",36.0341190079,-115.2074834704,"1","Food, Desserts, Restaurants, Bakeries, Breakfast & Brunch, Vegan"
"440",107248,"YC's Mongolian Grill","Gilbert","AZ","85296",33.3221715,-111.6875461,"1","Mongolian, Vegan, Buffets, Chinese, Asian Fusion, Restaurants"
"441",134940,"DP Dough","Tempe","AZ","85281",33.4211371127,-111.9250794125,"1","Nightlife, Vegan, Restaurants, Italian, Pizza"
"442",36483,"How Do You Roll? Phoenix","Phoenix","AZ","85003",33.465772,-112.082382,"0","Restaurants, Sushi Bars, Vegan, Japanese"
"443",20607,"B52 Cafe","Pittsburgh","PA","15201",40.4804345,-79.9541429,"1","Vegan, Middle Eastern, Bakeries, Coffee & Tea, Breakfast & Brunch, Food, Cafes, Restaurants"
"444",152774,"Go Vegan Cafe","Las Vegas","NV","89118",36.0820518,-115.2432648,"1","Vegan, Specialty Food, Fruits & Veggies, Food, Comfort Food, Organic Stores, Juice Bars & Smoothies, Gluten-Free, Restaurants"
"445",40656,"Mu Shu Asian Grill","Phoenix","AZ","85015",33.480771,-112.09158,"1","American (Traditional), Restaurants, Asian Fusion, Vegan, Chinese"
"446",25654,"Urban Picnic","Mesa","AZ","85201",33.4154308,-111.8374321,"0","Sandwiches, Vegan, Delis, American (New), Restaurants, Fast Food"
"447",85835,"La Panthère Verte","Montréal","QC","H3T 1M2",45.4974339,-73.623109,"1","Restaurants, Vegan"
"448",54904,"Pure & Supreme Cuisine","Cleveland Heights","OH","44115",41.50278,-81.556118,"1","Vegan, Gluten-Free, Soul Food, Restaurants"
"449",39109,"Market Eatery","Bedford Heights","OH","44146",41.419167,-81.526734,"1","Vegan, Food, Vegetarian, Restaurants, Juice Bars & Smoothies"
"450",17253,"La Santisima","Phoenix","AZ","85006",33.469201,-112.0473809,"1","Vegetarian, New Mexican Cuisine, Cafes, Restaurants, Mexican, Bars, Breakfast & Brunch, Tacos, Vegan, Seafood, Nightlife, Tex-Mex"
"451",5526,"Spinach Urban Bistro","Pittsburgh","PA","15232",40.451138,-79.934616,"0","Cafes, Restaurants, Vegan, Organic Stores, American (New), Vegetarian, Gluten-Free, Food"
"452",87790,"GUSTA","Montréal","QC","H2S 1A2",45.535984,-73.616161,"1","Vegan, Restaurants"
"453",138123,"Coco Rice Thai Cuisine","Toronto","ON","M5V 1M9",43.6437815874,-79.4029973833,"1","Vegan, Restaurants, Thai"
"454",112071,"LACUNA","Henderson","NV","89074",36.0170599,-115.1012842,"1","Wraps, Vegan, Restaurants, Gluten-Free, Salad"
"455",62217,"Café Lalibela","Tempe","AZ","85281",33.4213360711,-111.9516148853,"1","Food, Beer, Wine & Spirits, Gluten-Free, Vegan, Ethiopian, African, Restaurants, Vegetarian"
"456",59096,"Nekter Juice Bar","Las Vegas","NV","89135",36.1490366437,-115.3335092442,"1","Vegan, Acai Bowls, Food, Gluten-Free, Restaurants, Juice Bars & Smoothies"
"457",183650,"Rainbow's End Natural Foods","Las Vegas","NV","89104",36.144583,-115.139501,"1","Nutritionists, Health Markets, Food, Shopping, Restaurants, Health & Medical, Weight Loss Centers, Specialty Food, Vitamins & Supplements, Grocery, Vegan"
"458",64178,"Ronald's Donuts","Las Vegas","NV","89102",36.1265632,-115.2042227,"1","Restaurants, Vegan, Donuts, Food"
"459",816,"Thai Kitchen","Lakewood","OH","44107",41.4770696,-81.7743871,"1","Thai, Gluten-Free, Vegetarian, Vegan, Restaurants"
"460",15761,"VeggiEAT Xpress","Henderson","NV","89014",36.0551158,-115.0455333,"1","Restaurants, Vegetarian, Bubble Tea, Vegan, Food"
"461",7028,"Pop Up Pizza","Las Vegas","NV","89101",36.1721156,-115.1469038,"1","Restaurants, Vegan, Pizza"
"462",185424,"Aladdin's Eatery","Pittsburgh","PA","15228",40.3818982582,-80.0442885177,"1","Vegetarian, Mediterranean, Restaurants, Vegan, Specialty Food, Middle Eastern, Food, Ethnic Food"
"463",168307,"Freshii","Toronto","ON","M8X 2X4",43.6454271,-79.5224469,"1","Salad, Vegetarian, Restaurants, Vegan"
"464",144483,"Pita Jungle","Glendale","AZ","85308",33.6398836,-112.220984,"1","Mediterranean, American (New), Greek, Restaurants, Vegan, Vegetarian"
"465",47881,"Burger Royal","Montréal","QC","H2W 1X6",45.5156494125,-73.5766624597,"1","Restaurants, Comfort Food, Salad, Hot Dogs, Vegan, Food, Burgers, Poutineries"
"466",166680,"The Modern Vegan","Las Vegas","NV","89119",36.1059933,-115.1491273,"1","Vegan, Breakfast & Brunch, Restaurants, American (Traditional)"
"467",1127,"Lola Rosa William","Montréal","QC","H3C",45.4982068,-73.5580338,"1","Vegan, Restaurants"
"468",9289,"Pura Vida Bakery & Bystro","Las Vegas","NV","89102",36.1557391,-115.1595401,"0","Food Delivery Services, Vegan, Personal Chefs, Bakeries, Event Planning & Services, Restaurants, Food, Caribbean"
"469",24276,"North of Bombay","Toronto","ON","M6P 1Z3",43.6655769,-79.4693212,"1","Vegan, Indian, Vegetarian, Restaurants"
"470",187959,"Cool Beans Taco Truck","Pittsburgh","PA","15212",40.45657,-80.001484,"1","Vegetarian, Food Trucks, Mexican, Local Flavor, Sandwiches, Food, Vegan, Tacos, Restaurants"
"471",163841,"Zen Gardens","Mississauga","ON","L5W 1Z3",43.6430518,-79.7082653,"1","Vegan, Sushi Bars, Chinese, Dim Sum, Restaurants, Vegetarian"
"472",48308,"Iss' Magic Mixes","Mesa","AZ","85202",33.3629331508,-111.87532436,"0","Restaurants, Vegetarian, Farmers Market, Food, Breakfast & Brunch, Internet Cafes, Vegan, Health Markets, Specialty Food"
"473",44524,"Eat By Stacey Weber","Phoenix","AZ","85028",33.5831802,-111.9786115,"1","Specialty Food, Restaurants, Gluten-Free, Vegan, Food, Vegetarian, Health Markets, Caterers, Event Planning & Services, Organic Stores"
"474",153714,"LOV de la Montagne","Montréal","QC","H3G 1Z1",45.4973726,-73.5745699,"1","Bistros, Restaurants, Vegan, Breakfast & Brunch, Gluten-Free, Vegetarian"
"475",53681,"Green New American Vegetarian","Phoenix","AZ","85004",33.47014,-112.065474,"1","Restaurants, Vegetarian, Vegan"
"476",136422,"Mythology Diner","Toronto","ON","M6K 1L4",43.6415973621,-79.431304404,"1","Breakfast & Brunch, Restaurants, Diners, Vegan"
"477",54256,"SaVeg","Calgary","AB","T2R 0E1",51.0424132,-114.0762541,"1","Korean, Vegan, Vegetarian, Restaurants"
"478",70967,"Hoche Glacé","Montréal","QC","H1V 2T4",45.5560866,-73.5413071,"1","Food, Restaurants, Vegan, Ice Cream & Frozen Yogurt"
"479",126808,"King's Vegetarian Food","Toronto","ON","M1S 1T8",43.7867543,-79.270045,"1","Vegetarian, Restaurants, Vegan, Food"
"480",41567,"Happy Veggie House","Calgary","AB","T2G 2B9",51.0502225,-114.0627436,"1","Taiwanese, Vegetarian, Restaurants, Chinese, Fast Food, Vegan"
"481",2258,"Chef Kennys Asian Vegan Restaurant","Las Vegas","NV","89146",36.1269461,-115.2410542,"1","Restaurants, Vegetarian, Sushi Bars, Vegan, Chinese"
"482",179504,"Délicieux","Montréal","QC","H2V 4H1",45.523171,-73.605007,"1","Restaurants, Vegan, Breakfast & Brunch, Vegetarian"
"483",125254,"La Lumiere du Mile End","Montréal","QC","H2T 2K4",45.524638,-73.604421,"1","Vegan, Vegetarian, Restaurants"
"484",22198,"A La Saj","Calgary","AB","T2P 1B4",51.0456261,-114.0638478,"0","Hookah Bars, Mediterranean, Vegan, Nightlife, Falafel, Bars, Middle Eastern, Restaurants"
"485",34594,"Noodlebox","Airdrie","AB","T4B 3S6",51.2637385,-114.0060405,"1","Food, Noodles, Restaurants, Vegan, Chinese, Gluten-Free, Asian Fusion"
"486",119130,"My Healthy Meal","Las Vegas","NV","89135",36.160552,-115.318872,"0","Restaurants, American (New), Vegan, Food, Vegetarian"
"487",165918,"Bhai's Indian Canteen","Richmond Hill","ON","L4B 3B4",43.8470893822,-79.3782470196,"1","Restaurants, Vegan, Indian, Vegetarian"
"488",51577,"Sushi Momo","Montréal","QC","H2W 1G6",45.5171696,-73.5790995,"0","Vegan, Asian Fusion, Restaurants, Sushi Bars, Japanese"
"489",10561,"Pancho's Vegan Tacos","Las Vegas","NV","89121",36.1007774746,-115.1018145027,"1","Vegan, Tacos, Mexican, Restaurants"
"490",191365,"D E Thai Kitchen","Las Vegas","NV","89104",36.1584415,-115.1512002,"1","Food, Restaurants, Thai, Soup, Vegan, Seafood, Noodles"
"491",41470,"Chez José","Montréal","QC","H2W 1H4",45.5187285,-73.5778979,"1","Desserts, Breakfast & Brunch, Sandwiches, Cafes, Portuguese, Food, Bakeries, Soul Food, Restaurants, Vegetarian, Vegan"
"492",17179,"Vegan Rapide","Montréal","QC","H4B 1M2",45.4664209,-73.623343,"1","Food Delivery Services, Restaurants, Vegan, Food"
"493",24226,"Thai Fusion","Clover","SC","29710",35.1156317005,-81.0764505342,"1","Restaurants, Thai, Soup, Noodles, Vegan"
"494",148720,"Treehouse Bakery","Phoenix","AZ","85007",33.4462721,-112.0893682,"0","Specialty Food, Desserts, Vegan, Food, Restaurants, Bakeries"
"495",23537,"Café Juicy Lotus","Montréal","QC","H4A 1C9",45.475799,-73.62225,"1","Vegetarian, Food, Salad, Restaurants, Organic Stores, Vegan"
