"","business_id","name","city","state","postal_code","latitude","longitude","is_open","categories"
"157",99165,"The Fifth & Terrace","Toronto","ON","M5V 1W2",43.6493079441,-79.3893122699,"1","French, Bars, Italian, Event Planning & Services, American (Traditional), Mediterranean, Canadian (New), Gastropubs, Modern European, Nightlife, Restaurants, Steakhouses, Venues & Event Spaces"
"158",53345,"Little Polish Diner","Parma","OH","44129",41.4054068,-81.7348395,"1","Polish, Restaurants, Diners, Modern European"
"159",97053,"Senti Restaurant","Pittsburgh","PA","15201",40.4642168798,-79.9663847326,"1","Restaurants, Wineries, Italian, Wine Bars, Bars, Arts & Entertainment, Modern European, Food, Desserts, Nightlife"
"160",28073,"Hogan's Restaurant","King City","ON","L7B 1H8",43.9282713,-79.5283339,"1","Modern European, French, Italian, Latin American, Caterers, Canadian (New), Event Planning & Services, Seafood, Restaurants, Vegetarian"
"161",84870,"Petite","Calgary","AB","T2S 2V1",51.0380541851,-114.0712415146,"0","Modern European, Restaurants"
"162",90252,"European's Best Restaurant & Bakery","Strongsville","OH","44136",41.278663,-81.7860552,"1","Restaurants, Breakfast & Brunch, Food, Bakeries, Modern European"
"163",52196,"Madeline's","Toronto","ON","M5V 1M5",43.6443256,-79.4006013,"0","Restaurants, Modern European"
"164",38970,"Cafe Europa and Bistro","Willoughby","OH","44094",41.6072477,-81.4411265,"1","Cafes, Modern European, Restaurants, Italian, Bakeries, Food"
"165",130363,"BG Bistro","Las Vegas","NV","89103",36.1011439,-115.2274256,"1","Specialty Food, Food, Mediterranean, Ethnic Food, American (Traditional), Modern European, Restaurants"
"166",98562,"Eur Haus Food Truck","Scottsdale","AZ","85251",33.4986286,-111.9224398,"1","Modern European, Food, Restaurants, Wraps, Food Trucks, German"
"167",76002,"The Elm Tree Restaurant","Toronto","ON","M5G 1H1",43.6572873032,-79.383696553,"1","Modern European, Restaurants, Mediterranean"
